Update Time,Jurisdiction,Route,MRM,Description,Label
"01/31/2025 06:08 AM ET","Brunswick (County)","Rt. 634N (Brunswick County)",4.19,"On Rt. 634 in the County of Brunswick, in the vicinity of Big Horn Rd; Rt. 633N/S (Brunswick County), motorists can expect delays due to a tractor trailer crash. All north lanes are closed. All south lanes are closed.","Major Incident - Traffic - Tractor Trailer Crash"
"01/31/2025 06:07 AM ET","Petersburg (City)","I-85N",67,"On I-85 at mile marker 67 in the City of Petersburg, motorists can expect delays due to a vehicle crash. The north right shoulder is closed.","Minor Incident - Traffic - Vehicle Crash"
"01/31/2025 06:03 AM ET","Fairfax (County)","I-66E",49.7,"On I-66 at mile marker 49.7 in the County of Fairfax, motorists can expect delays due to a disabled vehicle. The east right shoulder is closed.","Minor Incident - Traffic - Disabled Vehicle"
"01/31/2025 06:10 AM ET","Prince William (County)","I-95N",158.8,"On I-95 at mile marker 158.8 in the County of Prince William, motorists can expect delays due to a multi-vehicle crash. The north left shoulder and left lane are closed.","Major Incident - Traffic - Multi-Vehicle Crash"
"01/31/2025 06:04 AM ET","Henrico (County)","I-64E",194,"On I-64 at mile marker 194 in the County of Henrico, motorists can expect delays due to a vehicle crash. The east right shoulder is closed.","Minor Incident - Traffic - Vehicle Crash"
