Update Time,Jurisdiction,Route,MRM,Description,Label
"10/24/2025, 02:48 PM ET","Newport News (City)","I-664S",7.8,"On I-664 South in the City of Newport News, at Monitor Merrimac Memorial Bridge Tunnel South, motorists can expect delays due to congestion. Traffic backups are approximately 1.5 miles.","Major Incident - Traffic - Congestion/Delay"
"10/24/2025, 04:03 PM ET","Norfolk (City)","I-264W",13.3,"On I-264 at mile marker 13.3 in the City of Norfolk, near Newtown Road, motorists can expect delays due to a vehicle crash. The west inside left shoulder is closed.","Minor Incident - Traffic - Vehicle Crash"
"10/24/2025, 03:58 PM ET","Albemarle (County)","Rt. 631N (Albemarle County)",13.7,"On Rt. 631 in the County of Albemarle, in the vicinity of Hillsdale Dr; Northfield Rd; Rt. 1427E/W (Albemarle County), motorists can expect delays due to a multi-vehicle crash. All north lanes are closed. All south lanes are closed.","Major Incident - Traffic - Multi-Vehicle Crash"
"10/24/2025, 04:15 PM ET","Virginia Beach (City)","I-264W",16.4,"On I-264 at mile marker 16.4 in the City of Virginia Beach, near Independence Boulevard, motorists can expect delays due to a disabled vehicle. The west entrance ramp narrows.","Minor Incident - Traffic - Disabled Vehicle"
"10/24/2025, 04:16 PM ET","Chesterfield (County)","I-95S",63.2,"On I-95 at mile marker 63.2 in the County of Chesterfield, motorists can expect delays due to a multi-vehicle crash. The south left shoulder, left lane, center lane, and right lane are closed. Traffic backups are approximately 5.0 miles.","Major Incident - Traffic - Multi-Vehicle Crash"
"10/24/2025, 08:50 AM ET","Carroll (County)","I-77S",24.1,"On I-77 South at mile marker 24.1 in the County of Carroll, motorists can expect delays due to high wind.","Weather Incident - High Wind - Advisory"
"10/23/2025, 08:54 PM ET","Prince William (County)","On I-66W Express Lanes exit ramp to Sudley Road","","On I-66W Express Lanes exit ramp to Sudley Road in the County of Prince William, motorists can expect potential delays due to a disabled vehicle. The west exit ramp is closed.","Minor Incident - Traffic - Disabled Vehicle"
"10/24/2025, 04:14 PM ET","Norfolk (City)","I-64R",280.6,"On I-64R at mile marker 280.6 in the City of Norfolk, near Military Highway, motorists can expect delays due to a disabled vehicle. The east left shoulder is closed.","Minor Incident - Traffic - Disabled Vehicle"
"10/24/2025, 04:05 PM ET","Henrico (County)","I-64E",186.6,"On I-64 at mile marker 186.6 in the County of Henrico, motorists can expect delays due to a tractor trailer crash. The east right lane, right shoulder, and exit 186 are closed. Traffic backups are approximately 2.0 miles.","Major Incident - Traffic - Tractor Trailer Crash"
"10/24/2025, 03:52 PM ET","Brunswick (County)","I-85N",37,"On I-85 at mile marker 37 in the County of Brunswick, motorists can expect delays due to a multi-vehicle crash. All north lanes are closed.","Major Incident - Traffic - Multi-Vehicle Crash"
"10/24/2025, 03:59 PM ET","Newport News (City)","I-64W",247.7,"On I-64 at mile marker 247.7 in the City of Newport News, near Jefferson Avenue, motorists can expect delays due to a disabled vehicle. The west left shoulder is closed.","Minor Incident - Traffic - Disabled Vehicle"
"10/24/2025, 08:49 AM ET","Carroll (County)","I-77N",0,"On I-77 North at mile marker 0 in the County of Carroll, motorists can expect delays due to high wind.","Weather Incident - High Wind - Advisory"
"10/24/2025, 03:02 PM ET","Hampton (City)","I-64E",270,"On I-64 East in the City of Hampton, at Hampton Roads Bridge Tunnel East, motorists can expect delays due to congestion. Traffic backups are approximately 5.25 miles.","Major Incident - Traffic - Congestion/Delay"
"10/24/2025, 04:04 PM ET","Newport News (City)","I-64W",260.3,"On I-64 at mile marker 260.3 in the City of Newport News, near Big Bethel Road, motorists can expect delays due to a vehicle crash. The west left shoulder is closed.","Minor Incident - Traffic - Vehicle Crash"
"10/24/2025, 04:16 PM ET","Franklin (County)","Rt. 1293E (Franklin County)",0.1,"On Rt. 1293 East in the County of Franklin, in the vicinity of Cul-de-Sac, motorists can expect delays due to weather. Lane closures exist.","Weather Incident - Other Weather - Advisory"
"10/24/2025, 04:16 PM ET","Prince William (County)","I-95S",154,"On I-95 at mile marker 154 in the County of Prince William, motorists can expect delays due to a multi-vehicle crash. The south left shoulder is closed.","Minor Incident - Traffic - Multi-Vehicle Crash"
"10/24/2025, 04:05 PM ET","Roanoke (County)","I-81S",137,"On I-81 at mile marker 137 in the County of Roanoke, motorists can expect delays due to a disabled tractor trailer. The south right shoulder is closed.","Minor Incident - Traffic - Disabled Tractor Trailer"
"10/24/2025, 04:12 PM ET","Fauquier (County)","US-29N",209,"On US-29 North in the County of Fauquier, in the vicinity of BALDWIN RD, motorists can expect delays due to a vehicle crash.","Minor Incident - Traffic - Vehicle Crash"
"10/24/2025, 04:10 PM ET","Henrico (County)","I-64W",186.4,"On I-64 at mile marker 186.4 in the County of Henrico, motorists can expect delays due to a vehicle crash. The west left shoulder is closed.","Minor Incident - Traffic - Vehicle Crash"
"10/24/2025, 04:18 PM ET","Suffolk (City)","I-664N",8.9,"On I-664 North in the City of Suffolk, at Monitor Merrimac Memorial Bridge Tunnel North, motorists can expect delays due to congestion. Traffic backups are approximately 3.75 miles.","Major Incident - Traffic - Congestion/Delay"
"10/24/2025, 03:42 PM ET","Chesterfield (County)","I-95N",69,"On I-95 at mile marker 69 in the County of Chesterfield, motorists can expect delays due to a vehicle crash. The north right shoulder is closed.","Minor Incident - Traffic - Vehicle Crash"
"10/24/2025, 04:16 PM ET","Fairfax (County)","I-495S",52.6,"On I-495 at mile marker 52.6 in the County of Fairfax, motorists can expect delays due to a disabled vehicle. The south right shoulder is closed.","Minor Incident - Traffic - Disabled Vehicle"
"10/24/2025, 03:32 PM ET","Virginia Beach (City)","I-64E",287.5,"On I-64 at mile marker 287.5 in the City of Virginia Beach, near Indian River Road, motorists can expect potential delays due to an incident. The east left lane and left center lane are closed.","Major Incident - Traffic - Other Traffic"
"10/24/2025, 10:49 AM ET","Fairfax (County)","On I-4965N Express Lanes at mile marker 54.8","","On I-4965N Express Lanes at mile marker 54.8 in the County of Fairfax, motorists can expect potential delays due to a vehicle crash. The north left shoulder is closed.","Minor Incident - Traffic - Vehicle Crash"
"10/24/2025, 04:11 PM ET","Shenandoah (County)","I-81S",264.7,"On I-81 at mile marker 264.7 in the County of Shenandoah, motorists can expect delays due to a tractor trailer crash. The south right shoulder is closed.","Minor Incident - Traffic - Tractor Trailer Crash"
"10/24/2025, 04:07 PM ET","Newport News (City)","I-64W",248,"On I-64 at mile marker 248 in the City of Newport News, near Yorktown Road, motorists can expect delays due to a disabled vehicle. The west right shoulder is closed.","Minor Incident - Traffic - Disabled Vehicle"
"10/24/2025, 04:16 PM ET","Norfolk (City)","I-64W",272.4,"On I-64 West in the City of Norfolk, at Hampton Roads Bridge Tunnel West, motorists can expect major delays due to congestion. Traffic backups are approximately 7.5 miles.","Major Incident - Traffic - Congestion/Delay"
"10/24/2025, 04:08 PM ET","Prince William (County)","I-95S",161.9,"On I-95 at mile marker 161.9 in the County of Prince William, motorists can expect delays due to a vehicle crash. The south right shoulder is closed.","Minor Incident - Traffic - Vehicle Crash"
