Update Time,Jurisdiction,Route,MRM,Description,Label
"12/12/2025, 11:04 PM ET","Gloucester (County)","US-17N",69.2,"On US-17 North in the County of Gloucester, in the vicinity of George Washington Memorial Hwy; Lafayette Heights Dr; Rt. 1206E/W (Gloucester County), motorists can expect delays due to a multi-vehicle crash.","Minor Incident - Traffic - Multi-Vehicle Crash"
"12/12/2025, 11:13 PM ET","Spotsylvania (County)","I-95N",126.3,"On I-95 at mile marker 126.3 in the County of Spotsylvania, motorists can expect delays due to a disabled tractor trailer. The north right shoulder is closed.","Minor Incident - Traffic - Disabled Tractor Trailer"
"12/12/2025, 11:23 PM ET","Prince William (County)","I-95S",150,"On I-95 at mile marker 150 in the County of Prince William, motorists can expect delays due to other security/police activity. The south left shoulder is closed.","Minor Incident - Security/Police Activity - Other Security/Police Activity"
"12/12/2025, 10:28 PM ET","Roanoke (County)","US-220S",59,"On US-220 in the County of Roanoke, in the vicinity of Crossbow Cir; Pheasant Ridge Rd; Rt. 1290N/S (Roanoke County), motorists can expect delays due to a vehicle crash. All north lanes are closed. All south lanes are closed.","Major Incident - Traffic - Vehicle Crash"
"12/12/2025, 11:17 PM ET","Arlington (County)","I-66E",70.3,"On I-66 at mile marker 70.3 in the County of Arlington, motorists can expect delays due to a vehicle crash. The east left lane is closed.","Major Incident - Traffic - Vehicle Crash"
"12/12/2025, 06:13 PM ET","Fairfax (County)","VA-28S",32,"On VA-28 in the County of Fairfax, in the vicinity of Braddock Rd; Rt. 620E/W (Fairfax County), motorists can expect delays due to a disabled vehicle. The south right shoulder is closed.","Minor Incident - Traffic - Disabled Vehicle"
"12/12/2025, 11:14 PM ET","Washington (County)","I-81S",6,"On I-81 at mile marker 6 in the County of Washington, motorists can expect delays due to a vehicle crash. The south center lane, right lane, and right shoulder are closed. Traffic backups are approximately 1.5 miles.","Major Incident - Traffic - Vehicle Crash"
