Update Time,Jurisdiction,Route,MRM,Description,Label
"05/06/2025 05:47 AM ET","Shenandoah (County)","I-81S",269,"On I-81 South at mile marker 269 in the County of Shenandoah, motorists can expect delays due to congestion. Traffic backups are approximately 2.0 miles.","Major Incident - Traffic - Congestion/Delay"
"05/06/2025 02:34 AM ET","Emporia (City)","US-58W",411.5,"On US-58 West in the City of Emporia, in the vicinity of Purdy Rd; Service Road; City Rt. 2N/S (City of Emporia), near Purdy Road, motorists can expect delays due to standing water.","Minor Incident - Standing Water - Advisory"
"05/06/2025 05:54 AM ET","Fairfax (County)","I-95S",173.9,"On I-95 at mile marker 173.9 in the County of Fairfax, motorists can expect delays due to a vehicle fire. The south right shoulder is closed.","Minor Incident - Traffic - Vehicle Fire"
"05/06/2025 06:14 AM ET","Prince William (County)","I-95S",153,"On I-95 at mile marker 153 in the County of Prince William, motorists can expect delays due to a disabled vehicle. The south right shoulder is closed.","Minor Incident - Traffic - Disabled Vehicle"
"05/06/2025 06:10 AM ET","Chesterfield (County)","I-95S",60.2,"On I-95 at mile marker 60.2 in the County of Chesterfield, motorists can expect delays due to a vehicle crash. The south right shoulder is closed.","Minor Incident - Traffic - Vehicle Crash"
"05/06/2025 05:58 AM ET","Fairfax (County)","I-495N",42.6,"On I-495 at mile marker 42.6 in the County of Fairfax, motorists can expect delays due to a disabled vehicle. The north right shoulder is closed.","Minor Incident - Traffic - Disabled Vehicle"
"05/06/2025 02:11 AM ET","King George (County)","Rt. 679E (King George County)",0.4,"On Rt. 679 East in the County of King George, in the vicinity of Ashland Mill Rd; Carver Ln; Clementine Ln; Rt. 622N/S (King George County), motorists can expect delays due to standing water.","Minor Incident - Standing Water - Advisory"
