Update Time,Jurisdiction,Route,MRM,Description,Label
"09/20/2025, 06:12 AM ET","Hampton (City)","I-64E",265,"On I-64 at mile marker 265 in the City of Hampton, near LaSalle Avenue, motorists can expect delays due to a vehicle fire. The east exit 265A is closed.","Minor Incident - Traffic - Vehicle Fire"
"09/20/2025, 06:07 AM ET","Fairfax (County)","I-95N",177.1,"On I-95 at mile marker 177.1 in the County of Fairfax, motorists can expect delays due to a disabled vehicle. The north right shoulder is closed.","Minor Incident - Traffic - Disabled Vehicle"
"09/19/2025, 09:40 PM ET","Chesterfield (County)","Rt. 643E (Chesterfield County)",0,"On Rt. 643 East in the County of Chesterfield, in the vicinity of Belmont Rd; Turner Rd; Rt. 651E/W (Chesterfield County); Rt. 650N/S (Chesterfield County), motorists can expect delays due to standing water.","Weather Incident - Standing Water - Advisory"
"09/20/2025, 06:06 AM ET","Prince William (County)","I-95N",150.9,"On I-95 at mile marker 150.9 in the County of Prince William, motorists can expect delays due to a disabled vehicle. The north right shoulder is closed.","Minor Incident - Traffic - Disabled Vehicle"
"09/20/2025, 06:13 AM ET","Virginia Beach (City)","I-64W",287.6,"On I-64 at mile marker 287.6 in the City of Virginia Beach, near Indian River Road, motorists can expect delays due to a vehicle crash. The west right shoulder is closed.","Minor Incident - Traffic - Vehicle Crash"
"09/20/2025, 05:37 AM ET","Chesterfield (County)","Rt. 827E (Chesterfield County)",0.7,"On Rt. 827 in the County of Chesterfield, in the vicinity of E Hundred Rd; VA-10W, motorists can expect delays due to weather. All east lanes are closed. All west lanes are closed.","Weather Incident - Other Weather - Closed"
"09/20/2025, 06:09 AM ET","Fairfax (County)","I-95S",168.8,"On I-95 at mile marker 168.8 in the County of Fairfax, motorists can expect delays due to a disabled vehicle. The south right shoulder is closed.","Minor Incident - Traffic - Disabled Vehicle"
"09/20/2025, 06:12 AM ET","Norfolk (City)","I-64W",272.4,"On I-64 West in the City of Norfolk, at Hampton Roads Bridge Tunnel West, motorists can expect delays due to congestion. Traffic backups are approximately 3.5 miles.","Major Incident - Traffic - Congestion/Delay"
