Update Time,Jurisdiction,Route,MRM,Description,Label
"01/25/2025 09:04 PM","Spotsylvania (County)","I-95S",126.5,"On I-95 at mile marker 126.5 in the County of Spotsylvania, motorists can expect delays due to a disabled vehicle. The south right shoulder is closed.","Major Incident - Traffic - Disabled Vehicle"
"01/25/2025 08:48 PM","Prince William (County)","I-95S",153.8,"On I-95 at mile marker 153.8 in the County of Prince William, motorists can expect delays due to a disabled vehicle. The south left shoulder is closed.","Major Incident - Traffic - Disabled Vehicle"
"01/25/2025 09:39 PM","Norfolk (City)","On US- 60W","","On US- 60W in the City of Norfolk, near 15th View gate, motorists can expect potential delays due to an incident.","Minor Incident - Traffic - Other Traffic"
"01/25/2025 09:18 PM","Fairfax (County)","I-495S",49.6,"On I-495 at mile marker 49.6 in the County of Fairfax, motorists can expect delays due to a disabled vehicle. The south exit ramp narrows.","Minor Incident - Traffic - Disabled Vehicle"
"01/25/2025 09:36 PM","Norfolk (City)","I-64W",277.41,"On I-64 West at mile marker 277.4 in the City of Norfolk, near Little Creek Road, motorists can expect delays due to a vehicle crash.","Minor Incident - Traffic - Vehicle Crash"
"01/25/2025 09:41 PM","Norfolk (City)","I-64W",273,"On I-64 at mile marker 273 in the City of Norfolk, near Willoughby Bay Bridge, motorists can expect delays due to a vehicle crash. All west lanes are closed. Traffic backups are approximately 3.5 miles.","Major Incident - Traffic - Vehicle Crash"
"01/25/2025 09:41 PM","Powhatan (County)","US-60E",170.04,"On US-60 East in the County of Powhatan, in the vicinity of Turnaround; Urbine Rd; Rt. 675E/W (Powhatan County); Rt. 676E/W (Powhatan County), motorists can expect delays due to a vehicle crash.","Minor Incident - Traffic - Vehicle Crash"
"01/25/2025 09:40 PM","Fairfax (County)","I-395N",1.2,"On I-395 North at mile marker 1.2 in the County of Fairfax, motorists can expect delays due to a vehicle crash.","Minor Incident - Traffic - Vehicle Crash"
"01/25/2025 08:48 PM","Stafford (County)","I-95S",140.7,"On I-95 at mile marker 140.7 in the County of Stafford, motorists can expect delays due to a disabled vehicle. The south right shoulder is closed.","Major Incident - Traffic - Disabled Vehicle"
"01/25/2025 07:38 PM","Washington (County)","I-81N",13.6,"On I-81 North at mile marker 13.6 in the County of Washington, motorists can expect delays due to a vehicle crash.","Minor Incident - Traffic - Vehicle Crash"
