Update Time,Jurisdiction,Route,MRM,Description,Label
"03/09/2025 01:10 PM ET","James City (County)","I-64E",227.1,"On I-64 at mile marker 227.1 in the County of James City, near Old Stage Road, motorists can expect delays due to a tractor trailer crash. The east right lane and right shoulder are closed.","Major Incident - Traffic - Tractor Trailer Crash"
"03/09/2025 01:07 PM ET","Richmond (City)","I-95S",75.2,"On I-95 at mile marker 75.2 in the City of Richmond, motorists can expect delays due to a multi-vehicle crash. The south center lane, right lane, and right shoulder are closed.","Major Incident - Traffic - Multi-Vehicle Crash"
"03/09/2025 05:23 AM ET","Brunswick (County)","Rt. 629E (Brunswick County)",5.7,"On Rt. 629 East in the County of Brunswick, in the vicinity of Waqua Creek Rd; Rt. 630N/S (Brunswick County), motorists can expect delays due to standing water.","Minor Incident - Standing Water - Advisory"
"03/09/2025 01:01 PM ET","Caroline (County)","Rt. 652N (Caroline County)",6.4,"On Rt. 652 in the County of Caroline, in the vicinity of Concord Rd; Rt. 602E/W (Caroline County), motorists can expect delays due to a vehicle crash. All north lanes are closed. All south lanes are closed.","Major Incident - Traffic - Vehicle Crash"
"03/09/2025 11:32 AM ET","Henry (County)","Rt. 669E (Henry County)",1.9,"On Rt. 669 East in the County of Henry, in the vicinity of Daniels Creek Rd; Rt. 609N/S (Henry County), motorists can expect delays due to a vehicle crash. Lane closures exist.","Minor Incident - Traffic - Vehicle Crash"
"03/09/2025 12:54 PM ET","Norfolk (City)","I-64W",272.4,"On I-64 West in the City of Norfolk, at Hampton Roads Bridge Tunnel West, motorists can expect potential delays due to a bridge/tunnel stoppage.","Minor Incident - Traffic - Bridge/Tunnel Stoppage"
"03/09/2025 01:02 PM ET","Chesterfield (County)","I-95S",54.2,"On I-95 at mile marker 54.2 in the County of Chesterfield, motorists can expect delays due to a disabled vehicle. The south right shoulder is closed.","Minor Incident - Traffic - Disabled Vehicle"
"03/09/2025 01:09 PM ET","Arlington (County)","N Highland Street and Clarendon Blvd","","N Highland Street and Clarendon Blvd in the County of Arlington, motorists can expect delays due to a vehicle crash. All north lanes are closed. All south lanes are closed.","Major Incident - Traffic - Vehicle Crash"
"03/09/2025 12:52 PM ET","Arlington (County)","I-395N",9.4,"On I-395 at mile marker 9.4 in the County of Arlington, motorists can expect delays due to a vehicle crash. The north right shoulder is closed.","Minor Incident - Traffic - Vehicle Crash"
