Update Time,Jurisdiction,Route,MRM,Description,Label
"04/23/2025 10:59 PM ET","Fairfax (County)","US-1S",187.1,"On US-1 in the County of Fairfax, in the vicinity of Buckman Rd; Rt. 836N/S (Fairfax County), motorists can expect delays due to a multi-vehicle crash. The north left shoulder, left lane, and right lane are closed. All south lanes are closed.","Major Incident - Traffic - Multi-Vehicle Crash"
"04/23/2025 11:01 PM ET","Hampton (City)","I-64E",270,"On I-64 East in the City of Hampton, at Hampton Roads Bridge Tunnel East, motorists can expect delays due to congestion.","Minor Incident - Traffic - Congestion/Delay"
"04/23/2025 10:48 PM ET","Prince William (County)","I-95S",157.8,"On I-95 at mile marker 157.8 in the County of Prince William, motorists can expect delays due to a disabled vehicle. The south right shoulder is closed.","Minor Incident - Traffic - Disabled Vehicle"
"04/23/2025 06:46 PM ET","Arlington (County)","I-395N HOV",9.4,"On I-395N HOV at mile marker 9.4 in the County of Arlington, motorists can expect potential delays due to a disabled vehicle. The north right shoulder is closed.","Minor Incident - Traffic - Disabled Vehicle"
"04/23/2025 09:35 PM ET","Stafford (County)","I-95N",133.4,"On I-95 at mile marker 133.4 in the County of Stafford, motorists can expect delays due to a disabled vehicle. The north right shoulder is closed.","Minor Incident - Traffic - Disabled Vehicle"
"04/23/2025 10:43 PM ET","Fairfax (County)","Rt. 620E (Fairfax County)",17.7,"On Rt. 620 in the County of Fairfax, in the vicinity of Port Royal Rd; Rt. 3090N/S (Fairfax County), motorists can expect delays due to a vehicle crash. The east right center lane and right lane are closed.","Major Incident - Traffic - Vehicle Crash"
"04/23/2025 10:49 PM ET","Henrico (County)","I-64E",186.4,"On I-64 at mile marker 186.4 in the County of Henrico, motorists can expect delays due to a disabled vehicle. The east right shoulder is closed.","Minor Incident - Traffic - Disabled Vehicle"
