Update Time,Jurisdiction,Route,MRM,Description,Label
"10/27/2025, 12:15 AM ET","Fairfax (County)","I-495N",49.1,"On I-495 at mile marker 49.1 in the County of Fairfax, motorists can expect delays due to a disabled vehicle. The north exit ramp narrows.","Minor Incident - Traffic - Disabled Vehicle"
"10/27/2025, 01:09 AM ET","Prince William (County)","I-95S",161.5,"On I-95 at mile marker 161.5 in the County of Prince William, motorists can expect delays due to a disabled vehicle. The south right shoulder is closed.","Minor Incident - Traffic - Disabled Vehicle"
"10/27/2025, 01:04 AM ET","Henrico (County)","I-95N",84.7,"On I-95 at mile marker 84.7 in the County of Henrico, motorists can expect delays due to a disabled vehicle. The north right shoulder is closed.","Minor Incident - Traffic - Disabled Vehicle"
"10/26/2025, 11:55 PM ET","Pittsylvania (County)","Rt. 887E (Pittsylvania County)",0,"On Rt. 887 in the County of Pittsylvania, in the vicinity of Union Hall School Rd; Rt. 612E/W (Pittsylvania County), motorists can expect delays due to standing water. All east lanes are closed. All west lanes are closed.","Weather Incident - Standing Water - Closed"
"10/27/2025, 01:18 AM ET","Fairfax (County)","I-495S",53.6,"On I-495 at mile marker 53.6 in the County of Fairfax, motorists can expect delays due to a disabled vehicle. The south right shoulder is closed.","Minor Incident - Traffic - Disabled Vehicle"
