Update Time,Jurisdiction,Route,MRM,Description,Label
"09/09/2025, 04:24 AM ET","Carroll (County)","I-77S",11,"On I-77 at mile marker 11 in the County of Carroll, motorists can expect delays due to a disabled vehicle. The south right shoulder is closed.","Minor Incident - Traffic - Disabled Vehicle"
"09/09/2025, 04:19 AM ET","Spotsylvania (County)","I-95S",128.5,"On I-95 at mile marker 128.5 in the County of Spotsylvania, motorists can expect delays due to a disabled vehicle. The south right shoulder is closed.","Minor Incident - Traffic - Disabled Vehicle"
"09/09/2025, 03:51 AM ET","Fairfax (County)","Rt. 2578N (Fairfax County)",0,"On Rt. 2578 North in the County of Fairfax, in the vicinity of Elizabeth La; Rt. 2235E/W (Fairfax County), motorists can expect delays due to weather. Lane closures exist.","Weather Incident - Other Weather - Advisory"
"09/09/2025, 03:35 AM ET","Henrico (County)","I-64E",192,"On I-64 East at mile marker 192 in the County of Henrico, motorists can expect delays due to a tractor trailer crash.","Minor Incident - Traffic - Tractor Trailer Crash"
"09/09/2025, 04:18 AM ET","Alleghany (County)","I-64E",9.8,"On I-64 at mile marker 9.8 in the County of Alleghany, motorists can expect delays due to a vehicle crash. The east right lane and right shoulder are closed.","Major Incident - Traffic - Vehicle Crash"
"09/09/2025, 04:18 AM ET","Hampton (City)","I-64E",270,"On I-64 in the City of Hampton, at Hampton Roads Bridge Tunnel East, motorists can expect potential delays due to a bridge/tunnel stoppage. All east lanes are closed.","Major Incident - Traffic - Bridge/Tunnel Stoppage"
