Update Time,Jurisdiction,Route,MRM,Description,Label
"11/25/2025, 12:56 AM ET","Spotsylvania (County)","I-95S",122.1,"On I-95 at mile marker 122.1 in the County of Spotsylvania, motorists can expect delays due to a disabled vehicle. The south right shoulder is closed.","Minor Incident - Traffic - Disabled Vehicle"
"11/25/2025, 12:39 AM ET","Smyth (County)","I-81S",34.8,"On I-81 at mile marker 34.8 in the County of Smyth, motorists can expect delays due to a tractor trailer crash. The south right shoulder is closed.","Minor Incident - Traffic - Tractor Trailer Crash"
"11/25/2025, 12:56 AM ET","Wythe (County)","Rt. 749E (Wythe County)",10,"On Rt. 749 East in the County of Wythe, in the vicinity of Ward Branch Rd; Rt. 672N/S (Wythe County), motorists can expect delays due to a vehicle crash. Lane closures exist.","Minor Incident - Traffic - Vehicle Crash"
"11/25/2025, 01:30 AM ET","Hanover (County)","I-295S",41,"On I-295 at mile marker 41 in the County of Hanover, motorists can expect delays due to a disabled vehicle. The south right shoulder is closed.","Minor Incident - Traffic - Disabled Vehicle"
"11/25/2025, 01:17 AM ET","Wythe (County)","I-77N",41.2,"On I-77 at mile marker 41.2 in the County of Wythe, motorists can expect delays due to a vehicle crash. The north entrance ramp narrows.","Minor Incident - Traffic - Vehicle Crash"
"11/25/2025, 12:34 AM ET","Stafford (County)","I-95N",134.2,"On I-95 at mile marker 134.2 in the County of Stafford, motorists can expect delays due to a disabled vehicle. The north right shoulder is closed.","Minor Incident - Traffic - Disabled Vehicle"
