Update Time,Jurisdiction,Route,MRM,Description,Label
"04/20/2025 06:15 AM ET","Fairfax (County)","I-95N",169.9,"On I-95 at mile marker 169.9 in the County of Fairfax, motorists can expect delays due to a disabled vehicle. The north left shoulder is closed.","Minor Incident - Traffic - Disabled Vehicle"
"04/20/2025 05:44 AM ET","Norfolk (City)","I-64W",278,"On I-64 at mile marker 278 in the City of Norfolk, near Little Creek Road, motorists can expect delays due to a disabled vehicle. The west right shoulder is closed.","Minor Incident - Traffic - Disabled Vehicle"
"04/20/2025 06:02 AM ET","Chesapeake (City)","I-64E",291.6,"On I-64 at mile marker 291.6 in the City of Chesapeake, near 464 Interchange, motorists can expect delays due to a disabled vehicle. The east exit 291A narrows.","Minor Incident - Traffic - Disabled Vehicle"
"04/20/2025 06:06 AM ET","Spotsylvania (County)","I-95N",120.8,"On I-95 at mile marker 120.8 in the County of Spotsylvania, motorists can expect delays due to a disabled vehicle. The north right shoulder is closed.","Minor Incident - Traffic - Disabled Vehicle"
"04/20/2025 06:14 AM ET","Hanover (County)","I-95N",91,"On I-95 North at mile marker 91 in the County of Hanover, motorists can expect delays due to a tractor trailer crash.","Minor Incident - Traffic - Tractor Trailer Crash"
