Update Time,Jurisdiction,Route,MRM,Description,Label
"12/05/2025, 09:20 PM ET","Hanover (County)","Rt. 606E (Hanover County)",6.9,"On Rt. 606 East in the County of Hanover, in the vicinity of Williamsville Rd; Rt. 615N/S (Hanover County), motorists can expect delays due to icy conditions. Lane closures exist.","Weather Incident - Icy Conditions - Advisory"
"12/06/2025, 04:47 AM ET","Fairfax (County)","VA-28S",32.2,"On VA-28 in the County of Fairfax, in the vicinity of Braddock Rd; Rt. 620E/W (Fairfax County), motorists can expect delays due to a disabled vehicle. The south right shoulder is closed.","Minor Incident - Traffic - Disabled Vehicle"
"12/06/2025, 05:13 AM ET","Fairfax (County)","I-66W",67.9,"On I-66 at mile marker 67.9 in the County of Fairfax, motorists can expect delays due to a disabled vehicle. The west right shoulder is closed.","Minor Incident - Traffic - Disabled Vehicle"
"12/06/2025, 04:59 AM ET","Augusta (County)","I-64W",99.9,"On I-64 West at mile marker 99.9 in the County of Augusta, motorists can expect delays due to fog.","Weather Incident - Fog - Advisory"
"12/06/2025, 04:59 AM ET","Augusta (County)","I-64E",99.9,"On I-64 East at mile marker 99.9 in the County of Augusta, motorists can expect delays due to fog.","Weather Incident - Fog - Advisory"
"12/06/2025, 03:51 AM ET","Carroll (County)","I-77N",0,"On I-77 North at mile marker 0 in the County of Carroll, motorists can expect delays due to fog.","Weather Incident - Fog - Advisory"
"12/06/2025, 03:51 AM ET","Carroll (County)","I-77S",24,"On I-77 South at mile marker 24 in the County of Carroll, motorists can expect delays due to fog.","Weather Incident - Fog - Advisory"
"12/06/2025, 05:13 AM ET","Newport News (City)","I-64W",259.6,"On I-64 at mile marker 259.6 in the City of Newport News, near J. Clyde Boulevard, motorists can expect delays due to a disabled vehicle. The west right shoulder is closed.","Minor Incident - Traffic - Disabled Vehicle"
