Update Time,Jurisdiction,Route,MRM,Description,Label
"11/30/2025, 06:10 AM ET","Prince William (County)","I-95S",157.7,"On I-95 at mile marker 157.7 in the County of Prince William, motorists can expect delays due to a disabled vehicle. The south right lane is closed.","Major Incident - Traffic - Disabled Vehicle"
"11/30/2025, 06:01 AM ET","Richmond (City)","I-95N",75.3,"On I-95 at mile marker 75.3 in the City of Richmond, motorists can expect delays due to a disabled vehicle. The north right shoulder is closed.","Minor Incident - Traffic - Disabled Vehicle"
"11/30/2025, 05:08 AM ET","Floyd (County)","Rt. 799N (Floyd County)",2.4,"On Rt. 799 in the County of Floyd, in the vicinity of Emmanuel Rd; Emmanuel Rd SW; Rt. 805E/W (Floyd County), motorists can expect delays due to a tractor trailer crash. All north lanes are closed. All south lanes are closed.","Major Incident - Traffic - Tractor Trailer Crash"
"11/30/2025, 06:08 AM ET","Hampton (City)","I-64W",260.8,"On I-64 at mile marker 260.8 in the City of Hampton, near Big Bethel Road, motorists can expect delays due to a disabled vehicle. The west right lane and right shoulder are closed.","Major Incident - Traffic - Disabled Vehicle"
"11/30/2025, 05:57 AM ET","Caroline (County)","Rt. 639E (Caroline County)",5.2,"On Rt. 639 East in the County of Caroline, in the vicinity of Green Rd; Rt. 712N/S (Caroline County), motorists can expect delays due to a vehicle crash.","Minor Incident - Traffic - Vehicle Crash"
"11/30/2025, 05:49 AM ET","Carroll (County)","I-77N",8.2,"On I-77 at mile marker 8.2 in the County of Carroll, motorists can expect delays due to a tractor trailer crash. All north lanes are closed. Traffic backups are approximately 1.5 miles.","Major Incident - Traffic - Tractor Trailer Crash"
"11/30/2025, 05:24 AM ET","Norfolk (City)","I-264E",10.6,"On I-264 at mile marker 10.6 in the City of Norfolk, near Ingleside Road, motorists can expect delays due to a disabled vehicle. The east right shoulder is closed.","Minor Incident - Traffic - Disabled Vehicle"
"11/30/2025, 05:55 AM ET","Fairfax (County)","I-66E",55.2,"On I-66 at mile marker 55.2 in the County of Fairfax, motorists can expect delays due to a disabled vehicle. The east right shoulder is closed.","Minor Incident - Traffic - Disabled Vehicle"
