Update Time,Jurisdiction,Route,MRM,Description,Label
"12/12/2025, 01:20 AM ET","James City (County)","I-64W",226.5,"On I-64 at mile marker 226.5 in the County of James City, near Barnes Road, motorists can expect delays due to a disabled vehicle. The west right shoulder is closed.","Minor Incident - Traffic - Disabled Vehicle"
"12/12/2025, 01:16 AM ET","Arlington (County)","I-395S",9,"On I-395 at mile marker 9 in the County of Arlington, motorists can expect delays due to a disabled vehicle. The south right shoulder is closed.","Minor Incident - Traffic - Disabled Vehicle"
"12/12/2025, 01:15 AM ET","Norfolk (City)","I-64W",272.4,"On I-64 in the City of Norfolk, at Hampton Roads Bridge Tunnel West, motorists can expect potential delays due to a bridge/tunnel stoppage. All west lanes are closed.","Major Incident - Traffic - Bridge/Tunnel Stoppage"
"12/11/2025, 09:33 PM ET","Norfolk (City)","I-64W",272.4,"On I-64 in the City of Norfolk, at Hampton Roads Bridge Tunnel West, motorists can expect potential delays due to a bridge/tunnel stoppage. All west lanes are closed.","Major Incident - Traffic - Bridge/Tunnel Stoppage"
"12/12/2025, 12:29 AM ET","Fairfax (County)","I-66W",62.1,"On I-66 at mile marker 62.1 in the County of Fairfax, motorists can expect delays due to a vehicle crash. The west right shoulder is closed.","Minor Incident - Traffic - Vehicle Crash"
"12/12/2025, 01:27 AM ET","Prince William (County)","I-95N",149.8,"On I-95 at mile marker 149.8 in the County of Prince William, motorists can expect delays due to a disabled vehicle. The north right shoulder is closed.","Minor Incident - Traffic - Disabled Vehicle"
"12/12/2025, 01:33 AM ET","Fairfax (County)","VA-28S",32,"On VA-28 in the County of Fairfax, in the vicinity of Braddock Rd; Rt. 620E/W (Fairfax County), motorists can expect delays due to a disabled vehicle. The south right shoulder is closed.","Minor Incident - Traffic - Disabled Vehicle"
