Update Time,Jurisdiction,Route,MRM,Description,Label
"11/27/2025, 10:01 AM ET","Albemarle (County)","US-29S",148.7,"On US-29 in the County of Albemarle, in the vicinity of Crossover; Dickerson Ln; Rt. 763E/W (Albemarle County), motorists can expect delays due to a disabled vehicle. The south right shoulder is closed.","Minor Incident - Traffic - Disabled Vehicle"
"11/28/2025, 05:18 AM ET","Fairfax (County)","I-395N",0.7,"On I-395 at mile marker 0.7 in the County of Fairfax, motorists can expect delays due to a disabled vehicle. The north right lane and right shoulder are closed.","Major Incident - Traffic - Disabled Vehicle"
"11/28/2025, 04:35 AM ET","Alexandria (City)","I-395N",6.1,"On I-395 at mile marker 6.1 in the City of Alexandria, motorists can expect delays due to a disabled vehicle. The north right shoulder is closed.","Minor Incident - Traffic - Disabled Vehicle"
"11/28/2025, 03:31 AM ET","Fairfax (County)","I-495S",45.7,"On I-495 at mile marker 45.7 in the County of Fairfax, motorists can expect delays due to a disabled vehicle. The south right shoulder is closed.","Minor Incident - Traffic - Disabled Vehicle"
"11/28/2025, 05:09 AM ET","Carroll (County)","I-77N",0,"On I-77 North at mile marker 0 in the County of Carroll, motorists can expect delays due to high wind.","Weather Incident - High Wind - Advisory"
"11/28/2025, 05:10 AM ET","Carroll (County)","I-77S",24,"On I-77 South at mile marker 24 in the County of Carroll, motorists can expect delays due to high wind.","Weather Incident - High Wind - Advisory"
"11/27/2025, 07:47 AM ET","Madison (County)","US-29N",160,"On US-29 in the County of Madison, in the vicinity of Shelby Rd; Rt. 662N/S (Madison County), motorists can expect delays due to a disabled vehicle. The north right shoulder is closed.","Minor Incident - Traffic - Disabled Vehicle"
