Update Time,Jurisdiction,Route,MRM,Description,Label
"02/24/2025 10:22 PM ET","Richmond (City)","I-95S",76.6,"On I-95 at mile marker 76.6 in the City of Richmond, motorists can expect delays due to a disabled vehicle. The south right shoulder is closed.","Minor Incident - Traffic - Disabled Vehicle"
"02/24/2025 10:13 PM ET","Dinwiddie (County)","US-460W",290.5,"On US-460 West in the County of Dinwiddie, in the vicinity of Springston Rd; Rt. 724E/W (Dinwiddie County), motorists can expect delays due to a tractor trailer crash.","Minor Incident - Traffic - Tractor Trailer Crash"
"02/24/2025 09:58 PM ET","Fairfax (County)","I-495S",48,"On I-495 at mile marker 48 in the County of Fairfax, motorists can expect delays due to a disabled vehicle. The south right shoulder is closed.","Minor Incident - Traffic - Disabled Vehicle"
"02/24/2025 02:09 PM ET","Mecklenburg (County)","Rt. 688N (Mecklenburg County)",5,"On Rt. 688 North in the County of Mecklenburg, in the vicinity of Wilkerson Rd; Rt. 677E/W (Mecklenburg County), motorists can expect delays due to standing water.","Minor Incident - Standing Water - Advisory"
"02/24/2025 09:58 PM ET","Fairfax (County)","I-95S",173,"On I-95 at mile marker 173 in the County of Fairfax, motorists can expect delays due to a disabled vehicle. The south exit ramp narrows.","Minor Incident - Traffic - Disabled Vehicle"
"02/24/2025 10:22 PM ET","Ashland (Town)","I-95S",91.7,"On I-95 at mile marker 91.7 in the Town of Ashland, motorists can expect delays due to a disabled vehicle. The south right shoulder is closed.","Minor Incident - Traffic - Disabled Vehicle"
