Update Time,Jurisdiction,Route,MRM,Description,Label
"12/23/2025, 12:18 AM ET","Norfolk (City)","I-64W",272.4,undefined,"Minor Incident - Traffic - Disabled Vehicle"
"12/23/2025, 04:58 AM ET","Fairfax (County)","I-395S",2.4,"On I-395 at mile marker 2.4 in the County of Fairfax, motorists can expect delays due to a disabled vehicle. The south right shoulder is closed.","Minor Incident - Traffic - Disabled Vehicle"
"12/23/2025, 05:21 AM ET","Virginia Beach (City)","I-64E",287.4,"On I-64 at mile marker 287.4 in the City of Virginia Beach, near Indian River Road, motorists can expect delays due to a disabled vehicle. The east right shoulder is closed.","Minor Incident - Traffic - Disabled Vehicle"
"12/23/2025, 05:18 AM ET","Arlington (County)","I-66W",72,"On I-66 at mile marker 72 in the County of Arlington, motorists can expect delays due to a disabled vehicle. The west right shoulder is closed.","Minor Incident - Traffic - Disabled Vehicle"
"12/23/2025, 04:57 AM ET","Colonial Heights (City)","I-95N",53.5,"On I-95 at mile marker 53.5 in the City of Colonial Heights, motorists can expect delays due to a tractor trailer crash. The north right shoulder is closed.","Minor Incident - Traffic - Tractor Trailer Crash"
