Update Time,Jurisdiction,Route,MRM,Description,Label
"11/14/2025, 03:25 PM ET","Charles City (County)","Rt. 609N (Charles City County)",9.6,"On Rt. 609 in the County of Charles City, in the vicinity of Roxbury Rd; Wiant Ln; Rt. 652E/W (Charles City County); VA-106N/S, motorists can expect delays due to an incident. The north right lane and right shoulder are closed.","Major Incident - Traffic - Other Traffic"
"11/15/2025, 05:09 AM ET","Arlington (County)","I-395N HOV",9,"On I-395N HOV at mile marker 9 in the County of Arlington, motorists can expect potential delays due to a vehicle crash. The north entrance ramp is closed.","Minor Incident - Traffic - Vehicle Crash"
"11/15/2025, 05:15 AM ET","Newport News (City)","I-64W",255.6,"On I-64 at mile marker 255.6 in the City of Newport News, near Jefferson Avenue, motorists can expect delays due to a vehicle crash. The west outside exit 255B is closed.","Minor Incident - Traffic - Vehicle Crash"
"11/15/2025, 04:45 AM ET","Prince William (County)","I-95N",159.4,"On I-95 at mile marker 159.4 in the County of Prince William, motorists can expect delays due to a disabled vehicle. The north right shoulder is closed.","Minor Incident - Traffic - Disabled Vehicle"
"11/15/2025, 05:17 AM ET","Hampton (City)","I-664S",1.5,"On I-664 at mile marker 1.5 in the City of Hampton, near Powatan Parkway, motorists can expect delays due to a vehicle crash. The south right lane and right shoulder are closed.","Major Incident - Traffic - Vehicle Crash"
