Update Time,Jurisdiction,Route,MRM,Description,Label
"03/27/2025 03:07 AM ET","Fairfax (County)","I-66W",60.6,"On I-66 at mile marker 60.6 in the County of Fairfax, motorists can expect delays due to a disabled vehicle. The west right shoulder is closed.","Minor Incident - Traffic - Disabled Vehicle"
"03/27/2025 03:08 AM ET","New Kent (County)","I-64W",212.7,"On I-64 at mile marker 212.7 in the County of New Kent, motorists can expect delays due to a tractor trailer crash. The west right lane and right shoulder are closed.","Major Incident - Traffic - Tractor Trailer Crash"
"03/27/2025 03:14 AM ET","Henrico (County)","I-295S",37,"On I-295 South at mile marker 37 in the County of Henrico, motorists can expect delays due to a vehicle crash.","Minor Incident - Traffic - Vehicle Crash"
"03/26/2025 06:05 PM ET","Augusta (County)","I-64E",99.9,"On I-64 East at mile marker 99.9 in the County of Augusta, motorists can expect delays due to high wind.","Minor Incident - High Wind - Advisory"
"03/27/2025 02:58 AM ET","Washington (County)","US-19N",18.6,"On US-19 North in the County of Washington, in the vicinity of Brinkley Rd; Rich Valley Rd; Rt. 700E/W (Washington County), motorists can expect delays due to a vehicle crash. Lane closures exist.","Minor Incident - Traffic - Vehicle Crash"
"03/26/2025 06:06 PM ET","Augusta (County)","I-64W",99.9,"On I-64 West at mile marker 99.9 in the County of Augusta, motorists can expect delays due to high wind.","Minor Incident - High Wind - Advisory"
"03/27/2025 03:12 AM ET","Richmond (City)","I-95S",73,"On I-95 at mile marker 73 in the City of Richmond, motorists can expect delays due to a disabled vehicle. The south right shoulder is closed. The south exit ramp narrows.","Minor Incident - Traffic - Disabled Vehicle"
