Update Time,Jurisdiction,Route,MRM,Description,Label
"04/22/2025 04:38 AM ET","Augusta (County)","I-81S",236.4,"On I-81 at mile marker 236.4 in the County of Augusta, motorists can expect delays due to a tractor trailer crash. The south right lane and right shoulder are closed.","Major Incident - Traffic - Tractor Trailer Crash"
"04/22/2025 05:07 AM ET","Stafford (County)","I-95N",143.6,"On I-95 at mile marker 143.6 in the County of Stafford, motorists can expect delays due to a disabled vehicle. The north right shoulder is closed.","Minor Incident - Traffic - Disabled Vehicle"
"04/22/2025 05:00 AM ET","Spotsylvania (County)","I-95S",130.2,"On I-95 at mile marker 130.2 in the County of Spotsylvania, motorists can expect delays due to a tractor trailer crash. The south center lane, right lane, and right shoulder are closed.","Major Incident - Traffic - Tractor Trailer Crash"
"04/22/2025 04:24 AM ET","Sussex (County)","I-95S",27,"On I-95 at mile marker 27 in the County of Sussex, motorists can expect delays due to a vehicle crash. The south left shoulder is closed.","Minor Incident - Traffic - Vehicle Crash"
"04/22/2025 05:12 AM ET","Hampton (City)","I-64E",270,"On I-64 in the City of Hampton, at Hampton Roads Bridge Tunnel East, motorists can expect delays due to a disabled vehicle. The east right shoulder is closed.","Minor Incident - Traffic - Disabled Vehicle"
"04/22/2025 04:06 AM ET","Stafford (County)","I-95N",137.6,"On I-95 at mile marker 137.6 in the County of Stafford, motorists can expect delays due to a disabled vehicle. The north right shoulder is closed.","Minor Incident - Traffic - Disabled Vehicle"
"04/22/2025 05:01 AM ET","Mecklenburg (County)","I-85S",3.4,"On I-85 at mile marker 3.4 in the County of Mecklenburg, motorists can expect delays due to a vehicle crash. The south right lane and right shoulder are closed.","Major Incident - Traffic - Vehicle Crash"
"04/22/2025 05:00 AM ET","Alexandria (City)","City Rt. 6579N (City of Alexandria)",0.1,"On City Rt. 6579 North in the City of Alexandria, in the vicinity of the ramp from and to I-95S, motorists can expect delays due to a vehicle crash. Lane closures exist.","Minor Incident - Traffic - Vehicle Crash"
