Update Time,Jurisdiction,Route,MRM,Description,Label
"10/20/2025, 11:27 PM ET","Patrick (County)","VA-57E",9.9,"On VA-57 East in the County of Patrick, in the vicinity of Goosepoint Rd; Rt. 822N/S (Patrick County), motorists can expect delays due to weather. Lane closures exist.","Weather Incident - Other Weather - Advisory"
"10/21/2025, 12:15 AM ET","Mecklenburg (County)","VA-138N",1.8,"On VA-138 in the County of Mecklenburg, in the vicinity of Clover Rd; Rt. 649N/S (Mecklenburg County), motorists can expect delays due to a vehicle crash. All north lanes are closed. All south lanes are closed.","Major Incident - Traffic - Vehicle Crash"
"10/20/2025, 11:50 PM ET","Hanover (County)","VA-30W",0.6,"On VA-30 in the County of Hanover, in the vicinity of the ramp to I-95, motorists can expect delays due to a vehicle crash. The west exit ramp is closed.","Minor Incident - Traffic - Vehicle Crash"
"10/21/2025, 12:13 AM ET","Hanover (County)","I-95S",98,"On I-95 at mile marker 98 in the County of Hanover, motorists can expect delays due to a vehicle crash. The south right lane, right shoulder, and entrance ramp are closed.","Major Incident - Traffic - Vehicle Crash"
"10/21/2025, 12:20 AM ET","Spotsylvania (County)","I-95S",126.3,"On I-95 at mile marker 126.3 in the County of Spotsylvania, motorists can expect delays due to a disabled vehicle. The south exit ramp narrows.","Minor Incident - Traffic - Disabled Vehicle"
