Update Time,Jurisdiction,Route,MRM,Description,Label
"12/02/2025, 03:27 AM ET","Carroll (County)","I-77S",24.1,"On I-77 South at mile marker 24.1 in the County of Carroll, motorists can expect delays due to fog.","Weather Incident - Fog - Advisory"
"12/02/2025, 03:26 AM ET","Carroll (County)","I-77N",0,"On I-77 North at mile marker 0 in the County of Carroll, motorists can expect delays due to fog.","Weather Incident - Fog - Advisory"
"12/01/2025, 11:14 PM ET","Roanoke (County)","Rt. 694N (Roanoke County)",7.5,"On Rt. 694 in the County of Roanoke, in the vicinity of Mowles Rd, motorists can expect delays due to weather. All north lanes are closed. All south lanes are closed.","Weather Incident - Other Weather - Closed"
"12/02/2025, 02:59 AM ET","Henrico (County)","I-64W",192.7,"On I-64 at mile marker 192.7 in the County of Henrico, motorists can expect delays due to a disabled vehicle. The west right shoulder is closed.","Minor Incident - Traffic - Disabled Vehicle"
"12/02/2025, 03:18 AM ET","Fairfax (County)","I-95N",161.4,"On I-95 at mile marker 161.4 in the County of Fairfax, motorists can expect delays due to a disabled vehicle. The north right shoulder is closed.","Minor Incident - Traffic - Disabled Vehicle"
"12/02/2025, 03:22 AM ET","Loudoun (County)","Rt. 704N (Loudoun County)",0.1,"On Rt. 704 in the County of Loudoun, in the vicinity of Mount Gilead Rd; Rt. 797E/W (Loudoun County), motorists can expect delays due to a vehicle crash. All north lanes are closed. All south lanes are closed.","Major Incident - Traffic - Vehicle Crash"
"12/02/2025, 02:46 AM ET","Loudoun (County)","VA-28N",40.4,"On VA-28 in the County of Loudoun, in the vicinity of Ex Ramp To, motorists can expect delays due to a disabled vehicle. The north right shoulder is closed.","Minor Incident - Traffic - Disabled Vehicle"
"12/02/2025, 03:24 AM ET","Stafford (County)","I-95S",136.2,"On I-95 at mile marker 136.2 in the County of Stafford, motorists can expect delays due to a disabled vehicle. The south right shoulder is closed.","Minor Incident - Traffic - Disabled Vehicle"
