Update Time,Jurisdiction,Route,MRM,Description,Label
"07/24/2025, 05:59 PM ET","Fairfax (County)","Rt. 1268E (Fairfax County)",0.4,"On Rt. 1268 in the County of Fairfax, in the vicinity of Golden Woods Ct; Rt. 7844E/W (Fairfax County), motorists can expect delays due to weather. All east lanes are closed. All west lanes are closed.","Weather Incident - Other Weather - Closed"
"07/24/2025, 11:14 PM ET","Rockbridge (County)","I-64W",65.2,"On I-64 at mile marker 65.2 in the County of Rockbridge, motorists can expect delays due to a disabled vehicle. The west right shoulder is closed.","Minor Incident - Traffic - Disabled Vehicle"
"07/24/2025, 06:25 PM ET","Lunenburg (County)","Rt. 619E (Lunenburg County)",2,"On Rt. 619 in the County of Lunenburg, in the vicinity of Bacon Fork Rd; Rt. 610N/S (Lunenburg County), motorists can expect delays due to weather. All east lanes are closed. All west lanes are closed.","Weather Incident - Other Weather - Closed"
"07/25/2025, 05:14 AM ET","Fairfax (County)","Rt. 5329E (Fairfax County)",0.8,"On Rt. 5329 East in the County of Fairfax, in the vicinity of Olde Crafts Dr; Rt. 5337N/S (Fairfax County), motorists can expect delays due to a vehicle fire. Lane closures exist.","Minor Incident - Traffic - Vehicle Fire"
"07/25/2025, 05:18 AM ET","Stafford (County)","I-95N",141.3,"On I-95 at mile marker 141.3 in the County of Stafford, motorists can expect delays due to a disabled vehicle. The north right shoulder is closed.","Minor Incident - Traffic - Disabled Vehicle"
