Update Time,Jurisdiction,Route,MRM,Description,Label
"01/26/2025 12:30 AM","Spotsylvania (County)","I-95S",126.5,"On I-95 at mile marker 126.5 in the County of Spotsylvania, motorists can expect delays due to a disabled vehicle. The south right shoulder is closed.","Major Incident - Traffic - Disabled Vehicle"
"01/26/2025 01:06 AM","Lancaster (County)","VA-201N",2.83,"On VA-201 North in the County of Lancaster, in the vicinity of Mary Ball Rd; VA-3E/W, motorists can expect delays due to a vehicle crash. Lane closures exist.","Minor Incident - Traffic - Vehicle Crash"
"01/26/2025 12:52 AM","Fairfax (County)","I-495S",49.6,"On I-495 at mile marker 49.6 in the County of Fairfax, motorists can expect delays due to a disabled vehicle. The south exit ramp narrows.","Minor Incident - Traffic - Disabled Vehicle"
"01/26/2025 01:10 AM","Norfolk (City)","I-564E",1.99,"On I-564 at mile marker 2 in the City of Norfolk, near Intermodal Connector, motorists can expect delays due to a vehicle crash. The east right lane and right shoulder are closed. The east entrance ramp narrows.","Major Incident - Traffic - Vehicle Crash"
"01/26/2025 12:35 AM","Washington (County)","I-81S",14,"On I-81 at mile marker 14 in the County of Washington, motorists can expect delays due to a vehicle crash. The south right shoulder is closed.","Major Incident - Traffic - Vehicle Crash"
"01/26/2025 01:18 AM","Norfolk (City)","I-64W",271.38,"On I-64 at mile marker 271.4 in the City of Norfolk, motorists can expect delays due to a multi-vehicle crash. The west left shoulder and left lane are closed.","Major Incident - Traffic - Multi-Vehicle Crash"
"01/26/2025 01:18 AM","Henrico (County)","I-295N",43,"On I-295 North at mile marker 43 in the County of Henrico, motorists can expect delays due to a vehicle crash.","Minor Incident - Traffic - Vehicle Crash"
"01/26/2025 01:17 AM","Chesapeake (City)","I-664S",18.63,"On I-664 at mile marker 18.6 in the City of Chesapeake, near US-58, motorists can expect delays due to a vehicle crash. The south right shoulder is closed.","Major Incident - Traffic - Vehicle Crash"
"01/26/2025 01:09 AM","Fairfax (County)","I-495N",48.1,"On I-495 at mile marker 48.1 in the County of Fairfax, motorists can expect delays due to a disabled vehicle. The north right shoulder is closed.","Major Incident - Traffic - Disabled Vehicle"
