Update Time,Jurisdiction,Route,MRM,Description,Label
"05/30/2025 01:58 AM ET","Montgomery (County)","I-81N",106.5,"On I-81 at mile marker 106.5 in the County of Montgomery, motorists can expect delays due to a disabled tractor trailer. The north right lane and right shoulder are closed.","Major Incident - Traffic - Disabled Tractor Trailer"
"05/30/2025 01:17 AM ET","Giles (County)","BUS US-460W (5 Pearisburg/Giles)",2.7,"On BUS US-460 in the County of Giles, in the vicinity of Rt. 9849E/W (Giles County), motorists can expect delays due to an incident. The west left shoulder and left lane are closed.","Major Incident - Traffic - Other Traffic"
"05/30/2025 02:14 AM ET","Chesterfield (County)","VA-150N",14.9,"On VA-150 in the County of Chesterfield, in the vicinity of the ramp from VA-150, motorists can expect delays due to a vehicle crash. The north exit ramp is closed.","Minor Incident - Traffic - Vehicle Crash"
"05/30/2025 02:23 AM ET","Virginia Beach (City)","I-264E",12.2,"On I-264 at mile marker 12.2 in the City of Virginia Beach, near Military Highway, motorists can expect delays due to a disabled vehicle. The east inside right shoulder is closed.","Minor Incident - Traffic - Disabled Vehicle"
"05/30/2025 01:51 AM ET","Isle Of Wight (County)","US-258E",25.5,"On US-258 East in the County of Isle Of Wight, in the vicinity of Colosse Rd; Rt. 641N/S (Isle of Wight County), near 27055 Colosse Road, motorists can expect delays due to a vehicle crash.","Minor Incident - Traffic - Vehicle Crash"
"05/30/2025 02:03 AM ET","Hanover (County)","I-295S",34,"On I-295 at mile marker 34 in the County of Hanover, motorists can expect delays due to a vehicle crash. The south right shoulder is closed.","Minor Incident - Traffic - Vehicle Crash"
