Update Time,Jurisdiction,Route,MRM,Description,Label
"05/23/2025 03:17 AM ET","Chesapeake (City)","I-664S",20,"On I-664 at mile marker 20 in the City of Chesapeake, near 64 interchange, motorists can expect delays due to a tractor trailer crash. All south lanes are closed. The south exit 15B is closed.","Major Incident - Traffic - Tractor Trailer Crash"
"05/22/2025 10:27 PM ET","Essex (County)","US-17N",129.3,"On US-17 in the County of Essex, in the vicinity of Maryfield Rd; Turnout; Rt. 1215N/S (Essex County), motorists can expect delays due to standing water. The north right lane and right shoulder are closed.","Major Incident - Standing Water - Advisory"
"05/23/2025 03:15 AM ET","Stafford (County)","I-95N",133,"On I-95 at mile marker 133 in the County of Stafford, motorists can expect delays due to a disabled tractor trailer. The north right lane and right shoulder are closed.","Major Incident - Traffic - Disabled Tractor Trailer"
"05/23/2025 03:08 AM ET","Hampton (City)","I-64E",266.4,"On I-64 at mile marker 266.4 in the City of Hampton, near Hampton River Bridge, motorists can expect delays due to a disabled vehicle. The east right shoulder is closed.","Minor Incident - Traffic - Disabled Vehicle"
"05/23/2025 03:06 AM ET","Prince William (County)","I-95N",160.4,"On I-95 at mile marker 160.4 in the County of Prince William, motorists can expect delays due to a disabled vehicle. The north right shoulder is closed.","Minor Incident - Traffic - Disabled Vehicle"
