Update Time,Jurisdiction,Route,MRM,Description,Label
"12/30/2025, 07:09 PM ET","Fairfax (County)","I-395S",0.8,"On I-395 at mile marker 0.8 in the County of Fairfax, motorists can expect delays due to a disabled vehicle. The south right shoulder is closed.","Minor Incident - Traffic - Disabled Vehicle"
"12/30/2025, 08:34 PM ET","James City (County)","I-64W",229.3,"On I-64 at mile marker 229.3 in the County of James City, near Six Mount Zion Road, motorists can expect delays due to a vehicle crash. The west right lane and right shoulder are closed.","Major Incident - Traffic - Vehicle Crash"
"12/30/2025, 08:33 PM ET","Virginia Beach (City)","I-264W",15.3,"On I-264 at mile marker 15.3 in the City of Virginia Beach, near Witchduck Road, motorists can expect delays due to a disabled vehicle. The west exit 16 narrows.","Minor Incident - Traffic - Disabled Vehicle"
"12/30/2025, 07:21 PM ET","Prince William (County)","I-95R",155.8,"On I-95R at mile marker 155.8 in the County of Prince William, motorists can expect potential delays due to a disabled vehicle. The south right shoulder is closed.","Minor Incident - Traffic - Disabled Vehicle"
"12/30/2025, 07:46 PM ET","Fairfax (County)","I-95S",168.5,"On I-95 at mile marker 168.5 in the County of Fairfax, motorists can expect delays due to a disabled tractor trailer. The south exit ramp narrows.","Minor Incident - Traffic - Disabled Tractor Trailer"
"12/30/2025, 07:58 PM ET","Prince William (County)","I-95N",157.4,"On I-95 at mile marker 157.4 in the County of Prince William, motorists can expect delays due to a vehicle crash. The north right shoulder is closed.","Minor Incident - Traffic - Vehicle Crash"
"12/30/2025, 04:56 PM ET","Franklin (County)","Rt. 739E (Franklin County)",0.6,"On Rt. 739 in the County of Franklin, in the vicinity of Algoma Rd; Rt. 740E/W (Franklin County), motorists can expect delays due to weather. All east lanes are closed. All west lanes are closed.","Weather Incident - Other Weather - Closed"
"12/30/2025, 08:41 PM ET","Prince William (County)","I-95N",150.3,"On I-95 at mile marker 150.3 in the County of Prince William, motorists can expect delays due to a disabled vehicle. The north right shoulder is closed.","Minor Incident - Traffic - Disabled Vehicle"
