Update Time,Jurisdiction,Route,MRM,Description,Label
"02/24/2025 02:09 PM ET","Mecklenburg (County)","Rt. 688N (Mecklenburg County)",5,"On Rt. 688 North in the County of Mecklenburg, in the vicinity of Wilkerson Rd; Rt. 677E/W (Mecklenburg County), motorists can expect delays due to standing water.","Minor Incident - Standing Water - Advisory"
"02/24/2025 11:56 PM ET","Fairfax (County)","I-495S",51.6,"On I-495 at mile marker 51.6 in the County of Fairfax, motorists can expect delays due to a disabled vehicle. The south right shoulder is closed.","Minor Incident - Traffic - Disabled Vehicle"
"02/25/2025 12:13 AM ET","Arlington (County)","I-66W",68.5,"On I-66 at mile marker 68.5 in the County of Arlington, motorists can expect delays due to a disabled vehicle. The west right shoulder is closed.","Minor Incident - Traffic - Disabled Vehicle"
"02/25/2025 12:15 AM ET","Alexandria (City)","I-395S",5.8,"On I-395 South at mile marker 5.8 in the City of Alexandria, motorists can expect delays due to a disabled vehicle.","Minor Incident - Traffic - Disabled Vehicle"
"02/25/2025 12:12 AM ET","Emporia (City)","I-95S",11,"On I-95 at mile marker 11 in the City of Emporia, motorists can expect delays due to a disabled tractor trailer. The south exit 11A is closed.","Minor Incident - Traffic - Disabled Tractor Trailer"
