Update Time,Jurisdiction,Route,MRM,Description,Label
"01/26/2025 10:40 AM","Carroll (County)","I-77N",0,"On I-77 North at mile marker 0 in the County of Carroll, motorists can expect delays due to high wind.","Minor Incident - High Wind - Advisory"
"01/26/2025 11:11 AM","Brunswick (County)","US-1S",31.7,"On US-1 South in the County of Brunswick, in the vicinity of Rosebud Ln; FR-78E/W, motorists can expect delays due to a disabled vehicle. Lane closures exist.","Minor Incident - Traffic - Disabled Vehicle"
"01/26/2025 10:40 AM","Carroll (County)","I-77S",24,"On I-77 South at mile marker 24 in the County of Carroll, motorists can expect delays due to high wind.","Minor Incident - High Wind - Advisory"
"01/26/2025 11:09 AM","Fairfax (County)","I-66W",63.7,"On I-66 at mile marker 63.7 in the County of Fairfax, motorists can expect delays due to a disabled vehicle. The west right shoulder is closed.","Major Incident - Traffic - Disabled Vehicle"
"01/26/2025 11:14 AM","Fairfax (County)","I-495S",54.6,"On I-495 at mile marker 54.6 in the County of Fairfax, motorists can expect delays due to a disabled vehicle. The south right shoulder is closed.","Major Incident - Traffic - Disabled Vehicle"
"01/26/2025 11:09 AM","Fairfax (County)","I-495N",47.6,"On I-495 at mile marker 47.6 in the County of Fairfax, motorists can expect delays due to a vehicle crash. The north right lane is closed.","Major Incident - Traffic - Vehicle Crash"
"01/26/2025 11:00 AM","Augusta (County)","Rt. 610E (Augusta County)",2.77,"On Rt. 610 in the County of Augusta, in the vicinity of Patton Farm Rd; Rt. 633N/S (Augusta County), motorists can expect delays due to a vehicle crash. All east lanes are closed.","Major Incident - Traffic - Vehicle Crash"
"01/26/2025 10:46 AM","Loudoun (County)","Rt. 736N (Loudoun County)",1.8,"On Rt. 736 North in the County of Loudoun, in the vicinity of Airmont Rd; Rt. 719N/S (Loudoun County), motorists can expect delays due to icy conditions. Lane closures exist.","Minor Incident - Icy Conditions - Advisory"
"01/26/2025 10:59 AM","Albemarle (County)","Rt. 631S (Albemarle County)",14.25,"On Rt. 631 in the County of Albemarle, in the vicinity of Seminole Trl; US-29N, motorists can expect delays due to a vehicle crash. All south lanes are closed.","Major Incident - Traffic - Vehicle Crash"
