Update Time,Jurisdiction,Route,MRM,Description,Label
"08/04/2025, 01:48 AM ET","Carroll (County)","Rt. 728E (Carroll County)",0.5,"On Rt. 728 in the County of Carroll, in the vicinity of Country Club Ln; Estate Dr; Hasson Ln; Oak Cluster Ln; Spivey Ln; Tower Rd; Twin Pines Loop; Wards Mill Ln; Rt. 792N/S (Carroll County), motorists can expect delays due to standing water. All east lanes are closed. All west lanes are closed.","Weather Incident - Standing Water - Closed"
"08/04/2025, 04:25 AM ET","Stafford (County)","I-95N",145,"On I-95 at mile marker 145 in the County of Stafford, motorists can expect delays due to a disabled vehicle. The north right shoulder is closed.","Minor Incident - Traffic - Disabled Vehicle"
"08/04/2025, 04:25 AM ET","Virginia Beach (City)","I-264E",14.2,"On I-264 at mile marker 14.2 in the City of Virginia Beach, near Witchduck Road, motorists can expect delays due to a disabled vehicle. The east right shoulder is closed.","Minor Incident - Traffic - Disabled Vehicle"
"08/04/2025, 04:13 AM ET","Stafford (County)","I-95S",146.2,"On I-95 at mile marker 146.2 in the County of Stafford, motorists can expect delays due to a disabled vehicle. The south left shoulder is closed.","Minor Incident - Traffic - Disabled Vehicle"
"08/04/2025, 04:08 AM ET","Fairfax (County)","I-95S",172.6,"On I-95 at mile marker 172.6 in the County of Fairfax, motorists can expect delays due to a disabled tractor trailer. The south right shoulder is closed.","Minor Incident - Traffic - Disabled Tractor Trailer"
"08/03/2025, 04:52 PM ET","Isle Of Wight (County)","US-258E",36.4,"On US-258 in the County of Isle Of Wight, in the vicinity of Fire Tower Rd; Rt. 644E/W (Isle of Wight County), motorists can expect delays due to standing water. All east lanes are closed. All west lanes are closed.","Weather Incident - Standing Water - Closed"
"08/03/2025, 04:51 PM ET","Surry (County)","VA-10E",63,"On VA-10 in the County of Surry, in the vicinity of Bacons Castle Trl; White Marsh Rd; Rt. 617E/W (Surry County), motorists can expect delays due to standing water. All east lanes are closed. All west lanes are closed.","Weather Incident - Standing Water - Closed"
