Update Time,Jurisdiction,Route,MRM,Description,Label
"02/04/2025 10:19 PM ET","Portsmouth (City)","I-264E",2.7,"On I-264 East at mile marker 2.7 in the City of Portsmouth, near Victory Boulevard, motorists can expect delays due to a disabled vehicle.","Minor Incident - Traffic - Disabled Vehicle"
"02/04/2025 09:57 PM ET","Carroll (County)","VA-97E",2.76,"On VA-97 in the County of Carroll, in the vicinity of Whitney Ln; Rt. 725N/S (Carroll County), motorists can expect delays due to a vehicle crash. All east lanes are closed. All west lanes are closed.","Major Incident - Traffic - Vehicle Crash"
"02/04/2025 10:18 PM ET","Norfolk (City)","I-64W",279.88,"On I-64 West at mile marker 279.9 in the City of Norfolk, near Norview Avenue, motorists can expect delays due to a disabled vehicle.","Minor Incident - Traffic - Disabled Vehicle"
"02/04/2025 10:08 PM ET","Chesterfield (County)","I-95S",59.4,"On I-95 at mile marker 59.4 in the County of Chesterfield, motorists can expect delays due to a disabled vehicle. The south right shoulder is closed.","Minor Incident - Traffic - Disabled Vehicle"
"02/04/2025 10:12 PM ET","Newport News (City)","I-64W",252.97,"On I-64 at mile marker 253 in the City of Newport News, near Denbigh Boulevard, motorists can expect delays due to a disabled vehicle. The west right shoulder is closed.","Minor Incident - Traffic - Disabled Vehicle"
"02/04/2025 09:48 PM ET","Southampton (County)","Rt. 616S (Southampton County)",17.32,"On Rt. 616 South in the County of Southampton, in the vicinity of General Mahone Blvd; US-460E/W; /PROCTORS BR. RD., motorists can expect delays due to standing water.","Minor Incident - Standing Water - Advisory"
