Update Time,Jurisdiction,Route,MRM,Description,Label
"03/09/2025 05:23 AM ET","Brunswick (County)","Rt. 629E (Brunswick County)",5.7,"On Rt. 629 East in the County of Brunswick, in the vicinity of Waqua Creek Rd; Rt. 630N/S (Brunswick County), motorists can expect delays due to standing water.","Minor Incident - Standing Water - Advisory"
"03/09/2025 06:35 AM ET","Fairfax (County)","I-495N",50,"On I-495 at mile marker 50 in the County of Fairfax, motorists can expect delays due to a disabled vehicle. The north right shoulder is closed.","Minor Incident - Traffic - Disabled Vehicle"
"03/09/2025 07:07 AM ET","Norfolk (City)","I-64W",277.6,"On I-64 at mile marker 277.6 in the City of Norfolk, near 564 Interchange, motorists can expect delays due to a vehicle crash. The west exit 276B narrows.","Minor Incident - Traffic - Vehicle Crash"
"03/09/2025 06:30 AM ET","Fairfax (County)","I-66E",51.2,"On I-66 at mile marker 51.2 in the County of Fairfax, motorists can expect delays due to a disabled vehicle. The east right shoulder is closed.","Minor Incident - Traffic - Disabled Vehicle"
"03/09/2025 07:07 AM ET","Colonial Heights (City)","City Rt. 2U Ramp 0A (City of Colonial Heights)",0.1,"On City Rt. 2U Ramp 0A South at mile marker 0.1 in the City of Colonial Heights, motorists can expect delays due to a vehicle crash.","Minor Incident - Traffic - Vehicle Crash"
"03/09/2025 07:03 AM ET","Fairfax (County)","I-66E",59.4,"On I-66 at mile marker 59.4 in the County of Fairfax, motorists can expect delays due to a disabled vehicle. The east right shoulder is closed.","Minor Incident - Traffic - Disabled Vehicle"
"03/09/2025 07:03 AM ET","Franklin (County)","Rt. 697E (Franklin County)",8.9,"On Rt. 697 in the County of Franklin, in the vicinity of Booker T Washington Hwy; Jamont Ln; VA-122N/S, motorists can expect delays due to a vehicle crash. All east lanes are closed. All west lanes are closed.","Major Incident - Traffic - Vehicle Crash"
