Update Time,Jurisdiction,Route,MRM,Description,Label
"01/21/2025 03:47 PM","Suffolk (City)","I-664N",8.9,"On I-664 North in the City of Suffolk, at Monitor Merrimac Memorial Bridge Tunnel North, motorists can expect delays due to congestion. Traffic backups are approximately 2.5 miles.","Major Incident - Traffic - Congestion/Delay"
"01/21/2025 04:09 PM","Newport News (City)","I-664S",7.84,"On I-664 South in the City of Newport News, at Monitor Merrimac Memorial Bridge Tunnel South, motorists can expect delays due to congestion. Traffic backups are approximately 1.5 miles.","Major Incident - Traffic - Congestion/Delay"
"01/21/2025 03:59 PM","Norfolk (City)","I-64W",272.4,"On I-64 West in the City of Norfolk, at Hampton Roads Bridge Tunnel West, motorists can expect delays due to congestion. Traffic backups are approximately 6.5 miles.","Major Incident - Traffic - Congestion/Delay"
"01/21/2025 03:42 PM","Richmond (City)","I-95S",72.9,"On I-95 at mile marker 72.9 in the City of Richmond, motorists can expect delays due to a vehicle crash. The south right lane and right shoulder are closed.","Major Incident - Traffic - Vehicle Crash"
"01/21/2025 03:55 PM","Henrico (County)","I-64E",199,"On I-64 at mile marker 199 in the County of Henrico, motorists can expect delays due to a disabled vehicle. The east right shoulder is closed.","Major Incident - Traffic - Disabled Vehicle"
"01/21/2025 03:41 PM","Fairfax (County)","I-66E",54.2,"On I-66 at mile marker 54.2 in the County of Fairfax, motorists can expect delays due to a disabled vehicle. The east right shoulder is closed.","Major Incident - Traffic - Disabled Vehicle"
"01/21/2025 04:13 PM","Fairfax (County)","I-495N",49.5,"On I-495 at mile marker 49.5 in the County of Fairfax, motorists can expect delays due to a multi-vehicle crash. The north right center lane, right outside lane, and right shoulder are closed.","Major Incident - Traffic - Multi-Vehicle Crash"
"01/21/2025 03:26 PM","Richmond (City)","I-95N",73.6,"On I-95 at mile marker 73.6 in the City of Richmond, motorists can expect delays due to a vehicle crash. The north exit 73 narrows.","Minor Incident - Traffic - Vehicle Crash"
"01/21/2025 03:55 PM","Hampton (City)","I-64E",270,"On I-64 East in the City of Hampton, at Hampton Roads Bridge Tunnel East, motorists can expect delays due to congestion. Traffic backups are approximately 1.0 mile.","Minor Incident - Traffic - Congestion/Delay"
"01/21/2025 04:04 PM","Prince William (County)","I-95N",148.8,"On I-95 at mile marker 148.8 in the County of Prince William, motorists can expect delays due to a disabled tractor trailer. The north right shoulder is closed.","Major Incident - Traffic - Disabled Tractor Trailer"
"01/21/2025 04:12 PM","Norfolk (City)","I-64W",272.4,"On I-64 West in the City of Norfolk, at Hampton Roads Bridge Tunnel West, motorists can expect potential delays due to a bridge/tunnel stoppage.","Minor Incident - Traffic - Bridge/Tunnel Stoppage"
"01/21/2025 04:03 PM","Norfolk (City)","I-264W",13.24,"On I-264 at mile marker 13.2 in the City of Norfolk, near 64 Interchange, motorists can expect delays due to a vehicle crash. The west inside left shoulder and left lane are closed.","Major Incident - Traffic - Vehicle Crash"
"01/21/2025 04:02 PM","Loudoun (County)","Defender Drive and S Riding Blvd","","Defender Drive and S Riding Blvd in the County of Loudoun, motorists can expect delays due to a vehicle crash. Lane closures exist.","Minor Incident - Traffic - Vehicle Crash"
