Update Time,Jurisdiction,Route,MRM,Description,Label
"07/26/2025, 04:04 AM ET","Chesterfield (County)","I-95N",71,"On I-95 at mile marker 71 in the County of Chesterfield, motorists can expect delays due to a vehicle crash. The north right shoulder is closed.","Minor Incident - Traffic - Vehicle Crash"
"07/26/2025, 01:28 AM ET","Richmond (City)","I-195N",1.6,"On I-195 at mile marker 1.6 in the City of Richmond, motorists can expect delays due to weather. The north right lane and right shoulder are closed.","Weather Incident - Other Weather - Advisory"
"07/26/2025, 04:19 AM ET","Chesterfield (County)","I-95S",73.3,"On I-95 at mile marker 73.3 in the County of Chesterfield, motorists can expect delays due to a disabled vehicle. The south right shoulder is closed.","Minor Incident - Traffic - Disabled Vehicle"
"07/26/2025, 04:16 AM ET","Frederick (County)","I-81S",321,"On I-81 at mile marker 321 in the County of Frederick, motorists can expect delays due to a vehicle crash. The south left shoulder is closed.","Minor Incident - Traffic - Vehicle Crash"
"07/25/2025, 06:13 PM ET","Virginia Beach (City)","I-64E",287.9,"On I-64 East at mile marker 287.9 in the City of Virginia Beach, near Greenbrier Parkway, motorists can expect potential delays due to an incident.","Minor Incident - Traffic - Other Traffic"
"07/25/2025, 08:03 PM ET","Lunenburg (County)","Rt. 619E (Lunenburg County)",2,"On Rt. 619 in the County of Lunenburg, in the vicinity of Bacon Fork Rd; Rt. 610N/S (Lunenburg County), motorists can expect delays due to weather. All east lanes are closed. All west lanes are closed.","Weather Incident - Other Weather - Closed"
"07/26/2025, 04:14 AM ET","Henrico (County)","I-295S",28,"On I-295 at mile marker 28 in the County of Henrico, motorists can expect delays due to a vehicle fire. The south right lane and right shoulder are closed.","Major Incident - Traffic - Vehicle Fire"
"07/26/2025, 03:57 AM ET","Spotsylvania (County)","I-95S",130.9,"On I-95 at mile marker 130.9 in the County of Spotsylvania, motorists can expect delays due to a disabled vehicle. The south right shoulder is closed.","Minor Incident - Traffic - Disabled Vehicle"
