Update Time,Jurisdiction,Route,MRM,Description,Label
"06/02/2025 08:22 PM ET","Giles (County)","BUS US-460W (5 Pearisburg/Giles)",2.7,"On BUS US-460 in the County of Giles, in the vicinity of Rt. 9849E/W (Giles County), motorists can expect delays due to an incident. The west left shoulder and left lane are closed.","Major Incident - Traffic - Other Traffic"
"06/03/2025 02:22 AM ET","Hanover (County)","I-95S",97.3,"On I-95 at mile marker 97.3 in the County of Hanover, motorists can expect delays due to a disabled vehicle. The south right shoulder is closed.","Minor Incident - Traffic - Disabled Vehicle"
"06/03/2025 02:28 AM ET","Stafford (County)","I-95S",136.5,"On I-95 at mile marker 136.5 in the County of Stafford, motorists can expect delays due to a disabled vehicle. The south right shoulder is closed.","Minor Incident - Traffic - Disabled Vehicle"
"06/03/2025 02:15 AM ET","Rockbridge (County)","I-81N",181,"On I-81 at mile marker 181 in the County of Rockbridge, motorists can expect delays due to a tractor trailer crash. The north left shoulder and left lane are closed.","Major Incident - Traffic - Tractor Trailer Crash"
"06/03/2025 01:41 AM ET","New Kent (County)","I-64W",218,"On I-64 at mile marker 218 in the County of New Kent, motorists can expect delays due to a vehicle crash. The west right shoulder is closed.","Minor Incident - Traffic - Vehicle Crash"
"06/03/2025 01:39 AM ET","Fredericksburg (City)","VA-3W",32.4,"On VA-3 in the City of Fredericksburg, in the vicinity of Mahone St, motorists can expect delays due to a multi-vehicle crash. The west left lane, center lane, and right lane are closed.","Major Incident - Traffic - Multi-Vehicle Crash"
"06/03/2025 02:18 AM ET","Gloucester (County)","Rt. 614N (Gloucester County)",7.9,"On Rt. 614 North in the County of Gloucester, in the vicinity of Aberdeen Creek Rd; Beechwood Knoll Tr; Cedar Bush Rd; Old Hickory Fork Rd; Rt. 633N/S (Gloucester County), motorists can expect delays due to a vehicle crash.","Minor Incident - Traffic - Vehicle Crash"
