Update Time,Jurisdiction,Route,MRM,Description,Label
"04/02/2025 11:32 PM ET","Virginia Beach (City)","I-264E",15.2,"On I-264 East at mile marker 15.2 in the City of Virginia Beach, near Witchduck Road, motorists can expect delays due to a disabled vehicle.","Minor Incident - Traffic - Disabled Vehicle"
"04/02/2025 11:15 PM ET","Stafford (County)","I-95S",136.7,"On I-95 at mile marker 136.7 in the County of Stafford, motorists can expect delays due to a disabled vehicle. The south right shoulder is closed.","Minor Incident - Traffic - Disabled Vehicle"
"04/02/2025 10:46 PM ET","Fairfax (County)","On I-495S Express Lanes at mile marker 54.8","","On I-495S Express Lanes at mile marker 54.8 in the County of Fairfax, motorists can expect potential delays due to a vehicle crash. The south left shoulder is closed.","Minor Incident - Traffic - Vehicle Crash"
"04/02/2025 11:30 PM ET","Fairfax (County)","I-66W",55.2,"On I-66 at mile marker 55.2 in the County of Fairfax, motorists can expect delays due to a disabled vehicle. The west right shoulder is closed.","Minor Incident - Traffic - Disabled Vehicle"
"04/02/2025 11:25 PM ET","Fairfax (County)","I-495S",54.6,"Vehicle Accident","Major Incident - Traffic - Vehicle Crash"
"04/02/2025 11:18 PM ET","Chesapeake (City)","I-64E",298.1,"On I-64 at mile marker 298.1 in the City of Chesapeake, near Military Highway, motorists can expect delays due to a disabled vehicle. The east right shoulder is closed.","Minor Incident - Traffic - Disabled Vehicle"
"04/02/2025 10:52 PM ET","Dinwiddie (County)","I-85S",57,"On I-85 at mile marker 57 in the County of Dinwiddie, motorists can expect delays due to a vehicle crash. The south left shoulder and left lane are closed.","Major Incident - Traffic - Vehicle Crash"
"04/02/2025 11:27 PM ET","Stafford (County)","I-95S",141.2,"On I-95 at mile marker 141.2 in the County of Stafford, motorists can expect delays due to a vehicle crash. The south left shoulder and left lane are closed. Traffic backups are approximately 1.0 mile.","Major Incident - Traffic - Vehicle Crash"
