Update Time,Jurisdiction,Route,MRM,Description,Label
"12/04/2025, 10:15 PM ET","Caroline (County)","I-95S",116.2,"On I-95 at mile marker 116.2 in the County of Caroline, motorists can expect delays due to a disabled vehicle. The south left shoulder is closed.","Minor Incident - Traffic - Disabled Vehicle"
"12/04/2025, 10:16 PM ET","Stafford (County)","I-95S",141.9,"On I-95 at mile marker 141.9 in the County of Stafford, motorists can expect delays due to a disabled vehicle. The south right shoulder is closed.","Minor Incident - Traffic - Disabled Vehicle"
"12/04/2025, 07:18 PM ET","Fairfax (County)","Rt. 610N (Fairfax County)",4.1,"On Rt. 610 North in the County of Fairfax, in the vicinity of Wolf Run Shoals Rd; Rt. 8474E/W (Fairfax County), motorists can expect delays due to an incident.","Minor Incident - Traffic - Other Traffic"
"12/04/2025, 10:12 PM ET","Fairfax (County)","I-66E",60,"On I-66 at mile marker 60 in the County of Fairfax, motorists can expect delays due to a disabled vehicle. The east right shoulder is closed.","Minor Incident - Traffic - Disabled Vehicle"
"12/04/2025, 12:15 PM ET","Caroline (County)","I-95S",116.5,"On I-95 at mile marker 116.5 in the County of Caroline, motorists can expect delays due to a disabled vehicle. The south left shoulder is closed.","Minor Incident - Traffic - Disabled Vehicle"
"12/04/2025, 10:08 PM ET","Spotsylvania (County)","VA-3E",23.7,"On VA-3 East in the County of Spotsylvania, in the vicinity of Stuart Dr, motorists can expect delays due to a vehicle crash. Lane closures exist.","Minor Incident - Traffic - Vehicle Crash"
"12/04/2025, 08:07 PM ET","Fairfax (County)","US-50E",66.1,"On US-50 East in the County of Fairfax, in the vicinity of Plaza Ln; Rt. 7163N/S (Fairfax County), motorists can expect delays due to an incident.","Minor Incident - Traffic - Other Traffic"
"12/04/2025, 07:02 PM ET","Fairfax (County)","Rt. 738E (Fairfax County)",2.8,"On Rt. 738 East in the County of Fairfax, in the vicinity of Bellview Rd; Rt. 683E/W (Fairfax County), motorists can expect delays due to an incident.","Minor Incident - Traffic - Other Traffic"
