Update Time,Jurisdiction,Route,MRM,Description,Label
"03/04/2025 12:08 AM ET","Henrico (County)","I-64E",180,"On I-64 at mile marker 180 in the County of Henrico, motorists can expect delays due to a disabled vehicle. The east exit 180A narrows.","Minor Incident - Traffic - Disabled Vehicle"
"03/04/2025 12:01 AM ET","Prince William (County)","I-95S",154.8,"On I-95 at mile marker 154.8 in the County of Prince William, motorists can expect delays due to a disabled vehicle. The south right shoulder is closed.","Minor Incident - Traffic - Disabled Vehicle"
"03/04/2025 12:15 AM ET","Fairfax (County)","I-95N",177,"On I-95 at mile marker 177 in the County of Fairfax, motorists can expect delays due to a disabled tractor trailer. The north right lane and right shoulder are closed.","Major Incident - Traffic - Disabled Tractor Trailer"
"03/03/2025 11:33 PM ET","Amelia (County)","VA-38E",5.1,"On VA-38 East in the County of Amelia, in the vicinity of Cheathams Rd; Rt. 627N/S (Amelia County), motorists can expect delays due to a vehicle crash.","Minor Incident - Traffic - Vehicle Crash"
"03/04/2025 12:10 AM ET","Newport News (City)","I-64W",248.5,"On I-64 at mile marker 248.5 in the City of Newport News, near Yorktown Road, motorists can expect delays due to a disabled vehicle. The west right shoulder is closed.","Minor Incident - Traffic - Disabled Vehicle"
"03/03/2025 10:40 PM ET","Frederick (County)","I-81N",323,"On I-81 at mile marker 323 in the County of Frederick, motorists can expect delays due to congestion. All north lanes are closed. Traffic backups are approximately 1.0 mile.","Major Incident - Traffic - Congestion/Delay"
"03/04/2025 12:11 AM ET","Prince William (County)","I-66W",42.6,"On I-66 at mile marker 42.6 in the County of Prince William, motorists can expect delays due to a disabled tractor trailer. The west right shoulder is closed.","Minor Incident - Traffic - Disabled Tractor Trailer"
"03/04/2025 12:12 AM ET","Fairfax (County)","I-495S",50,"On I-495 at mile marker 50 in the County of Fairfax, motorists can expect delays due to a disabled vehicle. The south right shoulder is closed.","Minor Incident - Traffic - Disabled Vehicle"
