Update Time,Jurisdiction,Route,MRM,Description,Label
"07/02/2025, 11:06 PM ET","Chesterfield (County)","I-95S",62.9,"On I-95 at mile marker 62.9 in the County of Chesterfield, motorists can expect delays due to a disabled vehicle. The south left shoulder is closed.","Minor Incident - Traffic - Disabled Vehicle"
"07/02/2025, 11:07 AM ET","Hanover (County)","Rt. 608E (Hanover County)",5.3,"On Rt. 608 East in the County of Hanover, in the vicinity of Old Ridge Rd; Rt. 631E/W (Hanover County), motorists can expect delays due to standing water.","Minor Incident - Standing Water - Advisory"
"07/02/2025, 10:44 PM ET","Rockingham (County)","VA-253W",8.2,"On VA-253 in the County of Rockingham, in the vicinity of Mill Creek Church Rd; Rt. 673N/S (Rockingham County), motorists can expect delays due to a vehicle crash. All west lanes are closed.","Major Incident - Traffic - Vehicle Crash"
"07/02/2025, 11:04 PM ET","Caroline (County)","VA-207N",0.5,"On VA-207 North in the County of Caroline, in the vicinity of the ramp to I-95, motorists can expect delays due to a vehicle crash.","Minor Incident - Traffic - Vehicle Crash"
"07/02/2025, 10:25 AM ET","Chesterfield (County)","VA-145E",4.9,"On VA-145 East in the County of Chesterfield, in the vicinity of Dorsey Rd; Kingsland Rd; Rt. 611E/W (Chesterfield County), motorists can expect delays due to standing water.","Minor Incident - Standing Water - Advisory"
"07/02/2025, 11:09 PM ET","Norfolk (City)","I-64E",274.8,"On I-64 at mile marker 274.8 in the City of Norfolk, near Bay Avenue, motorists can expect delays due to a disabled tractor trailer. The east right lane and right shoulder are closed.","Major Incident - Traffic - Disabled Tractor Trailer"
"07/02/2025, 07:36 PM ET","Chesterfield (County)","Rt. 650N (Chesterfield County)",0,"On Rt. 650 North in the County of Chesterfield, in the vicinity of Belmont Rd; Turner Rd; Rt. 643E/W (Chesterfield County); Rt. 651E/W (Chesterfield County), motorists can expect delays due to standing water.","Minor Incident - Standing Water - Advisory"
"07/02/2025, 09:44 PM ET","Fairfax (County)","I-495S",44.8,"On I-495 at mile marker 44.8 in the County of Fairfax, motorists can expect delays due to a disabled vehicle. The south right shoulder is closed.","Minor Incident - Traffic - Disabled Vehicle"
"07/02/2025, 10:56 PM ET","Fairfax (County)","I-66W",56.2,"On I-66 at mile marker 56.2 in the County of Fairfax, motorists can expect delays due to a disabled vehicle. The west right shoulder is closed.","Minor Incident - Traffic - Disabled Vehicle"
"07/02/2025, 11:09 PM ET","Accomack (County)","Rt. 734S (Accomack County)",0.9,"On Rt. 734 in the County of Accomack, in the vicinity of Lankford Hwy; US-13N, near Downing Road, motorists can expect delays due to a vehicle crash. All south lanes are closed.","Major Incident - Traffic - Vehicle Crash"
"07/02/2025, 10:08 PM ET","Fairfax (County)","I-95R",165.4,"On I-95R at mile marker 165.4 in the County of Fairfax, motorists can expect potential delays due to a disabled vehicle. The south left shoulder is closed.","Minor Incident - Traffic - Disabled Vehicle"
"07/02/2025, 02:02 PM ET","Brunswick (County)","Rt. 626E (Brunswick County)",7,"On Rt. 626 in the County of Brunswick, in the vicinity of Ankum Rd; Rt. 665N/S (Brunswick County), motorists can expect delays due to standing water. All east lanes are closed. All west lanes are closed.","Major Incident - Standing Water - Closed"
"07/02/2025, 10:18 PM ET","Greensville (County)","Rt. 604N (Greensville County)",4.2,"On Rt. 604 North in the County of Greensville, in the vicinity of Dry Bread Rd; Rt. 611E/W (Greensville County), motorists can expect delays due to standing water.","Minor Incident - Standing Water - Advisory"
"07/02/2025, 10:52 PM ET","Franklin (County)","US-220S",28.3,"On US-220 in the County of Franklin, in the vicinity of Muddy Fork Rd; Rt. 618N/S (Franklin County), motorists can expect delays due to a vehicle crash. The south right lane and right shoulder are closed.","Major Incident - Traffic - Vehicle Crash"
"07/02/2025, 02:30 PM ET","Chesterfield (County)","Rt. 617N (Chesterfield County)",1.3,"On Rt. 617 North in the County of Chesterfield, in the vicinity of Golf Course Rd; Green Spire Dr; Old Bermuda Hundred Rd; Woods Edge Rd; Rt. 620N/S (Chesterfield County), motorists can expect delays due to standing water.","Minor Incident - Standing Water - Advisory"
"07/02/2025, 10:26 PM ET","Fairfax (County)","I-95R",166.4,"On I-95R at mile marker 166.4 in the County of Fairfax, motorists can expect potential delays due to a disabled vehicle. The south left shoulder is closed.","Minor Incident - Traffic - Disabled Vehicle"
"07/02/2025, 10:21 AM ET","Caroline (County)","Rt. 652N (Caroline County)",13.9,"On Rt. 652 North in the County of Caroline, in the vicinity of Moncure Dr; Rt. 716E/W (Caroline County), motorists can expect delays due to standing water. Lane closures exist.","Minor Incident - Standing Water - Advisory"
"07/02/2025, 10:18 PM ET","Greensville (County)","Rt. 604N (Greensville County)",0,"On Rt. 604 in the County of Greensville, in the vicinity of Macedonia Rd; Rt. 603N/S (Greensville County), motorists can expect delays due to standing water. All north lanes are closed. All south lanes are closed.","Major Incident - Standing Water - Closed"
"07/02/2025, 10:59 PM ET","Chesterfield (County)","VA-10E",8,"On VA-10 East in the County of Chesterfield, in the vicinity of Iron Bridge Xo; Kingsland Xo; Quaiff Xo; Whitepine Rd, motorists can expect delays due to a vehicle crash.","Minor Incident - Traffic - Vehicle Crash"
"07/02/2025, 02:29 PM ET","Brunswick (County)","Rt. 672N (Brunswick County)",4.9,"On Rt. 672 North in the County of Brunswick, in the vicinity of Western Mill Rd; Rt. 670N/S (Brunswick County), motorists can expect delays due to standing water. Lane closures exist.","Minor Incident - Standing Water - Advisory"
"07/02/2025, 01:12 PM ET","Brunswick (County)","Rt. 664S (Brunswick County)",0,"On Rt. 664 South in the County of Brunswick, in the vicinity of Gasburg Rd; Rt. 626E/W (Brunswick County), motorists can expect delays due to standing water. Lane closures exist.","Minor Incident - Standing Water - Advisory"
