Update Time,Jurisdiction,Route,MRM,Description,Label
"05/07/2025 12:15 AM ET","Norfolk (City)","I-64W",272.4,"On I-64 in the City of Norfolk, at Hampton Roads Bridge Tunnel West, motorists can expect potential delays due to a bridge/tunnel stoppage. All west lanes are closed.","Major Incident - Traffic - Bridge/Tunnel Stoppage"
"05/07/2025 12:09 AM ET","Goochland (County)","I-64E",153,"On I-64 at mile marker 153 in the County of Goochland, motorists can expect delays due to a tractor trailer crash. All east lanes are closed.","Major Incident - Traffic - Tractor Trailer Crash"
"05/07/2025 12:10 AM ET","Alleghany (County)","I-64E",15.6,"On I-64 at mile marker 15.6 in the County of Alleghany, motorists can expect delays due to a vehicle fire. The east right lane and right shoulder are closed.","Major Incident - Traffic - Vehicle Fire"
"05/06/2025 11:54 PM ET","Rockbridge (County)","I-81S",191.5,"On I-81 at mile marker 191.5 in the County of Rockbridge, motorists can expect delays due to a vehicle crash. The south right shoulder is closed.","Minor Incident - Traffic - Vehicle Crash"
"05/06/2025 11:58 PM ET","Chesterfield (County)","I-95S",66.5,"On I-95 at mile marker 66.5 in the County of Chesterfield, motorists can expect delays due to a disabled vehicle. The south right shoulder is closed.","Minor Incident - Traffic - Disabled Vehicle"
"05/06/2025 11:46 PM ET","Norfolk (City)","I-564E",0.7,"On I-564 at mile marker 0.7 in the City of Norfolk, near Terminal Boulevard, motorists can expect delays due to a vehicle crash. The east entrance ramp narrows.","Minor Incident - Traffic - Vehicle Crash"
"05/07/2025 12:12 AM ET","Fairfax (County)","I-66E",66,"On I-66 at mile marker 66 in the County of Fairfax, motorists can expect delays due to a vehicle crash. The east right shoulder is closed.","Minor Incident - Traffic - Vehicle Crash"
