Update Time,Jurisdiction,Route,MRM,Description,Label
"10/16/2025, 04:40 AM ET","Prince William (County)","I-95S",149.5,"On I-95 at mile marker 149.5 in the County of Prince William, motorists can expect delays due to a vehicle crash. The south right shoulder is closed.","Minor Incident - Traffic - Vehicle Crash"
"10/16/2025, 05:59 AM ET","Carroll (County)","I-77S",24.1,"On I-77 South at mile marker 24.1 in the County of Carroll, motorists can expect delays due to high wind.","Weather Incident - High Wind - Advisory"
"10/16/2025, 04:07 AM ET","Prince William (County)","I-95N",158.4,"On I-95 at mile marker 158.4 in the County of Prince William, motorists can expect delays due to a disabled vehicle. The north right shoulder is closed.","Minor Incident - Traffic - Disabled Vehicle"
"10/16/2025, 06:16 AM ET","Norfolk (City)","I-64W",279.9,"On I-64 at mile marker 279.9 in the City of Norfolk, near Norview Avenue, motorists can expect delays due to a disabled vehicle. The west right shoulder is closed.","Minor Incident - Traffic - Disabled Vehicle"
"10/16/2025, 05:58 AM ET","Carroll (County)","I-77N",0,"On I-77 North at mile marker 0 in the County of Carroll, motorists can expect delays due to high wind.","Weather Incident - High Wind - Advisory"
"10/16/2025, 06:06 AM ET","Fairfax (County)","VA-28N",34.4,"On VA-28 in the County of Fairfax, in the vicinity of Willard Rd; Rt. 8457W (Fairfax County); Rt. 6215W (Fairfax County), motorists can expect delays due to a disabled vehicle. The north right shoulder is closed.","Minor Incident - Traffic - Disabled Vehicle"
"10/16/2025, 05:50 AM ET","Prince William (County)","I-95N",158.5,"On I-95 at mile marker 158.5 in the County of Prince William, motorists can expect delays due to a disabled vehicle. The north right shoulder is closed.","Minor Incident - Traffic - Disabled Vehicle"
"10/16/2025, 04:52 AM ET","Floyd (County)","Rt. 612N (Floyd County)",2.1,"On Rt. 612 North in the County of Floyd, in the vicinity of Eanes Rd; Rt. 665E/W (Floyd County), motorists can expect delays due to weather. Lane closures exist.","Weather Incident - Other Weather - Advisory"
