Update Time,Jurisdiction,Route,MRM,Description,Label
"08/10/2025, 09:26 AM ET","Amherst (County)","Rt. 663E (Amherst County)",5.4,"On Rt. 663 in the County of Amherst, in the vicinity of Mount Airy Rd; Rt. 770E/W (Amherst County), motorists can expect delays due to a vehicle crash. All east lanes are closed. All west lanes are closed.","Major Incident - Traffic - Vehicle Crash"
"08/10/2025, 08:23 AM ET","Fairfax (County)","Rt. 677E (Fairfax County)",1.2,"On Rt. 677 East in the County of Fairfax, in the vicinity of Hunter Mill Rd; Rt. 674S (Fairfax County), motorists can expect delays due to weather.","Weather Incident - Other Weather - Advisory"
"08/10/2025, 09:24 AM ET","Chesterfield (County)","I-95N",56.8,"On I-95 at mile marker 56.8 in the County of Chesterfield, motorists can expect delays due to a disabled vehicle. The north right shoulder is closed.","Minor Incident - Traffic - Disabled Vehicle"
"08/10/2025, 09:23 AM ET","Fairfax (County)","I-66W",54.9,"On I-66 at mile marker 54.9 in the County of Fairfax, motorists can expect delays due to a vehicle crash. The west right shoulder is closed.","Minor Incident - Traffic - Vehicle Crash"
"08/10/2025, 09:12 AM ET","Hampton (City)","I-64E",265.3,"On I-64 at mile marker 265.3 in the City of Hampton, near La Salle avenue, motorists can expect delays due to a tractor trailer crash. All east lanes are closed.","Major Incident - Traffic - Tractor Trailer Crash"
"08/10/2025, 09:20 AM ET","Dinwiddie (County)","I-85S",61,"On I-85 at mile marker 61 in the County of Dinwiddie, motorists can expect delays due to a disabled vehicle. The south right shoulder is closed.","Minor Incident - Traffic - Disabled Vehicle"
"08/10/2025, 09:22 AM ET","Pulaski (County)","I-81S",92,"On I-81 at mile marker 92 in the County of Pulaski, motorists can expect delays due to a vehicle crash. The south right shoulder is closed.","Minor Incident - Traffic - Vehicle Crash"
"08/10/2025, 09:05 AM ET","Fairfax (County)","I-66E",54.8,"On I-66 at mile marker 54.8 in the County of Fairfax, motorists can expect delays due to a disabled vehicle. The east right shoulder is closed.","Minor Incident - Traffic - Disabled Vehicle"
"08/10/2025, 09:24 AM ET","Suffolk (City)","I-664N",11.4,"On I-664 North at mile marker 11.4 in the City of Suffolk, near Suffolk Shore Inspection Station, motorists can expect delays due to a disabled vehicle.","Minor Incident - Traffic - Disabled Vehicle"
