Update Time,Jurisdiction,Route,MRM,Description,Label
"05/26/2025 01:05 AM ET","Prince William (County)","I-95N",150,"On I-95 at mile marker 150 in the County of Prince William, motorists can expect delays due to a multi-vehicle crash. The north center lane, right lane, and right shoulder are closed.","Major Incident - Traffic - Multi-Vehicle Crash"
"05/26/2025 01:16 AM ET","Montgomery (County)","I-81N",110.2,"On I-81 at mile marker 110.2 in the County of Montgomery, motorists can expect delays due to a vehicle crash. The north right shoulder is closed.","Minor Incident - Traffic - Vehicle Crash"
"05/26/2025 01:15 AM ET","Hampton (City)","I-64E",263,"On I-64 at mile marker 263 in the City of Hampton, near Mercury Boulevard, motorists can expect delays due to a vehicle crash. The east left shoulder and left outside lane are closed.","Major Incident - Traffic - Vehicle Crash"
"05/26/2025 01:09 AM ET","Fairfax (County)","I-66W",63.9,"On I-66 at mile marker 63.9 in the County of Fairfax, motorists can expect delays due to a disabled vehicle. The west right shoulder is closed.","Minor Incident - Traffic - Disabled Vehicle"
"05/26/2025 12:54 AM ET","Fairfax (County)","I-495N",44.6,"On I-495 at mile marker 44.6 in the County of Fairfax, motorists can expect delays due to a disabled vehicle. The north right shoulder is closed.","Minor Incident - Traffic - Disabled Vehicle"
