Update Time,Jurisdiction,Route,MRM,Description,Label
"11/16/2025, 05:30 PM ET","Augusta (County)","I-64W",99.9,"On I-64 West at mile marker 99.9 in the County of Augusta, motorists can expect delays due to high wind.","Weather Incident - High Wind - Advisory"
"11/16/2025, 05:30 PM ET","Augusta (County)","I-64E",99.9,"On I-64 East at mile marker 99.9 in the County of Augusta, motorists can expect delays due to high wind.","Weather Incident - High Wind - Advisory"
"11/16/2025, 09:17 PM ET","Carroll (County)","I-77N",0,"On I-77 North at mile marker 0 in the County of Carroll, motorists can expect delays due to high wind.","Weather Incident - High Wind - Advisory"
"11/16/2025, 10:14 PM ET","Fairfax (County)","I-95S",168.6,"On I-95 at mile marker 168.6 in the County of Fairfax, motorists can expect delays due to a disabled vehicle. The south right shoulder is closed.","Minor Incident - Traffic - Disabled Vehicle"
"11/16/2025, 08:46 PM ET","Loudoun (County)","Rt. 663W (Loudoun County)",8.8,"On Rt. 663 in the County of Loudoun, in the vicinity of Hiddenhollow Ln, motorists can expect delays due to an incident. The west through lanes are closed.","Major Incident - Traffic - Other Traffic"
"11/16/2025, 10:13 PM ET","Chesapeake (City)","I-64W",291.8,"On I-64 at mile marker 291.8 in the City of Chesapeake, near Battlefield Boulevard, motorists can expect delays due to a disabled vehicle. The west outside right shoulder is closed.","Minor Incident - Traffic - Disabled Vehicle"
"11/16/2025, 10:06 PM ET","Stafford (County)","I-95N",135.7,"On I-95 at mile marker 135.7 in the County of Stafford, motorists can expect delays due to a vehicle crash. The north right shoulder is closed.","Minor Incident - Traffic - Vehicle Crash"
"11/16/2025, 09:19 PM ET","Carroll (County)","I-77S",24.1,"On I-77 South at mile marker 24.1 in the County of Carroll, motorists can expect delays due to high wind.","Weather Incident - High Wind - Advisory"
