Update Time,Jurisdiction,Route,MRM,Description,Label
"03/08/2025 12:58 PM ET","James City (County)","I-64E",229.4,"On I-64 at mile marker 229.4 in the County of James City, near Six Mount Zion Road, motorists can expect delays due to a vehicle crash. The east left shoulder and left lane are closed.","Major Incident - Traffic - Vehicle Crash"
"03/08/2025 06:27 AM ET","Brunswick (County)","Rt. 629E (Brunswick County)",5.7,"On Rt. 629 East in the County of Brunswick, in the vicinity of Waqua Creek Rd; Rt. 630N/S (Brunswick County), motorists can expect delays due to standing water.","Minor Incident - Standing Water - Advisory"
"03/08/2025 01:12 PM ET","Stafford (County)","I-95N",139.8,"On I-95 at mile marker 139.8 in the County of Stafford, motorists can expect delays due to a vehicle crash. The north left shoulder is closed.","Minor Incident - Traffic - Vehicle Crash"
"03/08/2025 01:12 PM ET","Roanoke (County)","US-220S",63.1,"On US-220 in the County of Roanoke, in the vicinity of Ramp 0a To I-581s Ramp SE; VA-24U Ramp 0A; Ramp Intersection:FROM RT 24 - ELM STREET, motorists can expect delays due to a disabled vehicle. The south right shoulder is closed.","Minor Incident - Traffic - Disabled Vehicle"
"03/08/2025 01:12 PM ET","Norfolk (City)","I-64W",272.4,"On I-64 West in the City of Norfolk, at Hampton Roads Bridge Tunnel West, motorists can expect delays due to congestion. Traffic backups are approximately 2.5 miles.","Major Incident - Traffic - Congestion/Delay"
"03/08/2025 12:07 PM ET","Carroll (County)","I-77S",24.1,"On I-77 South at mile marker 24.1 in the County of Carroll, motorists can expect delays due to high wind.","Minor Incident - High Wind - Advisory"
"03/08/2025 01:04 PM ET","New Kent (County)","I-64W",209.5,"On I-64 at mile marker 209.5 in the County of New Kent, motorists can expect delays due to a tractor trailer crash. The west right lane and right shoulder are closed. Traffic backups are approximately 2.5 miles.","Major Incident - Traffic - Tractor Trailer Crash"
"03/08/2025 12:06 PM ET","Carroll (County)","I-77N",0,"On I-77 North at mile marker 0 in the County of Carroll, motorists can expect delays due to high wind.","Minor Incident - High Wind - Advisory"
