Update Time,Jurisdiction,Route,MRM,Description,Label
"12/07/2025, 12:14 AM ET","Loudoun (County)","Rt. 2200E (Loudoun County)",0.4,"On Rt. 2200 East in the County of Loudoun, in the vicinity of South Riding Blvd; Tall Cedars Pkwy; Rt. 2201N/S (Loudoun County), near Nations Street, motorists can expect delays due to a vehicle crash.","Minor Incident - Traffic - Vehicle Crash"
"12/07/2025, 12:08 AM ET","Fairfax (County)","VA-28S",32.2,"On VA-28 in the County of Fairfax, in the vicinity of Braddock Rd; Rt. 620E/W (Fairfax County), motorists can expect delays due to a disabled vehicle. The south right shoulder is closed.","Minor Incident - Traffic - Disabled Vehicle"
"12/07/2025, 12:14 AM ET","Henrico (County)","VA-195S",1.3,"On VA-195 in the County of Henrico, in the vicinity of the ramp, motorists can expect delays due to a vehicle crash. The south left shoulder, left lane, and center lane are closed.","Major Incident - Traffic - Vehicle Crash"
"12/06/2025, 11:57 PM ET","Suffolk (City)","US-58W",477.9,"On US-58 in the City of Suffolk, in the vicinity of FR-672E/W, Rt. 1E (City of Suffolk), near Portsmouth Boulevard, motorists can expect delays due to a vehicle crash. All west lanes are closed.","Major Incident - Traffic - Vehicle Crash"
"12/07/2025, 12:12 AM ET","Rockingham (County)","US-33W",16.2,"On US-33 in the County of Rockingham, in the vicinity of Muddy Creek Rd; Rt. 752N/S (Rockingham County);MUDDY CREEK RD., motorists can expect delays due to a vehicle fire. All east lanes are closed. All west lanes are closed.","Major Incident - Traffic - Vehicle Fire"
"12/07/2025, 12:15 AM ET","Fairfax (County)","I-66W",59.9,"On I-66 at mile marker 59.9 in the County of Fairfax, motorists can expect delays due to a disabled vehicle. The west exit ramp narrows.","Minor Incident - Traffic - Disabled Vehicle"
"12/07/2025, 12:04 AM ET","Fairfax (County)","I-495S",44.2,"On I-495 at mile marker 44.2 in the County of Fairfax, motorists can expect delays due to a disabled vehicle. The south right shoulder is closed.","Minor Incident - Traffic - Disabled Vehicle"
"12/06/2025, 11:07 PM ET","Prince William (County)","I-95R",153.5,"On I-95R at mile marker 153.5 in the County of Prince William, motorists can expect potential delays due to a disabled vehicle. The north right shoulder is closed.","Minor Incident - Traffic - Disabled Vehicle"
"12/07/2025, 12:12 AM ET","Fairfax (County)","I-495S",43.2,"On I-495 at mile marker 43.2 in the County of Fairfax, motorists can expect delays due to a disabled vehicle. The south right shoulder is closed.","Minor Incident - Traffic - Disabled Vehicle"
