Update Time,Jurisdiction,Route,MRM,Description,Label
"03/13/2025 06:02 AM ET","Stafford (County)","I-95N",133.6,"On I-95 at mile marker 133.6 in the County of Stafford, motorists can expect delays due to an incident. The north right lane and right shoulder are closed.","Major Incident - Traffic - Other Traffic"
"03/13/2025 05:43 AM ET","Carroll (County)","I-77S",24.1,"On I-77 South at mile marker 24.1 in the County of Carroll, motorists can expect delays due to high wind.","Minor Incident - High Wind - Advisory"
"03/12/2025 08:49 AM ET","Nelson (County)","VA-151N",20.2,"On VA-151 in the County of Nelson, in the vicinity of Rhue Hollow Rd; Rt. 628E/W (Nelson County), motorists can expect delays due to a tractor trailer crash. The north right lane is closed.","Major Incident - Traffic - Tractor Trailer Crash"
"03/13/2025 04:50 AM ET","Chesterfield (County)","I-95S",53.1,"On I-95 at mile marker 53.1 in the County of Chesterfield, motorists can expect delays due to a tractor trailer crash. The south center lane, right lane, and right shoulder are closed.","Major Incident - Traffic - Tractor Trailer Crash"
"03/13/2025 06:11 AM ET","Fairfax (County)","I-95S",164.2,"On I-95 at mile marker 164.2 in the County of Fairfax, motorists can expect delays due to a disabled vehicle. The south right shoulder is closed.","Minor Incident - Traffic - Disabled Vehicle"
"03/13/2025 05:44 AM ET","Carroll (County)","I-77N",0,"On I-77 North at mile marker 0 in the County of Carroll, motorists can expect delays due to high wind.","Minor Incident - High Wind - Advisory"
"03/13/2025 06:03 AM ET","Fairfax (County)","I-495S",44,"On I-495 at mile marker 44 in the County of Fairfax, motorists can expect delays due to a disabled vehicle. The south right shoulder is closed.","Minor Incident - Traffic - Disabled Vehicle"
"03/13/2025 06:16 AM ET","Loudoun (County)","VA-9W",12.5,"On VA-9 West in the County of Loudoun, in the vicinity of Clarkes Gap Rd, motorists can expect delays due to a disabled vehicle.","Minor Incident - Traffic - Disabled Vehicle"
"03/13/2025 06:09 AM ET","Stafford (County)","I-95N",136,"Gate Strike","Major Incident - Traffic - Other Traffic"
