Update Time,Jurisdiction,Route,MRM,Description,Label
"05/28/2025 02:03 AM ET","Mecklenburg (County)","I-85N",17.2,"On I-85 North at mile marker 17.2 in the County of Mecklenburg, motorists can expect delays due to a vehicle crash.","Minor Incident - Traffic - Vehicle Crash"
"05/28/2025 02:24 AM ET","Norfolk (City)","I-64E",282.6,"On I-64 at mile marker 282.6 in the City of Norfolk, near Northampton Boulevard, motorists can expect delays due to a disabled vehicle. The east right shoulder is closed.","Minor Incident - Traffic - Disabled Vehicle"
"05/27/2025 05:26 PM ET","Fairfax (County)","On I-495N Express Lanes at mile marker 48.2","","On I-495N Express Lanes at mile marker 48.2 in the County of Fairfax, motorists can expect potential delays due to a disabled vehicle. The north left shoulder is closed.","Minor Incident - Traffic - Disabled Vehicle"
"05/28/2025 02:22 AM ET","Prince William (County)","I-95S",158,"On I-95 at mile marker 158 in the County of Prince William, motorists can expect delays due to a disabled vehicle. The south left shoulder is closed.","Minor Incident - Traffic - Disabled Vehicle"
"05/27/2025 09:11 PM ET","Augusta (County)","I-64W",99.9,"On I-64 West at mile marker 99.9 in the County of Augusta, motorists can expect delays due to fog.","Minor Incident - Fog - Advisory"
"05/28/2025 02:17 AM ET","Arlington (County)","I-66W",69.2,"On I-66 at mile marker 69.2 in the County of Arlington, motorists can expect delays due to a disabled vehicle. The west right shoulder is closed.","Minor Incident - Traffic - Disabled Vehicle"
"05/27/2025 06:17 PM ET","Augusta (County)","I-64E",99.9,"On I-64 East at mile marker 99.9 in the County of Augusta, motorists can expect delays due to fog.","Minor Incident - Fog - Advisory"
"05/28/2025 02:08 AM ET","Stafford (County)","I-95S",141.5,"On I-95 at mile marker 141.5 in the County of Stafford, motorists can expect delays due to a disabled vehicle. The south right shoulder is closed.","Minor Incident - Traffic - Disabled Vehicle"
"05/28/2025 02:21 AM ET","Washington (County)","Rt. 689E (Washington County)",0.1,"On Rt. 689 East in the County of Washington, in the vicinity of Porterfield Hwy; US-19N, ALT US-58E/W, motorists can expect delays due to a vehicle crash. Lane closures exist.","Minor Incident - Traffic - Vehicle Crash"
