Update Time,Jurisdiction,Route,MRM,Description,Label
"05/09/2025 04:14 AM ET","Richmond (City)","I-95S",76,"On I-95 at mile marker 76 in the City of Richmond, motorists can expect delays due to a disabled vehicle. The south right shoulder is closed.","Minor Incident - Traffic - Disabled Vehicle"
"05/09/2025 04:17 AM ET","Virginia Beach (City)","I-264W",14.8,"On I-264 at mile marker 14.8 in the City of Virginia Beach, near Witchduck Road, motorists can expect delays due to a disabled vehicle. The west right lane and right shoulder are closed.","Major Incident - Traffic - Disabled Vehicle"
"05/09/2025 02:27 AM ET","Augusta (County)","I-64W",99.9,"On I-64 West at mile marker 99.9 in the County of Augusta, motorists can expect delays due to fog.","Minor Incident - Fog - Advisory"
"05/09/2025 04:21 AM ET","Richmond (City)","I-95S",77.8,"On I-95 at mile marker 77.8 in the City of Richmond, motorists can expect delays due to a disabled vehicle. The south right shoulder is closed.","Minor Incident - Traffic - Disabled Vehicle"
"05/09/2025 04:00 AM ET","Fairfax (County)","I-495N",54,"On I-495 at mile marker 54 in the County of Fairfax, motorists can expect delays due to a disabled vehicle. The north right shoulder is closed.","Minor Incident - Traffic - Disabled Vehicle"
"05/09/2025 02:25 AM ET","Augusta (County)","I-64E",99.9,"On I-64 East at mile marker 99.9 in the County of Augusta, motorists can expect delays due to fog.","Minor Incident - Fog - Advisory"
"05/09/2025 03:57 AM ET","Prince George (County)","VA-156N",24.5,"On VA-156 North in the County of Prince George, at Benjamin Harrison Bridge, motorists can expect delays due to a vehicle crash.","Minor Incident - Traffic - Vehicle Crash"
