Update Time,Jurisdiction,Route,MRM,Description,Label
"06/13/2025, 02:25 AM ET","Shenandoah (County)","I-81N",265.9,"On I-81 at mile marker 265.9 in the County of Shenandoah, motorists can expect delays due to a vehicle crash. The north left shoulder and right shoulder are closed.","Minor Incident - Traffic - Vehicle Crash"
"06/13/2025, 02:12 AM ET","Spotsylvania (County)","I-95S",127.8,"On I-95 at mile marker 127.8 in the County of Spotsylvania, motorists can expect delays due to a disabled vehicle. The south left shoulder is closed.","Minor Incident - Traffic - Disabled Vehicle"
"06/13/2025, 02:12 AM ET","Richmond (City)","I-95N",74,"On I-95 at mile marker 74 in the City of Richmond, motorists can expect delays due to a disabled vehicle. The north exit 74A narrows.","Minor Incident - Traffic - Disabled Vehicle"
"06/13/2025, 02:28 AM ET","Fairfax (County)","I-66E",63.6,"On I-66 at mile marker 63.6 in the County of Fairfax, motorists can expect delays due to a disabled vehicle. The east right shoulder is closed.","Minor Incident - Traffic - Disabled Vehicle"
"06/13/2025, 02:18 AM ET","Leesburg (Town)","US-15N",219.1,"On US-15 North in the Town of Leesburg, in the vicinity of Edwards Ferry Rd NE; City Rt. 4208E (Town of Leesburg), motorists can expect delays due to a vehicle crash. Lane closures exist.","Minor Incident - Traffic - Vehicle Crash"
"06/13/2025, 02:15 AM ET","Fairfax (County)","I-95S",168.4,"On I-95 at mile marker 168.4 in the County of Fairfax, motorists can expect delays due to a disabled vehicle. The south right shoulder is closed.","Minor Incident - Traffic - Disabled Vehicle"
