Update Time,Jurisdiction,Route,MRM,Description,Label
"03/04/2025 04:01 AM ET","Montgomery (County)","I-81S",127.3,"On I-81 at mile marker 127.3 in the County of Montgomery, motorists can expect delays due to a tractor trailer crash. The south right lane and right shoulder are closed.","Major Incident - Traffic - Tractor Trailer Crash"
"03/04/2025 04:10 AM ET","Suffolk (City)","I-664S",11.8,"On I-664 at mile marker 11.8 in the City of Suffolk, near College Drive, motorists can expect delays due to a tractor trailer crash. All south lanes are closed. The south entrance ramp is closed.","Major Incident - Traffic - Tractor Trailer Crash"
"03/04/2025 03:52 AM ET","Stafford (County)","I-95S",145.1,"On I-95 at mile marker 145.1 in the County of Stafford, motorists can expect delays due to a disabled vehicle. The south right shoulder is closed.","Minor Incident - Traffic - Disabled Vehicle"
"03/04/2025 03:30 AM ET","Prince William (County)","I-95S",154.8,"On I-95 at mile marker 154.8 in the County of Prince William, motorists can expect delays due to a disabled vehicle. The south right shoulder is closed.","Minor Incident - Traffic - Disabled Vehicle"
"03/04/2025 04:02 AM ET","Prince William (County)","I-66W",42.6,"On I-66 at mile marker 42.6 in the County of Prince William, motorists can expect delays due to a disabled tractor trailer. The west right shoulder is closed.","Minor Incident - Traffic - Disabled Tractor Trailer"
"03/04/2025 03:41 AM ET","Stafford (County)","I-95N",145.5,"On I-95 at mile marker 145.5 in the County of Stafford, motorists can expect delays due to a disabled vehicle. The north right shoulder is closed.","Minor Incident - Traffic - Disabled Vehicle"
"03/04/2025 03:43 AM ET","Chesterfield (County)","VA-288N",11,"On VA-288 in the County of Chesterfield, in the vicinity of the ramp to Commonwealth Centre Parkway, motorists can expect delays due to a vehicle crash. All north lanes are closed.","Major Incident - Traffic - Vehicle Crash"
