Update Time,Jurisdiction,Route,MRM,Description,Label
"01/19/2025 07:22 AM","Dinwiddie (County)","I-85N",44.6,"On I-85 at mile marker 44.6 in the County of Dinwiddie, motorists can expect delays due to a vehicle crash. The north right shoulder is closed.","Major Incident - Traffic - Vehicle Crash"
"01/19/2025 07:12 AM","Norfolk (City)","I-264E",10.46,"On I-264 at mile marker 10.5 in the City of Norfolk, near Ingleside Road, motorists can expect delays due to a disabled vehicle. The east right shoulder is closed.","Major Incident - Traffic - Disabled Vehicle"
"01/19/2025 07:25 AM","Rockbridge (County)","I-81N",181.6,"On I-81 at mile marker 181.6 in the County of Rockbridge, motorists can expect delays due to a disabled vehicle. The north right shoulder is closed.","Major Incident - Traffic - Disabled Vehicle"
"01/19/2025 06:01 AM","Norfolk (City)","I-64W",272.4,"On I-64 West in the City of Norfolk, at Hampton Roads Bridge Tunnel West, motorists can expect potential delays due to fog.","Minor Incident - Fog - Advisory"
"01/19/2025 06:02 AM","Hampton (City)","I-64E",270,"On I-64 East in the City of Hampton, at Hampton Roads Bridge Tunnel East, motorists can expect potential delays due to fog.","Minor Incident - Fog - Advisory"
"01/19/2025 07:06 AM","Fairfax (County)","I-66E",55.5,"On I-66 at mile marker 55.5 in the County of Fairfax, motorists can expect delays due to a disabled vehicle. The east right shoulder is closed.","Major Incident - Traffic - Disabled Vehicle"
"01/19/2025 07:14 AM","Stafford (County)","I-95N",136,"On I-95 at mile marker 136 in the County of Stafford, motorists can expect delays due to a disabled vehicle. The north right shoulder is closed.","Major Incident - Traffic - Disabled Vehicle"
