Update Time,Jurisdiction,Route,MRM,Description,Label
"12/28/2025, 10:18 AM ET","Carroll (County)","I-77N",0,"On I-77 North at mile marker 0 in the County of Carroll, motorists can expect delays due to fog.","Weather Incident - Fog - Advisory"
"12/28/2025, 09:58 AM ET","Fairfax (County)","I-66E",58,"On I-66 at mile marker 58 in the County of Fairfax, motorists can expect delays due to a disabled vehicle. The east right shoulder is closed.","Minor Incident - Traffic - Disabled Vehicle"
"12/28/2025, 10:04 AM ET","Stafford (County)","I-95S",139.8,"On I-95 at mile marker 139.8 in the County of Stafford, motorists can expect delays due to a disabled vehicle. The south right shoulder is closed.","Minor Incident - Traffic - Disabled Vehicle"
"12/28/2025, 10:10 AM ET","Chesterfield (County)","Rt. 4700N (Chesterfield County)",1,"On Rt. 4700 in the County of Chesterfield, in the vicinity of Key Deer Dr; Rt. 4744E/W (Chesterfield County), motorists can expect delays due to an incident. All north lanes are closed. All south lanes are closed.","Major Incident - Traffic - Other Traffic"
"12/27/2025, 02:47 PM ET","Mecklenburg (County)","I-85N",15.7,"On I-85 at mile marker 15.7 in the County of Mecklenburg, motorists can expect delays due to a disabled vehicle. The north right shoulder is closed.","Minor Incident - Traffic - Disabled Vehicle"
"12/28/2025, 10:07 AM ET","Spotsylvania (County)","I-95N",125,"On I-95 at mile marker 125 in the County of Spotsylvania, motorists can expect delays due to a disabled vehicle. The north right shoulder is closed.","Minor Incident - Traffic - Disabled Vehicle"
"12/28/2025, 10:19 AM ET","Carroll (County)","I-77S",24.1,"On I-77 South at mile marker 24.1 in the County of Carroll, motorists can expect delays due to fog.","Weather Incident - Fog - Advisory"
