Update Time,Jurisdiction,Route,MRM,Description,Label
"05/08/2025 02:24 AM ET","Rockbridge (County)","I-81N",180.4,"On I-81 at mile marker 180.4 in the County of Rockbridge, motorists can expect delays due to a tractor trailer crash. The north right shoulder is closed.","Minor Incident - Traffic - Tractor Trailer Crash"
"05/08/2025 02:20 AM ET","Norfolk (City)","I-64W",280.7,"On I-64 at mile marker 280.6 in the City of Norfolk, near Norview Avenue, motorists can expect delays due to a disabled vehicle. The west right shoulder is closed.","Minor Incident - Traffic - Disabled Vehicle"
"05/08/2025 01:54 AM ET","Mecklenburg (County)","US-58E",364.9,"On US-58 East in the County of Mecklenburg, in the vicinity of Buggs Island Rd; VA-4N/S; Rt. 674N/S (Mecklenburg County), motorists can expect delays due to a vehicle crash.","Minor Incident - Traffic - Vehicle Crash"
"05/08/2025 02:25 AM ET","Spotsylvania (County)","I-95N",131.5,"On I-95 at mile marker 131.5 in the County of Spotsylvania, motorists can expect delays due to a vehicle crash. The north center lane, right lane, and right shoulder are closed.","Major Incident - Traffic - Vehicle Crash"
"05/08/2025 02:14 AM ET","Fairfax (County)","I-66W",63.6,"On I-66 at mile marker 63.6 in the County of Fairfax, motorists can expect delays due to a disabled vehicle. The west right shoulder is closed.","Minor Incident - Traffic - Disabled Vehicle"
