Update Time,Jurisdiction,Route,MRM,Description,Label
"03/13/2025 10:46 PM ET","Fairfax (County)","I-66W",55.7,"On I-66 at mile marker 55.7 in the County of Fairfax, motorists can expect delays due to a disabled vehicle. The west entrance ramp narrows.","Minor Incident - Traffic - Disabled Vehicle"
"03/13/2025 10:52 PM ET","Shenandoah (County)","I-81N",266.5,"On I-81 at mile marker 266.5 in the County of Shenandoah, motorists can expect delays due to a disabled tractor trailer. The north right lane and right shoulder are closed.","Major Incident - Traffic - Disabled Tractor Trailer"
"03/13/2025 10:51 PM ET","Hanover (County)","I-95S",100.1,"On I-95 at mile marker 100.1 in the County of Hanover, motorists can expect delays due to a tractor trailer crash. The south right shoulder is closed.","Minor Incident - Traffic - Tractor Trailer Crash"
"03/13/2025 10:44 PM ET","Fairfax (County)","I-95N",164.1,"On I-95 at mile marker 164.1 in the County of Fairfax, motorists can expect delays due to a disabled tractor trailer. The north right shoulder is closed.","Minor Incident - Traffic - Disabled Tractor Trailer"
"03/13/2025 08:20 PM ET","Arlington (County)","I-395N HOV",9,"On I-395N HOV North at mile marker 9 in the County of Arlington, motorists can expect potential delays due to a disabled vehicle.","Minor Incident - Traffic - Disabled Vehicle"
"03/13/2025 10:46 PM ET","Prince William (County)","I-95R",160.4,"On I-95R at mile marker 160.4 in the County of Prince William, motorists can expect potential delays due to a disabled vehicle. The south left shoulder is closed.","Minor Incident - Traffic - Disabled Vehicle"
"03/13/2025 10:22 PM ET","Prince William (County)","I-95N",155.4,"On I-95 at mile marker 155.4 in the County of Prince William, motorists can expect delays due to a disabled vehicle. The north right shoulder is closed.","Minor Incident - Traffic - Disabled Vehicle"
