Update Time,Jurisdiction,Route,MRM,Description,Label
"12/24/2025, 03:59 AM ET","Prince William (County)","I-66W",48.7,"On I-66 at mile marker 48.7 in the County of Prince William, motorists can expect delays due to a disabled vehicle. The west right shoulder is closed.","Minor Incident - Traffic - Disabled Vehicle"
"12/24/2025, 03:29 AM ET","Chesterfield (County)","Rt. 637N (Chesterfield County)",4.9,"On Rt. 637 in the County of Chesterfield, in the vicinity of Windy Oaks Ln; Rt. 3442E/W (Chesterfield County), motorists can expect delays due to an incident. All north lanes are closed. All south lanes are closed.","Major Incident - Traffic - Other Traffic"
"12/24/2025, 04:13 AM ET","Fairfax (County)","I-495S",43,"On I-495 at mile marker 43 in the County of Fairfax, motorists can expect delays due to a disabled tractor trailer. The south right shoulder is closed.","Minor Incident - Traffic - Disabled Tractor Trailer"
"12/24/2025, 03:40 AM ET","Carroll (County)","I-77N",0,"On I-77 North at mile marker 0 in the County of Carroll, motorists can expect delays due to high wind.","Weather Incident - High Wind - Advisory"
"12/24/2025, 03:42 AM ET","Carroll (County)","I-77S",24.1,"On I-77 South at mile marker 24.1 in the County of Carroll, motorists can expect delays due to high wind.","Weather Incident - High Wind - Advisory"
"12/24/2025, 04:21 AM ET","Chesterfield (County)","I-95N",56.9,"On I-95 at mile marker 56.9 in the County of Chesterfield, motorists can expect delays due to a disabled vehicle. The north right shoulder is closed.","Minor Incident - Traffic - Disabled Vehicle"
