Update Time,Jurisdiction,Route,MRM,Description,Label
"12/28/2025, 09:07 AM ET","Carroll (County)","I-77N",0,"On I-77 North at mile marker 0 in the County of Carroll, motorists can expect delays due to fog.","Weather Incident - Fog - Advisory"
"12/28/2025, 08:44 AM ET","Stafford (County)","I-95S",139.8,"On I-95 at mile marker 139.8 in the County of Stafford, motorists can expect delays due to a disabled vehicle. The south right shoulder is closed.","Minor Incident - Traffic - Disabled Vehicle"
"12/28/2025, 08:59 AM ET","Chesterfield (County)","Rt. 4700N (Chesterfield County)",1,"On Rt. 4700 North in the County of Chesterfield, in the vicinity of Key Deer Dr; Rt. 4744E/W (Chesterfield County), motorists can expect delays due to an incident. Lane closures exist.","Minor Incident - Traffic - Other Traffic"
"12/27/2025, 02:47 PM ET","Mecklenburg (County)","I-85N",15.7,"On I-85 at mile marker 15.7 in the County of Mecklenburg, motorists can expect delays due to a disabled vehicle. The north right shoulder is closed.","Minor Incident - Traffic - Disabled Vehicle"
"12/28/2025, 08:01 AM ET","Augusta (County)","Rt. 795E (Augusta County)",6.2,"On Rt. 795 in the County of Augusta, in the vicinity of Old White Bridge Rd; Rt. 640N/S (Augusta County), motorists can expect delays due to a vehicle crash. All east lanes are closed. All west lanes are closed.","Major Incident - Traffic - Vehicle Crash"
"12/28/2025, 09:08 AM ET","Carroll (County)","I-77S",24.1,"On I-77 South at mile marker 24.1 in the County of Carroll, motorists can expect delays due to fog.","Weather Incident - Fog - Advisory"
