Update Time,Jurisdiction,Route,MRM,Description,Label
"10/17/2025, 01:17 AM ET","Virginia Beach (City)","I-264W",14.6,"On I-264 at mile marker 14.6 in the City of Virginia Beach, near Witchduck Road, motorists can expect delays due to a disabled vehicle. The west left shoulder is closed.","Minor Incident - Traffic - Disabled Vehicle"
"10/17/2025, 12:00 AM ET","Fairfax (County)","I-95N",171.8,"On I-95 at mile marker 171.8 in the County of Fairfax, motorists can expect delays due to a disabled vehicle. The north right shoulder is closed.","Minor Incident - Traffic - Disabled Vehicle"
"10/17/2025, 01:12 AM ET","Carroll (County)","I-77N",0,"On I-77 North at mile marker 0 in the County of Carroll, motorists can expect delays due to high wind.","Weather Incident - High Wind - Advisory"
"10/17/2025, 12:52 AM ET","Goochland (County)","I-64E",156,"On I-64 at mile marker 156 in the County of Goochland, motorists can expect delays due to a vehicle crash. The east right shoulder is closed.","Minor Incident - Traffic - Vehicle Crash"
"10/17/2025, 01:15 AM ET","Arlington (County)","I-395N",9,"On I-395 at mile marker 9 in the County of Arlington, motorists can expect delays due to a vehicle crash. The north center lane, right lane, right shoulder, and entrance ramp are closed.","Major Incident - Traffic - Vehicle Crash"
"10/17/2025, 01:08 AM ET","Hanover (County)","I-95N",94.2,"On I-95 at mile marker 94.2 in the County of Hanover, motorists can expect delays due to a disabled vehicle. The north right shoulder is closed.","Minor Incident - Traffic - Disabled Vehicle"
"10/17/2025, 01:06 AM ET","Franklin (County)","US-220S",36.1,"On US-220 in the County of Franklin, in the vicinity of Cassell Dr; Sontag Rd; Rt. 816N/S (Franklin County), motorists can expect delays due to a tractor trailer crash. All south lanes are closed.","Major Incident - Traffic - Tractor Trailer Crash"
"10/17/2025, 01:17 AM ET","Stafford (County)","I-95N",146,"On I-95 at mile marker 146 in the County of Stafford, motorists can expect delays due to a disabled vehicle. The north right shoulder is closed.","Minor Incident - Traffic - Disabled Vehicle"
"10/17/2025, 01:13 AM ET","Carroll (County)","I-77S",24.1,"On I-77 South at mile marker 24.1 in the County of Carroll, motorists can expect delays due to high wind.","Weather Incident - High Wind - Advisory"
