Update Time,Jurisdiction,Route,MRM,Description,Label
"10/06/2025, 02:15 AM ET","Fairfax (County)","I-495S",44.5,"On I-495 at mile marker 44.5 in the County of Fairfax, motorists can expect delays due to a disabled vehicle. The south right shoulder is closed.","Minor Incident - Traffic - Disabled Vehicle"
"10/06/2025, 02:21 AM ET","Arlington (County)","I-395S",5.6,"On I-395 at mile marker 5.6 in the County of Arlington, motorists can expect delays due to a disabled vehicle. The south right shoulder is closed.","Minor Incident - Traffic - Disabled Vehicle"
"10/06/2025, 02:16 AM ET","Fairfax (County)","I-66W",61.4,"On I-66 at mile marker 61.4 in the County of Fairfax, motorists can expect delays due to a vehicle crash. The west right shoulder is closed.","Minor Incident - Traffic - Vehicle Crash"
"10/06/2025, 01:57 AM ET","Augusta (County)","VA-254E",14.6,"On VA-254 in the County of Augusta, in the vicinity of Woodrow Wilson Pkwy; VA-262E/W, motorists can expect delays due to a vehicle crash. All east lanes are closed. All west lanes are closed.","Major Incident - Traffic - Vehicle Crash"
"10/06/2025, 02:14 AM ET","Fairfax (County)","I-95N",163,"On I-95 at mile marker 163 in the County of Fairfax, motorists can expect delays due to a tractor trailer crash. The north left shoulder and left lane are closed.","Major Incident - Traffic - Tractor Trailer Crash"
