Update Time,Jurisdiction,Route,MRM,Description,Label
"11/19/2025, 02:28 AM ET","Augusta (County)","I-64W",99.9,"On I-64 West at mile marker 99.9 in the County of Augusta, motorists can expect delays due to fog.","Weather Incident - Fog - Advisory"
"11/19/2025, 02:28 AM ET","Augusta (County)","I-64E",99.9,"On I-64 East at mile marker 99.9 in the County of Augusta, motorists can expect delays due to fog.","Weather Incident - Fog - Advisory"
"11/19/2025, 04:20 AM ET","Virginia Beach (City)","I-64E",287.3,"On I-64 at mile marker 287.3 in the City of Virginia Beach, near Indian River Road, motorists can expect delays due to a disabled vehicle. The east right shoulder is closed.","Minor Incident - Traffic - Disabled Vehicle"
"11/19/2025, 04:11 AM ET","Fairfax (County)","I-95N",172,"On I-95 at mile marker 172 in the County of Fairfax, motorists can expect delays due to a tractor trailer crash. The north left center lane, right center lane, right inside center lane, right outside lane, and right shoulder are closed.","Major Incident - Traffic - Tractor Trailer Crash"
"11/19/2025, 02:43 AM ET","Spotsylvania (County)","I-95S",119,"On I-95 at mile marker 119 in the County of Spotsylvania, motorists can expect delays due to a disabled vehicle. The south right shoulder is closed.","Minor Incident - Traffic - Disabled Vehicle"
"11/19/2025, 03:56 AM ET","Chesterfield (County)","I-95S",64.4,"On I-95 at mile marker 64.4 in the County of Chesterfield, motorists can expect delays due to a tractor trailer crash. The south center lane, right lane, and right shoulder are closed.","Major Incident - Traffic - Tractor Trailer Crash"
