Update Time,Jurisdiction,Route,MRM,Description,Label
"01/21/2025 07:05 PM","Caroline (County)","VA-207N",0.31,"On VA-207 North in the County of Caroline, in the vicinity of Jefferson Davis Hwy; Jericho Rd; FR-160N/S, motorists can expect delays due to a tractor trailer crash. Lane closures exist.","Minor Incident - Traffic - Tractor Trailer Crash"
"01/21/2025 08:10 PM","Hanover (County)","I-95N",93.9,"On I-95 at mile marker 93.9 in the County of Hanover, motorists can expect delays due to a disabled vehicle. The north right shoulder is closed.","Major Incident - Traffic - Disabled Vehicle"
"01/21/2025 07:33 PM","Prince William (County)","I-95N",156.5,"On I-95 at mile marker 156.5 in the County of Prince William, motorists can expect delays due to a disabled vehicle. The north left shoulder is closed.","Major Incident - Traffic - Disabled Vehicle"
"01/21/2025 05:52 PM","Goochland (County)","I-64E",170,"On I-64 East at mile marker 170 in the County of Goochland, motorists can expect delays due to a vehicle crash.","Minor Incident - Traffic - Vehicle Crash"
"01/21/2025 08:14 PM","Frederick (County)","I-81N",321.9,"On I-81 at mile marker 321.9 in the County of Frederick, motorists can expect delays due to a disabled vehicle. The north left shoulder is closed.","Major Incident - Traffic - Disabled Vehicle"
"01/21/2025 08:09 PM","Chesapeake (City)","I-64W",293.39,"On I-64 in the City of Chesapeake, at High Rise Bridge, motorists can expect delays due to a disabled vehicle. The west right shoulder is closed.","Major Incident - Traffic - Disabled Vehicle"
"01/21/2025 08:14 PM","Suffolk (City)","I-664N",8.9,"On I-664 in the City of Suffolk, at Monitor Merrimac Memorial Bridge Tunnel North, motorists can expect delays due to a disabled vehicle. The north right lane and right shoulder are closed.","Major Incident - Traffic - Disabled Vehicle"
