Update Time,Jurisdiction,Route,MRM,Description,Label
"06/03/2025 11:31 PM ET","Fairfax (County)","I-95S",164.9,"On I-95 at mile marker 164.9 in the County of Fairfax, motorists can expect delays due to a disabled tractor trailer. The south right shoulder is closed.","Minor Incident - Traffic - Disabled Tractor Trailer"
"06/04/2025 12:30 AM ET","Chesterfield (County)","VA-10E",7,"On VA-10 in the County of Chesterfield, in the vicinity of Tucker Rd; Rt. 774E/W (Chesterfield County), motorists can expect delays due to a vehicle crash. All east lanes are closed. All west lanes are closed.","Major Incident - Traffic - Vehicle Crash"
"06/04/2025 12:52 AM ET","Buchanan (County)","VA-83E",51.5,"On VA-83 in the County of Buchanan, in the vicinity of Upper Mill Branch Rd; Rt. 674N/S (Buchanan County), motorists can expect delays due to a disabled tractor trailer. All east lanes are closed. All west lanes are closed.","Major Incident - Traffic - Disabled Tractor Trailer"
"06/04/2025 01:06 AM ET","Prince George (County)","I-95S",49.1,"On I-95 at mile marker 49.1 in the County of Prince George, motorists can expect delays due to an incident. The south right lane and right shoulder are closed.","Major Incident - Traffic - Other Traffic"
"06/04/2025 12:43 AM ET","Powhatan (County)","VA-288S",23.7,"On VA-288 in the County of Powhatan, in the vicinity of the ramp to Robious Road, motorists can expect delays due to a vehicle crash. The south left shoulder is closed.","Minor Incident - Traffic - Vehicle Crash"
"06/04/2025 12:43 AM ET","Henrico (County)","I-295S",28,"On I-295 at mile marker 28 in the County of Henrico, motorists can expect delays due to a disabled vehicle. The south right shoulder is closed.","Minor Incident - Traffic - Disabled Vehicle"
"06/04/2025 01:15 AM ET","Stafford (County)","I-95S",148,"On I-95 at mile marker 148 in the County of Stafford, motorists can expect delays due to a vehicle crash. The south left shoulder, left lane, and center lane are closed.","Major Incident - Traffic - Vehicle Crash"
