Update Time,Jurisdiction,Route,MRM,Description,Label
"05/03/2025 05:13 AM ET","Lunenburg (County)","VA-137E",6.9,"On VA-137 East in the County of Lunenburg, in the vicinity of Gigg Rd; Rt. 616N/S (Lunenburg County), motorists can expect delays due to a vehicle crash. Lane closures exist.","Minor Incident - Traffic - Vehicle Crash"
"05/03/2025 05:05 AM ET","Stafford (County)","I-95S",146.3,"On I-95 at mile marker 146.3 in the County of Stafford, motorists can expect delays due to a disabled vehicle. The south right shoulder is closed.","Minor Incident - Traffic - Disabled Vehicle"
"05/03/2025 05:03 AM ET","Norfolk (City)","I-64W",276.7,"On I-64 at mile marker 276.7 in the City of Norfolk, near Granby Street, motorists can expect delays due to a disabled vehicle. The west left shoulder is closed.","Minor Incident - Traffic - Disabled Vehicle"
"05/03/2025 05:13 AM ET","Henrico (County)","US-360W",145.1,"On US-360 in the County of Henrico, in the vicinity of Neale St, motorists can expect delays due to a vehicle crash. All east lanes are closed. All west lanes are closed.","Major Incident - Traffic - Vehicle Crash"
"05/02/2025 05:47 PM ET","Lunenburg (County)","VA-49S",47.6,"On VA-49 in the County of Lunenburg, in the vicinity of Pete Osborne Rd; Rt. 706N/S (Lunenburg County), motorists can expect delays due to a disabled vehicle. The south right shoulder is closed.","Minor Incident - Traffic - Disabled Vehicle"
