Update Time,Jurisdiction,Route,MRM,Description,Label
"10/08/2025, 05:14 AM ET","Spotsylvania (County)","I-95S",118.7,"On I-95 at mile marker 118.7 in the County of Spotsylvania, motorists can expect delays due to a tractor trailer crash. The south exit 118 narrows.","Minor Incident - Traffic - Tractor Trailer Crash"
"10/08/2025, 04:59 AM ET","Prince William (County)","I-95S",148.2,"On I-95 at mile marker 148.2 in the County of Prince William, motorists can expect delays due to a vehicle crash. The south right shoulder is closed. The south exit ramp narrows.","Minor Incident - Traffic - Vehicle Crash"
"10/08/2025, 01:00 AM ET","Augusta (County)","I-64E",99.9,"On I-64 East at mile marker 99.9 in the County of Augusta, motorists can expect delays due to fog.","Weather Incident - Fog - Advisory"
"10/08/2025, 03:12 AM ET","Giles (County)","VA-100N",50.6,"On VA-100 North in the County of Giles, in the vicinity of Fletchers Mountain Rd; Rt. 711E/W (Giles County), motorists can expect delays due to weather. Lane closures exist.","Weather Incident - Other Weather - Advisory"
"10/08/2025, 01:00 AM ET","Augusta (County)","I-64W",99.9,"On I-64 West at mile marker 99.9 in the County of Augusta, motorists can expect delays due to fog.","Weather Incident - Fog - Advisory"
"10/08/2025, 05:04 AM ET","New Kent (County)","I-64W",218.8,"On I-64 at mile marker 218.8 in the County of New Kent, motorists can expect delays due to a disabled vehicle. The west right shoulder is closed.","Minor Incident - Traffic - Disabled Vehicle"
