Update Time,Jurisdiction,Route,MRM,Description,Label
"09/11/2025, 03:20 PM ET","Fairfax (County)","On I-495N Express Lanes at mile marker 44.9","","On I-495N Express Lanes at mile marker 44.9 in the County of Fairfax, motorists can expect potential delays due to congestion.","Minor Incident - Traffic - Congestion/Delay"
"09/11/2025, 09:55 PM ET","Albemarle (County)","Rt. 676N (Albemarle County)",8.4,"On Rt. 676 in the County of Albemarle, in the vicinity of Beau Mont Farm Rd; Rt. 1548N/S (Albemarle County), motorists can expect delays due to a vehicle crash. All north lanes are closed. All south lanes are closed.","Major Incident - Traffic - Vehicle Crash"
"09/11/2025, 10:23 PM ET","Wise (County)","ALT US-58W",42.8,"On ALT US-58 West in the County of Wise, in the vicinity of Tacoma Mountain Rd; Rt. 706N/S (Wise County), motorists can expect delays due to a vehicle crash. Lane closures exist.","Minor Incident - Traffic - Vehicle Crash"
"09/11/2025, 09:46 PM ET","Norfolk (City)","I-64E",282.2,"On I-64 at mile marker 282.2 in the City of Norfolk, near Northampton Boulevard, motorists can expect delays due to a vehicle crash. The east exit 282 is closed.","Minor Incident - Traffic - Vehicle Crash"
"09/11/2025, 10:46 PM ET","Henrico (County)","I-295N",20.6,"On I-295 at mile marker 20.6 in the County of Henrico, motorists can expect delays due to a disabled vehicle. The north right shoulder is closed.","Minor Incident - Traffic - Disabled Vehicle"
"09/11/2025, 10:52 PM ET","James City (County)","I-64E",225,"On I-64 at mile marker 225 in the County of James City, near Ropers Church Road, motorists can expect delays due to a vehicle crash. The east right shoulder is closed.","Minor Incident - Traffic - Vehicle Crash"
"09/11/2025, 09:47 PM ET","Norfolk (City)","I-64W",282.7,"On I-64 at mile marker 282.6 in the City of Norfolk, near Northampton Boulevard, motorists can expect delays due to a vehicle crash. The west exit 282 is closed.","Minor Incident - Traffic - Vehicle Crash"
