Update Time,Jurisdiction,Route,MRM,Description,Label
"09/01/2025, 04:24 AM ET","Fairfax (County)","I-95N",165.7,"On I-95 at mile marker 165.7 in the County of Fairfax, motorists can expect delays due to a disabled vehicle. The north right shoulder is closed.","Minor Incident - Traffic - Disabled Vehicle"
"09/01/2025, 04:02 AM ET","Loudoun (County)","VA-28S",42.2,"On VA-28 in the County of Loudoun, in the vicinity of Ex Ramp To, motorists can expect delays due to a disabled vehicle. The south right shoulder is closed.","Minor Incident - Traffic - Disabled Vehicle"
"09/01/2025, 04:16 AM ET","Richmond (City)","I-95S",73,"On I-95 South at mile marker 73 in the City of Richmond, motorists can expect delays due to a disabled vehicle.","Minor Incident - Traffic - Disabled Vehicle"
"09/01/2025, 04:17 AM ET","Hampton (City)","I-64E",270,"On I-64 in the City of Hampton, at Hampton Roads Bridge Tunnel East, motorists can expect potential delays due to a bridge/tunnel stoppage. All east lanes are closed.","Major Incident - Traffic - Bridge/Tunnel Stoppage"
"09/01/2025, 04:22 AM ET","Alexandria (City)","I-395N",4.1,"On I-395 at mile marker 4.1 in the City of Alexandria, motorists can expect delays due to a disabled vehicle. The north right shoulder is closed.","Minor Incident - Traffic - Disabled Vehicle"
"09/01/2025, 04:22 AM ET","Wythe (County)","I-77N",44.3,"On I-77 at mile marker 44.3 in the County of Wythe, motorists can expect delays due to a vehicle crash. The north right shoulder is closed.","Minor Incident - Traffic - Vehicle Crash"
