Update Time,Jurisdiction,Route,MRM,Description,Label
"12/25/2025, 02:08 AM ET","Chesapeake (City)","I-664S",19.8,"On I-664 at mile marker 19.8 in the City of Chesapeake, near Bowers Hill Interchange, motorists can expect potential delays due to a vehicle crash. The south exit ramp is closed.","Minor Incident - Traffic - Vehicle Crash"
"12/25/2025, 02:00 AM ET","Stafford (County)","I-95S",142.3,"On I-95 at mile marker 142.3 in the County of Stafford, motorists can expect delays due to a disabled vehicle. The south right shoulder is closed.","Minor Incident - Traffic - Disabled Vehicle"
"12/25/2025, 02:02 AM ET","Chesapeake (City)","I-664N",19.1,"On I-664 at mile marker 19.1 in the City of Chesapeake, near Bowers Hill Interchange, motorists can expect delays due to a disabled vehicle. The north left shoulder and left lane are closed.","Major Incident - Traffic - Disabled Vehicle"
"12/25/2025, 02:13 AM ET","Prince William (County)","I-95N",156.2,"On I-95 at mile marker 156.2 in the County of Prince William, motorists can expect delays due to a disabled vehicle. The north right shoulder is closed.","Minor Incident - Traffic - Disabled Vehicle"
"12/25/2025, 02:09 AM ET","Richmond (City)","I-64E",191.9,"On I-64 at mile marker 191.9 in the City of Richmond, motorists can expect delays due to a vehicle crash. The east exit 192 narrows.","Minor Incident - Traffic - Vehicle Crash"
