Update Time,Jurisdiction,Route,MRM,Description,Label
"10/18/2025, 12:21 PM ET","Stafford (County)","On I-95R Express Lanes at mile marker 135.3","","On I-95R Express Lanes at mile marker 135.3 in the County of Stafford, motorists can expect potential delays due to a disabled vehicle. The south right shoulder is closed.","Minor Incident - Traffic - Disabled Vehicle"
"10/19/2025, 03:07 AM ET","Fairfax (County)","I-66W",53.4,"On I-66 at mile marker 53.4 in the County of Fairfax, motorists can expect delays due to an incident. The west exit 53 narrows.","Minor Incident - Traffic - Other Traffic"
"10/19/2025, 02:43 AM ET","Fairfax (County)","I-66E",60.9,"On I-66 at mile marker 60.9 in the County of Fairfax, motorists can expect delays due to a disabled vehicle. The east right shoulder is closed.","Minor Incident - Traffic - Disabled Vehicle"
"10/19/2025, 02:56 AM ET","Petersburg (City)","I-95S",52.4,"On I-95 at mile marker 52.4 in the City of Petersburg, motorists can expect delays due to other security/police activity. The south exit 52A narrows.","Minor Incident - Security/Police Activity - Other Security/Police Activity"
"10/19/2025, 03:14 AM ET","Stafford (County)","I-95S",148,"On I-95 at mile marker 148 in the County of Stafford, motorists can expect delays due to a disabled vehicle. The south exit 148 narrows.","Minor Incident - Traffic - Disabled Vehicle"
