Update Time,Jurisdiction,Route,MRM,Description,Label
"02/23/2025 09:40 PM ET","Mecklenburg (County)","Rt. 688N (Mecklenburg County)",5,"On Rt. 688 North in the County of Mecklenburg, in the vicinity of Wilkerson Rd; Rt. 677E/W (Mecklenburg County), motorists can expect delays due to standing water.","Minor Incident - Standing Water - Advisory"
"02/23/2025 10:20 PM ET","Fairfax (County)","I-66E",51.7,"On I-66 at mile marker 51.7 in the County of Fairfax, motorists can expect delays due to a vehicle crash. The east right shoulder is closed.","Minor Incident - Traffic - Vehicle Crash"
"02/23/2025 09:13 PM ET","Northumberland (County)","US-360E",211.8,"On US-360 East in the County of Northumberland, in the vicinity of Courthouse Rd; VA-201N/S, motorists can expect delays due to a vehicle crash. Lane closures exist.","Minor Incident - Traffic - Vehicle Crash"
"02/23/2025 05:45 AM ET","Mecklenburg (County)","Rt. 609N (Mecklenburg County)",1.6,"On Rt. 609 in the County of Mecklenburg, in the vicinity of Jones Rd; Rt. 698E/W (Mecklenburg County), motorists can expect delays due to standing water. All north lanes are closed. All south lanes are closed.","Major Incident - Standing Water - Closed"
"02/23/2025 10:20 PM ET","Henrico (County)","I-64E",194.5,"On I-64 at mile marker 194.5 in the County of Henrico, motorists can expect delays due to a disabled vehicle. The east right shoulder is closed.","Minor Incident - Traffic - Disabled Vehicle"
"02/23/2025 05:46 AM ET","Mecklenburg (County)","Rt. 693S (Mecklenburg County)",0,"On Rt. 693 in the County of Mecklenburg, in the vicinity of Sullivan Rd; Rt. 703N/S (Mecklenburg County), motorists can expect delays due to standing water. All north lanes are closed. All south lanes are closed.","Major Incident - Standing Water - Closed"
"02/23/2025 05:45 AM ET","Mecklenburg (County)","Rt. 640E (Mecklenburg County)",3.1,"On Rt. 640 in the County of Mecklenburg, in the vicinity of Trottinridge Rd; Rt. 609N/S (Mecklenburg County), motorists can expect delays due to standing water. All east lanes are closed. All west lanes are closed.","Major Incident - Standing Water - Closed"
