Update Time,Jurisdiction,Route,MRM,Description,Label
"03/13/2025 04:08 AM ET","Prince William (County)","I-95S",150.8,"On I-95 at mile marker 150.8 in the County of Prince William, motorists can expect delays due to a vehicle crash. The south right lane and right shoulder are closed.","Major Incident - Traffic - Vehicle Crash"
"03/13/2025 03:46 AM ET","Carroll (County)","I-77S",24.1,"On I-77 South at mile marker 24.1 in the County of Carroll, motorists can expect delays due to high wind.","Minor Incident - High Wind - Advisory"
"03/12/2025 08:49 AM ET","Nelson (County)","VA-151N",20.2,"On VA-151 in the County of Nelson, in the vicinity of Rhue Hollow Rd; Rt. 628E/W (Nelson County), motorists can expect delays due to a tractor trailer crash. The north right lane is closed.","Major Incident - Traffic - Tractor Trailer Crash"
"03/13/2025 04:19 AM ET","Chesterfield (County)","I-95S",53.1,"On I-95 at mile marker 53.1 in the County of Chesterfield, motorists can expect delays due to a tractor trailer crash. The south center lane, right lane, and right shoulder are closed.","Major Incident - Traffic - Tractor Trailer Crash"
"03/13/2025 04:17 AM ET","Spotsylvania (County)","I-95N",128.8,"On I-95 at mile marker 128.8 in the County of Spotsylvania, motorists can expect delays due to an incident. All north lanes are closed.","Major Incident - Traffic - Other Traffic"
"03/13/2025 03:43 AM ET","Carroll (County)","I-77N",0,"On I-77 North at mile marker 0 in the County of Carroll, motorists can expect delays due to high wind.","Minor Incident - High Wind - Advisory"
"03/13/2025 02:05 AM ET","Fauquier (County)","US-17N",210.5,"On US-17 in the County of Fauquier, in the vicinity of Lees Mill Rd; Rt. 651N/S (Fauquier County), motorists can expect delays due to a vehicle crash. All north lanes are closed.","Major Incident - Traffic - Vehicle Crash"
