Update Time,Jurisdiction,Route,MRM,Description,Label
"05/27/2025 05:55 AM ET","Goochland (County)","I-64W",149,"On I-64 at mile marker 149 in the County of Goochland, motorists can expect delays due to a vehicle crash. The west left shoulder and left lane are closed.","Major Incident - Traffic - Vehicle Crash"
"05/27/2025 06:04 AM ET","Stafford (County)","I-95S",147,"On I-95 at mile marker 147 in the County of Stafford, motorists can expect delays due to a disabled vehicle. The south left shoulder is closed.","Minor Incident - Traffic - Disabled Vehicle"
"05/27/2025 05:53 AM ET","Fairfax (County)","I-495S",52,"On I-495 at mile marker 52 in the County of Fairfax, motorists can expect delays due to a disabled vehicle. The south right shoulder is closed.","Minor Incident - Traffic - Disabled Vehicle"
"05/27/2025 06:19 AM ET","Norfolk (City)","I-564E",2.2,"On I-564 at mile marker 2.2 in the City of Norfolk, near Runway Tunnel, motorists can expect potential delays due to an incident. The east right lane is closed.","Major Incident - Traffic - Other Traffic"
"05/27/2025 06:05 AM ET","Carroll (County)","I-77S",24.1,"On I-77 South at mile marker 24.1 in the County of Carroll, motorists can expect delays due to fog.","Minor Incident - Fog - Advisory"
"05/27/2025 06:02 AM ET","Fairfax (County)","I-95N",168.2,"On I-95 at mile marker 168.2 in the County of Fairfax, motorists can expect delays due to a disabled vehicle. The north right shoulder is closed.","Minor Incident - Traffic - Disabled Vehicle"
"05/27/2025 06:04 AM ET","Carroll (County)","I-77N",0,"On I-77 North at mile marker 0 in the County of Carroll, motorists can expect delays due to fog.","Minor Incident - Fog - Advisory"
"05/27/2025 05:47 AM ET","Stafford (County)","I-95S",142.5,"On I-95 at mile marker 142.5 in the County of Stafford, motorists can expect delays due to a disabled vehicle. The south right shoulder is closed.","Minor Incident - Traffic - Disabled Vehicle"
