Update Time,Jurisdiction,Route,MRM,Description,Label
"03/23/2025 04:16 AM ET","Fairfax (County)","I-66W",67,"On I-66 at mile marker 67 in the County of Fairfax, motorists can expect delays due to a vehicle crash. The west left shoulder and left lane are closed. The west exit ramp narrows.","Major Incident - Traffic - Vehicle Crash"
"03/22/2025 12:43 PM ET","Augusta (County)","I-64W",99.9,"On I-64 West at mile marker 99.9 in the County of Augusta, motorists can expect delays due to high wind.","Minor Incident - High Wind - Advisory"
"03/23/2025 04:07 AM ET","Chesapeake (City)","I-464S",2.2,"On I-464 at mile marker 2.2 in the City of Chesapeake, near Freeman Avenue, motorists can expect delays due to a vehicle crash. The south left shoulder, left lane, and center lane are closed.","Major Incident - Traffic - Vehicle Crash"
"03/23/2025 04:16 AM ET","Albemarle (County)","Rt. 601N (Albemarle County)",4.2,"On Rt. 601 in the County of Albemarle, in the vicinity of Barracks Farm Rd; Rt. 658E/W (Albemarle County), motorists can expect delays due to a vehicle crash. All north lanes are closed. All south lanes are closed.","Major Incident - Traffic - Vehicle Crash"
"03/22/2025 12:42 PM ET","Augusta (County)","I-64E",99.9,"On I-64 East at mile marker 99.9 in the County of Augusta, motorists can expect delays due to high wind.","Minor Incident - High Wind - Advisory"
"03/23/2025 04:04 AM ET","Fairfax (County)","I-66E",53.9,"On I-66 at mile marker 53.9 in the County of Fairfax, motorists can expect delays due to a disabled vehicle. The east right shoulder is closed.","Minor Incident - Traffic - Disabled Vehicle"
"03/23/2025 04:00 AM ET","Fairfax (County)","I-95S",166.6,"On I-95 at mile marker 166.6 in the County of Fairfax, motorists can expect delays due to a vehicle crash. The south left shoulder is closed.","Minor Incident - Traffic - Vehicle Crash"
"03/23/2025 04:17 AM ET","Newport News (City)","I-664S",4.5,"On I-664 at mile marker 4.5 in the City of Newport News, near 35th Street, motorists can expect delays due to a vehicle crash. The south left shoulder, right lane, and right shoulder are closed.","Major Incident - Traffic - Vehicle Crash"
"03/23/2025 04:01 AM ET","Alexandria (City)","I-95S",177.5,"On I-95 at mile marker 177.5 in the City of Alexandria, motorists can expect delays due to a disabled vehicle. The south right shoulder is closed.","Minor Incident - Traffic - Disabled Vehicle"
