Update Time,Jurisdiction,Route,MRM,Description,Label
"09/01/2025, 11:44 PM ET","Alexandria (City)","I-395N",5,"On I-395 at mile marker 5 in the City of Alexandria, motorists can expect delays due to a multi-vehicle crash. The north entrance ramp narrows.","Minor Incident - Traffic - Multi-Vehicle Crash"
"09/01/2025, 11:37 PM ET","Albemarle (County)","VA-20N",31.8,"On VA-20 in the County of Albemarle, in the vicinity of Marshall Ct; Rt. 1800E/W (Albemarle County), motorists can expect delays due to other security/police activity. All north lanes are closed. All south lanes are closed.","Major Incident - Security/Police Activity - Other Security/Police Activity"
"09/01/2025, 11:10 PM ET","Fairfax (County)","I-66W",60.1,"On I-66 at mile marker 60.1 in the County of Fairfax, motorists can expect delays due to a disabled vehicle. The west right shoulder is closed.","Minor Incident - Traffic - Disabled Vehicle"
"09/02/2025, 12:08 AM ET","Fairfax (County)","I-66W",64,"On I-66 at mile marker 64 in the County of Fairfax, motorists can expect delays due to a disabled vehicle. The west right shoulder is closed.","Minor Incident - Traffic - Disabled Vehicle"
"09/01/2025, 11:51 PM ET","Dinwiddie (County)","I-85N",56.8,"On I-85 at mile marker 56.8 in the County of Dinwiddie, motorists can expect delays due to a disabled vehicle. The north right shoulder is closed.","Minor Incident - Traffic - Disabled Vehicle"
"09/01/2025, 11:59 PM ET","Bedford (County)","Rt. 711N (Bedford County)",3.1,"On Rt. 711 North in the County of Bedford, in the vicinity of Austin Mill Rd; Rt. 625E/W (Bedford County), motorists can expect delays due to a vehicle crash. Lane closures exist.","Minor Incident - Traffic - Vehicle Crash"
"09/02/2025, 12:14 AM ET","Albemarle (County)","US-250E",76.6,"On US-250 in the County of Albemarle, in the vicinity of Critzers Shop Rd; VA-151N/S, motorists can expect delays due to a vehicle crash. The east left shoulder and right shoulder are closed. The west left shoulder is closed.","Minor Incident - Traffic - Vehicle Crash"
