Update Time,Jurisdiction,Route,MRM,Description,Label
"07/31/2025, 04:17 AM ET","Hampton (City)","I-64E",270,"On I-64 in the City of Hampton, at Hampton Roads Bridge Tunnel East, motorists can expect potential delays due to a bridge/tunnel stoppage. All east lanes are closed.","Major Incident - Traffic - Bridge/Tunnel Stoppage"
"07/30/2025, 10:15 PM ET","Giles (County)","Rt. 644E (Giles County)",1.9,"On Rt. 644 in the County of Giles, in the vicinity of Market Rd; Rt. 645N/S (Giles County), motorists can expect delays due to standing water. All east lanes are closed. All west lanes are closed.","Weather Incident - Standing Water - Closed"
"07/30/2025, 11:23 PM ET","Montgomery (County)","Rt. 663N (Montgomery County)",0.9,"On Rt. 663 in the County of Montgomery, in the vicinity of Hawley Rd; Snapdragon Ln; Spaulding Rd; Rt. 720E/W (Montgomery County), motorists can expect delays due to standing water. All north lanes are closed. All south lanes are closed.","Weather Incident - Standing Water - Closed"
"07/31/2025, 01:53 AM ET","Fairfax (County)","Rt. 673E (Fairfax County)",3.6,"On Rt. 673 East in the County of Fairfax, in the vicinity of Hunters Crest Way; Rt. 7490N/S (Fairfax County), motorists can expect delays due to weather. Lane closures exist.","Weather Incident - Other Weather - Advisory"
"07/30/2025, 04:32 PM ET","Rockingham (County)","VA-276N",3.9,"On VA-276 North in the County of Rockingham, in the vicinity of E Timber Ridge Rd; W Timber Ridge Rd; Rt. 668E/W (Rockingham County), motorists can expect potential delays due to a vehicle crash.","Minor Incident - Traffic - Vehicle Crash"
"07/31/2025, 04:13 AM ET","Prince William (County)","I-95N",160.7,"On I-95 at mile marker 160.7 in the County of Prince William, motorists can expect delays due to a disabled vehicle. The north right shoulder is closed.","Minor Incident - Traffic - Disabled Vehicle"
"07/31/2025, 04:12 AM ET","Fairfax (County)","VA-7E",60.9,"On VA-7 in the County of Fairfax, in the vicinity of Rt. 2724E/W (Fairfax County), motorists can expect delays due to a tractor trailer crash. The east left lane, left center lane, and right center lane are closed. The west left lane, left center lane, right center lane, and right lane are closed.","Major Incident - Traffic - Tractor Trailer Crash"
