Update Time,Jurisdiction,Route,MRM,Description,Label
"09/21/2025, 11:46 PM ET","Fairfax (County)","I-495S",55,"On I-495 at mile marker 55 in the County of Fairfax, motorists can expect delays due to a disabled vehicle. The south left shoulder is closed.","Minor Incident - Traffic - Disabled Vehicle"
"09/22/2025, 12:19 AM ET","Chesapeake (City)","I-64W",294.8,"On I-64 at mile marker 294.8 in the City of Chesapeake, near High Rise Bridge, motorists can expect delays due to a disabled vehicle. The west right lane and right shoulder are closed.","Major Incident - Traffic - Disabled Vehicle"
"09/22/2025, 12:18 AM ET","Henrico (County)","I-95S",83.7,"On I-95 at mile marker 83.7 in the County of Henrico, motorists can expect delays due to a disabled vehicle. The south right shoulder is closed.","Minor Incident - Traffic - Disabled Vehicle"
"09/21/2025, 10:29 PM ET","Accomack (County)","VA-316N",4.2,"On VA-316 North in the County of Accomack, in the vicinity of Hurst Store Rd; John Cane Rd; Rt. 661E/W (Accomack County), motorists can expect delays due to a vehicle crash.","Minor Incident - Traffic - Vehicle Crash"
"09/22/2025, 12:16 AM ET","Henrico (County)","I-64W",183,"On I-64 at mile marker 183 in the County of Henrico, motorists can expect delays due to a vehicle crash. The west exit 183 is closed.","Minor Incident - Traffic - Vehicle Crash"
"09/21/2025, 06:09 PM ET","Chesterfield (County)","Rt. 643E (Chesterfield County)",0,"On Rt. 643 East in the County of Chesterfield, in the vicinity of Belmont Rd; Turner Rd; Rt. 651E/W (Chesterfield County); Rt. 650N/S (Chesterfield County), motorists can expect delays due to standing water.","Weather Incident - Standing Water - Advisory"
"09/22/2025, 12:20 AM ET","Chesterfield (County)","I-95S",68.5,"On I-95 South at mile marker 68.5 in the County of Chesterfield, motorists can expect delays due to a disabled vehicle.","Minor Incident - Traffic - Disabled Vehicle"
"09/22/2025, 12:04 AM ET","Franklin (County)","US-220S",38.3,"On US-220 in the County of Franklin, in the vicinity of Doe Run South Ramp, motorists can expect delays due to a disabled vehicle. The south left shoulder and left lane are closed.","Major Incident - Traffic - Disabled Vehicle"
