Update Time,Jurisdiction,Route,MRM,Description,Label
"01/24/2025 11:11 PM","Prince William (County)","I-95N",159.2,"On I-95 at mile marker 159.2 in the County of Prince William, motorists can expect delays due to a disabled vehicle. The north right shoulder is closed.","Major Incident - Traffic - Disabled Vehicle"
"01/24/2025 09:07 PM","Fairfax (County)","Rt. 650N (Fairfax County)",0.2,"On Rt. 650 North in the County of Fairfax, in the vicinity of Markham St; Poplar St; Rt. 756N/S (Fairfax County); Rt. 957E/W (Fairfax County), motorists can expect delays due to icy conditions. Lane closures exist.","Minor Incident - Icy Conditions - Advisory"
"01/24/2025 10:13 PM","Prince William (County)","On I-66E Express Lanes at mile marker 46.6","","On I-66E Express Lanes at mile marker 46.6 in the County of Prince William, motorists can expect potential delays due to a vehicle crash. All east lanes are closed.","Major Incident - Traffic - Vehicle Crash"
"01/24/2025 11:05 PM","Fairfax (County)","I-495S",50.6,"On I-495 at mile marker 50.6 in the County of Fairfax, motorists can expect delays due to a disabled vehicle. The south right shoulder is closed.","Major Incident - Traffic - Disabled Vehicle"
"01/24/2025 11:15 PM","Prince William (County)","I-95N",149.1,"On I-95 at mile marker 149.1 in the County of Prince William, motorists can expect delays due to a disabled vehicle. The north right shoulder is closed.","Major Incident - Traffic - Disabled Vehicle"
"01/24/2025 10:48 PM","Chesterfield (County)","US-60W",174.45,"On US-60 West in the County of Chesterfield, in the vicinity of the ramp to Watkins Center Parkway, motorists can expect delays due to a disabled vehicle. Lane closures exist.","Minor Incident - Traffic - Disabled Vehicle"
"01/24/2025 11:12 PM","Richmond (City)","I-95S",77.5,"On I-95 at mile marker 77.5 in the City of Richmond, motorists can expect delays due to a vehicle crash. The south right shoulder is closed.","Major Incident - Traffic - Vehicle Crash"
"01/24/2025 11:07 PM","Wythe (County)","I-81N",80,"On I-81 at mile marker 80 in the County of Wythe, motorists can expect delays due to a disabled tractor trailer. The north left shoulder and left lane are closed.","Major Incident - Traffic - Disabled Tractor Trailer"
"01/24/2025 11:05 PM","Fairfax (County)","I-495N",49.1,"On I-495 at mile marker 49.1 in the County of Fairfax, motorists can expect delays due to a disabled tractor trailer. The north right shoulder is closed.","Major Incident - Traffic - Disabled Tractor Trailer"
"01/24/2025 11:07 PM","Fairfax (County)","I-495N",42.7,"On I-495 at mile marker 42.7 in the County of Fairfax, motorists can expect delays due to a tractor trailer crash. The north right center lane, right lane, and right shoulder are closed.","Major Incident - Traffic - Tractor Trailer Crash"
"01/24/2025 10:31 PM","Spotsylvania (County)","I-95S",128.9,"On I-95 at mile marker 128.9 in the County of Spotsylvania, motorists can expect delays due to a disabled vehicle. The south right shoulder is closed.","Major Incident - Traffic - Disabled Vehicle"
"01/24/2025 11:13 PM","Fairfax (County)","I-66W",62,"On I-66 at mile marker 62 in the County of Fairfax, motorists can expect delays due to a multi-vehicle crash. The west left lane is closed.","Major Incident - Traffic - Multi-Vehicle Crash"
"01/24/2025 10:16 PM","Fairfax (County)","Rt. 2809N (Fairfax County)",0.13,"On Rt. 2809 North in the County of Fairfax, in the vicinity of Old Dominion Dr, motorists can expect delays due to icy conditions. Lane closures exist.","Minor Incident - Icy Conditions - Advisory"
