Update Time,Jurisdiction,Route,MRM,Description,Label
"08/24/2025, 05:16 AM ET","Chesterfield (County)","I-95S",62,"On I-95 at mile marker 62 in the County of Chesterfield, motorists can expect delays due to a vehicle crash. The south center lane, right lane, and right shoulder are closed.","Major Incident - Traffic - Vehicle Crash"
"08/24/2025, 04:38 AM ET","Fairfax (County)","I-95N",175.6,"On I-95 at mile marker 175.6 in the County of Fairfax, motorists can expect delays due to a disabled vehicle. The north left shoulder is closed.","Minor Incident - Traffic - Disabled Vehicle"
"08/24/2025, 04:20 AM ET","Fairfax (County)","I-66W",59,"On I-66 at mile marker 59 in the County of Fairfax, motorists can expect delays due to a disabled vehicle. The west right shoulder is closed.","Minor Incident - Traffic - Disabled Vehicle"
"08/24/2025, 05:05 AM ET","Loudoun (County)","VA-28S",42.4,"On VA-28 in the County of Loudoun, in the vicinity of W Severn Wy; Rt. 1748E/W (Loudoun County), motorists can expect delays due to a disabled vehicle. The south right shoulder is closed.","Minor Incident - Traffic - Disabled Vehicle"
"08/24/2025, 04:47 AM ET","Caroline (County)","I-95N",104.9,"On I-95 at mile marker 104.9 in the County of Caroline, motorists can expect delays due to a vehicle crash. The north right shoulder is closed.","Minor Incident - Traffic - Vehicle Crash"
"08/24/2025, 04:07 AM ET","Prince William (County)","I-66E",42,"On I-66 at mile marker 42 in the County of Prince William, motorists can expect delays due to a disabled vehicle. The east right shoulder is closed.","Minor Incident - Traffic - Disabled Vehicle"
"08/24/2025, 05:17 AM ET","Arlington (County)","I-395S",8.1,"On I-395 at mile marker 8.1 in the County of Arlington, motorists can expect delays due to a disabled vehicle. The south right shoulder is closed.","Minor Incident - Traffic - Disabled Vehicle"
"08/23/2025, 10:49 AM ET","Tappahannock (Town)","US-17N",126.9,"On US-17 in the Town of Tappahannock, in the vicinity of Airport Rd; Rt. 627E/W (Essex County), motorists can expect delays due to standing water. All north lanes are closed. All south lanes are closed.","Weather Incident - Standing Water - Closed"
"08/23/2025, 10:47 AM ET","Gloucester (County)","Rt. 646N (Gloucester County)",1.2,"On Rt. 646 in the County of Gloucester, in the vicinity of Bonniville Rd; Cross Rd; Cupp Ln; Rt. 1106E/W (Gloucester County), motorists can expect delays due to standing water. All north lanes are closed. All south lanes are closed.","Weather Incident - Standing Water - Closed"
