Update Time,Jurisdiction,Route,MRM,Description,Label
"03/02/2025 05:02 PM ET","Loudoun (County)","US-15S",227.3,"On US-15 in the County of Loudoun, in the vicinity of Windy Creek La, motorists can expect delays due to a multi-vehicle crash. The south left lane and right lane are closed.","Major Incident - Traffic - Multi-Vehicle Crash"
"03/02/2025 05:14 PM ET","Chesterfield (County)","I-95N",56.2,"On I-95 North at mile marker 56.2 in the County of Chesterfield, motorists can expect delays due to a disabled vehicle.","Minor Incident - Traffic - Disabled Vehicle"
"03/02/2025 01:58 PM ET","Mecklenburg (County)","Rt. 688N (Mecklenburg County)",5,"On Rt. 688 in the County of Mecklenburg, in the vicinity of Wilkerson Rd; Rt. 677E/W (Mecklenburg County), motorists can expect delays due to standing water. All north lanes are closed. All south lanes are closed.","Major Incident - Standing Water - Closed"
"03/02/2025 05:14 PM ET","Chesapeake (City)","I-64W",290.8,"On I-64 at mile marker 290.8 in the City of Chesapeake, near Greenbrier Parkway, motorists can expect delays due to a disabled vehicle. The west inside right shoulder is closed.","Minor Incident - Traffic - Disabled Vehicle"
"03/02/2025 05:13 PM ET","Caroline (County)","I-95N",116,"On I-95 at mile marker 116 in the County of Caroline, motorists can expect delays due to a disabled vehicle. The north right shoulder is closed.","Minor Incident - Traffic - Disabled Vehicle"
"03/02/2025 05:14 PM ET","Shenandoah (County)","I-81S",298,"On I-81 at mile marker 298 in the County of Shenandoah, motorists can expect delays due to a disabled vehicle. The south entrance ramp narrows.","Minor Incident - Traffic - Disabled Vehicle"
"03/02/2025 04:54 PM ET","Fairfax (County)","I-66E",61.8,"On I-66 at mile marker 61.8 in the County of Fairfax, motorists can expect delays due to a disabled vehicle. The east right shoulder is closed.","Minor Incident - Traffic - Disabled Vehicle"
"03/02/2025 04:59 PM ET","Loudoun (County)","On Riding Center Drive north at Ulysses Street","","On Riding Center Drive north at Ulysses Street in the County of Loudoun, motorists can expect delays due to a vehicle crash. The north left lane and right lane are closed. The south left lane and right lane are closed.","Major Incident - Traffic - Vehicle Crash"
