Update Time,Jurisdiction,Route,MRM,Description,Label
"07/22/2025, 09:17 PM ET","Norfolk (City)","I-64E",283.6,"On I-64 at mile marker 283.6 in the City of Norfolk, near 264 Interchange, motorists can expect potential delays due to an incident. The east left center lane and right center lane are closed.","Major Incident - Traffic - Other Traffic"
"07/22/2025, 09:42 AM ET","Lunenburg (County)","Rt. 619E (Lunenburg County)",2,"On Rt. 619 in the County of Lunenburg, in the vicinity of Bacon Fork Rd; Rt. 610N/S (Lunenburg County), motorists can expect delays due to weather. All east lanes are closed. All west lanes are closed.","Weather Incident - Other Weather - Closed"
"07/23/2025, 02:20 AM ET","Fairfax (County)","I-95S",168.2,"On I-95 at mile marker 168.2 in the County of Fairfax, motorists can expect delays due to a disabled vehicle. The south left shoulder is closed.","Minor Incident - Traffic - Disabled Vehicle"
"07/23/2025, 02:30 AM ET","Fairfax (County)","I-95S",174.8,"On I-95 at mile marker 174.8 in the County of Fairfax, motorists can expect delays due to a disabled vehicle. The south right shoulder is closed.","Minor Incident - Traffic - Disabled Vehicle"
"07/23/2025, 01:36 AM ET","Stafford (County)","Rt. 670E (Stafford County)",0,"On Rt. 670 East in the County of Stafford, in the vicinity of Greenbank Rd; Rt. 656N/S (Stafford County), motorists can expect delays due to weather. Lane closures exist.","Weather Incident - Other Weather - Advisory"
"07/23/2025, 02:23 AM ET","Fairfax (County)","I-395S",1.7,"On I-395 at mile marker 1.7 in the County of Fairfax, motorists can expect delays due to a disabled vehicle. The south right shoulder is closed.","Minor Incident - Traffic - Disabled Vehicle"
