Update Time,Jurisdiction,Route,MRM,Description,Label
"09/15/2025, 04:15 PM ET","Fairfax (County)","Rt. 755N (Fairfax County)",0.5,"On Rt. 755 North in the County of Fairfax, in the vicinity of Allenwood La; Rt. 8279E/W (Fairfax County), motorists can expect delays due to weather. Lane closures exist.","Weather Incident - Other Weather - Advisory"
"09/15/2025, 11:59 PM ET","Stafford (County)","I-95S",143,"On I-95 at mile marker 143 in the County of Stafford, motorists can expect delays due to a disabled vehicle. The south exit 143A narrows.","Minor Incident - Traffic - Disabled Vehicle"
"09/16/2025, 12:08 AM ET","Henrico (County)","I-295S",37.5,"On I-295 at mile marker 37.5 in the County of Henrico, motorists can expect delays due to a disabled vehicle. The south right shoulder is closed.","Minor Incident - Traffic - Disabled Vehicle"
"09/16/2025, 12:07 AM ET","Goochland (County)","I-64E",170,"On I-64 East at mile marker 170 in the County of Goochland, motorists can expect delays due to a vehicle crash.","Minor Incident - Traffic - Vehicle Crash"
"09/15/2025, 11:58 PM ET","Fairfax (County)","I-66W",57.8,"On I-66 at mile marker 57.8 in the County of Fairfax, motorists can expect delays due to a disabled vehicle. The west right shoulder is closed.","Minor Incident - Traffic - Disabled Vehicle"
"09/15/2025, 07:24 PM ET","Campbell (County)","Rt. 660E (Campbell County)",0.8,"On Rt. 660 in the County of Campbell, in the vicinity of Eastbrook Rd; Wood Ln; Rt. 665E/W (Campbell County), motorists can expect delays due to weather. All east lanes are closed. All west lanes are closed.","Weather Incident - Other Weather - Closed"
"09/16/2025, 12:11 AM ET","Fairfax (County)","I-66W",59,"On I-66 at mile marker 59 in the County of Fairfax, motorists can expect delays due to a disabled vehicle. The west right shoulder is closed.","Minor Incident - Traffic - Disabled Vehicle"
