Update Time,Jurisdiction,Route,MRM,Description,Label
"02/18/2025 08:24 AM ET","Amelia (County)","Rt. 615E (Amelia County)",7.66,"On Rt. 615 in the County of Amelia, in the vicinity of Earls Rd; Rt. 641N/S (Amelia County), motorists can expect delays due to standing water. All east lanes are closed. All west lanes are closed.","Major Incident - Standing Water - Closed"
"02/18/2025 12:09 PM ET","Carroll (County)","I-77N",0,"On I-77 North at mile marker 0 in the County of Carroll, motorists can expect delays due to high wind.","Minor Incident - High Wind - Advisory"
"02/18/2025 12:59 PM ET","Chesterfield (County)","VA-288S",12.9,"On VA-288 South in the County of Chesterfield, in the vicinity of the ramp to Hull Street Road, motorists can expect delays due to a multi-vehicle crash.","Minor Incident - Traffic - Multi-Vehicle Crash"
"02/18/2025 10:13 AM ET","Surry (County)","Rt. 608E (Surry County)",3.4,"On Rt. 608 East in the County of Surry, in the vicinity of VA-40E/W, motorists can expect delays due to standing water.","Minor Incident - Standing Water - Advisory"
"02/18/2025 01:18 PM ET","Henrico (County)","I-95S",83,"On I-95 South at mile marker 83 in the County of Henrico, motorists can expect delays due to a vehicle crash.","Minor Incident - Traffic - Vehicle Crash"
"02/18/2025 08:29 AM ET","Amelia (County)","Rt. 620N (Amelia County)",2.71,"On Rt. 620 in the County of Amelia, in the vicinity of Reed Rock Rd; Rt. 621N/S (Amelia County), motorists can expect delays due to standing water. All north lanes are closed. All south lanes are closed.","Major Incident - Standing Water - Closed"
"02/18/2025 08:30 AM ET","Amelia (County)","Rt. 643N (Amelia County)",3.35,"On Rt. 643 in the County of Amelia, in the vicinity of Clementown Rd; Rt. 681N/S (Amelia County), motorists can expect delays due to standing water. All north lanes are closed. All south lanes are closed.","Major Incident - Standing Water - Closed"
"02/18/2025 01:02 PM ET","Buchanan (County)","Rt. 620N (Buchanan County)",9.91,"On Rt. 620 North in the County of Buchanan, in the vicinity of Robinson Fork Rd; Rt. 662E/W (Buchanan County), motorists can expect delays due to a disabled tractor trailer. Lane closures exist.","Minor Incident - Traffic - Disabled Tractor Trailer"
"02/18/2025 01:20 PM ET","Montgomery (County)","I-81N",129,"On I-81 North at mile marker 129 in the County of Montgomery, motorists can expect delays due to a disabled vehicle.","Minor Incident - Traffic - Disabled Vehicle"
"02/18/2025 08:34 AM ET","Powhatan (County)","Rt. 621E (Powhatan County)",0.62,"On Rt. 621 in the County of Powhatan, in the vicinity of Bell Rd; Rt. 684N/S (Powhatan County), motorists can expect delays due to standing water. The east left shoulder and right shoulder are closed. The west left shoulder and right shoulder are closed.","Minor Incident - Standing Water - Advisory"
"02/18/2025 08:27 AM ET","Amelia (County)","Rt. 637E (Amelia County)",2.99,"On Rt. 637 in the County of Amelia, in the vicinity of Royalton Rd; Rt. 609N/S (Amelia County), motorists can expect delays due to standing water. All east lanes are closed. All west lanes are closed.","Major Incident - Standing Water - Closed"
"02/18/2025 01:16 PM ET","Hanover (County)","I-95S",100,"On I-95 at mile marker 100 in the County of Hanover, motorists can expect delays due to a vehicle crash. The south left shoulder is closed.","Minor Incident - Traffic - Vehicle Crash"
"02/18/2025 01:11 PM ET","Fairfax (County)","I-66W",57.6,"On I-66 at mile marker 57.6 in the County of Fairfax, motorists can expect delays due to a disabled vehicle. The west right shoulder is closed.","Minor Incident - Traffic - Disabled Vehicle"
"02/18/2025 01:20 PM ET","Norfolk (City)","I-264E",12.9,"On I-264 East at mile marker 12.9 in the City of Norfolk, near 64 Interchange, motorists can expect potential delays due to an incident.","Minor Incident - Traffic - Other Traffic"
"02/18/2025 08:26 AM ET","Amelia (County)","Rt. 621S (Amelia County)",9,"On Rt. 621 in the County of Amelia, in the vicinity of Brook Hill Rd; Fowlkes Bridge Rd; Old Buckingham Rd; Rt. 621N/S (Cumberland County); County/City/Town Line: AMELIA - CUMBERLAND COUNTY LINE, motorists can expect delays due to standing water. All north lanes are closed. All south lanes are closed.","Major Incident - Standing Water - Closed"
"02/18/2025 12:38 PM ET","Goochland (County)","VA-288N",28.59,"On VA-288 in the County of Goochland, in the vicinity of the ramp, motorists can expect delays due to a vehicle crash. The north exit ramp is closed.","Minor Incident - Traffic - Vehicle Crash"
"02/18/2025 08:28 AM ET","Amelia (County)","Rt. 607S (Amelia County)",0.65,"On Rt. 607 South in the County of Amelia, in the vicinity of Old Court House Rd; Rt. 649E/W (Amelia County), motorists can expect delays due to standing water.","Minor Incident - Standing Water - Advisory"
"02/18/2025 08:30 AM ET","Dinwiddie (County)","Rt. 613E (Dinwiddie County)",4.4,"On Rt. 613 in the County of Dinwiddie, in the vicinity of Darvills Rd; VA-40E/W, motorists can expect delays due to standing water. All east lanes are closed. All west lanes are closed.","Major Incident - Standing Water - Closed"
"02/18/2025 01:20 PM ET","Stafford (County)","I-95S",139,"On I-95 South at mile marker 139 in the County of Stafford, motorists can expect delays due to a disabled vehicle.","Minor Incident - Traffic - Disabled Vehicle"
"02/18/2025 10:09 AM ET","Sussex (County)","Rt. 634E (Sussex County)",7.55,"On Rt. 634 in the County of Sussex, in the vicinity of Cool Spring Rd; Rt. 622E/W (Sussex County), motorists can expect delays due to standing water. All east lanes are closed. All west lanes are closed.","Major Incident - Standing Water - Closed"
"02/18/2025 12:08 PM ET","Carroll (County)","I-77S",24.1,"On I-77 South at mile marker 24.1 in the County of Carroll, motorists can expect delays due to high wind.","Minor Incident - High Wind - Advisory"
"02/18/2025 08:28 AM ET","Amelia (County)","Rt. 640N (Amelia County)",5.27,"On Rt. 640 North in the County of Amelia, in the vicinity of Old Court House Rd; Rt. 649E/W (Amelia County), motorists can expect delays due to standing water.","Minor Incident - Standing Water - Advisory"
"02/18/2025 01:12 PM ET","Albemarle (County)","Rt. 656N (Albemarle County)",0,"On Rt. 656 in the County of Albemarle, in the vicinity of Barracks Rd; Rt. 654E/W (Albemarle County); Rt. 654E (Albemarle County); Rt. 654W (Albemarle County), motorists can expect delays due to a vehicle crash. All north lanes are closed. All south lanes are closed.","Major Incident - Traffic - Vehicle Crash"
"02/17/2025 01:30 PM ET","Goochland (County)","Rt. 710N (Goochland County)",0,"On Rt. 710 North in the County of Goochland, in the vicinity of Maidens Rd; US-522N/S, motorists can expect delays due to standing water.","Minor Incident - Standing Water - Advisory"
"02/18/2025 01:06 PM ET","Fairfax (County)","I-66E",63.8,"On I-66 at mile marker 63.8 in the County of Fairfax, motorists can expect delays due to a multi-vehicle crash. The east right shoulder is closed.","Minor Incident - Traffic - Multi-Vehicle Crash"
"02/18/2025 01:09 PM ET","Fairfax (County)","I-95S",164.4,"On I-95 at mile marker 164.4 in the County of Fairfax, motorists can expect delays due to a disabled vehicle. The south right shoulder is closed.","Minor Incident - Traffic - Disabled Vehicle"
