Update Time,Jurisdiction,Route,MRM,Description,Label
"05/31/2025 10:45 PM ET","Giles (County)","BUS US-460W (5 Pearisburg/Giles)",2.7,"On BUS US-460 in the County of Giles, in the vicinity of Rt. 9849E/W (Giles County), motorists can expect delays due to an incident. The west left shoulder and left lane are closed.","Major Incident - Traffic - Other Traffic"
"05/31/2025 10:51 PM ET","Nottoway (County)","Rt. 607N (Nottoway County)",12.3,"On Rt. 607 in the County of Nottoway, in the vicinity of Lone Pine Rd; Mallory Hill Rd; Schutt Rd; Rt. 633E/W (Nottoway County), motorists can expect delays due to a vehicle crash. All north lanes are closed. All south lanes are closed.","Major Incident - Traffic - Vehicle Crash"
"05/31/2025 11:29 PM ET","Prince William (County)","I-95N",158.4,"On I-95 at mile marker 158.4 in the County of Prince William, motorists can expect delays due to a disabled vehicle. The north right shoulder is closed.","Minor Incident - Traffic - Disabled Vehicle"
"05/31/2025 11:33 PM ET","Fairfax (County)","VA-28S",38.1,"On VA-28 in the County of Fairfax, in the vicinity of Rt. 608S (Fairfax County), motorists can expect delays due to a vehicle crash. The south left shoulder, left lane, and left center lane are closed.","Major Incident - Traffic - Vehicle Crash"
"05/31/2025 11:20 PM ET","Lee (County)","US-58W",13.3,"On US-58 West in the County of Lee, in the vicinity of Civitan Park Rd; Wilderness Rd; Rt. 724N/S (Lee County), motorists can expect delays due to a vehicle crash. Lane closures exist.","Minor Incident - Traffic - Vehicle Crash"
"05/31/2025 06:39 AM ET","Ashland (Town)","I-95S",91.5,"On I-95 at mile marker 91.5 in the Town of Ashland, motorists can expect potential delays due to a disabled vehicle. The south right shoulder is closed.","Minor Incident - Traffic - Disabled Vehicle"
"05/31/2025 10:05 AM ET","Madison (County)","US-29N",159.7,"On US-29 in the County of Madison, in the vicinity of Shelby Rd; Rt. 662N/S (Madison County), motorists can expect delays due to a vehicle crash. The north right shoulder is closed.","Minor Incident - Traffic - Vehicle Crash"
"05/31/2025 11:17 PM ET","Fairfax (County)","I-495N",43.7,"On I-495 at mile marker 43.7 in the County of Fairfax, motorists can expect delays due to an incident. The north exit ramp narrows.","Minor Incident - Traffic - Other Traffic"
"05/31/2025 11:17 PM ET","Richmond (City)","I-95N",78.7,"On I-95 at mile marker 78.7 in the City of Richmond, motorists can expect delays due to a disabled vehicle. The north right shoulder is closed.","Minor Incident - Traffic - Disabled Vehicle"
