Update Time,Jurisdiction,Route,MRM,Description,Label
"03/22/2025 03:03 AM ET","Fairfax (County)","I-395N",4,"On I-395 at mile marker 4 in the County of Fairfax, motorists can expect delays due to a disabled vehicle. The north exit ramp narrows.","Minor Incident - Traffic - Disabled Vehicle"
"03/22/2025 02:28 AM ET","Chesterfield (County)","VA-76W",6.4,"On VA-76 in the County of Chesterfield, in the vicinity of the ramp to Powhite Parkway, motorists can expect delays due to a vehicle crash. The west left shoulder and left lane are closed.","Major Incident - Traffic - Vehicle Crash"
"03/21/2025 03:12 PM ET","Roanoke (County)","VA-311N",3.4,"On VA-311 in the County of Roanoke, in the vicinity of Dutch Oven Rd; Rt. 863N/S (Roanoke County), motorists can expect delays due to an incident. All north lanes are closed. All south lanes are closed.","Major Incident - Traffic - Other Traffic"
"03/22/2025 03:01 AM ET","Chesapeake (City)","I-64E",295.6,"On I-64 at mile marker 295.6 in the City of Chesapeake, near George Washington Highway, motorists can expect delays due to a disabled vehicle. The east right shoulder is closed.","Minor Incident - Traffic - Disabled Vehicle"
"03/22/2025 03:02 AM ET","Newport News (City)","I-64E",256.9,"On I-64 at mile marker 256.9 in the City of Newport News, near Victory Boulevard, motorists can expect delays due to a vehicle crash. The east right lane, right shoulder, and exit 256B are closed.","Major Incident - Traffic - Vehicle Crash"
"03/22/2025 03:14 AM ET","Fairfax (County)","I-95S",174.7,"On I-95 South at mile marker 174.7 in the County of Fairfax, motorists can expect delays due to a disabled vehicle.","Minor Incident - Traffic - Disabled Vehicle"
"03/22/2025 03:10 AM ET","Chesterfield (County)","VA-150N",14,"On VA-150 North in the County of Chesterfield, in the vicinity of the ramp at Chippenham, motorists can expect delays due to a vehicle fire. Lane closures exist.","Minor Incident - Traffic - Vehicle Fire"
