Update Time,Jurisdiction,Route,MRM,Description,Label
"12/01/2025, 05:00 AM ET","Carroll (County)","I-77N",0,"On I-77 North at mile marker 0 in the County of Carroll, motorists can expect delays due to high wind.","Weather Incident - High Wind - Advisory"
"12/01/2025, 05:16 AM ET","Brunswick (County)","I-85N",23.6,"On I-85 at mile marker 23.6 in the County of Brunswick, motorists can expect delays due to a vehicle crash. The north right lane and right shoulder are closed.","Major Incident - Traffic - Vehicle Crash"
"12/01/2025, 05:16 AM ET","Fairfax (County)","VA-28S",33.2,"On VA-28 in the County of Fairfax, in the vicinity of Willard Rd; Rt. 8457E (Fairfax County), motorists can expect delays due to a disabled vehicle. The south right shoulder is closed.","Minor Incident - Traffic - Disabled Vehicle"
"12/01/2025, 05:01 AM ET","Carroll (County)","I-77S",24.1,"On I-77 South at mile marker 24.1 in the County of Carroll, motorists can expect delays due to high wind.","Weather Incident - High Wind - Advisory"
"12/01/2025, 05:02 AM ET","Spotsylvania (County)","I-95S",127.8,"On I-95 at mile marker 127.8 in the County of Spotsylvania, motorists can expect delays due to a disabled vehicle. The south right shoulder is closed.","Minor Incident - Traffic - Disabled Vehicle"
"12/01/2025, 05:10 AM ET","Henrico (County)","I-295S",35,"On I-295 at mile marker 35 in the County of Henrico, motorists can expect delays due to a vehicle crash. The south right shoulder is closed.","Minor Incident - Traffic - Vehicle Crash"
"12/01/2025, 04:36 AM ET","Fairfax (County)","I-66W",57.4,"On I-66 at mile marker 57.4 in the County of Fairfax, motorists can expect delays due to a disabled vehicle. The west right shoulder is closed.","Minor Incident - Traffic - Disabled Vehicle"
