Update Time,Jurisdiction,Route,MRM,Description,Label
"03/02/2025 10:44 AM ET","Pittsylvania (County)","US-58W",280.8,"On US-58 in the County of Pittsylvania, in the vicinity of W Fork Rd; Rt. 622N/S (Pittsylvania County), motorists can expect delays due to a vehicle crash. The west right lane and right shoulder are closed.","Major Incident - Traffic - Vehicle Crash"
"03/02/2025 10:43 AM ET","Stafford (County)","I-95S",134,"On I-95 at mile marker 134 in the County of Stafford, motorists can expect delays due to a disabled vehicle. The south left shoulder is closed.","Minor Incident - Traffic - Disabled Vehicle"
"03/02/2025 11:17 AM ET","Fairfax (County)","I-95S",168.8,"On I-95 at mile marker 168.8 in the County of Fairfax, motorists can expect delays due to a disabled vehicle. The south left shoulder is closed.","Minor Incident - Traffic - Disabled Vehicle"
"03/02/2025 10:40 AM ET","Augusta (County)","I-81N",222,"On I-81 at mile marker 222 in the County of Augusta, motorists can expect delays due to a disabled vehicle. The north right shoulder is closed.","Minor Incident - Traffic - Disabled Vehicle"
"03/02/2025 08:48 AM ET","Mecklenburg (County)","Rt. 688N (Mecklenburg County)",5,"On Rt. 688 in the County of Mecklenburg, in the vicinity of Wilkerson Rd; Rt. 677E/W (Mecklenburg County), motorists can expect delays due to standing water. All north lanes are closed. All south lanes are closed.","Major Incident - Standing Water - Closed"
"03/02/2025 11:14 AM ET","Fairfax (County)","I-495S",57,"On I-495 at mile marker 57 in the County of Fairfax, motorists can expect delays due to a vehicle crash. The south left lane is closed.","Major Incident - Traffic - Vehicle Crash"
"03/02/2025 10:50 AM ET","Fairfax (County)","I-95N",177,"On I-95 at mile marker 177 in the County of Fairfax, motorists can expect delays due to a disabled vehicle. The north entrance ramp narrows.","Minor Incident - Traffic - Disabled Vehicle"
"03/02/2025 10:37 AM ET","Botetourt (County)","I-81N",169,"On I-81 at mile marker 169 in the County of Botetourt, motorists can expect delays due to a disabled vehicle. The north right shoulder is closed.","Minor Incident - Traffic - Disabled Vehicle"
