Update Time,Jurisdiction,Route,MRM,Description,Label
"12/26/2025, 12:41 AM ET","Fairfax (County)","On I-495S Express Lanes at mile marker 45.6","","On I-495S Express Lanes at mile marker 45.6 in the County of Fairfax, motorists can expect potential delays due to other security/police activity. All south lanes are closed.","Major Incident - Security/Police Activity - Other Security/Police Activity"
"12/26/2025, 02:14 AM ET","Richmond (City)","I-195S",1.3,"On I-195 at mile marker 1.3 in the City of Richmond, motorists can expect delays due to a vehicle crash. All south lanes are closed.","Major Incident - Traffic - Vehicle Crash"
"12/26/2025, 12:55 AM ET","Arlington (County)","I-395S",7,"On I-395 at mile marker 7 in the County of Arlington, motorists can expect delays due to a disabled vehicle. The south exit 7B narrows.","Minor Incident - Traffic - Disabled Vehicle"
"12/25/2025, 10:45 PM ET","Fairfax (County)","On I-495S Express Lanes at mile marker 47.4","","On I-495S Express Lanes at mile marker 47.4 in the County of Fairfax, motorists can expect potential delays due to a vehicle crash. All south lanes are closed.","Major Incident - Traffic - Vehicle Crash"
"12/26/2025, 12:09 AM ET","Fairfax (County)","Rt. 2796N (Fairfax County)",0.2,"On Rt. 2796 North in the County of Fairfax, in the vicinity of Southwick St; Rt. 978N/S (Fairfax County), motorists can expect delays due to an incident.","Minor Incident - Traffic - Other Traffic"
"12/26/2025, 01:26 AM ET","Middlesex (County)","US-17N",0,"On US-17 North in the County of Middlesex, in the vicinity of Tank Rd; Rt. 711N/S (Middlesex County), motorists can expect delays due to a vehicle crash.","Minor Incident - Traffic - Vehicle Crash"
"12/26/2025, 02:16 AM ET","Fairfax (County)","I-495S",47.4,"On I-495 at mile marker 47.4 in the County of Fairfax, motorists can expect delays due to a vehicle crash. The south left lane, left center lane, and right center lane are closed.","Major Incident - Traffic - Vehicle Crash"
"12/26/2025, 01:40 AM ET","Fairfax (County)","I-495S",42.8,"On I-495 at mile marker 42.8 in the County of Fairfax, motorists can expect delays due to a disabled vehicle. The south right shoulder is closed.","Minor Incident - Traffic - Disabled Vehicle"
"12/26/2025, 02:18 AM ET","Fairfax (County)","I-95N",163.2,"On I-95 at mile marker 163.2 in the County of Fairfax, motorists can expect delays due to a disabled vehicle. The north right shoulder is closed.","Minor Incident - Traffic - Disabled Vehicle"
