Update Time,Jurisdiction,Route,MRM,Description,Label
"12/27/2025, 03:24 AM ET","Pittsylvania (County)","Rt. 878N (Pittsylvania County)",1,"On Rt. 878 North in the County of Pittsylvania, in the vicinity of Martinsville Hwy; Old Farm Rd; Pineview Rd; US-58E, motorists can expect delays due to a disabled tractor trailer. Lane closures exist.","Minor Incident - Traffic - Disabled Tractor Trailer"
"12/27/2025, 03:18 AM ET","Roanoke (County)","I-81S",131.8,"On I-81 at mile marker 131.8 in the County of Roanoke, motorists can expect delays due to a vehicle crash. The south left shoulder and left lane are closed.","Major Incident - Traffic - Vehicle Crash"
"12/27/2025, 03:12 AM ET","York (County)","I-64E",242,"On I-64 at mile marker 242 in the County of York, near Penniman Road, motorists can expect delays due to a vehicle crash. The east right shoulder is closed.","Minor Incident - Traffic - Vehicle Crash"
"12/27/2025, 03:22 AM ET","Hampton (City)","I-64E",265.3,"On I-64 at mile marker 265.3 in the City of Hampton, near Armistead Parkway, motorists can expect delays due to a vehicle crash. The east exit ramp is closed.","Minor Incident - Traffic - Vehicle Crash"
"12/27/2025, 02:41 AM ET","Stafford (County)","I-95S",139.2,"On I-95 at mile marker 139.2 in the County of Stafford, motorists can expect delays due to a disabled vehicle. The south right shoulder is closed.","Minor Incident - Traffic - Disabled Vehicle"
"12/27/2025, 03:21 AM ET","Prince Edward (County)","US-460E",0,"On US-460 in the County of Prince Edward, in the vicinity of Rt. 603N/S (Prince Edward County), motorists can expect delays due to a vehicle crash. The east right lane and right shoulder are closed.","Major Incident - Traffic - Vehicle Crash"
