Update Time,Jurisdiction,Route,MRM,Description,Label
"01/12/2025 08:17 PM","Hanover (County)","US-360E",146.2,"On US-360 East in the County of Hanover, in the vicinity of County/City/Town Line: HENRICO COUNTY LINE/HANOVER CL, motorists can expect delays due to icy conditions.","Minor Incident - Icy Conditions - Advisory"
"01/12/2025 08:12 PM","Henrico (County)","I-64W",182,"On I-64 at mile marker 182 in the County of Henrico, motorists can expect delays due to a vehicle crash. The west left shoulder and right shoulder are closed.","Major Incident - Traffic - Vehicle Crash"
"01/12/2025 03:58 PM","Prince George (County)","Rt. 1405E (Prince George County)",0.33,"On Rt. 1405 East in the County of Prince George, in the vicinity of Beaver Castle Rd; Rt. 642N/S (Prince George County), motorists can expect delays due to icy conditions. Lane closures exist.","Minor Incident - Icy Conditions - Advisory"
"01/12/2025 07:45 PM","Chesterfield (County)","I-95N",58,"On I-95 at mile marker 58 in the County of Chesterfield, motorists can expect delays due to a disabled vehicle. The north right shoulder is closed.","Major Incident - Traffic - Disabled Vehicle"
"01/12/2025 08:19 PM","James City (County)","I-64W",227.51,"On I-64 at mile marker 227.5 in the County of James City, near Old Stage Road, motorists can expect delays due to a disabled vehicle. The west right shoulder is closed.","Major Incident - Traffic - Disabled Vehicle"
"01/12/2025 08:13 PM","Norfolk (City)","I-264W",8.46,"On I-264 at mile marker 8.5 in the City of Norfolk, near Tidewater Drive, motorists can expect delays due to a disabled vehicle. The west exit 9 narrows.","Minor Incident - Traffic - Disabled Vehicle"
"01/12/2025 08:16 PM","Stafford (County)","I-95S",140.6,"On I-95 at mile marker 140.6 in the County of Stafford, motorists can expect delays due to a disabled vehicle. The south right shoulder is closed.","Major Incident - Traffic - Disabled Vehicle"
"01/12/2025 08:04 PM","Augusta (County)","US-250W",38.95,"On US-250 in the County of Augusta, in the vicinity of Deerfield Valley Rd; Rt. 629N/S (Augusta County), motorists can expect delays due to a vehicle crash. All west lanes are closed.","Major Incident - Traffic - Vehicle Crash"
"01/12/2025 08:15 PM","Spotsylvania (County)","I-95N",119.3,"On I-95 at mile marker 119.3 in the County of Spotsylvania, motorists can expect delays due to a disabled vehicle. The north left lane, right lane, and right shoulder are closed.","Major Incident - Traffic - Disabled Vehicle"
"01/12/2025 08:15 PM","Spotsylvania (County)","I-95S",126.8,"On I-95 at mile marker 126.8 in the County of Spotsylvania, motorists can expect delays due to a disabled vehicle. The south right shoulder is closed.","Major Incident - Traffic - Disabled Vehicle"
"01/12/2025 07:45 PM","Smyth (County)","I-81N",40.7,"On I-81 at mile marker 40.7 in the County of Smyth, motorists can expect delays due to a vehicle crash. The north left shoulder and left lane are closed.","Major Incident - Traffic - Vehicle Crash"
"01/12/2025 07:22 PM","Brunswick (County)","Rt. 688E (Brunswick County)",0,"On Rt. 688 East in the County of Brunswick, in the vicinity of Reedy Creek Rd; Rt. 634N/S (Brunswick County), motorists can expect delays due to icy conditions. Lane closures exist.","Minor Incident - Icy Conditions - Advisory"
