Update Time,Jurisdiction,Route,MRM,Description,Label
"10/17/2025, 04:44 AM ET","Highland (County)","US-220S",175.6,"On US-220 in the County of Highland, in the vicinity of Mill Gap Rd; VA-84E/W, motorists can expect delays due to an incident. All north lanes are closed. All south lanes are closed.","Major Incident - Traffic - Other Traffic"
"10/17/2025, 05:13 AM ET","Fairfax (County)","I-495N",46.3,"On I-495 at mile marker 46.3 in the County of Fairfax, motorists can expect delays due to a tractor trailer crash. The north right shoulder is closed.","Minor Incident - Traffic - Tractor Trailer Crash"
"10/17/2025, 05:01 AM ET","Fairfax (County)","I-495N",49.3,"On I-495 at mile marker 49.3 in the County of Fairfax, motorists can expect delays due to a disabled vehicle. The north right shoulder is closed.","Minor Incident - Traffic - Disabled Vehicle"
"10/17/2025, 05:16 AM ET","Suffolk (City)","I-664S",12.4,"On I-664 at mile marker 12.3 in the City of Suffolk, near College Drive, motorists can expect delays due to a vehicle crash. The south right lane and right shoulder are closed.","Major Incident - Traffic - Vehicle Crash"
"10/17/2025, 04:40 AM ET","Clarke (County)","US-340N",111.5,"On US-340 in the County of Clarke, in the vicinity of County/City/Town Line: BOYCE, motorists can expect delays due to a tractor trailer crash. All north lanes are closed.","Major Incident - Traffic - Tractor Trailer Crash"
"10/17/2025, 05:16 AM ET","Richmond (City)","City Rt. 7561E (City of Richmond)",2,"On City Rt. 7561 in the City of Richmond, in the vicinity of I 95; I-95U Ramp 73A, motorists can expect delays due to a vehicle crash. The east exit ramp narrows.","Minor Incident - Traffic - Vehicle Crash"
"10/17/2025, 05:18 AM ET","Fairfax (County)","I-66W",61,"On I-66 at mile marker 61 in the County of Fairfax, motorists can expect delays due to a vehicle crash. The west right shoulder is closed.","Minor Incident - Traffic - Vehicle Crash"
"10/17/2025, 04:20 AM ET","Powhatan (County)","US-60E",154.9,"On US-60 East in the County of Powhatan, in the vicinity of Old Tavern Rd; Trenholm Rd; Rt. 629N/S (Powhatan County), motorists can expect delays due to a vehicle crash.","Minor Incident - Traffic - Vehicle Crash"
