Update Time,Jurisdiction,Route,MRM,Description,Label
"03/07/2025 02:44 PM ET","Fairfax (County)","On I-495N Express Lanes at mile marker 44.5","","On I-495N Express Lanes at mile marker 44.5 in the County of Fairfax, motorists can expect major delays due to congestion. Traffic backups are approximately 1.0 mile.","Minor Incident - Traffic - Congestion/Delay"
"03/07/2025 02:29 PM ET","Fairfax (County)","On I-495N Express Lanes at mile marker 44.8","","On I-495N Express Lanes at mile marker 44.8 in the County of Fairfax, motorists can expect potential delays due to congestion.","Minor Incident - Traffic - Congestion/Delay"
"03/07/2025 11:04 PM ET","Brunswick (County)","Rt. 629E (Brunswick County)",5.7,"On Rt. 629 East in the County of Brunswick, in the vicinity of Waqua Creek Rd; Rt. 630N/S (Brunswick County), motorists can expect delays due to standing water.","Minor Incident - Standing Water - Advisory"
"03/08/2025 04:20 AM ET","Roanoke (County)","I-81N",140,"On I-81 at mile marker 140 in the County of Roanoke, motorists can expect delays due to a vehicle crash. The north exit ramp narrows.","Minor Incident - Traffic - Vehicle Crash"
"03/08/2025 04:59 AM ET","Fairfax (County)","I-66W",61,"On I-66 at mile marker 61 in the County of Fairfax, motorists can expect delays due to a disabled vehicle. The west right shoulder is closed.","Minor Incident - Traffic - Disabled Vehicle"
"03/07/2025 11:49 PM ET","Prince William (County)","I-95R",156.8,"On I-95R at mile marker 156.8 in the County of Prince William, motorists can expect potential delays due to a vehicle fire. The south left shoulder is closed.","Minor Incident - Traffic - Vehicle Fire"
"03/08/2025 05:04 AM ET","Fairfax (County)","I-95N",171.7,"On I-95 at mile marker 171.7 in the County of Fairfax, motorists can expect delays due to a disabled vehicle. The north right shoulder is closed.","Minor Incident - Traffic - Disabled Vehicle"
