Update Time,Jurisdiction,Route,MRM,Description,Label
"02/06/2025 12:46 AM ET","Augusta (County)","I-64E",99.9,"On I-64 East at mile marker 99.9 in the County of Augusta, motorists can expect delays due to fog.","Minor Incident - Fog - Advisory"
"02/06/2025 03:08 AM ET","Prince William (County)","I-95N",151.8,"On I-95 at mile marker 151.8 in the County of Prince William, motorists can expect delays due to a vehicle crash. The north center lane, right lane, and right shoulder are closed.","Major Incident - Traffic - Vehicle Crash"
"02/06/2025 03:14 AM ET","Loudoun (County)","VA-28S",39.8,"On VA-28 in the County of Loudoun, in the vicinity of the exit ramp, motorists can expect delays due to a disabled vehicle. The south left shoulder is closed.","Minor Incident - Traffic - Disabled Vehicle"
"02/05/2025 11:43 PM ET","Fairfax (County)","On I-195R Express Lanes at mile marker 169.5","","On I-195R Express Lanes at mile marker 169.5 in the County of Fairfax, motorists can expect potential delays due to a disabled vehicle. The south left shoulder is closed.","Minor Incident - Traffic - Disabled Vehicle"
"02/06/2025 12:47 AM ET","Augusta (County)","I-64W",99.9,"On I-64 West at mile marker 99.9 in the County of Augusta, motorists can expect delays due to fog.","Minor Incident - Fog - Advisory"
"02/06/2025 02:55 AM ET","Fairfax (County)","I-495N",51.2,"On I-495 at mile marker 51.2 in the County of Fairfax, motorists can expect delays due to a disabled vehicle. The north right shoulder is closed.","Minor Incident - Traffic - Disabled Vehicle"
"02/06/2025 02:02 AM ET","Rockingham (County)","I-81N",249.9,"On I-81 at mile marker 249.9 in the County of Rockingham, motorists can expect delays due to a tractor trailer crash. The north left shoulder is closed.","Minor Incident - Traffic - Tractor Trailer Crash"
