Update Time,Jurisdiction,Route,MRM,Description,Label
"01/19/2025 11:15 AM","Augusta (County)","I-64E",99.9,"On I-64 East at mile marker 99.9 in the County of Augusta, motorists can expect delays due to fog.","Minor Incident - Fog - Advisory"
"01/19/2025 11:10 AM","Chesterfield (County)","I-95N",54.9,"On I-95 at mile marker 54.9 in the County of Chesterfield, motorists can expect delays due to a disabled vehicle. The north right shoulder is closed.","Major Incident - Traffic - Disabled Vehicle"
"01/19/2025 11:11 AM","Spotsylvania (County)","I-95S",123.6,"On I-95 at mile marker 123.6 in the County of Spotsylvania, motorists can expect delays due to a disabled vehicle. The south right shoulder is closed.","Major Incident - Traffic - Disabled Vehicle"
"01/19/2025 10:38 AM","Augusta (County)","I-81N",210,"On I-81 at mile marker 210 in the County of Augusta, motorists can expect delays due to a disabled vehicle. The north right shoulder is closed.","Major Incident - Traffic - Disabled Vehicle"
"01/19/2025 11:10 AM","Augusta (County)","I-64W",99.9,"On I-64 West at mile marker 99.9 in the County of Augusta, motorists can expect delays due to fog.","Minor Incident - Fog - Advisory"
"01/19/2025 10:28 AM","Rockbridge (County)","I-81N",181.6,"On I-81 at mile marker 181.6 in the County of Rockbridge, motorists can expect delays due to a disabled vehicle. The north right shoulder is closed.","Major Incident - Traffic - Disabled Vehicle"
