Update Time,Jurisdiction,Route,MRM,Description,Label
"05/23/2025 12:16 AM ET","Rockingham (County)","I-81N",257,"On I-81 at mile marker 257 in the County of Rockingham, motorists can expect delays due to a tractor trailer crash. The north right shoulder is closed.","Minor Incident - Traffic - Tractor Trailer Crash"
"05/23/2025 12:00 AM ET","Fairfax (County)","I-66E",57,"On I-66 at mile marker 57 in the County of Fairfax, motorists can expect delays due to a disabled vehicle. The east right shoulder is closed.","Minor Incident - Traffic - Disabled Vehicle"
"05/22/2025 10:27 PM ET","Essex (County)","US-17N",129.3,"On US-17 in the County of Essex, in the vicinity of Maryfield Rd; Turnout; Rt. 1215N/S (Essex County), motorists can expect delays due to standing water. The north right lane and right shoulder are closed.","Major Incident - Standing Water - Advisory"
"05/22/2025 10:19 PM ET","Carroll (County)","I-77N",5.3,"On I-77 at mile marker 5.3 in the County of Carroll, motorists can expect delays due to a tractor trailer crash. The north right lane and right shoulder are closed.","Major Incident - Traffic - Tractor Trailer Crash"
"05/22/2025 11:51 PM ET","Caroline (County)","Rt. 656N (Caroline County)",4.1,"On Rt. 656 in the County of Caroline, in the vicinity of Mcbryant Rd; Rt. 655E/W (Caroline County), motorists can expect delays due to a vehicle crash. All north lanes are closed. All south lanes are closed.","Major Incident - Traffic - Vehicle Crash"
"05/23/2025 12:13 AM ET","Botetourt (County)","I-81N",172.4,"On I-81 at mile marker 172.4 in the County of Botetourt, motorists can expect delays due to a disabled vehicle. The north right shoulder is closed.","Minor Incident - Traffic - Disabled Vehicle"
"05/22/2025 11:03 PM ET","Fauquier (County)","VA-28S",7.3,"On VA-28 in the County of Fauquier, in the vicinity of Catlett Rd; Eustace Rd; Rt. 643N/S (Fauquier County);MEETZE RD, motorists can expect delays due to a vehicle crash. All north lanes are closed. All south lanes are closed.","Major Incident - Traffic - Vehicle Crash"
"05/23/2025 12:17 AM ET","Fairfax (County)","I-95N",169,"On I-95 at mile marker 169 in the County of Fairfax, motorists can expect delays due to a disabled tractor trailer. The north left shoulder is closed.","Minor Incident - Traffic - Disabled Tractor Trailer"
"05/23/2025 12:05 AM ET","Norfolk (City)","I-64W",272.4,"On I-64 in the City of Norfolk, at Hampton Roads Bridge Tunnel West, motorists can expect potential delays due to a bridge/tunnel stoppage. All west lanes are closed.","Major Incident - Traffic - Bridge/Tunnel Stoppage"
