Update Time,Jurisdiction,Route,MRM,Description,Label
"04/28/2025 11:02 PM ET","Arlington (County)","I-66W",69.3,"On I-66 at mile marker 69.3 in the County of Arlington, motorists can expect delays due to a disabled vehicle. The west right shoulder is closed.","Minor Incident - Traffic - Disabled Vehicle"
"04/28/2025 10:51 PM ET","Hampton (City)","I-64E",270,"On I-64 in the City of Hampton, at Hampton Roads Bridge Tunnel East, motorists can expect potential delays due to a bridge/tunnel stoppage. All east lanes are closed.","Major Incident - Traffic - Bridge/Tunnel Stoppage"
"04/28/2025 10:21 PM ET","Rockbridge (County)","I-81S",196.4,"On I-81 at mile marker 196.4 in the County of Rockbridge, motorists can expect delays due to a vehicle crash. The south right lane and right shoulder are closed.","Major Incident - Traffic - Vehicle Crash"
"04/28/2025 10:39 PM ET","Stafford (County)","I-95S",138,"On I-95 at mile marker 138 in the County of Stafford, motorists can expect delays due to a disabled vehicle. The south right shoulder is closed.","Minor Incident - Traffic - Disabled Vehicle"
"04/28/2025 10:03 PM ET","Roanoke (County)","I-81S",141.9,"On I-81 at mile marker 141.9 in the County of Roanoke, motorists can expect delays due to a disabled tractor trailer. The south left shoulder and left lane are closed.","Major Incident - Traffic - Disabled Tractor Trailer"
"04/28/2025 10:52 PM ET","Franklin (County)","VA-40E",38.4,"On VA-40 in the County of Franklin, in the vicinity of Byrds Mill Rd; Rt. 876E/W (Franklin County), motorists can expect delays due to a vehicle crash. All east lanes are closed. All west lanes are closed.","Major Incident - Traffic - Vehicle Crash"
"04/28/2025 09:51 PM ET","Prince William (County)","I-95R",156.9,"On I-95R at mile marker 156.9 in the County of Prince William, motorists can expect potential delays due to a disabled vehicle. The south right shoulder is closed.","Minor Incident - Traffic - Disabled Vehicle"
"04/28/2025 10:56 PM ET","Prince William (County)","I-95S",160,"On I-95 at mile marker 160 in the County of Prince William, motorists can expect delays due to a disabled tractor trailer. The south right lane and right shoulder are closed.","Major Incident - Traffic - Disabled Tractor Trailer"
