Update Time,Jurisdiction,Route,MRM,Description,Label
"08/09/2025, 06:12 AM ET","Hampton (City)","I-64E",270,"On I-64 in the City of Hampton, at Hampton Roads Bridge Tunnel East, motorists can expect potential delays due to a bridge/tunnel stoppage. All east lanes are closed.","Major Incident - Traffic - Bridge/Tunnel Stoppage"
"08/09/2025, 04:39 AM ET","Loudoun (County)","Rt. 690N (Loudoun County)",1.3,"On Rt. 690 in the County of Loudoun, in the vicinity of Otley Rd; Rt. 701E/W (Loudoun County), motorists can expect delays due to weather. The north through lanes are closed. The south through lanes are closed.","Weather Incident - Other Weather - Closed"
"08/09/2025, 06:04 AM ET","Henrico (County)","I-95N",81,"On I-95 at mile marker 81 in the County of Henrico, motorists can expect delays due to a disabled tractor trailer. The north right lane and right shoulder are closed.","Major Incident - Traffic - Disabled Tractor Trailer"
"08/09/2025, 06:17 AM ET","Washington (County)","I-81S",17.7,"On I-81 at mile marker 17.7 in the County of Washington, motorists can expect delays due to a vehicle fire. The south right shoulder is closed.","Minor Incident - Traffic - Vehicle Fire"
"08/09/2025, 06:06 AM ET","Arlington (County)","I-66E",68.2,"On I-66 at mile marker 68.2 in the County of Arlington, motorists can expect delays due to a disabled vehicle. The east right shoulder is closed.","Minor Incident - Traffic - Disabled Vehicle"
"08/09/2025, 06:18 AM ET","Roanoke (County)","I-81S",132.6,"On I-81 at mile marker 132.6 in the County of Roanoke, motorists can expect delays due to a disabled vehicle. The south right shoulder is closed.","Minor Incident - Traffic - Disabled Vehicle"
"08/09/2025, 06:12 AM ET","Richmond (City)","I-95S",74.3,"On I-95 at mile marker 74.3 in the City of Richmond, motorists can expect delays due to a disabled vehicle. The south right lane and right shoulder are closed.","Major Incident - Traffic - Disabled Vehicle"
"08/09/2025, 06:02 AM ET","Fairfax (County)","I-495N",49.6,"On I-495 at mile marker 49.6 in the County of Fairfax, motorists can expect delays due to a disabled vehicle. The north right shoulder is closed.","Minor Incident - Traffic - Disabled Vehicle"
