Update Time,Jurisdiction,Route,MRM,Description,Label
"09/03/2025, 11:15 PM ET","Shenandoah (County)","I-81S",266.1,"On I-81 at mile marker 266.1 in the County of Shenandoah, motorists can expect delays due to a tractor trailer crash. All south lanes are closed. Traffic backups are approximately 2.5 miles.","Major Incident - Traffic - Tractor Trailer Crash"
"09/03/2025, 11:07 PM ET","Powhatan (County)","Rt. 609N (Powhatan County)",2.8,"On Rt. 609 North in the County of Powhatan, in the vicinity of Old Buckingham Rd; VA-13E/W, motorists can expect delays due to a vehicle crash.","Minor Incident - Traffic - Vehicle Crash"
"09/03/2025, 10:56 PM ET","Stafford (County)","I-95S",138.3,"On I-95 at mile marker 138.3 in the County of Stafford, motorists can expect delays due to a disabled tractor trailer. The south right shoulder is closed.","Minor Incident - Traffic - Disabled Tractor Trailer"
"09/03/2025, 10:50 PM ET","Spotsylvania (County)","Rt. 639N (Spotsylvania County)",1.8,"On Rt. 639 in the County of Spotsylvania, in the vicinity of Leavells Ct; Rt. 2259N (Spotsylvania County), motorists can expect delays due to a vehicle crash. The north through lanes are closed. The south through lanes are closed.","Major Incident - Traffic - Vehicle Crash"
"09/03/2025, 11:25 PM ET","Richmond (City)","I-95S",74.7,"On I-95 at mile marker 74.7 in the City of Richmond, motorists can expect delays due to a disabled tractor trailer. The south center lane, right lane, and right shoulder are closed.","Major Incident - Traffic - Disabled Tractor Trailer"
"09/03/2025, 10:58 PM ET","Richmond (City)","US-250E",166.5,"On US-250 in the City of Richmond, in the vicinity of the ramp to I-95, motorists can expect delays due to a disabled tractor trailer. The east exit ramp is closed.","Minor Incident - Traffic - Disabled Tractor Trailer"
