Update Time,Jurisdiction,Route,MRM,Description,Label
"06/20/2025, 06:14 AM ET","Henrico (County)","I-295N",28,"On I-295 at mile marker 28 in the County of Henrico, motorists can expect delays due to a disabled vehicle. The north exit 28 narrows.","Minor Incident - Traffic - Disabled Vehicle"
"06/20/2025, 06:03 AM ET","Albemarle (County)","I-64W",110,"On I-64 at mile marker 110 in the County of Albemarle, motorists can expect delays due to a vehicle crash. The west right shoulder is closed.","Minor Incident - Traffic - Vehicle Crash"
"06/20/2025, 06:16 AM ET","Hampton (City)","I-64E",270,"On I-64 East in the City of Hampton, at Hampton Roads Bridge Tunnel East, motorists can expect delays due to congestion. Traffic backups are approximately 1.5 miles.","Major Incident - Traffic - Congestion/Delay"
"06/20/2025, 06:16 AM ET","Prince William (County)","I-95N",158,"On I-95 at mile marker 158 in the County of Prince William, motorists can expect delays due to a disabled vehicle. The north exit 158 narrows.","Minor Incident - Traffic - Disabled Vehicle"
"06/20/2025, 02:53 AM ET","Fairfax (County)","I-66W",56.8,"On I-66 at mile marker 56.8 in the County of Fairfax, motorists can expect delays due to a disabled vehicle. The west right shoulder is closed.","Minor Incident - Traffic - Disabled Vehicle"
"06/20/2025, 06:07 AM ET","Rockingham (County)","I-81N",262.1,"On I-81 at mile marker 262.1 in the County of Rockingham, motorists can expect delays due to a tractor trailer crash. The north right shoulder is closed.","Minor Incident - Traffic - Tractor Trailer Crash"
