Update Time,Jurisdiction,Route,MRM,Description,Label
"11/16/2025, 08:13 AM ET","Harrisonburg (City)","US-33E",23.4,"On US-33 in the City of Harrisonburg, in the vicinity of Cantrell Ave; City Rt. 4106E/W (City of Harrisonburg), motorists can expect delays due to a vehicle crash. The east right shoulder is closed.","Minor Incident - Traffic - Vehicle Crash"
"11/16/2025, 07:58 AM ET","Stafford (County)","I-95N",146.8,"On I-95 at mile marker 146.8 in the County of Stafford, motorists can expect delays due to a disabled vehicle. The north left shoulder is closed.","Minor Incident - Traffic - Disabled Vehicle"
"11/16/2025, 08:07 AM ET","Caroline (County)","I-95S",110.6,"On I-95 at mile marker 110.6 in the County of Caroline, motorists can expect delays due to a multi-vehicle crash. The south right shoulder is closed.","Minor Incident - Traffic - Multi-Vehicle Crash"
"11/16/2025, 08:08 AM ET","Fairfax (County)","I-66W",62.6,"On I-66 at mile marker 62.6 in the County of Fairfax, motorists can expect delays due to a disabled vehicle. The west exit ramp narrows.","Minor Incident - Traffic - Disabled Vehicle"
"11/16/2025, 08:12 AM ET","Chesapeake (City)","I-664N",19.7,"On I-664 at mile marker 19.7 in the City of Chesapeake, near Bowers Hill Interchange, motorists can expect delays due to a disabled vehicle. The north right shoulder is closed.","Minor Incident - Traffic - Disabled Vehicle"
"11/16/2025, 08:08 AM ET","Carroll (County)","I-77N",0,"On I-77 North at mile marker 0 in the County of Carroll, motorists can expect delays due to high wind.","Weather Incident - High Wind - Advisory"
"11/16/2025, 08:17 AM ET","Fairfax (County)","I-95N",172.7,"On I-95 at mile marker 172.7 in the County of Fairfax, motorists can expect delays due to a disabled vehicle. The north right shoulder is closed.","Minor Incident - Traffic - Disabled Vehicle"
"11/16/2025, 08:21 AM ET","Orange (County)","VA-20S",65.6,"On VA-20 in the County of Orange, in the vicinity of Greenwood Rd; Jones Mill Rd; Rt. 635N/S (Orange County), motorists can expect delays due to other security/police activity. All north lanes are closed. All south lanes are closed.","Major Incident - Security/Police Activity - Other Security/Police Activity"
"11/16/2025, 08:08 AM ET","Carroll (County)","I-77S",24.1,"On I-77 South at mile marker 24.1 in the County of Carroll, motorists can expect delays due to high wind.","Weather Incident - High Wind - Advisory"
