Update Time,Jurisdiction,Route,MRM,Description,Label
"06/07/2025 12:20 AM ET","Fairfax (County)","On I-66W Express Lanes at mile marker 64.9","","On I-66W Express Lanes at mile marker 64.9 in the County of Fairfax, motorists can expect potential delays due to a vehicle crash. The west left lane and right lane are closed.","Major Incident - Traffic - Vehicle Crash"
"06/06/2025 08:30 PM ET","Augusta (County)","I-64E",99.9,"On I-64 East at mile marker 99.9 in the County of Augusta, motorists can expect delays due to fog.","Minor Incident - Fog - Advisory"
"06/07/2025 12:08 AM ET","Arlington (County)","I-66E",71.3,"On I-66 at mile marker 71.3 in the County of Arlington, motorists can expect delays due to a disabled vehicle. The east right shoulder is closed.","Minor Incident - Traffic - Disabled Vehicle"
"06/07/2025 12:07 AM ET","Petersburg (City)","I-95N",49,"On I-95 at mile marker 49 in the City of Petersburg, motorists can expect delays due to a tractor trailer crash. The north right lane and right shoulder are closed.","Major Incident - Traffic - Tractor Trailer Crash"
"06/07/2025 12:03 AM ET","Mecklenburg (County)","US-58W",341.6,"On US-58 in the County of Mecklenburg, in the vicinity of Rt. 732E/W (Mecklenburg County), motorists can expect delays due to a vehicle crash. All west lanes are closed.","Major Incident - Traffic - Vehicle Crash"
"06/07/2025 12:15 AM ET","Henrico (County)","I-95S",83,"On I-95 at mile marker 83 in the County of Henrico, motorists can expect delays due to a tractor trailer crash. The south left shoulder and left lane are closed.","Major Incident - Traffic - Tractor Trailer Crash"
"06/06/2025 08:31 PM ET","Augusta (County)","I-64W",99.9,"On I-64 West at mile marker 99.9 in the County of Augusta, motorists can expect delays due to fog.","Minor Incident - Fog - Advisory"
