Update Time,Jurisdiction,Route,MRM,Description,Label
"09/13/2025, 10:54 PM ET","Virginia Beach (City)","I-264W",16.8,"On I-264 at mile marker 16.8 in the City of Virginia Beach, near Independence Boulevard, motorists can expect delays due to a disabled vehicle. The west right shoulder is closed.","Minor Incident - Traffic - Disabled Vehicle"
"09/13/2025, 10:38 PM ET","Chesapeake (City)","I-464N",0.8,"On I-464 at mile marker 0.8 in the City of Chesapeake, near Military Highway, motorists can expect delays due to a vehicle crash. The north exit 2 narrows.","Minor Incident - Traffic - Vehicle Crash"
"09/13/2025, 10:33 PM ET","Chesterfield (County)","VA-150N",14.8,"On VA-150 in the County of Chesterfield, in the vicinity of the ramp at Chippenham; Hull Street, motorists can expect delays due to a vehicle crash. The north left shoulder and right shoulder are closed.","Minor Incident - Traffic - Vehicle Crash"
"09/13/2025, 10:58 PM ET","Henrico (County)","I-295N",27.6,"On I-295 at mile marker 27.6 in the County of Henrico, motorists can expect delays due to a vehicle crash. The north exit ramp narrows.","Minor Incident - Traffic - Vehicle Crash"
"09/13/2025, 10:51 PM ET","Fairfax (County)","I-66W",65.8,"On I-66 at mile marker 65.8 in the County of Fairfax, motorists can expect delays due to a disabled vehicle. The west left shoulder is closed.","Minor Incident - Traffic - Disabled Vehicle"
"09/13/2025, 10:37 PM ET","Prince William (County)","I-95S",152.5,"On I-95 at mile marker 152.5 in the County of Prince William, motorists can expect delays due to a disabled vehicle. The south right shoulder is closed.","Minor Incident - Traffic - Disabled Vehicle"
"09/13/2025, 10:25 PM ET","Brunswick (County)","US-1N",41.2,"On US-1 North in the County of Brunswick, in the vicinity of King Ave; Rt. 1110N/S (Brunswick County), motorists can expect delays due to a disabled vehicle. Lane closures exist.","Minor Incident - Traffic - Disabled Vehicle"
