Update Time,Jurisdiction,Route,MRM,Description,Label
"08/09/2025, 08:24 AM ET","Arlington (County)","On Old Dominion Drive at 37th St North","","On Old Dominion Drive at 37th St North in the County of Arlington, motorists can expect delays due to an incident.","Minor Incident - Traffic - Other Traffic"
"08/09/2025, 09:21 AM ET","Alexandria (City)","VA-420W",0.1,"On VA-420 in the City of Alexandria, in the vicinity of the ramp from I-395 (Seminary Road), motorists can expect delays due to a vehicle crash. The west left shoulder and left lane are closed.","Major Incident - Traffic - Vehicle Crash"
"08/09/2025, 09:20 AM ET","Prince William (County)","I-95S",160.6,"On I-95 at mile marker 160.6 in the County of Prince William, motorists can expect delays due to a vehicle crash. The south right shoulder is closed.","Minor Incident - Traffic - Vehicle Crash"
"08/09/2025, 09:19 AM ET","Fairfax (County)","I-495S",56,"On I-495 at mile marker 56 in the County of Fairfax, motorists can expect delays due to a disabled vehicle. The south right shoulder is closed.","Minor Incident - Traffic - Disabled Vehicle"
"08/09/2025, 09:17 AM ET","Caroline (County)","I-95S",106.4,"On I-95 at mile marker 106.4 in the County of Caroline, motorists can expect delays due to a multi-vehicle crash. The south left shoulder is closed.","Minor Incident - Traffic - Multi-Vehicle Crash"
"08/09/2025, 09:24 AM ET","New Kent (County)","I-64E",210.4,"On I-64 at mile marker 210.4 in the County of New Kent, motorists can expect delays due to a multi-vehicle crash. The east left shoulder, left lane, and right lane are closed.","Major Incident - Traffic - Multi-Vehicle Crash"
"08/09/2025, 09:01 AM ET","Fairfax (County)","VA-28N",35,"On VA-28 in the County of Fairfax, in the vicinity of Willard Rd; Rt. 8457W (Fairfax County); Rt. 6215W (Fairfax County), motorists can expect delays due to a disabled vehicle. The north right shoulder is closed.","Minor Incident - Traffic - Disabled Vehicle"
"08/09/2025, 09:25 AM ET","Norfolk (City)","I-64W",277.8,"On I-64 West at mile marker 277.8 in the City of Norfolk, near Little Creek Road, motorists can expect delays due to a multi-vehicle crash.","Minor Incident - Traffic - Multi-Vehicle Crash"
"08/09/2025, 09:25 AM ET","Botetourt (County)","I-81S",168.2,"On I-81 at mile marker 168.2 in the County of Botetourt, motorists can expect delays due to a disabled vehicle. The south right shoulder is closed.","Minor Incident - Traffic - Disabled Vehicle"
