Update Time,Jurisdiction,Route,MRM,Description,Label
"02/10/2025 06:09 AM ET","Fairfax (County)","I-495S",49.7,"On I-495 at mile marker 49.7 in the County of Fairfax, motorists can expect delays due to a vehicle crash. The south right shoulder is closed.","Minor Incident - Traffic - Vehicle Crash"
"02/10/2025 05:28 AM ET","Prince William (County)","On I-66W Express Lanes at mile marker 48.8","","On I-66W Express Lanes at mile marker 48.8 in the County of Prince William, motorists can expect potential delays due to a disabled vehicle. The west left shoulder is closed.","Minor Incident - Traffic - Disabled Vehicle"
"02/10/2025 06:10 AM ET","Chesterfield (County)","I-95N",66.1,"On I-95 at mile marker 66.1 in the County of Chesterfield, motorists can expect delays due to a disabled vehicle. The north right shoulder is closed.","Minor Incident - Traffic - Disabled Vehicle"
"02/10/2025 05:48 AM ET","Carroll (County)","I-77N",0,"On I-77 North at mile marker 0 in the County of Carroll, motorists can expect delays due to high wind.","Minor Incident - High Wind - Advisory"
"02/10/2025 06:10 AM ET","Chesapeake (City)","I-64W",297.65,"On I-64 at mile marker 297.6 in the City of Chesapeake, near Yadkin Road, motorists can expect delays due to a vehicle crash. The west express lane is closed.","Major Incident - Traffic - Vehicle Crash"
"02/10/2025 05:49 AM ET","Carroll (County)","I-77S",24.1,"On I-77 South at mile marker 24.1 in the County of Carroll, motorists can expect delays due to high wind.","Minor Incident - High Wind - Advisory"
"02/10/2025 06:01 AM ET","Fairfax (County)","I-95N",172.6,"On I-95 at mile marker 172.6 in the County of Fairfax, motorists can expect delays due to a disabled vehicle. The north right shoulder is closed.","Minor Incident - Traffic - Disabled Vehicle"
"02/10/2025 06:05 AM ET","Brunswick (County)","Rt. 644N (Brunswick County)",18.13,"On Rt. 644 North in the County of Brunswick, in the vicinity of Pleasant Grove Rd; Rt. 681N/S (Brunswick County), motorists can expect delays due to a disabled vehicle.","Minor Incident - Traffic - Disabled Vehicle"
