Update Time,Jurisdiction,Route,MRM,Description,Label
"10/01/2025, 01:12 AM ET","Prince William (County)","I-95S",161.4,"On I-95 at mile marker 161.4 in the County of Prince William, motorists can expect delays due to a disabled tractor trailer. The south right shoulder is closed.","Minor Incident - Traffic - Disabled Tractor Trailer"
"09/30/2025, 06:54 AM ET","Chesterfield (County)","VA-145E",2.8,"On VA-145 East in the County of Chesterfield, in the vicinity of Centralia Rd; Chester Rd; Rt. 717E/W (Chesterfield County); VA-144N/S; VA-145W, motorists can expect delays due to standing water.","Weather Incident - Standing Water - Advisory"
"09/30/2025, 10:55 PM ET","Fairfax (County)","I-66E",57,"On I-66 at mile marker 57 in the County of Fairfax, motorists can expect delays due to a disabled vehicle. The east right shoulder is closed.","Minor Incident - Traffic - Disabled Vehicle"
"10/01/2025, 12:24 AM ET","Fairfax (County)","I-95S",165.5,"On I-95 at mile marker 165.5 in the County of Fairfax, motorists can expect delays due to a disabled vehicle. The south right shoulder is closed.","Minor Incident - Traffic - Disabled Vehicle"
"10/01/2025, 12:49 AM ET","Arlington (County)","I-395N",9.7,"On I-395 at mile marker 9.7 in the County of Arlington, motorists can expect delays due to a vehicle crash. The north entrance ramp narrows.","Minor Incident - Traffic - Vehicle Crash"
"10/01/2025, 12:56 AM ET","Frederick (County)","I-81N",301.8,"On I-81 at mile marker 301.8 in the County of Frederick, motorists can expect delays due to a vehicle crash. The north left shoulder is closed.","Minor Incident - Traffic - Vehicle Crash"
