Update Time,Jurisdiction,Route,MRM,Description,Label
"01/19/2025 09:46 PM","Fairfax (County)","I-395R",2,"On I-395R at mile marker 2 in the County of Fairfax, motorists can expect potential delays due to an incident. The north left lane and center lane are closed.","Major Incident - Traffic - Other Traffic"
"01/19/2025 06:46 PM","Fairfax (County)","On I-66W Express Lanes from mile marker 65 to mile marker 43","","On I-66W Express Lanes from mile marker 65 to mile marker 43 in the County of Fairfax, motorists can expect potential delays due to icy conditions.","Minor Incident - Icy Conditions - Advisory"
"01/20/2025 01:23 AM","Chesapeake (City)","I-664N",20.2,"On I-664 North at mile marker 20.2 in the City of Chesapeake, near Bowers Hill, motorists can expect delays due to a vehicle crash.","Minor Incident - Traffic - Vehicle Crash"
"01/19/2025 11:57 PM","Carroll (County)","I-77N",0,"On I-77 North at mile marker 0 in the County of Carroll, motorists can expect delays due to high wind.","Minor Incident - High Wind - Advisory"
"01/19/2025 11:58 PM","Carroll (County)","I-77S",24,"On I-77 South at mile marker 24 in the County of Carroll, motorists can expect delays due to high wind.","Minor Incident - High Wind - Advisory"
"01/19/2025 06:46 PM","Prince William (County)","On I-66E Express Lanes from mile marker 43 to mile marker 65","","On I-66E Express Lanes from mile marker 43 to mile marker 65 in the County of Prince William, motorists can expect potential delays due to icy conditions.","Minor Incident - Icy Conditions - Advisory"
"01/20/2025 12:52 AM","Fairfax (County)","I-95S",166,"On I-95 at mile marker 166 in the County of Fairfax, motorists can expect delays due to a disabled vehicle. The south left shoulder is closed.","Major Incident - Traffic - Disabled Vehicle"
