Update Time,Jurisdiction,Route,MRM,Description,Label
"03/13/2025 08:31 AM ET","Dinwiddie (County)","I-85N",67.6,"On I-85 North at mile marker 67.6 in the County of Dinwiddie, motorists can expect delays due to a disabled vehicle.","Minor Incident - Traffic - Disabled Vehicle"
"03/13/2025 08:17 AM ET","Arlington (County)","On I-95R Express Laes at mile marker 10","","On I-95R Express Laes at mile marker 10 in the County of Arlington, motorists can expect major delays due to congestion. Traffic backups are approximately 1.0 mile.","Minor Incident - Traffic - Congestion/Delay"
"03/13/2025 08:20 AM ET","Stafford (County)","On I-95R Express Lane at mile marker 146.4","","On I-95R Express Lane at mile marker 146.4 in the County of Stafford, motorists can expect potential delays due to a vehicle crash. The north right lane and right shoulder are closed.","Major Incident - Traffic - Vehicle Crash"
"03/13/2025 08:00 AM ET","Newport News (City)","US-17",45.8,"On US-17 South in the City of Newport News, at James River Bridge (Rte 17), motorists can expect potential delays due to fog.","Minor Incident - Fog - Advisory"
"03/13/2025 08:31 AM ET","Hampton (City)","I-64E",270,"On I-64 East in the City of Hampton, at Hampton Roads Bridge Tunnel East, motorists can expect delays due to congestion. Traffic backups are approximately 1.5 miles.","Major Incident - Traffic - Congestion/Delay"
"03/13/2025 08:22 AM ET","Arlington (County)","I-395S",5.8,"On I-395 at mile marker 5.8 in the County of Arlington, motorists can expect delays due to a disabled vehicle. The south right shoulder is closed.","Minor Incident - Traffic - Disabled Vehicle"
"03/12/2025 08:49 AM ET","Nelson (County)","VA-151N",20.2,"On VA-151 in the County of Nelson, in the vicinity of Rhue Hollow Rd; Rt. 628E/W (Nelson County), motorists can expect delays due to a tractor trailer crash. The north right lane is closed.","Major Incident - Traffic - Tractor Trailer Crash"
"03/13/2025 08:28 AM ET","Fairfax (County)","I-95R",169.4,"On I-95R North at mile marker 169.4 in the County of Fairfax, motorists can expect major delays due to congestion. Traffic backups are approximately 1.0 mile.","Minor Incident - Traffic - Congestion/Delay"
"03/13/2025 08:22 AM ET","Campbell (County)","Rt. 655N (Campbell County)",2,"On Rt. 655 North in the County of Campbell, in the vicinity of Canal Trce; Rt. 904E/W (Campbell County), motorists can expect delays due to a vehicle crash. Lane closures exist.","Minor Incident - Traffic - Vehicle Crash"
"03/13/2025 08:01 AM ET","Richmond (City)","I-95S",0,"On I-95 at mile marker 0 in the City of Richmond, motorists can expect delays due to a vehicle crash. The south exit ramp narrows.","Minor Incident - Traffic - Vehicle Crash"
"03/13/2025 08:00 AM ET","Newport News (City)","US-17",45.8,"On US-17 North in the City of Newport News, at James River Bridge (Rte 17), motorists can expect potential delays due to fog.","Minor Incident - Fog - Advisory"
"03/13/2025 08:23 AM ET","Stafford (County)","I-95S",143.9,"On I-95 at mile marker 143.9 in the County of Stafford, motorists can expect delays due to a disabled tractor trailer. The south exit 143B narrows.","Minor Incident - Traffic - Disabled Tractor Trailer"
"03/13/2025 04:50 AM ET","Chesterfield (County)","I-95S",53.1,"On I-95 at mile marker 53.1 in the County of Chesterfield, motorists can expect delays due to a tractor trailer crash. The south center lane, right lane, and right shoulder are closed.","Major Incident - Traffic - Tractor Trailer Crash"
"03/13/2025 08:32 AM ET","Norfolk (City)","I-64W",272.4,"On I-64 West in the City of Norfolk, at Hampton Roads Bridge Tunnel West, motorists can expect delays due to congestion. Traffic backups are approximately 3.5 miles.","Major Incident - Traffic - Congestion/Delay"
"03/13/2025 08:16 AM ET","Lunenburg (County)","Rt. 662N (Lunenburg County)",3.2,"On Rt. 662 North in the County of Lunenburg, in the vicinity of Fowlkes Rd; Rt. 667E/W (Lunenburg County), motorists can expect delays due to a vehicle crash.","Minor Incident - Traffic - Vehicle Crash"
"03/13/2025 07:32 AM ET","Buchanan (County)","US-460W",7.1,"On US-460 West in the County of Buchanan, in the vicinity of Bull Creek Rd; Rt. 609E/W (Buchanan County), motorists can expect delays due to a vehicle crash. Lane closures exist.","Minor Incident - Traffic - Vehicle Crash"
"03/13/2025 08:30 AM ET","Chesapeake (City)","I-664S",17.7,"On I-664 at mile marker 17.7 in the City of Chesapeake, near Dock Landing Road, motorists can expect delays due to a disabled vehicle. The south right shoulder is closed.","Minor Incident - Traffic - Disabled Vehicle"
"03/13/2025 08:32 AM ET","Henrico (County)","I-64W",185.7,"On I-64 West at mile marker 185.7 in the County of Henrico, motorists can expect delays due to a vehicle crash.","Minor Incident - Traffic - Vehicle Crash"
"03/13/2025 08:26 AM ET","Portsmouth (City)","I-264E",6.8,"On I-264 East in the City of Portsmouth, at Downtown Tunnel East, motorists can expect major delays due to congestion. Traffic backups are approximately 2.0 miles.","Major Incident - Traffic - Congestion/Delay"
"03/13/2025 08:32 AM ET","Chesapeake (City)","I-64W",299.3,"On I-64 at mile marker 299.3 in the City of Chesapeake, near Military Highway, motorists can expect delays due to a disabled vehicle. The west left shoulder is closed.","Minor Incident - Traffic - Disabled Vehicle"
"03/13/2025 08:13 AM ET","Stafford (County)","I-95S",139.1,"On I-95 at mile marker 139.1 in the County of Stafford, motorists can expect delays due to a disabled vehicle. The south right shoulder is closed.","Minor Incident - Traffic - Disabled Vehicle"
"03/13/2025 08:09 AM ET","Arlington (County)","I-66W",70.2,"On I-66 at mile marker 70.2 in the County of Arlington, motorists can expect delays due to a disabled vehicle. The west right shoulder is closed.","Minor Incident - Traffic - Disabled Vehicle"
"03/13/2025 08:32 AM ET","Fairfax (County)","I-66E",57,"On I-66 at mile marker 57 in the County of Fairfax, motorists can expect delays due to a disabled vehicle. The east exit ramp narrows.","Minor Incident - Traffic - Disabled Vehicle"
"03/13/2025 08:25 AM ET","Chesapeake (City)","I-664N",19.1,"On I-664 at mile marker 19.1 in the City of Chesapeake, near 58 Interchange, motorists can expect delays due to a disabled tractor trailer. The north left shoulder and left lane are closed.","Major Incident - Traffic - Disabled Tractor Trailer"
