Update Time,Jurisdiction,Route,MRM,Description,Label
"08/19/2025, 02:49 AM ET","Isle Of Wight (County)","US-17S",44.4,"On US-17 South in the County of Isle Of Wight, in the vicinity of Smiths Neck Rd; Rt. 669N/S (Isle of Wight County), motorists can expect delays due to standing water.","Weather Incident - Standing Water - Advisory"
"08/19/2025, 02:50 AM ET","James City (County)","US-60E",246.4,"On US-60 East in the County of James City, in the vicinity of Grove Heights Ave; Ron Springs Dr; Rt. 656N/S (James City County), motorists can expect delays due to standing water.","Weather Incident - Standing Water - Advisory"
"08/18/2025, 11:15 PM ET","Augusta (County)","I-64W",99.8,"On I-64 West at mile marker 99.8 in the County of Augusta, near Fog, motorists can expect delays due to fog.","Weather Incident - Fog - Advisory"
"08/19/2025, 02:50 AM ET","Suffolk (City)","US-58E",477,"On US-58 in the City of Suffolk, in the vicinity of Ramp Intersection, near 1900 Portsmouth Boulevard, motorists can expect delays due to weather. All east lanes are closed.","Weather Incident - Other Weather - Closed"
"08/19/2025, 02:41 AM ET","Fairfax (County)","I-95N",170,"On I-95 at mile marker 170 in the County of Fairfax, motorists can expect delays due to a vehicle crash. The north exit ramp narrows.","Minor Incident - Traffic - Vehicle Crash"
"08/19/2025, 12:25 AM ET","Isle Of Wight (County)","US-258E",50.7,"On US-258 East in the County of Isle Of Wight, in the vicinity of New Towne Haven Ln; Rt. 711N/S (Isle of Wight County), motorists can expect delays due to standing water.","Weather Incident - Standing Water - Advisory"
"08/19/2025, 03:10 AM ET","Spotsylvania (County)","I-95S",120.3,"On I-95 at mile marker 120.3 in the County of Spotsylvania, motorists can expect delays due to a disabled vehicle. The south right shoulder is closed.","Minor Incident - Traffic - Disabled Vehicle"
"08/19/2025, 03:00 AM ET","Henrico (County)","I-64W",199.2,"On I-64 at mile marker 199.2 in the County of Henrico, motorists can expect delays due to a disabled vehicle. The west right shoulder is closed.","Minor Incident - Traffic - Disabled Vehicle"
"08/18/2025, 11:16 PM ET","Augusta (County)","I-64E",99.8,"On I-64 East at mile marker 99.8 in the County of Augusta, motorists can expect delays due to fog.","Weather Incident - Fog - Advisory"
