Update Time,Jurisdiction,Route,MRM,Description,Label
"06/01/2025 07:23 AM ET","Henrico (County)","US-33E",131.2,"On US-33 in the County of Henrico, in the vicinity of the ramp to I-64E, motorists can expect delays due to an incident. The east exit ramp is closed.","Minor Incident - Traffic - Other Traffic"
"06/01/2025 10:10 AM ET","Prince William (County)","I-66E",47,"On I-66 at mile marker 47 in the County of Prince William, motorists can expect delays due to a vehicle crash. The east right shoulder is closed.","Minor Incident - Traffic - Vehicle Crash"
"06/01/2025 09:17 AM ET","Giles (County)","BUS US-460W (5 Pearisburg/Giles)",2.7,"On BUS US-460 in the County of Giles, in the vicinity of Rt. 9849E/W (Giles County), motorists can expect delays due to an incident. The west left shoulder and left lane are closed.","Major Incident - Traffic - Other Traffic"
"06/01/2025 07:34 AM ET","Henrico (County)","US-33W",131.3,"On US-33 in the County of Henrico, in the vicinity of Interstate 64 Ex E; US-33W Ramp 131B; Ramp Intersection:TO RT 64 EAST, motorists can expect delays due to an incident. The west exit ramp is closed.","Minor Incident - Traffic - Other Traffic"
"06/01/2025 09:53 AM ET","Spotsylvania (County)","I-95S",129.3,"On I-95 at mile marker 129.3 in the County of Spotsylvania, motorists can expect delays due to a disabled vehicle. The south right shoulder is closed.","Minor Incident - Traffic - Disabled Vehicle"
"06/01/2025 10:10 AM ET","Henrico (County)","I-64E",187.3,"On I-64 at mile marker 187.3 in the County of Henrico, motorists can expect delays due to other security/police activity. All east lanes are closed. The east exit 187 is closed.","Major Incident - Security/Police Activity - Other Security/Police Activity"
"06/01/2025 10:06 AM ET","Portsmouth (City)","VA-164W",2.6,"On VA-164 in the City of Portsmouth, in the vicinity of Cedar Ln On Ramp 164 W, near Towne Point Road, motorists can expect delays due to a disabled vehicle. The west exit ramp narrows.","Minor Incident - Traffic - Disabled Vehicle"
"06/01/2025 09:38 AM ET","New Kent (County)","I-64E",221.6,"On I-64 at mile marker 221.6 in the County of New Kent, near Homestead Road, motorists can expect delays due to a disabled vehicle. The east right shoulder is closed.","Minor Incident - Traffic - Disabled Vehicle"
"06/01/2025 10:11 AM ET","Henrico (County)","I-64E",186,"On I-64 at mile marker 186 in the County of Henrico, motorists can expect delays due to an incident. All east lanes are closed.","Major Incident - Traffic - Other Traffic"
