Update Time,Jurisdiction,Route,MRM,Description,Label
"11/11/2025, 04:59 AM ET","Northampton (County)","US-13S",55.7,"On US-13 South in the County of Northampton, at Chesapeake Bay Bridge Tunnel South, motorists can expect delays due to high wind.","Weather Incident - High Wind - Advisory"
"11/11/2025, 05:29 AM ET","Fauquier (County)","US-50E",42.9,"On US-50 in the County of Fauquier, in the vicinity of St Louis Rd; Rt. 611N/S (Loudoun County), motorists can expect delays due to a vehicle crash. All east lanes are closed.","Major Incident - Traffic - Vehicle Crash"
"11/11/2025, 05:05 AM ET","Carroll (County)","I-77N",0,"On I-77 North at mile marker 0 in the County of Carroll, motorists can expect delays due to high wind.","Weather Incident - High Wind - Advisory"
"11/11/2025, 06:12 AM ET","New Kent (County)","I-64E",216.8,"On I-64 at mile marker 216.8 in the County of New Kent, motorists can expect delays due to a disabled vehicle. The east right shoulder is closed.","Minor Incident - Traffic - Disabled Vehicle"
"11/11/2025, 05:35 AM ET","Floyd (County)","Rt. 720N (Floyd County)",5.5,"On Rt. 720 North in the County of Floyd, in the vicinity of Long Level Rd; Long Level Rd SW; Rt. 722N/S (Floyd County), motorists can expect delays due to weather. Lane closures exist.","Weather Incident - Other Weather - Advisory"
"11/11/2025, 04:58 AM ET","York (County)","US-17N",68.2,"On US-17 North in the County of York, at Coleman Bridge, motorists can expect delays due to high wind.","Weather Incident - High Wind - Advisory"
"11/11/2025, 06:10 AM ET","Alexandria (City)","I-395S",5.8,"On I-395 at mile marker 5.8 in the City of Alexandria, motorists can expect delays due to a disabled vehicle. The south right shoulder is closed.","Minor Incident - Traffic - Disabled Vehicle"
