Update Time,Jurisdiction,Route,MRM,Description,Label
"11/23/2025, 03:15 AM ET","Augusta (County)","I-64W",99.9,"On I-64 West at mile marker 99.9 in the County of Augusta, motorists can expect delays due to fog.","Weather Incident - Fog - Advisory"
"11/23/2025, 05:56 AM ET","Carroll (County)","I-77N",0,"On I-77 North at mile marker 0 in the County of Carroll, motorists can expect delays due to high wind.","Weather Incident - High Wind - Advisory"
"11/23/2025, 06:12 AM ET","James City (County)","I-64W",227.7,"On I-64 at mile marker 227.7 in the County of James City, near Old Stage Road, motorists can expect delays due to a disabled vehicle. The west right shoulder is closed.","Minor Incident - Traffic - Disabled Vehicle"
"11/23/2025, 06:08 AM ET","Suffolk (City)","I-664N",8.9,"On I-664 in the City of Suffolk, at Monitor Merrimac Memorial Bridge Tunnel North, motorists can expect delays due to a vehicle crash. All north lanes are closed.","Major Incident - Traffic - Vehicle Crash"
"11/23/2025, 05:58 AM ET","Carroll (County)","I-77S",24.1,"On I-77 South at mile marker 24.1 in the County of Carroll, motorists can expect delays due to high wind.","Weather Incident - High Wind - Advisory"
"11/22/2025, 01:50 PM ET","Virginia Beach (City)","I-264E",15.4,undefined,"Major Incident - Traffic - Vehicle Crash"
"11/23/2025, 02:25 AM ET","Albemarle (County)","I-64W",109.9,"On I-64 at mile marker 109.9 in the County of Albemarle, motorists can expect delays due to a disabled vehicle. The west right shoulder is closed. The west exit ramp narrows.","Minor Incident - Traffic - Disabled Vehicle"
"11/23/2025, 05:59 AM ET","Norfolk (City)","I-64E",281.9,"On I-64 at mile marker 281.9 in the City of Norfolk, near Northampton Boulevard, motorists can expect delays due to a disabled vehicle. The east right shoulder is closed.","Minor Incident - Traffic - Disabled Vehicle"
"11/23/2025, 03:15 AM ET","Augusta (County)","I-64E",99.9,"On I-64 East at mile marker 99.9 in the County of Augusta, motorists can expect delays due to fog.","Weather Incident - Fog - Advisory"
