Update Time,Jurisdiction,Route,MRM,Description,Label
"09/01/2025, 02:10 AM ET","Loudoun (County)","VA-28S",42.2,"On VA-28 in the County of Loudoun, in the vicinity of Ex Ramp To, motorists can expect delays due to a disabled vehicle. The south right shoulder is closed.","Minor Incident - Traffic - Disabled Vehicle"
"09/01/2025, 02:06 AM ET","Spotsylvania (County)","On I-95R Express Lanes at miler maker 139","","On I-95R Express Lanes at miler maker 139 in the County of Spotsylvania, motorists can expect potential delays due to a disabled vehicle. The north right shoulder is closed.","Minor Incident - Traffic - Disabled Vehicle"
"09/01/2025, 02:10 AM ET","Chesapeake (City)","I-64E",297.3,"On I-64 at mile marker 297.3 in the City of Chesapeake, near George Washington Highway, motorists can expect delays due to a disabled vehicle. The east left shoulder is closed.","Minor Incident - Traffic - Disabled Vehicle"
"09/01/2025, 02:20 AM ET","Richmond (City)","I-95U Ramp 73A",0,"On I-95U Ramp 73A at mile marker 0 in the City of Richmond, motorists can expect delays due to a disabled tractor trailer. All north lanes are closed.","Major Incident - Traffic - Disabled Tractor Trailer"
"09/01/2025, 02:03 AM ET","Stafford (County)","On I-95R Express Lanes at mile marker 137.1","","On I-95R Express Lanes at mile marker 137.1 in the County of Stafford, motorists can expect potential delays due to a disabled vehicle. The north right shoulder is closed.","Minor Incident - Traffic - Disabled Vehicle"
