Update Time,Jurisdiction,Route,MRM,Description,Label
"03/25/2025 01:16 AM ET","Norfolk (City)","I-64W",272.4,"On I-64 West in the City of Norfolk, at Hampton Roads Bridge Tunnel West, motorists can expect potential delays due to a bridge/tunnel stoppage.","Minor Incident - Traffic - Bridge/Tunnel Stoppage"
"03/25/2025 01:10 AM ET","Hampton (City)","I-64E",270,"On I-64 in the City of Hampton, at Hampton Roads Bridge Tunnel East, motorists can expect potential delays due to a bridge/tunnel stoppage. All east lanes are closed.","Major Incident - Traffic - Bridge/Tunnel Stoppage"
"03/25/2025 01:09 AM ET","Chesapeake (City)","I-664N",15.3,"On I-664 at mile marker 15.3 in the City of Chesapeake, near Pughsville Road, motorists can expect delays due to a vehicle crash. The north right lane and right shoulder are closed.","Major Incident - Traffic - Vehicle Crash"
"03/25/2025 12:39 AM ET","Fairfax (County)","I-66W",63,"On I-66 at mile marker 63 in the County of Fairfax, motorists can expect delays due to a tractor trailer crash. The west right center lane, right lane, and right shoulder are closed.","Major Incident - Traffic - Tractor Trailer Crash"
"03/25/2025 12:35 AM ET","Wise (County)","ALT US-58W",50.6,"On ALT US-58 in the County of Wise, in the vicinity of Lawson Hollow Rd, motorists can expect delays due to a tractor trailer crash. The east left shoulder and left lane are closed. All west lanes are closed.","Major Incident - Traffic - Tractor Trailer Crash"
"03/24/2025 01:34 PM ET","Prince George (County)","Rt. 625N (Prince George County)",0,"On Rt. 625 North in the County of Prince George, in the vicinity of Holdsworth Rd; Newville Rd; Rt. 625N/S (Sussex County); County/City/Town Line: SUSSEX - PRINCE GEORGE COUNTY LINE, motorists can expect delays due to standing water.","Minor Incident - Standing Water - Advisory"
