Update Time,Jurisdiction,Route,MRM,Description,Label
"12/23/2025, 02:14 AM ET","Prince William (County)","I-95N",155.1,"On I-95 at mile marker 155.1 in the County of Prince William, motorists can expect delays due to a disabled vehicle. The north right shoulder is closed.","Minor Incident - Traffic - Disabled Vehicle"
"12/23/2025, 02:06 AM ET","Roanoke (County)","I-81N",146,"On I-81 at mile marker 146 in the County of Roanoke, motorists can expect delays due to a tractor trailer crash. The north right lane and right shoulder are closed.","Major Incident - Traffic - Tractor Trailer Crash"
"12/23/2025, 02:20 AM ET","Henrico (County)","I-64E",184,"On I-64 at mile marker 184 in the County of Henrico, motorists can expect delays due to a disabled vehicle. The east right lane and right shoulder are closed.","Major Incident - Traffic - Disabled Vehicle"
"12/23/2025, 12:18 AM ET","Norfolk (City)","I-64W",272.4,undefined,"Minor Incident - Traffic - Disabled Vehicle"
"12/23/2025, 02:21 AM ET","Henrico (County)","I-95S",82,"On I-95 at mile marker 82 in the County of Henrico, motorists can expect delays due to a vehicle crash. The south left shoulder and left lane are closed.","Major Incident - Traffic - Vehicle Crash"
"12/23/2025, 02:17 AM ET","Fairfax (County)","I-395S",2.4,"On I-395 at mile marker 2.4 in the County of Fairfax, motorists can expect delays due to a disabled vehicle. The south right shoulder is closed.","Minor Incident - Traffic - Disabled Vehicle"
"12/23/2025, 02:00 AM ET","Colonial Heights (City)","I-95N",53.5,"On I-95 at mile marker 53.5 in the City of Colonial Heights, motorists can expect delays due to a tractor trailer crash. The north center lane, right lane, and right shoulder are closed.","Major Incident - Traffic - Tractor Trailer Crash"
"12/23/2025, 02:15 AM ET","Prince George (County)","VA-156N",24.5,"On VA-156 North in the County of Prince George, at Benjamin Harrison Bridge, motorists can expect delays due to a disabled vehicle.","Minor Incident - Traffic - Disabled Vehicle"
