Update Time,Jurisdiction,Route,MRM,Description,Label
"06/30/2025, 02:27 AM ET","Henrico (County)","I-295S",50,"On I-295 at mile marker 50 in the County of Henrico, motorists can expect delays due to a vehicle crash. The south right lane and right shoulder are closed.","Major Incident - Traffic - Vehicle Crash"
"06/30/2025, 02:52 AM ET","Fairfax (County)","I-66W",51.8,"On I-66 at mile marker 51.8 in the County of Fairfax, motorists can expect delays due to a disabled vehicle. The west right shoulder is closed.","Minor Incident - Traffic - Disabled Vehicle"
"06/29/2025, 09:12 PM ET","Warren (County)","Rt. 629E (Warren County)","","On Rt. 629 in the County of Warren, in the vicinity of Rocky Hollow Rd; Rt. 628N/S (Warren County), motorists can expect potential delays due to standing water. All east lanes are closed. All west lanes are closed.","Major Incident - Standing Water - Closed"
"06/30/2025, 12:30 AM ET","Prince William (County)","VA-234N",16,"On VA-234 North in the County of Prince William, in the vicinity of Clover Hill Rd, motorists can expect delays due to an incident. Lane closures exist.","Minor Incident - Traffic - Other Traffic"
"06/29/2025, 08:39 PM ET","Warren (County)","Rt. 620N (Warren County)","","On Rt. 620 in the County of Warren, in the vicinity of Bennys Beach Rd; Dead End, motorists can expect potential delays due to standing water. All north lanes are closed. All south lanes are closed.","Major Incident - Standing Water - Closed"
