Update Time,Jurisdiction,Route,MRM,Description,Label
"01/30/2025 10:01 AM ET","Franklin (County)","Rt. 726N (Franklin County)",0,"On Rt. 726 in the County of Franklin, in the vicinity of Dillons Mill Rd; Rt. 643N/S (Franklin County), motorists can expect delays due to a brush fire. All north lanes are closed. All south lanes are closed.","Major Incident - Disaster (Natural/Man-Made) - Brush Fire"
"01/30/2025 01:51 PM ET","Prince William (County)","I-66W",41.6,"On I-66 at mile marker 41.6 in the County of Prince William, motorists can expect delays due to a disabled vehicle. The west right shoulder is closed.","Minor Incident - Traffic - Disabled Vehicle"
"01/30/2025 02:10 PM ET","Henrico (County)","I-64W",202,"On I-64 West at mile marker 202 in the County of Henrico, motorists can expect delays due to a tractor trailer crash.","Minor Incident - Traffic - Tractor Trailer Crash"
"01/30/2025 02:09 PM ET","Hampton (City)","I-64E",261.61,"On I-64 at mile marker 261.6 in the City of Hampton, near Hampton Roads Center Parkway, motorists can expect delays due to a disabled vehicle. The east right shoulder is closed.","Minor Incident - Traffic - Disabled Vehicle"
"01/30/2025 02:00 PM ET","Prince William (County)","I-95S",162,"On I-95 at mile marker 162 in the County of Prince William, motorists can expect delays due to a disabled vehicle. The south right shoulder is closed.","Minor Incident - Traffic - Disabled Vehicle"
"01/30/2025 02:10 PM ET","Fairfax (County)","I-495S",54.1,"On I-495 South at mile marker 54.1 in the County of Fairfax, motorists can expect delays due to a disabled tractor trailer.","Minor Incident - Traffic - Disabled Tractor Trailer"
"01/30/2025 12:19 PM ET","Fairfax (County)","I-395N",5.6,"On I-395 at mile marker 5.6 in the County of Fairfax, motorists can expect delays due to a disabled vehicle. The north right shoulder is closed.","Minor Incident - Traffic - Disabled Vehicle"
"01/30/2025 09:42 AM ET","Chesterfield (County)","Rt. 602E (Chesterfield County)",17.14,"On Rt. 602 in the County of Chesterfield, in the vicinity of Graves Rd; Rt. 630E/W (Chesterfield County), motorists can expect delays due to a vehicle crash. All east lanes are closed. All west lanes are closed.","Major Incident - Traffic - Vehicle Crash"
