Update Time,Jurisdiction,Route,MRM,Description,Label
"10/25/2025, 05:39 AM ET","King William (County)","Rt. 600N (King William County)",9.7,"On Rt. 600 in the County of King William, in the vicinity of Ayletts Mill Dr; Rt. 1205E/W (King William County), motorists can expect delays due to a vehicle crash. All north lanes are closed. All south lanes are closed.","Major Incident - Traffic - Vehicle Crash"
"10/25/2025, 04:12 AM ET","Fairfax (County)","Rt. 7100S (Fairfax County)",22.3,"On Rt. 7100 South in the County of Fairfax, in the vicinity of Sugarland Valley Dr; Rt. 8215E/W (Fairfax County), motorists can expect delays due to an incident. Lane closures exist.","Minor Incident - Traffic - Other Traffic"
"10/25/2025, 06:00 AM ET","New Kent (County)","I-64W",220.2,"On I-64 at mile marker 220.2 in the County of New Kent, motorists can expect delays due to a disabled vehicle. The west right shoulder is closed.","Minor Incident - Traffic - Disabled Vehicle"
"10/25/2025, 06:06 AM ET","Fairfax (County)","VA-28N",38.8,"On VA-28 in the County of Fairfax, in the vicinity of County/City/Town Line: LOUDOUN CO LINE/FAIRFAX CL, motorists can expect delays due to a disabled vehicle. The north right shoulder is closed.","Minor Incident - Traffic - Disabled Vehicle"
"10/25/2025, 06:06 AM ET","Loudoun (County)","VA-28N",42.6,"On VA-28 in the County of Loudoun, in the vicinity of En Ramp FR, motorists can expect delays due to a disabled vehicle. The north right shoulder is closed.","Minor Incident - Traffic - Disabled Vehicle"
"10/25/2025, 06:05 AM ET","Virginia Beach (City)","I-264W",13.9,"On I-264 at mile marker 13.9 in the City of Virginia Beach, near Newtown Road, motorists can expect delays due to a vehicle crash. The west outside right shoulder is closed.","Minor Incident - Traffic - Vehicle Crash"
