Update Time,Jurisdiction,Route,MRM,Description,Label
"09/09/2025, 09:18 PM ET","Hampton (City)","I-64W",265,"On I-64 at mile marker 264.9 in the City of Hampton, near 664 Interchange, motorists can expect delays due to a multi-vehicle crash. The west right shoulder is closed. The west exit 264 narrows.","Minor Incident - Traffic - Multi-Vehicle Crash"
"09/09/2025, 09:04 PM ET","Albemarle (County)","Rt. 743N (Albemarle County)",0.4,"On Rt. 743 in the County of Albemarle, in the vicinity of Solomon Rd; Rt. 1430E/W (Albemarle County), motorists can expect delays due to a vehicle crash. All north lanes are closed. All south lanes are closed.","Major Incident - Traffic - Vehicle Crash"
"09/09/2025, 09:07 PM ET","Amelia (County)","Rt. 612N (Amelia County)",8.8,"On Rt. 612 in the County of Amelia, in the vicinity of River Rd; Rt. 602E/W (Amelia County), motorists can expect delays due to a vehicle crash. All north lanes are closed. All south lanes are closed.","Major Incident - Traffic - Vehicle Crash"
"09/09/2025, 08:58 PM ET","Prince William (County)","I-95S",152.5,"On I-95 at mile marker 152.5 in the County of Prince William, motorists can expect delays due to a disabled vehicle. The south right shoulder is closed.","Minor Incident - Traffic - Disabled Vehicle"
"09/09/2025, 08:05 PM ET","Fairfax (County)","VA-7E",50.5,"On VA-7 East in the County of Fairfax, in the vicinity of Dranesville Manor Dr; Rolling Holly Dr; Rt. 10294N (Fairfax County); Rt. 6224N/S (Fairfax County), motorists can expect delays due to weather. Lane closures exist.","Weather Incident - Other Weather - Advisory"
"09/09/2025, 09:17 PM ET","Carroll (County)","I-77S",21,"On I-77 at mile marker 21 in the County of Carroll, motorists can expect delays due to a disabled tractor trailer. The south left shoulder, left lane, and right shoulder are closed. Traffic backups are approximately 1.0 mile.","Major Incident - Traffic - Disabled Tractor Trailer"
"09/09/2025, 08:51 PM ET","Shenandoah (County)","I-81N",268,"On I-81 North at mile marker 268 in the County of Shenandoah, motorists can expect delays due to congestion. Traffic backups are approximately 10.0 miles.","Major Incident - Traffic - Congestion/Delay"
"09/09/2025, 08:28 PM ET","Fairfax (County)","Rt. 1905N (Fairfax County)",0.2,"On Rt. 1905 North in the County of Fairfax, in the vicinity of Ridge St; Rt. 1903E/W (Fairfax County), motorists can expect delays due to weather. Lane closures exist.","Weather Incident - Other Weather - Advisory"
"09/09/2025, 09:18 PM ET","Norfolk (City)","I-64W",272.8,"On I-64 at mile marker 272.8 in the City of Norfolk, motorists can expect delays due to a disabled vehicle. The west right lane and right shoulder are closed.","Major Incident - Traffic - Disabled Vehicle"
