Update Time,Jurisdiction,Route,MRM,Description,Label
"03/02/2025 09:55 AM ET","Stafford (County)","I-95S",134,"On I-95 at mile marker 134 in the County of Stafford, motorists can expect delays due to a disabled vehicle. The south left shoulder is closed.","Minor Incident - Traffic - Disabled Vehicle"
"03/02/2025 09:59 AM ET","Fairfax (County)","I-95S",168.8,"On I-95 at mile marker 168.8 in the County of Fairfax, motorists can expect delays due to a disabled vehicle. The south left shoulder is closed.","Minor Incident - Traffic - Disabled Vehicle"
"03/02/2025 10:13 AM ET","Virginia Beach (City)","I-264E",14.4,"On I-264 at mile marker 14.4 in the City of Virginia Beach, near Witchduck Road, motorists can expect delays due to a disabled vehicle. The east right shoulder is closed.","Minor Incident - Traffic - Disabled Vehicle"
"03/02/2025 10:15 AM ET","Prince William (County)","I-66W",43.3,"On I-66 at mile marker 43.3 in the County of Prince William, motorists can expect delays due to a disabled vehicle. The west right shoulder is closed.","Minor Incident - Traffic - Disabled Vehicle"
"03/02/2025 08:48 AM ET","Mecklenburg (County)","Rt. 688N (Mecklenburg County)",5,"On Rt. 688 in the County of Mecklenburg, in the vicinity of Wilkerson Rd; Rt. 677E/W (Mecklenburg County), motorists can expect delays due to standing water. All north lanes are closed. All south lanes are closed.","Major Incident - Standing Water - Closed"
"03/02/2025 10:15 AM ET","Norfolk (City)","I-64W",272.4,"On I-64 West in the City of Norfolk, at Hampton Roads Bridge Tunnel West, motorists can expect potential delays due to a bridge/tunnel stoppage.","Minor Incident - Traffic - Bridge/Tunnel Stoppage"
