Update Time,Jurisdiction,Route,MRM,Description,Label
"11/16/2025, 05:05 AM ET","Arlington (County)","I-66W",71.2,"On I-66 at mile marker 71.2 in the County of Arlington, motorists can expect delays due to a disabled vehicle. The west right shoulder is closed.","Minor Incident - Traffic - Disabled Vehicle"
"11/16/2025, 04:52 AM ET","Fairfax (County)","I-495S",47.6,"On I-495 at mile marker 47.6 in the County of Fairfax, motorists can expect delays due to a vehicle crash. The south right lane and right shoulder are closed.","Major Incident - Traffic - Vehicle Crash"
"11/16/2025, 05:03 AM ET","Chesapeake (City)","I-464S",0.4,"On I-464 at mile marker 0.4 in the City of Chesapeake, near 64 Interchange, motorists can expect delays due to a disabled vehicle. The south exit 1B narrows.","Minor Incident - Traffic - Disabled Vehicle"
"11/16/2025, 04:56 AM ET","Carroll (County)","I-77N",0,"On I-77 North at mile marker 0 in the County of Carroll, motorists can expect delays due to high wind.","Weather Incident - High Wind - Advisory"
"11/16/2025, 05:03 AM ET","Henrico (County)","I-64W",203.2,"On I-64 at mile marker 203.2 in the County of Henrico, motorists can expect delays due to a disabled vehicle. The west right shoulder is closed.","Minor Incident - Traffic - Disabled Vehicle"
"11/16/2025, 04:23 AM ET","Orange (County)","VA-20S",65.6,"On VA-20 in the County of Orange, in the vicinity of Greenwood Rd; Jones Mill Rd; Rt. 635N/S (Orange County), motorists can expect delays due to other security/police activity. All north lanes are closed. All south lanes are closed.","Major Incident - Security/Police Activity - Other Security/Police Activity"
"11/16/2025, 04:56 AM ET","Carroll (County)","I-77S",24.1,"On I-77 South at mile marker 24.1 in the County of Carroll, motorists can expect delays due to high wind.","Weather Incident - High Wind - Advisory"
