Update Time,Jurisdiction,Route,MRM,Description,Label
"08/27/2025, 12:00 AM ET","Carroll (County)","I-77S",24.1,"On I-77 South at mile marker 24.1 in the County of Carroll, motorists can expect delays due to high wind.","Weather Incident - High Wind - Advisory"
"08/27/2025, 05:00 AM ET","Fairfax (County)","On I-66E Express Lanes entrance ramp from Stringfellow","","On I-66E Express Lanes entrance ramp from Stringfellow in the County of Fairfax, motorists can expect potential delays due to an incident. The east right shoulder is closed.","Minor Incident - Traffic - Other Traffic"
"08/27/2025, 05:03 AM ET","Fairfax (County)","On I-66E Express Lanes at mile marker 54.9","","On I-66E Express Lanes at mile marker 54.9 in the County of Fairfax, motorists can expect potential delays due to a vehicle crash. The east left shoulder is closed.","Minor Incident - Traffic - Vehicle Crash"
"08/27/2025, 12:00 AM ET","Carroll (County)","I-77N",0,"On I-77 North at mile marker 0 in the County of Carroll, motorists can expect delays due to high wind.","Weather Incident - High Wind - Advisory"
"08/27/2025, 12:38 AM ET","Henrico (County)","I-295S",21.7,"On I-295 South at mile marker 21.7 in the County of Henrico, motorists can expect delays due to a disabled vehicle.","Minor Incident - Traffic - Disabled Vehicle"
