Update Time,Jurisdiction,Route,MRM,Description,Label
"02/23/2025 11:13 PM ET","Montgomery (County)","I-81N",106.8,"On I-81 at mile marker 106.8 in the County of Montgomery, motorists can expect delays due to a tractor trailer crash. The north left shoulder and left lane are closed.","Major Incident - Traffic - Tractor Trailer Crash"
"02/23/2025 09:40 PM ET","Mecklenburg (County)","Rt. 688N (Mecklenburg County)",5,"On Rt. 688 North in the County of Mecklenburg, in the vicinity of Wilkerson Rd; Rt. 677E/W (Mecklenburg County), motorists can expect delays due to standing water.","Minor Incident - Standing Water - Advisory"
"02/23/2025 11:15 PM ET","Caroline (County)","I-95N",112,"On I-95 North at mile marker 112 in the County of Caroline, motorists can expect delays due to a vehicle crash.","Minor Incident - Traffic - Vehicle Crash"
"02/23/2025 05:45 AM ET","Mecklenburg (County)","Rt. 609N (Mecklenburg County)",1.6,"On Rt. 609 in the County of Mecklenburg, in the vicinity of Jones Rd; Rt. 698E/W (Mecklenburg County), motorists can expect delays due to standing water. All north lanes are closed. All south lanes are closed.","Major Incident - Standing Water - Closed"
"02/23/2025 05:46 AM ET","Mecklenburg (County)","Rt. 693S (Mecklenburg County)",0,"On Rt. 693 in the County of Mecklenburg, in the vicinity of Sullivan Rd; Rt. 703N/S (Mecklenburg County), motorists can expect delays due to standing water. All north lanes are closed. All south lanes are closed.","Major Incident - Standing Water - Closed"
"02/23/2025 05:45 AM ET","Mecklenburg (County)","Rt. 640E (Mecklenburg County)",3.1,"On Rt. 640 in the County of Mecklenburg, in the vicinity of Trottinridge Rd; Rt. 609N/S (Mecklenburg County), motorists can expect delays due to standing water. All east lanes are closed. All west lanes are closed.","Major Incident - Standing Water - Closed"
