Update Time,Jurisdiction,Route,MRM,Description,Label
"09/14/2025, 05:11 PM ET","Portsmouth (City)","I-264W",4.7,"On I-264 at mile marker 4.7 in the City of Portsmouth, near Frederick Boulevard, motorists can expect delays due to a disabled vehicle. The west right shoulder is closed.","Minor Incident - Traffic - Disabled Vehicle"
"09/14/2025, 04:55 PM ET","Fairfax (County)","On I-66W Express Lanes exit ramp to Balls Ford Drive","","On I-66W Express Lanes exit ramp to Balls Ford Drive in the County of Fairfax, motorists can expect potential delays due to a vehicle crash. The west exit ramp is closed.","Minor Incident - Traffic - Vehicle Crash"
"09/14/2025, 04:37 PM ET","Fauquier (County)","I-66E",18.9,"On I-66 at mile marker 18.9 in the County of Fauquier, motorists can expect delays due to a disabled vehicle. The east exit ramp narrows.","Minor Incident - Traffic - Disabled Vehicle"
"09/14/2025, 04:54 PM ET","Newport News (City)","I-64W",254,"On I-64 at mile marker 254 in the City of Newport News, near Denbigh Boulevard, motorists can expect delays due to a disabled vehicle. The west right shoulder is closed.","Minor Incident - Traffic - Disabled Vehicle"
"09/14/2025, 05:12 PM ET","Hampton (City)","I-64E",270,"On I-64 in the City of Hampton, at Hampton Roads Bridge Tunnel East, motorists can expect delays due to a disabled vehicle. All east lanes are closed.","Major Incident - Traffic - Disabled Vehicle"
"09/14/2025, 04:57 PM ET","King George (County)","Rt. 677E (King George County)",0.2,"On Rt. 677 East in the County of King George, in the vicinity of Comorn Rd; Rt. 609N/S (King George County), motorists can expect delays due to a vehicle crash. Lane closures exist.","Minor Incident - Traffic - Vehicle Crash"
"09/14/2025, 03:38 PM ET","Rockbridge (County)","I-81N",174.6,"On I-81 at mile marker 174.6 in the County of Rockbridge, motorists can expect delays due to a vehicle crash. The north right shoulder is closed.","Minor Incident - Traffic - Vehicle Crash"
"09/14/2025, 03:28 PM ET","Rockbridge (County)","I-81N",173.9,"On I-81 at mile marker 173.9 in the County of Rockbridge, motorists can expect delays due to a disabled vehicle. The north right shoulder is closed.","Minor Incident - Traffic - Disabled Vehicle"
"09/14/2025, 05:11 PM ET","Arlington (County)","I-395N",7.3,"On I-395 at mile marker 7.3 in the County of Arlington, motorists can expect delays due to a disabled vehicle. The north right shoulder is closed.","Minor Incident - Traffic - Disabled Vehicle"
