Update Time,Jurisdiction,Route,MRM,Description,Label
"05/26/2025 12:11 AM ET","Fairfax (County)","I-495N",53.6,"On I-495 at mile marker 53.6 in the County of Fairfax, motorists can expect delays due to a disabled vehicle. The north right shoulder is closed.","Minor Incident - Traffic - Disabled Vehicle"
"05/26/2025 12:20 AM ET","Prince William (County)","I-95N",150,"On I-95 at mile marker 150 in the County of Prince William, motorists can expect delays due to a vehicle crash. The north center lane, right lane, and right shoulder are closed.","Major Incident - Traffic - Vehicle Crash"
"05/25/2025 11:11 PM ET","Prince William (County)","I-66W",45.4,"On I-66 at mile marker 45.4 in the County of Prince William, motorists can expect delays due to a disabled tractor trailer. The west right shoulder is closed.","Minor Incident - Traffic - Disabled Tractor Trailer"
"05/26/2025 12:12 AM ET","Stafford (County)","I-95N",133.3,"On I-95 at mile marker 133.3 in the County of Stafford, motorists can expect delays due to a disabled vehicle. The north left shoulder is closed.","Minor Incident - Traffic - Disabled Vehicle"
"05/26/2025 12:20 AM ET","Virginia Beach (City)","I-264E",22.2,"On I-264 at mile marker 22.2 in the City of Virginia Beach, near London Bridge Road, motorists can expect delays due to a disabled vehicle. The east right shoulder is closed.","Minor Incident - Traffic - Disabled Vehicle"
