Update Time,Jurisdiction,Route,MRM,Description,Label
"01/30/2025 10:10 PM ET","Norfolk (City)","I-64W",284.74,"On I-64 at mile marker 284.7 in the City of Norfolk, near 264 Interchange, motorists can expect delays due to a disabled vehicle. The west right shoulder is closed.","Minor Incident - Traffic - Disabled Vehicle"
"01/30/2025 10:11 PM ET","Rockingham (County)","Rt. 727W (Rockingham County)",5.32,"On Rt. 727 in the County of Rockingham, in the vicinity of Warm Springs Pike; VA-42N/S, motorists can expect delays due to a vehicle crash. All west lanes are closed.","Major Incident - Traffic - Vehicle Crash"
"01/30/2025 10:14 PM ET","Arlington (County)","I-395N",8.9,"On I-395 at mile marker 8.9 in the County of Arlington, motorists can expect delays due to a disabled vehicle. The north left shoulder and right shoulder are closed.","Minor Incident - Traffic - Disabled Vehicle"
"01/30/2025 09:44 PM ET","Lancaster (County)","Rt. 644E (Lancaster County)",0.2,"On Rt. 644 in the County of Lancaster, in the vicinity of Deep Water Dr; Rt. 1039N/S (Lancaster County), motorists can expect delays due to a vehicle crash. All east lanes are closed. All west lanes are closed.","Major Incident - Traffic - Vehicle Crash"
"01/30/2025 10:08 PM ET","Prince William (County)","I-95N",156,"On I-95 at mile marker 156 in the County of Prince William, motorists can expect delays due to a vehicle crash. The north left shoulder and left lane are closed.","Major Incident - Traffic - Vehicle Crash"
"01/30/2025 10:13 PM ET","Norfolk (City)","I-264E",13.48,"On I-264 at mile marker 13.5 in the City of Norfolk, near Newtown Road, motorists can expect delays due to a disabled vehicle. The east right shoulder is closed.","Minor Incident - Traffic - Disabled Vehicle"
"01/30/2025 09:59 PM ET","Fairfax (County)","I-66E",64,"On I-66 at mile marker 64 in the County of Fairfax, motorists can expect delays due to a disabled vehicle. The east right shoulder is closed.","Minor Incident - Traffic - Disabled Vehicle"
