Update Time,Jurisdiction,Route,MRM,Description,Label
"09/20/2025, 05:03 AM ET","Hampton (City)","I-64E",264.7,"On I-64 at mile marker 264.6 in the City of Hampton, near 664 Interchange, motorists can expect delays due to a vehicle fire. All east lanes are closed.","Major Incident - Traffic - Vehicle Fire"
"09/20/2025, 05:14 AM ET","James City (County)","I-64W",232,"On I-64 at mile marker 232 in the County of James City, near Croaker Road, motorists can expect delays due to a tractor trailer crash. The west right lane and right shoulder are closed.","Major Incident - Traffic - Tractor Trailer Crash"
"09/19/2025, 09:24 PM ET","Fairfax (County)","Rt. 3921E (Fairfax County)",0,"On Rt. 3921 in the County of Fairfax, in the vicinity of Birch Rd; Rt. 2807N/S (Fairfax County), motorists can expect delays due to an incident. The east right lane is closed.","Major Incident - Traffic - Other Traffic"
"09/19/2025, 09:40 PM ET","Chesterfield (County)","Rt. 643E (Chesterfield County)",0,"On Rt. 643 East in the County of Chesterfield, in the vicinity of Belmont Rd; Turner Rd; Rt. 651E/W (Chesterfield County); Rt. 650N/S (Chesterfield County), motorists can expect delays due to standing water.","Weather Incident - Standing Water - Advisory"
"09/20/2025, 04:50 AM ET","Prince William (County)","I-95N",150.9,"On I-95 at mile marker 150.9 in the County of Prince William, motorists can expect delays due to a disabled vehicle. The north right shoulder is closed.","Minor Incident - Traffic - Disabled Vehicle"
"09/20/2025, 05:06 AM ET","Fairfax (County)","I-95N",171.8,"On I-95 at mile marker 171.8 in the County of Fairfax, motorists can expect delays due to a disabled vehicle. The north right shoulder is closed.","Minor Incident - Traffic - Disabled Vehicle"
"09/20/2025, 05:14 AM ET","Norfolk (City)","I-64W",272.4,"On I-64 in the City of Norfolk, at Hampton Roads Bridge Tunnel West, motorists can expect delays due to a vehicle crash. All west lanes are closed.","Major Incident - Traffic - Vehicle Crash"
