Update Time,Jurisdiction,Route,MRM,Description,Label
"01/12/2025 03:58 PM","Prince George (County)","Rt. 1405E (Prince George County)",0.33,"On Rt. 1405 East in the County of Prince George, in the vicinity of Beaver Castle Rd; Rt. 642N/S (Prince George County), motorists can expect delays due to icy conditions. Lane closures exist.","Minor Incident - Icy Conditions - Advisory"
"01/12/2025 09:51 PM","Norfolk (City)","I-264W",12.54,"On I-264 at mile marker 12.5 in the City of Norfolk, near Military Highway, motorists can expect delays due to other security/police activity. The west inside right shoulder is closed.","Major Incident - Security/Police Activity - Other Security/Police Activity"
"01/12/2025 09:52 PM","Caroline (County)","VA-207N",0.89,"On VA-207 North in the County of Caroline, in the vicinity of Cool Water Dr; Ruther Glen Rd; Rt. 652N/S (Caroline County), motorists can expect delays due to a vehicle crash.","Minor Incident - Traffic - Vehicle Crash"
"01/12/2025 09:30 PM","Spotsylvania (County)","I-95S",125.4,"On I-95 at mile marker 125.4 in the County of Spotsylvania, motorists can expect delays due to a disabled vehicle. The south right shoulder is closed.","Major Incident - Traffic - Disabled Vehicle"
"01/12/2025 09:21 PM","Pulaski (County)","I-81N",89.1,"On I-81 at mile marker 89.1 in the County of Pulaski, motorists can expect delays due to a disabled tractor trailer. The north right shoulder is closed.","Major Incident - Traffic - Disabled Tractor Trailer"
"01/12/2025 09:28 PM","Spotsylvania (County)","I-95S",126.8,"On I-95 at mile marker 126.8 in the County of Spotsylvania, motorists can expect delays due to a disabled vehicle. The south right shoulder is closed.","Major Incident - Traffic - Disabled Vehicle"
"01/12/2025 07:22 PM","Brunswick (County)","Rt. 688E (Brunswick County)",0,"On Rt. 688 East in the County of Brunswick, in the vicinity of Reedy Creek Rd; Rt. 634N/S (Brunswick County), motorists can expect delays due to icy conditions. Lane closures exist.","Minor Incident - Icy Conditions - Advisory"
