Update Time,Jurisdiction,Route,MRM,Description,Label
"08/19/2025, 07:00 AM ET","Carroll (County)","I-77S",24.1,"On I-77 South at mile marker 24.1 in the County of Carroll, motorists can expect delays due to fog.","Weather Incident - Fog - Advisory"
"08/19/2025, 07:03 AM ET","Carroll (County)","I-77N",0,"On I-77 North at mile marker 0 in the County of Carroll, motorists can expect delays due to fog.","Weather Incident - Fog - Advisory"
"08/19/2025, 07:09 AM ET","Isle Of Wight (County)","US-17S",44.4,"On US-17 South in the County of Isle Of Wight, in the vicinity of Smiths Neck Rd; Rt. 669N/S (Isle of Wight County), motorists can expect delays due to standing water.","Weather Incident - Standing Water - Advisory"
"08/19/2025, 06:53 AM ET","Norfolk (City)","I-64W",272.4,"On I-64 West in the City of Norfolk, at Hampton Roads Bridge Tunnel West, motorists can expect delays due to congestion. Traffic backups are approximately 6.25 miles.","Major Incident - Traffic - Congestion/Delay"
"08/19/2025, 07:09 AM ET","James City (County)","US-60E",246.4,"On US-60 East in the County of James City, in the vicinity of Grove Heights Ave; Ron Springs Dr; Rt. 656N/S (James City County), motorists can expect delays due to standing water.","Weather Incident - Standing Water - Advisory"
"08/18/2025, 11:15 PM ET","Augusta (County)","I-64W",99.8,"On I-64 West at mile marker 99.8 in the County of Augusta, near Fog, motorists can expect delays due to fog.","Weather Incident - Fog - Advisory"
"08/19/2025, 07:03 AM ET","Henrico (County)","I-195S",2.5,"On I-195 at mile marker 2.5 in the County of Henrico, motorists can expect delays due to a vehicle crash. The south left shoulder and left lane are closed.","Major Incident - Traffic - Vehicle Crash"
"08/19/2025, 06:45 AM ET","Spotsylvania (County)","I-95N",126.3,"On I-95 at mile marker 126.3 in the County of Spotsylvania, motorists can expect delays due to a disabled vehicle. The north right shoulder is closed.","Minor Incident - Traffic - Disabled Vehicle"
"08/19/2025, 06:49 AM ET","Hampton (City)","I-64E",270,"On I-64 East in the City of Hampton, at Hampton Roads Bridge Tunnel East, motorists can expect delays due to congestion. Traffic backups are approximately 3.0 miles.","Major Incident - Traffic - Congestion/Delay"
"08/19/2025, 07:12 AM ET","Norfolk (City)","I-64E",276.5,"On I-64 at mile marker 276.5 in the City of Norfolk, near Granby Street, motorists can expect delays due to a vehicle fire. All east lanes are closed.","Major Incident - Traffic - Vehicle Fire"
"08/19/2025, 07:00 AM ET","Fairfax (County)","I-66W",61.8,"On I-66 at mile marker 61.8 in the County of Fairfax, motorists can expect delays due to a disabled vehicle. The west entrance ramp narrows.","Minor Incident - Traffic - Disabled Vehicle"
"08/19/2025, 07:12 AM ET","Stafford (County)","I-95N",145.8,"On I-95 at mile marker 145.8 in the County of Stafford, motorists can expect delays due to a disabled vehicle. The north right shoulder is closed.","Minor Incident - Traffic - Disabled Vehicle"
"08/19/2025, 07:12 AM ET","Chesapeake (City)","I-64W",293.4,"On I-64 in the City of Chesapeake, at High Rise Bridge, motorists can expect delays due to a vehicle crash. The west right shoulder is closed.","Minor Incident - Traffic - Vehicle Crash"
"08/19/2025, 07:03 AM ET","Prince William (County)","I-66W",45.6,"On I-66 at mile marker 45.6 in the County of Prince William, motorists can expect delays due to a disabled vehicle. The west right shoulder is closed.","Minor Incident - Traffic - Disabled Vehicle"
"08/19/2025, 07:08 AM ET","Virginia Beach (City)","I-264E",14.3,"On I-264 at mile marker 14.3 in the City of Virginia Beach, near Cleveland Street, motorists can expect delays due to a disabled vehicle. The east right shoulder is closed.","Minor Incident - Traffic - Disabled Vehicle"
"08/19/2025, 06:43 AM ET","Suffolk (City)","I-664N",8.9,"On I-664 North in the City of Suffolk, at Monitor Merrimac Memorial Bridge Tunnel North, motorists can expect delays due to congestion. Traffic backups are approximately 1.25 miles.","Major Incident - Traffic - Congestion/Delay"
"08/19/2025, 07:14 AM ET","Henrico (County)","I-295N",29.6,"On I-295 at mile marker 29.6 in the County of Henrico, motorists can expect delays due to a vehicle crash. The north left shoulder is closed.","Minor Incident - Traffic - Vehicle Crash"
"08/19/2025, 07:10 AM ET","Prince William (County)","I-66W",47.2,"On I-66 at mile marker 47.2 in the County of Prince William, motorists can expect delays due to a disabled vehicle. The west right shoulder is closed.","Minor Incident - Traffic - Disabled Vehicle"
"08/19/2025, 07:06 AM ET","Fairfax (County)","I-95S",169.2,"On I-95 at mile marker 169.2 in the County of Fairfax, motorists can expect delays due to a disabled vehicle. The south right shoulder is closed.","Minor Incident - Traffic - Disabled Vehicle"
"08/19/2025, 06:55 AM ET","Fairfax (County)","I-495S",52.8,"On I-495 at mile marker 52.8 in the County of Fairfax, motorists can expect delays due to a disabled vehicle. The south right shoulder is closed.","Minor Incident - Traffic - Disabled Vehicle"
"08/19/2025, 07:09 AM ET","Isle Of Wight (County)","US-258E",50.7,"On US-258 East in the County of Isle Of Wight, in the vicinity of New Towne Haven Ln; Rt. 711N/S (Isle of Wight County), motorists can expect delays due to standing water.","Weather Incident - Standing Water - Advisory"
"08/19/2025, 07:10 AM ET","Norfolk (City)","I-264W",9.8,"On I-264 at mile marker 9.8 in the City of Norfolk, near Ballentine Boulevard, motorists can expect delays due to a disabled vehicle. The west right shoulder is closed.","Minor Incident - Traffic - Disabled Vehicle"
"08/19/2025, 06:58 AM ET","Accomack (County)","BUS US-13N",3.9,"On BUS US-13 North in the County of Accomack, in the vicinity of Courthouse Ave; Cross St; Rt. 1502N/S (Accomack County); Rt. 764N/S (Accomack County), motorists can expect delays due to standing water.","Weather Incident - Standing Water - Advisory"
"08/18/2025, 11:16 PM ET","Augusta (County)","I-64E",99.8,"On I-64 East at mile marker 99.8 in the County of Augusta, motorists can expect delays due to fog.","Weather Incident - Fog - Advisory"
