Update Time,Jurisdiction,Route,MRM,Description,Label
"12/18/2025, 01:28 AM ET","Henrico (County)","I-95N",83,"On I-95 at mile marker 83 in the County of Henrico, motorists can expect delays due to a vehicle crash. The north right shoulder is closed.","Minor Incident - Traffic - Vehicle Crash"
"12/18/2025, 01:16 AM ET","Virginia Beach (City)","I-264W",20.8,"On I-264 at mile marker 20.8 in the City of Virginia Beach, near Lynnhaven Parkway, motorists can expect delays due to a vehicle crash. The west exit 19B is closed.","Minor Incident - Traffic - Vehicle Crash"
"12/17/2025, 04:24 PM ET","Washington (County)","I-81N",29.4,"On I-81 at mile marker 29.4 in the County of Washington, motorists can expect delays due to a disabled vehicle. The north right shoulder is closed.","Minor Incident - Traffic - Disabled Vehicle"
"12/18/2025, 12:49 AM ET","Augusta (County)","VA-254E",5.8,"On VA-254 in the County of Augusta, in the vicinity of Frog Pond Rd; Rt. 612E/W (Augusta County), motorists can expect delays due to other security/police activity. All east lanes are closed. All west lanes are closed.","Major Incident - Security/Police Activity - Other Security/Police Activity"
"12/18/2025, 12:20 AM ET","Fairfax (County)","I-95R",162.1,"On I-95R South at mile marker 162.1 in the County of Fairfax, motorists can expect potential delays due to a disabled tractor trailer.","Minor Incident - Traffic - Disabled Tractor Trailer"
"12/18/2025, 01:06 AM ET","Fairfax (County)","I-495N",44,"On I-495 at mile marker 44 in the County of Fairfax, motorists can expect delays due to a disabled vehicle. The north right shoulder is closed.","Minor Incident - Traffic - Disabled Vehicle"
"12/18/2025, 01:21 AM ET","Hampton (City)","I-64E",270,"On I-64 in the City of Hampton, at Hampton Roads Bridge Tunnel East, motorists can expect potential delays due to a bridge/tunnel stoppage. All east lanes are closed.","Major Incident - Traffic - Bridge/Tunnel Stoppage"
"12/18/2025, 01:25 AM ET","Stafford (County)","I-95S",142.6,"On I-95 at mile marker 142.6 in the County of Stafford, motorists can expect delays due to a disabled vehicle. The south right shoulder is closed.","Minor Incident - Traffic - Disabled Vehicle"
