Update Time,Jurisdiction,Route,MRM,Description,Label
"09/03/2025, 01:08 AM ET","Virginia Beach (City)","I-264W",17.2,"On I-264 at mile marker 17.2 in the City of Virginia Beach, near Mount Trashmore, motorists can expect delays due to a vehicle crash. The west left shoulder is closed.","Minor Incident - Traffic - Vehicle Crash"
"09/03/2025, 01:10 AM ET","Shenandoah (County)","I-81N",268,"On I-81 at mile marker 268 in the County of Shenandoah, motorists can expect delays due to a tractor trailer crash. The north right shoulder is closed.","Minor Incident - Traffic - Tractor Trailer Crash"
"09/03/2025, 12:50 AM ET","Stafford (County)","I-95S",138.3,"On I-95 at mile marker 138.3 in the County of Stafford, motorists can expect delays due to a disabled tractor trailer. The south right shoulder is closed.","Minor Incident - Traffic - Disabled Tractor Trailer"
"09/02/2025, 11:23 PM ET","Fairfax (County)","I-66E",67.8,"On I-66 at mile marker 67.8 in the County of Fairfax, motorists can expect delays due to a disabled vehicle. The east right shoulder is closed.","Minor Incident - Traffic - Disabled Vehicle"
"09/03/2025, 01:14 AM ET","Stafford (County)","I-95N",145,"On I-95 at mile marker 145 in the County of Stafford, motorists can expect delays due to a disabled vehicle. The north right shoulder is closed.","Minor Incident - Traffic - Disabled Vehicle"
"09/03/2025, 01:12 AM ET","Norfolk (City)","I-64W",284.2,"On I-64 at mile marker 284.2 in the City of Norfolk, near 264 Interchange, motorists can expect delays due to a multi-vehicle crash. The west left shoulder, left lane, and right shoulder are closed.","Major Incident - Traffic - Multi-Vehicle Crash"
"09/02/2025, 10:31 PM ET","Norfolk (City)","I-264E",11.8,"On I-264 East at mile marker 11.8 in the City of Norfolk, near Military Highway, motorists can expect delays due to a disabled vehicle.","Minor Incident - Traffic - Disabled Vehicle"
