Update Time,Jurisdiction,Route,MRM,Description,Label
"11/13/2025, 11:31 PM ET","King & Queen (County)","US-360W",175.7,"On US-360 in the County of King & Queen, in the vicinity of Midway Rd; Turnout; Rt. 621N/S (Essex County), motorists can expect delays due to a vehicle crash. All west lanes are closed.","Major Incident - Traffic - Vehicle Crash"
"11/14/2025, 12:06 AM ET","Richmond (City)","I-95S",69.7,"On I-95 at mile marker 69.7 in the City of Richmond, motorists can expect delays due to a disabled vehicle. The south right shoulder is closed.","Minor Incident - Traffic - Disabled Vehicle"
"11/14/2025, 12:14 AM ET","Hampton (City)","I-64W",261,"On I-64 at mile marker 261 in the City of Hampton, near Big Bethel Road, motorists can expect delays due to a disabled vehicle. The west right shoulder is closed.","Minor Incident - Traffic - Disabled Vehicle"
"11/13/2025, 11:52 PM ET","Prince William (County)","I-95N",157.9,"On I-95 at mile marker 157.9 in the County of Prince William, motorists can expect delays due to a disabled vehicle. The north right shoulder is closed.","Minor Incident - Traffic - Disabled Vehicle"
"11/13/2025, 11:55 PM ET","Fairfax (County)","I-495S",51.9,"On I-495 at mile marker 51.9 in the County of Fairfax, motorists can expect delays due to a disabled vehicle. The south right shoulder is closed.","Minor Incident - Traffic - Disabled Vehicle"
"11/14/2025, 12:10 AM ET","Hanover (County)","I-295N",41.9,"On I-295 at mile marker 41.9 in the County of Hanover, motorists can expect delays due to a vehicle crash. The north left shoulder and left lane are closed. The south left shoulder and left lane are closed.","Major Incident - Traffic - Vehicle Crash"
"11/14/2025, 12:14 AM ET","Norfolk (City)","I-64W",272.4,"On I-64 in the City of Norfolk, at Hampton Roads Bridge Tunnel West, motorists can expect potential delays due to a bridge/tunnel stoppage. All west lanes are closed.","Major Incident - Traffic - Bridge/Tunnel Stoppage"
