Update Time,Jurisdiction,Route,MRM,Description,Label
"03/02/2025 10:25 PM ET","Mecklenburg (County)","Rt. 688N (Mecklenburg County)",5,"On Rt. 688 in the County of Mecklenburg, in the vicinity of Wilkerson Rd; Rt. 677E/W (Mecklenburg County), motorists can expect delays due to standing water. All north lanes are closed. All south lanes are closed.","Major Incident - Standing Water - Closed"
"03/03/2025 03:18 AM ET","Henrico (County)","I-64E",195,"On I-64 at mile marker 195 in the County of Henrico, motorists can expect delays due to a vehicle crash. The east exit 195 narrows.","Minor Incident - Traffic - Vehicle Crash"
"03/03/2025 02:58 AM ET","Prince George (County)","I-95N",35.5,"On I-95 at mile marker 35.5 in the County of Prince George, motorists can expect delays due to a vehicle crash. The north left shoulder and left lane are closed.","Major Incident - Traffic - Vehicle Crash"
"03/03/2025 03:20 AM ET","Bland (County)","I-77S",47.8,"On I-77 South in the County of Bland, at Big Walker Mountain Tunnel South, motorists can expect delays due to a bridge/tunnel stoppage.","Minor Incident - Traffic - Bridge/Tunnel Stoppage"
"03/03/2025 03:22 AM ET","Spotsylvania (County)","I-95S",122.8,"On I-95 at mile marker 122.8 in the County of Spotsylvania, motorists can expect delays due to a disabled vehicle. The south right shoulder is closed.","Minor Incident - Traffic - Disabled Vehicle"
"03/03/2025 03:00 AM ET","Rockingham (County)","Rt. 721E (Rockingham County)",1,"On Rt. 721 in the County of Rockingham, in the vicinity of Glen Hollow Rd; Rt. 752N/S (Rockingham County), motorists can expect delays due to a vehicle crash. All east lanes are closed. All west lanes are closed.","Major Incident - Traffic - Vehicle Crash"
"03/03/2025 03:22 AM ET","Loudoun (County)","VA-28S",44.5,"On VA-28 in the County of Loudoun, in the vicinity of the exit ramp, motorists can expect delays due to a disabled vehicle. The south left shoulder is closed.","Minor Incident - Traffic - Disabled Vehicle"
