Update Time,Jurisdiction,Route,MRM,Description,Label
"12/26/2025, 10:21 PM ET","Brunswick (County)","Rt. 606E (Brunswick County)",15.6,"On Rt. 606 in the County of Brunswick, in the vicinity of Piney Woods Rd; Rt. 640E/W (Brunswick County), motorists can expect delays due to a vehicle crash. The east through lanes and right shoulder are closed.","Major Incident - Traffic - Vehicle Crash"
"12/26/2025, 09:47 PM ET","Henry (County)","VA-57E",0,"On VA-57 in the County of Henry, in the vicinity of Cedar St; Chestnut Oak Dr; Rt. 1231N/S (Henry County), motorists can expect delays due to a vehicle crash. All east lanes are closed. All west lanes are closed.","Major Incident - Traffic - Vehicle Crash"
"12/26/2025, 10:05 PM ET","Prince William (County)","I-66E",47,"On I-66 at mile marker 47 in the County of Prince William, motorists can expect delays due to a vehicle crash. The east right shoulder is closed. The east entrance ramp narrows.","Minor Incident - Traffic - Vehicle Crash"
"12/26/2025, 09:44 PM ET","Fairfax (County)","I-495N",55.5,"On I-495 at mile marker 55.5 in the County of Fairfax, motorists can expect delays due to a disabled vehicle. The north right shoulder is closed.","Minor Incident - Traffic - Disabled Vehicle"
"12/26/2025, 10:15 PM ET","Richmond (City)","I-95N",74,"On I-95 at mile marker 74 in the City of Richmond, motorists can expect delays due to a disabled vehicle. The north right lane and right shoulder are closed.","Major Incident - Traffic - Disabled Vehicle"
"12/26/2025, 10:06 PM ET","Brunswick (County)","I-85N",33.8,"On I-85 North at mile marker 33.8 in the County of Brunswick, motorists can expect delays due to a vehicle crash.","Minor Incident - Traffic - Vehicle Crash"
"12/26/2025, 10:16 PM ET","Stafford (County)","I-95S",135.2,"On I-95 at mile marker 135.2 in the County of Stafford, motorists can expect delays due to a disabled vehicle. The south right shoulder is closed.","Minor Incident - Traffic - Disabled Vehicle"
"12/26/2025, 10:14 PM ET","Chesterfield (County)","I-95S",59,"On I-95 at mile marker 59 in the County of Chesterfield, motorists can expect delays due to a vehicle crash. The south left shoulder and left lane are closed.","Major Incident - Traffic - Vehicle Crash"
