Update Time,Jurisdiction,Route,MRM,Description,Label
"02/28/2025 06:09 AM ET","Powhatan (County)","US-60E",154.9,"On US-60 in the County of Powhatan, in the vicinity of Old Tavern Rd; Trenholm Rd; Rt. 629N/S (Powhatan County), motorists can expect delays due to a vehicle crash. All east lanes are closed. All west lanes are closed.","Major Incident - Traffic - Vehicle Crash"
"02/28/2025 06:12 AM ET","Hampton (City)","I-64E",267.1,"On I-64 at mile marker 267.1 in the City of Hampton, near Settlers Landing Road, motorists can expect delays due to a vehicle crash. The east left shoulder is closed.","Minor Incident - Traffic - Vehicle Crash"
"02/28/2025 05:28 AM ET","Carroll (County)","I-77S",24.1,"On I-77 South at mile marker 24.1 in the County of Carroll, motorists can expect delays due to high wind.","Minor Incident - High Wind - Advisory"
"02/28/2025 06:04 AM ET","Frederick (County)","I-81N",299,"On I-81 at mile marker 299 in the County of Frederick, motorists can expect delays due to a tractor trailer crash. All north lanes are closed.","Major Incident - Traffic - Tractor Trailer Crash"
"02/28/2025 05:59 AM ET","Smyth (County)","I-81S",38.1,"On I-81 at mile marker 38.1 in the County of Smyth, motorists can expect delays due to a tractor trailer crash. The south left shoulder and left lane are closed.","Major Incident - Traffic - Tractor Trailer Crash"
"02/28/2025 06:07 AM ET","Fairfax (County)","I-495S",43.5,"On I-495 at mile marker 43.5 in the County of Fairfax, motorists can expect delays due to a disabled vehicle. The south right shoulder is closed.","Minor Incident - Traffic - Disabled Vehicle"
"02/28/2025 06:13 AM ET","Albemarle (County)","VA-22E",2.4,"On VA-22 in the County of Albemarle, in the vicinity of Black Cat Rd; Rt. 616N/S (Albemarle County), motorists can expect delays due to a tractor trailer crash. All east lanes are closed. All west lanes are closed.","Major Incident - Traffic - Tractor Trailer Crash"
"02/28/2025 05:27 AM ET","Carroll (County)","I-77N",0,"On I-77 North at mile marker 0 in the County of Carroll, motorists can expect delays due to high wind.","Minor Incident - High Wind - Advisory"
