Update Time,Jurisdiction,Route,MRM,Description,Label
"06/20/2025, 06:45 AM ET","Brunswick (County)","I-85N",30,"On I-85 North at mile marker 30 in the County of Brunswick, motorists can expect delays due to a vehicle fire.","Minor Incident - Traffic - Vehicle Fire"
"06/20/2025, 06:54 AM ET","Prince William (County)","I-66E",46.8,"On I-66 at mile marker 46.8 in the County of Prince William, motorists can expect delays due to a multi-vehicle crash. The east right shoulder is closed.","Minor Incident - Traffic - Multi-Vehicle Crash"
"06/20/2025, 07:11 AM ET","Henry (County)","Rt. 610N (Henry County)",2.1,"On Rt. 610 North in the County of Henry, in the vicinity of Keen Dr; Rt. 1041N/S (Henry County), motorists can expect delays due to a disabled vehicle. Lane closures exist.","Minor Incident - Traffic - Disabled Vehicle"
"06/20/2025, 06:49 AM ET","Hampton (City)","I-664N",2.7,"On I-664 at mile marker 2.7 in the City of Hampton, near Aberdeen Road, motorists can expect delays due to a disabled vehicle. The north right shoulder is closed.","Minor Incident - Traffic - Disabled Vehicle"
"06/20/2025, 07:00 AM ET","Norfolk (City)","I-64E",278.8,"On I-64 at mile marker 278.8 in the City of Norfolk, near Chesapeake Boulevard, motorists can expect delays due to a disabled vehicle. The east right shoulder is closed.","Minor Incident - Traffic - Disabled Vehicle"
"06/20/2025, 06:51 AM ET","Stafford (County)","US-1N",154.5,"On US-1 North in the County of Stafford, in the vicinity of American Legion Rd; Eskimo Hill Rd; Ramoth Church Rd; Rt. 628E/W (Stafford County), motorists can expect delays due to an incident.","Minor Incident - Traffic - Other Traffic"
"06/20/2025, 07:15 AM ET","Fairfax (County)","I-495S",46,"On I-495 at mile marker 46 in the County of Fairfax, motorists can expect delays due to a vehicle crash. The south left shoulder and left lane are closed.","Major Incident - Traffic - Vehicle Crash"
"06/20/2025, 06:25 AM ET","Fairfax (County)","Rt. 2804E (Fairfax County)",0.6,"On Rt. 2804 East in the County of Fairfax, in the vicinity of Valley Wood Rd; Vermont Ave; Rt. 691N/S (Fairfax County), motorists can expect delays due to an incident. Lane closures exist.","Minor Incident - Traffic - Other Traffic"
"06/20/2025, 07:12 AM ET","Fairfax (County)","I-95S",162.5,"On I-95 at mile marker 162.5 in the County of Fairfax, motorists can expect delays due to a disabled vehicle. The south left shoulder is closed.","Minor Incident - Traffic - Disabled Vehicle"
