Update Time,Jurisdiction,Route,MRM,Description,Label
"03/05/2025 12:11 PM ET","Hampton (City)","I-64E",270,"On I-64 East in the City of Hampton, at Hampton Roads Bridge Tunnel East, motorists can expect delays due to a disabled vehicle.","Minor Incident - Traffic - Disabled Vehicle"
"03/05/2025 09:45 AM ET","Chesapeake (City)","I-64W",293.4,"On I-64 West in the City of Chesapeake, at High Rise Bridge, motorists can expect delays due to high wind.","Minor Incident - High Wind - Advisory"
"03/05/2025 10:43 AM ET","York (County)","US-17S",68.2,"On US-17 South in the County of York, at Coleman Bridge, motorists can expect delays due to high wind.","Minor Incident - High Wind - Advisory"
"03/05/2025 12:12 PM ET","Henrico (County)","I-95S",82.6,"On I-95 at mile marker 82.6 in the County of Henrico, motorists can expect delays due to a disabled vehicle. The south right shoulder is closed.","Minor Incident - Traffic - Disabled Vehicle"
"03/05/2025 11:29 AM ET","Carroll (County)","I-77N",0,"On I-77 North at mile marker 0 in the County of Carroll, motorists can expect delays due to fog.","Minor Incident - Fog - Advisory"
"03/05/2025 11:59 AM ET","Albemarle (County)","Rt. 743N (Albemarle County)",3.2,"On Rt. 743 in the County of Albemarle, in the vicinity of Milford Rd; Rt. 1560E/W (Albemarle County), motorists can expect delays due to a vehicle fire. All north lanes are closed. All south lanes are closed.","Major Incident - Traffic - Vehicle Fire"
"03/05/2025 11:20 AM ET","Henrico (County)","US-250E",152.4,"On US-250 in the County of Henrico, in the vicinity of Crossover, motorists can expect delays due to a multi-vehicle crash. The east left shoulder and left lane are closed.","Major Incident - Traffic - Multi-Vehicle Crash"
"03/05/2025 12:11 PM ET","Norfolk (City)","I-264",7.5,"On I-264 West in the City of Norfolk, at Berkley Bridge, motorists can expect potential delays due to a multi-vehicle crash.","Minor Incident - Traffic - Multi-Vehicle Crash"
"03/05/2025 09:44 AM ET","Chesapeake (City)","I-64E",293.4,"On I-64 East in the City of Chesapeake, at High Rise Bridge, motorists can expect delays due to high wind.","Minor Incident - High Wind - Advisory"
"03/05/2025 12:11 PM ET","Newport News (City)","I-664S",7.8,"On I-664 South in the City of Newport News, at Monitor Merrimac Memorial Bridge Tunnel South, motorists can expect potential delays due to a bridge/tunnel stoppage.","Minor Incident - Traffic - Bridge/Tunnel Stoppage"
"03/05/2025 09:31 AM ET","Carroll (County)","I-77N",0,"On I-77 North at mile marker 0 in the County of Carroll, motorists can expect delays due to high wind.","Minor Incident - High Wind - Advisory"
"03/05/2025 09:56 AM ET","Northampton (County)","US-13S",55.7,"On US-13 South in the County of Northampton, at Chesapeake Bay Bridge Tunnel South, motorists can expect delays due to high wind.","Minor Incident - High Wind - Advisory"
"03/05/2025 10:37 AM ET","York (County)","US-17N",68.2,"On US-17 North in the County of York, at Coleman Bridge, motorists can expect delays due to high wind.","Minor Incident - High Wind - Advisory"
"03/05/2025 09:30 AM ET","Carroll (County)","I-77S",24,"On I-77 South at mile marker 24 in the County of Carroll, motorists can expect delays due to high wind.","Minor Incident - High Wind - Advisory"
"03/05/2025 10:24 AM ET","Fairfax (County)","On I-66E Express Lanes at mile marker 61.6","","On I-66E Express Lanes at mile marker 61.6 in the County of Fairfax, motorists can expect potential delays due to an incident. The east left shoulder is closed.","Minor Incident - Traffic - Other Traffic"
"03/05/2025 08:42 AM ET","Lancaster (County)","VA-3E",127,"On VA-3 East in the County of Lancaster, at R.O. Norris Bridge, motorists can expect delays due to high wind.","Minor Incident - High Wind - Advisory"
"03/05/2025 11:49 AM ET","Fairfax (County)","I-95N",167,"On I-95 at mile marker 167 in the County of Fairfax, motorists can expect delays due to a disabled vehicle. The north right shoulder is closed.","Minor Incident - Traffic - Disabled Vehicle"
"03/05/2025 09:55 AM ET","Virginia Beach (City)","US-13N",55.7,"On US-13 North in the City of Virginia Beach, at Chesapeake Bay Bridge Tunnel North, motorists can expect delays due to high wind.","Minor Incident - High Wind - Advisory"
"03/05/2025 12:13 PM ET","Stafford (County)","I-95N",138.5,"On I-95 at mile marker 138.5 in the County of Stafford, motorists can expect delays due to a disabled vehicle. The north right shoulder is closed.","Minor Incident - Traffic - Disabled Vehicle"
"03/05/2025 06:12 AM ET","Augusta (County)","I-64E",99.9,"On I-64 East at mile marker 99.9 in the County of Augusta, motorists can expect delays due to fog.","Minor Incident - Fog - Advisory"
"03/05/2025 10:50 AM ET","Norfolk (City)","I-64W",272.4,"On I-64 West in the City of Norfolk, at Hampton Roads Bridge Tunnel West, motorists can expect delays due to congestion. Traffic backups are approximately 2.5 miles.","Major Incident - Traffic - Congestion/Delay"
"03/05/2025 11:44 AM ET","Halifax (County)","VA-344E",2,"On VA-344 in the County of Halifax, in the vicinity of Rt. 613E/W (Halifax County), motorists can expect delays due to a disabled tractor trailer. All east lanes are closed. All west lanes are closed.","Major Incident - Traffic - Disabled Tractor Trailer"
"03/05/2025 11:30 AM ET","Carroll (County)","I-77S",24,"On I-77 South at mile marker 24 in the County of Carroll, motorists can expect delays due to fog.","Minor Incident - Fog - Advisory"
"03/05/2025 06:13 AM ET","Augusta (County)","I-64W",99.9,"On I-64 West at mile marker 99.9 in the County of Augusta, motorists can expect delays due to fog.","Minor Incident - Fog - Advisory"
"03/05/2025 11:55 AM ET","Hampton (City)","I-64E",270,"On I-64 East in the City of Hampton, at Hampton Roads Bridge Tunnel East, motorists can expect delays due to congestion. Traffic backups are approximately 1.5 miles.","Major Incident - Traffic - Congestion/Delay"
"03/05/2025 11:58 AM ET","Arlington (County)","I-395S",8.6,"On I-395 at mile marker 8.6 in the County of Arlington, motorists can expect delays due to a disabled vehicle. The south right shoulder is closed.","Minor Incident - Traffic - Disabled Vehicle"
