Update Time,Jurisdiction,Route,MRM,Description,Label
"04/06/2025 01:00 AM ET","Carroll (County)","I-77N",0,"On I-77 North at mile marker 0 in the County of Carroll, motorists can expect delays due to high wind.","Minor Incident - High Wind - Advisory"
"04/06/2025 01:02 AM ET","Frederick (County)","I-81S",305,"On I-81 at mile marker 305 in the County of Frederick, motorists can expect delays due to a tractor trailer crash. The south right lane and right shoulder are closed.","Major Incident - Traffic - Tractor Trailer Crash"
"04/06/2025 01:00 AM ET","Carroll (County)","I-77S",14,"On I-77 South at mile marker 14 in the County of Carroll, motorists can expect delays due to high wind.","Minor Incident - High Wind - Advisory"
"04/06/2025 01:11 AM ET","Fairfax (County)","I-395N",1.2,"On I-395 North at mile marker 1.2 in the County of Fairfax, motorists can expect delays due to a disabled vehicle.","Minor Incident - Traffic - Disabled Vehicle"
"04/06/2025 01:11 AM ET","Newport News (City)","US-17N",50.4,"On US-17 in the City of Newport News, at James River Bridge (Rte 17), motorists can expect delays due to a tractor trailer crash. The north right lane and right shoulder are closed.","Major Incident - Traffic - Tractor Trailer Crash"
"04/06/2025 01:06 AM ET","Henrico (County)","I-64E",195,"On I-64 at mile marker 195 in the County of Henrico, motorists can expect delays due to a vehicle crash. The east right lane and right shoulder are closed. The east exit 195 narrows.","Major Incident - Traffic - Vehicle Crash"
"04/06/2025 01:08 AM ET","Albemarle (County)","Rt 604 near Rt 605","","Rt 604 near Rt 605 in the County of Albemarle, motorists can expect delays due to a vehicle crash. All north lanes are closed. All south lanes are closed.","Major Incident - Traffic - Vehicle Crash"
