Update Time,Jurisdiction,Route,MRM,Description,Label
"06/23/2025, 11:52 PM ET","Fairfax (County)","I-95N",163,"On I-95 at mile marker 163 in the County of Fairfax, motorists can expect delays due to a disabled vehicle. The north right shoulder is closed.","Minor Incident - Traffic - Disabled Vehicle"
"06/24/2025, 12:21 AM ET","Prince George (County)","VA-36E",12,"On VA-36 East in the County of Prince George, in the vicinity of Crossings Blvd; Crossings Bvd; County/City/Town Line: HOPEWELL, motorists can expect delays due to a vehicle crash.","Minor Incident - Traffic - Vehicle Crash"
"06/24/2025, 12:05 AM ET","Botetourt (County)","I-81N",162,"On I-81 at mile marker 162 in the County of Botetourt, motorists can expect delays due to a disabled vehicle. The north exit ramp narrows.","Minor Incident - Traffic - Disabled Vehicle"
"06/23/2025, 11:53 PM ET","Fairfax (County)","On I-495S Express Lanes at mile marker 48.2","","On I-495S Express Lanes at mile marker 48.2 in the County of Fairfax, motorists can expect potential delays due to a disabled vehicle. The south left shoulder is closed.","Minor Incident - Traffic - Disabled Vehicle"
"06/24/2025, 12:19 AM ET","Spotsylvania (County)","I-95S",128.8,"On I-95 at mile marker 128.8 in the County of Spotsylvania, motorists can expect delays due to a disabled vehicle. The south right shoulder is closed.","Minor Incident - Traffic - Disabled Vehicle"
"06/24/2025, 12:18 AM ET","Spotsylvania (County)","I-95S",130.4,"On I-95 at mile marker 130.4 in the County of Spotsylvania, motorists can expect delays due to a disabled vehicle. The south right shoulder is closed.","Minor Incident - Traffic - Disabled Vehicle"
"06/23/2025, 11:20 PM ET","Sussex (County)","VA-40E",201.2,"On VA-40 in the County of Sussex, in the vicinity of Optimist Rd; Rt. 733N/S (Sussex County), motorists can expect delays due to a tractor trailer crash. All east lanes are closed. All west lanes are closed.","Major Incident - Traffic - Tractor Trailer Crash"
"06/23/2025, 11:38 PM ET","Stafford (County)","I-95N",147,"On I-95 at mile marker 147 in the County of Stafford, motorists can expect delays due to a disabled vehicle. The north right shoulder is closed.","Minor Incident - Traffic - Disabled Vehicle"
