Update Time,Jurisdiction,Route,MRM,Description,Label
"11/11/2025, 11:23 PM ET","Fairfax (County)","I-495S",55.3,"On I-495 at mile marker 55.3 in the County of Fairfax, motorists can expect delays due to a disabled vehicle. The south right shoulder is closed.","Minor Incident - Traffic - Disabled Vehicle"
"11/12/2025, 12:14 AM ET","Rockingham (County)","I-81N",248.1,"On I-81 at mile marker 248.1 in the County of Rockingham, motorists can expect delays due to a vehicle crash. The north left shoulder, left lane, and right lane are closed.","Major Incident - Traffic - Vehicle Crash"
"11/11/2025, 09:45 PM ET","Prince William (County)","I-95R",159.2,"On I-95R at mile marker 159.2 in the County of Prince William, motorists can expect potential delays due to a disabled tractor trailer. The south left shoulder is closed.","Minor Incident - Traffic - Disabled Tractor Trailer"
"11/12/2025, 12:18 AM ET","Stafford (County)","I-95N",133.5,"On I-95 at mile marker 133.5 in the County of Stafford, motorists can expect delays due to a disabled vehicle. The north right shoulder is closed.","Minor Incident - Traffic - Disabled Vehicle"
"11/12/2025, 12:05 AM ET","Fairfax (County)","I-95S",167.5,"On I-95 at mile marker 167.5 in the County of Fairfax, motorists can expect delays due to a disabled vehicle. The south right shoulder is closed.","Minor Incident - Traffic - Disabled Vehicle"
"11/11/2025, 11:03 PM ET","Fairfax (County)","Rt. 3830N (Fairfax County)",0,"On Rt. 3830 North in the County of Fairfax, in the vicinity of Arnon Chapel Rd; Rt. 682E/W (Fairfax County), motorists can expect delays due to weather. Lane closures exist.","Weather Incident - Other Weather - Advisory"
"11/12/2025, 12:18 AM ET","Hampton (City)","I-64E",270,"On I-64 East in the City of Hampton, at Hampton Roads Bridge Tunnel East, motorists can expect delays due to a tractor trailer crash.","Minor Incident - Traffic - Tractor Trailer Crash"
