Update Time,Jurisdiction,Route,MRM,Description,Label
"04/06/2025 11:27 PM ET","Carroll (County)","I-77S",24,"On I-77 South at mile marker 24 in the County of Carroll, motorists can expect delays due to high wind.","Minor Incident - High Wind - Advisory"
"04/06/2025 07:21 PM ET","Newport News (City)","I-64W",258.1,"On I-64 at mile marker 258.1 in the City of Newport News, near Oyster Point Road, motorists can expect potential delays due to an incident. The west left shoulder and left lane are closed.","Major Incident - Traffic - Other Traffic"
"04/07/2025 01:06 AM ET","Albemarle (County)","VA-20N",0,"On VA-20 in the County of Albemarle, in the vicinity of Coles Rolling Rd; Plank Rd; Rt. 712E/W (Albemarle County), motorists can expect delays due to a vehicle crash. All north lanes are closed. All south lanes are closed.","Major Incident - Traffic - Vehicle Crash"
"04/07/2025 01:11 AM ET","Stafford (County)","I-95N",144.5,"On I-95 at mile marker 144.5 in the County of Stafford, motorists can expect delays due to a disabled vehicle. The north right shoulder is closed.","Minor Incident - Traffic - Disabled Vehicle"
"04/07/2025 01:12 AM ET","Virginia Beach (City)","I-64W",288.4,"On I-64 at mile marker 288.4 in the City of Virginia Beach, near Indian River Road, motorists can expect delays due to a disabled vehicle. The west right shoulder is closed.","Minor Incident - Traffic - Disabled Vehicle"
"04/06/2025 11:26 PM ET","Carroll (County)","I-77N",0,"On I-77 North at mile marker 0 in the County of Carroll, motorists can expect delays due to high wind.","Minor Incident - High Wind - Advisory"
"04/07/2025 01:10 AM ET","Carroll (County)","I-77S",7.7,"On I-77 at mile marker 7.7 in the County of Carroll, motorists can expect delays due to a disabled vehicle. The south right shoulder is closed.","Minor Incident - Traffic - Disabled Vehicle"
"04/07/2025 01:15 AM ET","Newport News (City)","I-64W",259.2,"On I-64 at mile marker 259.2 in the City of Newport News, near Harpersville Road Overpass, motorists can expect delays due to a disabled vehicle. The west right shoulder is closed.","Minor Incident - Traffic - Disabled Vehicle"
