Update Time,Jurisdiction,Route,MRM,Description,Label
"10/04/2025, 01:32 AM ET","Fairfax (County)","Rt. 4815E (Fairfax County)",1.6,"On Rt. 4815 East in the County of Fairfax, in the vicinity of Eastlake Dr; Rt. 4817N/S (Fairfax County), motorists can expect delays due to an incident. Lane closures exist.","Minor Incident - Traffic - Other Traffic"
"10/04/2025, 03:05 AM ET","Fairfax (County)","I-95S",170,"On I-95 at mile marker 170 in the County of Fairfax, motorists can expect delays due to a disabled tractor trailer. The south right shoulder is closed.","Minor Incident - Traffic - Disabled Tractor Trailer"
"10/04/2025, 02:59 AM ET","Sussex (County)","I-95S",31,"On I-95 South at mile marker 31 in the County of Sussex, motorists can expect delays due to an incident. Lane closures exist.","Minor Incident - Traffic - Other Traffic"
"10/04/2025, 03:12 AM ET","Fairfax (County)","I-495S",53,"On I-495 at mile marker 53 in the County of Fairfax, motorists can expect delays due to a disabled vehicle. The south right shoulder is closed.","Minor Incident - Traffic - Disabled Vehicle"
"10/04/2025, 03:07 AM ET","James City (County)","I-64W",246.1,"On I-64 at mile marker 246.1 in the County of James City, near Weapon Station, motorists can expect delays due to a disabled vehicle. The west right shoulder is closed.","Minor Incident - Traffic - Disabled Vehicle"
"10/04/2025, 03:02 AM ET","Newport News (City)","I-664S",7.8,"On I-664 South in the City of Newport News, at Monitor Merrimac Memorial Bridge Tunnel South, motorists can expect delays due to a disabled vehicle.","Minor Incident - Traffic - Disabled Vehicle"
"10/03/2025, 07:21 PM ET","Fairfax (County)","Rt. 1556N (Fairfax County)",0.5,"On Rt. 1556 North in the County of Fairfax, in the vicinity of Cul-de-Sac, motorists can expect delays due to an incident. Lane closures exist.","Minor Incident - Traffic - Other Traffic"
"10/04/2025, 02:59 AM ET","Hanover (County)","US-301N",88.4,"On US-301 North in the County of Hanover, in the vicinity of Long Ln; Stumpy Rd; Rt. 654E/W (Hanover County), motorists can expect delays due to a vehicle crash.","Minor Incident - Traffic - Vehicle Crash"
"10/04/2025, 03:01 AM ET","York (County)","I-64W",234.5,"On I-64 at mile marker 234.5 in the County of York, near Lightfoot Road, motorists can expect delays due to a vehicle crash. The west exit 234A is closed.","Minor Incident - Traffic - Vehicle Crash"
