Update Time,Jurisdiction,Route,MRM,Description,Label
"08/28/2025, 01:16 AM ET","Prince William (County)","I-95S",162.1,"On I-95 at mile marker 162.1 in the County of Prince William, motorists can expect delays due to a disabled vehicle. The south right shoulder is closed.","Minor Incident - Traffic - Disabled Vehicle"
"08/28/2025, 01:09 AM ET","Virginia Beach (City)","I-64E",286.8,"On I-64 at mile marker 286.8 in the City of Virginia Beach, near Indian River Road, motorists can expect delays due to a disabled vehicle. The east right shoulder is closed.","Minor Incident - Traffic - Disabled Vehicle"
"08/27/2025, 09:03 PM ET","Fairfax (County)","On I-495N Express Lanes at mile marker 51.0","","On I-495N Express Lanes at mile marker 51.0 in the County of Fairfax, motorists can expect potential delays due to a disabled vehicle. The north left shoulder is closed.","Minor Incident - Traffic - Disabled Vehicle"
"08/28/2025, 12:50 AM ET","Norfolk (City)","I-64W",272.4,"On I-64 in the City of Norfolk, at Hampton Roads Bridge Tunnel West, motorists can expect potential delays due to a bridge/tunnel stoppage. All west lanes are closed.","Major Incident - Traffic - Bridge/Tunnel Stoppage"
"08/28/2025, 01:10 AM ET","Wythe (County)","I-77N",32.1,"On I-77 at mile marker 32.1 in the County of Wythe, motorists can expect delays due to a vehicle fire. The north right lane and right shoulder are closed.","Major Incident - Traffic - Vehicle Fire"
"08/28/2025, 01:16 AM ET","Norfolk (City)","I-564W",0.2,"On I-564 at mile marker 0.1 in the City of Norfolk, near 64 Interchange, motorists can expect delays due to a disabled vehicle. The west left shoulder is closed.","Minor Incident - Traffic - Disabled Vehicle"
"08/27/2025, 07:40 PM ET","Fairfax (County)","I-395R",2.3,"On I-395R at mile marker 2.3 in the County of Fairfax, motorists can expect potential delays due to a disabled vehicle. The south left shoulder is closed.","Minor Incident - Traffic - Disabled Vehicle"
