Update Time,Jurisdiction,Route,MRM,Description,Label
"12/25/2025, 08:36 PM ET","Nottoway (County)","US-460W",285.4,"On US-460 West in the County of Nottoway, in the vicinity of FR-818E/W, motorists can expect delays due to a vehicle crash. Lane closures exist.","Minor Incident - Traffic - Vehicle Crash"
"12/25/2025, 08:35 PM ET","Prince William (County)","I-66W",48.6,"On I-66 at mile marker 48.6 in the County of Prince William, motorists can expect delays due to a disabled vehicle. The west right shoulder is closed.","Minor Incident - Traffic - Disabled Vehicle"
"12/25/2025, 08:09 PM ET","Albemarle (County)","US-29N",128,"On US-29 in the County of Albemarle, in the vicinity of Taylors Gap Rd; Rt. 710N/S (Albemarle County), motorists can expect delays due to a multi-vehicle crash. The north right lane and right shoulder are closed.","Major Incident - Traffic - Multi-Vehicle Crash"
"12/25/2025, 08:35 PM ET","New Kent (County)","VA-249E",11.6,"On VA-249 in the County of New Kent, in the vicinity of Deer Run Rd; Hicks Rd, motorists can expect delays due to a vehicle crash. All west lanes are closed.","Major Incident - Traffic - Vehicle Crash"
"12/25/2025, 08:11 PM ET","Fairfax (County)","I-495S",42.8,"On I-495 at mile marker 42.8 in the County of Fairfax, motorists can expect delays due to a disabled vehicle. The south right shoulder is closed.","Minor Incident - Traffic - Disabled Vehicle"
"12/25/2025, 08:23 PM ET","Fairfax (County)","I-66E",58.3,"On I-66 at mile marker 58.3 in the County of Fairfax, motorists can expect delays due to a disabled vehicle. The east entrance ramp narrows.","Minor Incident - Traffic - Disabled Vehicle"
"12/25/2025, 08:19 PM ET","Montgomery (County)","I-81S",109,"On I-81 at mile marker 109 in the County of Montgomery, motorists can expect delays due to a disabled vehicle. The south right shoulder is closed.","Minor Incident - Traffic - Disabled Vehicle"
