Update Time,Jurisdiction,Route,MRM,Description,Label
"01/11/2025 07:53 PM","Virginia Beach (City)","I-264E",20.38,"On I-264 at mile marker 20.4 in the City of Virginia Beach, near Lynnhaven Parkway, motorists can expect delays due to a disabled vehicle. The east exit 19A narrows.","Minor Incident - Traffic - Disabled Vehicle"
"01/11/2025 07:50 PM","Fairfax (County)","I-95N",168.4,"On I-95 at mile marker 168.4 in the County of Fairfax, motorists can expect delays due to a multi-vehicle crash. The north left shoulder is closed.","Major Incident - Traffic - Multi-Vehicle Crash"
"01/11/2025 07:52 PM","Henry (County)","BUS US-220S (4 Martinsville/Henry)",6.5,"On BUS US-220 South in the County of Henry, in the vicinity of Commonwealth Blvd, motorists can expect delays due to a vehicle crash. Lane closures exist.","Minor Incident - Traffic - Vehicle Crash"
"01/11/2025 07:57 PM","Fairfax (County)","I-495S",50.4,"On I-495 at mile marker 50.4 in the County of Fairfax, motorists can expect delays due to a disabled vehicle. The south right shoulder is closed.","Major Incident - Traffic - Disabled Vehicle"
"01/11/2025 07:54 PM","Chesterfield (County)","I-95N",63.6,"On I-95 at mile marker 63.6 in the County of Chesterfield, motorists can expect delays due to a disabled vehicle. The north right shoulder is closed.","Major Incident - Traffic - Disabled Vehicle"
"01/11/2025 07:49 PM","Carroll (County)","I-77N",0,"On I-77 North at mile marker 0 in the County of Carroll, motorists can expect delays due to high wind.","Minor Incident - High Wind - Advisory"
"01/11/2025 07:55 PM","Fairfax (County)","I-395S",0.3,"On I-395 at mile marker 0.3 in the County of Fairfax, motorists can expect delays due to a vehicle crash. The south right shoulder is closed.","Major Incident - Traffic - Vehicle Crash"
"01/11/2025 07:49 PM","Carroll (County)","I-77S",24.1,"On I-77 South at mile marker 24.1 in the County of Carroll, motorists can expect delays due to high wind.","Minor Incident - High Wind - Advisory"
"01/11/2025 07:07 PM","Pittsylvania (County)","Rt. 638E (Pittsylvania County)",6.12,"On Rt. 638 East in the County of Pittsylvania, in the vicinity of Jacobs Rd; Rt. 637N/S (Pittsylvania County), motorists can expect delays due to a disabled vehicle. Lane closures exist.","Minor Incident - Traffic - Disabled Vehicle"
