Update Time,Jurisdiction,Route,MRM,Description,Label
"03/05/2025 03:17 AM ET","Carroll (County)","I-77N",0,"On I-77 North at mile marker 0 in the County of Carroll, motorists can expect delays due to fog.","Minor Incident - Fog - Advisory"
"03/05/2025 03:15 AM ET","Carroll (County)","I-77N",0,"On I-77 North at mile marker 0 in the County of Carroll, motorists can expect delays due to high wind.","Minor Incident - High Wind - Advisory"
"03/05/2025 03:14 AM ET","Carroll (County)","I-77S",24,"On I-77 South at mile marker 24 in the County of Carroll, motorists can expect delays due to high wind.","Minor Incident - High Wind - Advisory"
"03/05/2025 04:16 AM ET","Hampton (City)","I-64E",270,"On I-64 in the City of Hampton, at Hampton Roads Bridge Tunnel East, motorists can expect delays due to congestion. All east lanes are closed.","Major Incident - Traffic - Congestion/Delay"
"03/05/2025 03:19 AM ET","Carroll (County)","I-77S",24,"On I-77 South at mile marker 24 in the County of Carroll, motorists can expect delays due to fog.","Minor Incident - Fog - Advisory"
