Update Time,Jurisdiction,Route,MRM,Description,Label
"09/23/2025, 12:48 AM ET","Arlington (County)","I-395N",7,"On I-395 at mile marker 7 in the County of Arlington, motorists can expect delays due to a disabled vehicle. The north right shoulder is closed.","Minor Incident - Traffic - Disabled Vehicle"
"09/23/2025, 01:12 AM ET","Augusta (County)","I-81N",232.8,"On I-81 at mile marker 232.8 in the County of Augusta, motorists can expect delays due to a tractor trailer crash. All north lanes are closed. Traffic backups are approximately 3.0 miles.","Major Incident - Traffic - Tractor Trailer Crash"
"09/23/2025, 01:01 AM ET","Hanover (County)","I-95N",89.1,"On I-95 at mile marker 89.1 in the County of Hanover, motorists can expect delays due to a disabled vehicle. The north right shoulder is closed.","Minor Incident - Traffic - Disabled Vehicle"
"09/23/2025, 01:09 AM ET","Bland (County)","I-77S",67,"On I-77 in the County of Bland, at East River Mountain Tunnel South, motorists can expect delays due to a bridge/tunnel stoppage. All south lanes are closed.","Major Incident - Traffic - Bridge/Tunnel Stoppage"
"09/23/2025, 01:12 AM ET","Virginia Beach (City)","I-264W",15,"On I-264 at mile marker 15 in the City of Virginia Beach, near Witchduck Road, motorists can expect delays due to a disabled vehicle. The west entrance ramp narrows.","Minor Incident - Traffic - Disabled Vehicle"
"09/22/2025, 08:28 PM ET","Chesterfield (County)","Rt. 643E (Chesterfield County)",0,"On Rt. 643 East in the County of Chesterfield, in the vicinity of Belmont Rd; Turner Rd; Rt. 651E/W (Chesterfield County); Rt. 650N/S (Chesterfield County), motorists can expect delays due to standing water.","Weather Incident - Standing Water - Advisory"
"09/23/2025, 01:12 AM ET","Virginia Beach (City)","I-264W",23.7,"On I-264 at mile marker 23.7 in the City of Virginia Beach, near First Colonial Road, motorists can expect delays due to a disabled vehicle. The west right shoulder is closed.","Minor Incident - Traffic - Disabled Vehicle"
