Update Time,Jurisdiction,Route,MRM,Description,Label
"10/08/2025, 12:07 AM ET","Carroll (County)","I-77N",0,"On I-77 North at mile marker 0 in the County of Carroll, motorists can expect delays due to fog.","Weather Incident - Fog - Advisory"
"10/07/2025, 11:37 PM ET","Fairfax (County)","I-495N",44.1,"On I-495 at mile marker 44.1 in the County of Fairfax, motorists can expect delays due to a disabled vehicle. The north right shoulder is closed.","Minor Incident - Traffic - Disabled Vehicle"
"10/08/2025, 12:06 AM ET","Carroll (County)","I-77S",24.1,"On I-77 South at mile marker 24.1 in the County of Carroll, motorists can expect delays due to fog.","Weather Incident - Fog - Advisory"
"10/08/2025, 01:00 AM ET","Augusta (County)","I-64E",99.9,"On I-64 East at mile marker 99.9 in the County of Augusta, motorists can expect delays due to fog.","Weather Incident - Fog - Advisory"
"10/08/2025, 01:14 AM ET","Chesapeake (City)","I-664N",19.7,"On I-664 at mile marker 19.7 in the City of Chesapeake, near Bowers Hill Interchange, motorists can expect delays due to a disabled vehicle. The north right lane and right shoulder are closed.","Major Incident - Traffic - Disabled Vehicle"
"10/08/2025, 12:31 AM ET","Fairfax (County)","I-495S",42.6,"On I-495 at mile marker 42.6 in the County of Fairfax, motorists can expect delays due to a disabled vehicle. The south right lane and right shoulder are closed.","Major Incident - Traffic - Disabled Vehicle"
"10/07/2025, 11:39 PM ET","Fairfax (County)","I-95S",172.3,"On I-95 at mile marker 172.3 in the County of Fairfax, motorists can expect delays due to a disabled vehicle. The south right shoulder is closed.","Minor Incident - Traffic - Disabled Vehicle"
"10/08/2025, 01:00 AM ET","Augusta (County)","I-64W",99.9,"On I-64 West at mile marker 99.9 in the County of Augusta, motorists can expect delays due to fog.","Weather Incident - Fog - Advisory"
"10/08/2025, 01:11 AM ET","Fauquier (County)","I-66W",25.2,"On I-66 at mile marker 25.2 in the County of Fauquier, motorists can expect delays due to a vehicle crash. The west right shoulder is closed.","Minor Incident - Traffic - Vehicle Crash"
