Update Time,Jurisdiction,Route,MRM,Description,Label
"10/14/2025, 10:58 PM ET","Hanover (County)","I-295S",36,"On I-295 at mile marker 36 in the County of Hanover, motorists can expect delays due to a disabled tractor trailer. The south right lane and right shoulder are closed.","Major Incident - Traffic - Disabled Tractor Trailer"
"10/14/2025, 11:02 PM ET","Fairfax (County)","I-495N",46.8,"On I-495 at mile marker 46.8 in the County of Fairfax, motorists can expect delays due to a disabled vehicle. The north right shoulder is closed.","Minor Incident - Traffic - Disabled Vehicle"
"10/14/2025, 10:15 PM ET","Prince William (County)","I-66W",45.2,"On I-66 at mile marker 45.2 in the County of Prince William, motorists can expect delays due to a disabled vehicle. The west right shoulder is closed.","Minor Incident - Traffic - Disabled Vehicle"
"10/14/2025, 11:02 PM ET","Richmond (City)","I-95S",73.8,"On I-95 South at mile marker 73.8 in the City of Richmond, motorists can expect delays due to a disabled vehicle.","Minor Incident - Traffic - Disabled Vehicle"
"10/14/2025, 11:00 PM ET","Richmond (City)","I-95N",72.9,"On I-95 at mile marker 72.9 in the City of Richmond, motorists can expect delays due to a disabled vehicle. The north right shoulder is closed.","Minor Incident - Traffic - Disabled Vehicle"
