Update Time,Jurisdiction,Route,MRM,Description,Label
"04/23/2025 06:19 AM ET","Henrico (County)","I-295S",44.2,"On I-295 South at mile marker 44.2 in the County of Henrico, motorists can expect delays due to a disabled vehicle.","Minor Incident - Traffic - Disabled Vehicle"
"04/23/2025 06:14 AM ET","Hanover (County)","I-95S",99,"On I-95 at mile marker 99 in the County of Hanover, motorists can expect delays due to a multi-vehicle crash. The south left shoulder, left lane, and center lane are closed.","Major Incident - Traffic - Multi-Vehicle Crash"
"04/23/2025 06:18 AM ET","Hampton (City)","I-64E",270,"On I-64 East in the City of Hampton, at Hampton Roads Bridge Tunnel East, motorists can expect delays due to congestion. Traffic backups are approximately 1.0 mile.","Minor Incident - Traffic - Congestion/Delay"
"04/23/2025 06:17 AM ET","Portsmouth (City)","I-264E",4.1,"On I-264 at mile marker 4 in the City of Portsmouth, near Frederick Boulevard, motorists can expect delays due to standing water. The east right shoulder is closed. The east exit ramp narrows.","Minor Incident - Standing Water - Advisory"
"04/22/2025 10:01 PM ET","Caroline (County)","Rt. 690N (Caroline County)",0,"On Rt. 690 in the County of Caroline, in the vicinity of Ruther Glen Rd; Rt. 652N/S (Caroline County), motorists can expect delays due to standing water. All north lanes are closed.","Major Incident - Standing Water - Closed"
"04/23/2025 06:18 AM ET","New Kent (County)","I-64W",206.6,"On I-64 at mile marker 206.6 in the County of New Kent, motorists can expect delays due to a disabled tractor trailer. The west right shoulder is closed.","Minor Incident - Traffic - Disabled Tractor Trailer"
"04/23/2025 05:59 AM ET","Fairfax (County)","I-495N",53.4,"On I-495 at mile marker 53.4 in the County of Fairfax, motorists can expect delays due to a disabled vehicle. The north right shoulder is closed.","Minor Incident - Traffic - Disabled Vehicle"
