Update Time,Jurisdiction,Route,MRM,Description,Label
"10/14/2025, 12:08 AM ET","Carroll (County)","I-77S",24.1,"On I-77 South at mile marker 24.1 in the County of Carroll, motorists can expect delays due to high wind.","Weather Incident - High Wind - Advisory"
"10/14/2025, 12:08 AM ET","Carroll (County)","I-77N",0,"On I-77 North at mile marker 0 in the County of Carroll, motorists can expect delays due to high wind.","Weather Incident - High Wind - Advisory"
"10/14/2025, 12:15 AM ET","Chesterfield (County)","I-95N",68,"On I-95 at mile marker 68 in the County of Chesterfield, motorists can expect delays due to a disabled vehicle. The north left shoulder is closed.","Minor Incident - Traffic - Disabled Vehicle"
"10/13/2025, 06:14 PM ET","West Point (Town)","Rt. 1003N (King William County)",1.8,"On Rt. 1003 North in the Town of West Point, in the vicinity of Bagby St; Chelsea Rd; Rt. 1030N/S (King William County), motorists can expect delays due to standing water.","Weather Incident - Standing Water - Advisory"
"10/14/2025, 12:14 AM ET","Newport News (City)","I-64W",252,"On I-64 at mile marker 252 in the City of Newport News, near Fort Eustis Boulevard, motorists can expect delays due to a vehicle crash. The west left shoulder is closed.","Minor Incident - Traffic - Vehicle Crash"
