Update Time,Jurisdiction,Route,MRM,Description,Label
"09/13/2025, 04:18 AM ET","Mecklenburg (County)","Rt. 675N (Mecklenburg County)",0.6,"On Rt. 675 in the County of Mecklenburg, in the vicinity of Easters Rd; Rt. 677E/W (Mecklenburg County), motorists can expect delays due to a vehicle crash. All north lanes are closed. All south lanes are closed.","Major Incident - Traffic - Vehicle Crash"
"09/13/2025, 04:10 AM ET","Portsmouth (City)","I-264E",3.3,"On I-264 at mile marker 3.3 in the City of Portsmouth, near Portsmouth Boulevard, motorists can expect delays due to a disabled vehicle. The east right shoulder is closed.","Minor Incident - Traffic - Disabled Vehicle"
"09/13/2025, 03:49 AM ET","Caroline (County)","VA-207N",1.9,"On VA-207 North in the County of Caroline, in the vicinity of Dry Bridge Rd; Rt. 684E/W (Caroline County), motorists can expect delays due to a vehicle crash.","Minor Incident - Traffic - Vehicle Crash"
"09/13/2025, 03:33 AM ET","Fairfax (County)","On I-66W Express Lanes at mile marker 63.6","","On I-66W Express Lanes at mile marker 63.6 in the County of Fairfax, motorists can expect potential delays due to an incident. The west left shoulder and left lane are closed.","Major Incident - Traffic - Other Traffic"
"09/13/2025, 03:49 AM ET","Loudoun (County)","VA-28S",40,"On VA-28 in the County of Loudoun, in the vicinity of the exit ramp, motorists can expect delays due to a disabled vehicle. The south right shoulder is closed.","Minor Incident - Traffic - Disabled Vehicle"
"09/13/2025, 04:09 AM ET","Fairfax (County)","I-495S",52.7,"On I-495 at mile marker 52.7 in the County of Fairfax, motorists can expect delays due to a disabled tractor trailer. The south right shoulder is closed.","Minor Incident - Traffic - Disabled Tractor Trailer"
"09/13/2025, 04:06 AM ET","Brunswick (County)","Rt. 712N (Brunswick County)",1.5,"On Rt. 712 in the County of Brunswick, in the vicinity of Wilson Creek Ln; Rt. 755E/W (Brunswick County), motorists can expect delays due to a vehicle crash. All north lanes are closed. All south lanes are closed.","Major Incident - Traffic - Vehicle Crash"
"09/13/2025, 04:07 AM ET","Virginia Beach (City)","I-264W",15.2,"On I-264 at mile marker 15.2 in the City of Virginia Beach, near Witchduck Road, motorists can expect delays due to a disabled vehicle. The west right shoulder is closed.","Minor Incident - Traffic - Disabled Vehicle"
