Update Time,Jurisdiction,Route,MRM,Description,Label
"10/27/2025, 03:10 AM ET","Newport News (City)","I-64E",248.5,"On I-64 at mile marker 248.4 in the City of Newport News, near Lee Hall, motorists can expect delays due to a disabled vehicle. The east left shoulder is closed.","Minor Incident - Traffic - Disabled Vehicle"
"10/27/2025, 03:06 AM ET","Arlington (County)","I-395N",7.9,"On I-395 at mile marker 7.9 in the County of Arlington, motorists can expect delays due to a disabled vehicle. The north right shoulder is closed.","Minor Incident - Traffic - Disabled Vehicle"
"10/27/2025, 02:59 AM ET","Dinwiddie (County)","US-1N",61.5,"On US-1 North in the County of Dinwiddie, in the vicinity of White Oak Rd; Rt. 613E/W (Dinwiddie County), motorists can expect delays due to a vehicle crash.","Minor Incident - Traffic - Vehicle Crash"
"10/27/2025, 03:14 AM ET","Virginia Beach (City)","I-264E",15.5,"On I-264 at mile marker 15.5 in the City of Virginia Beach, near Witchduck Road, motorists can expect delays due to a vehicle crash. The east left shoulder, left outside lane, center lane, right center lane, right outside lane, and right shoulder are closed.","Major Incident - Traffic - Vehicle Crash"
"10/27/2025, 03:15 AM ET","Chesapeake (City)","I-664N",18.9,"On I-664 at mile marker 18.9 in the City of Chesapeake, near Jolliff road, motorists can expect delays due to a vehicle crash. The north left shoulder, left lane, center lane, and right shoulder are closed.","Major Incident - Traffic - Vehicle Crash"
"10/26/2025, 11:55 PM ET","Pittsylvania (County)","Rt. 887E (Pittsylvania County)",0,"On Rt. 887 in the County of Pittsylvania, in the vicinity of Union Hall School Rd; Rt. 612E/W (Pittsylvania County), motorists can expect delays due to standing water. All east lanes are closed. All west lanes are closed.","Weather Incident - Standing Water - Closed"
"10/27/2025, 03:04 AM ET","Hampton (City)","I-64E",262.7,"On I-64 at mile marker 262.7 in the City of Hampton, near Mercury Boulevard, motorists can expect delays due to a disabled vehicle. The east exit 263 narrows.","Minor Incident - Traffic - Disabled Vehicle"
