Update Time,Jurisdiction,Route,MRM,Description,Label
"10/26/2025, 04:08 AM ET","Prince William (County)","I-95N",150.9,"On I-95 at mile marker 150.9 in the County of Prince William, motorists can expect delays due to a disabled vehicle. The north right shoulder is closed.","Minor Incident - Traffic - Disabled Vehicle"
"10/26/2025, 04:16 AM ET","Bedford (County)","US-221N",131.6,"On US-221 North in the County of Bedford, in the vicinity of Centerville Rd; Timber Ridge Rd; Rt. 671E/W (Bedford County), motorists can expect delays due to a vehicle crash. Lane closures exist.","Minor Incident - Traffic - Vehicle Crash"
"10/26/2025, 04:17 AM ET","Wythe (County)","I-77S",26.6,"On I-77 at mile marker 26.6 in the County of Wythe, motorists can expect delays due to a tractor trailer crash. The south right shoulder is closed.","Minor Incident - Traffic - Tractor Trailer Crash"
"10/26/2025, 04:18 AM ET","Suffolk (City)","I-664S",13.2,"On I-664 at mile marker 13.2 in the City of Suffolk, near Bridge Road, motorists can expect delays due to a disabled vehicle. The south exit 9 narrows.","Minor Incident - Traffic - Disabled Vehicle"
"10/26/2025, 03:58 AM ET","Prince William (County)","I-95S",159,"On I-95 at mile marker 159 in the County of Prince William, motorists can expect delays due to a vehicle crash. The south right shoulder is closed.","Minor Incident - Traffic - Vehicle Crash"
"10/26/2025, 03:54 AM ET","Loudoun (County)","VA-287N",3.8,"On VA-287 in the County of Loudoun, in the vicinity of Charles Town Pke; VA-9E/W, motorists can expect delays due to a disabled vehicle. The north through lanes are closed.","Major Incident - Traffic - Disabled Vehicle"
"10/26/2025, 04:17 AM ET","Virginia Beach (City)","I-264W",21.9,"On I-264 at mile marker 21.9 in the City of Virginia Beach, near Laskin Road, motorists can expect delays due to a disabled vehicle. The west right shoulder is closed.","Minor Incident - Traffic - Disabled Vehicle"
"10/26/2025, 04:15 AM ET","James City (County)","I-64E",228.1,"On I-64 at mile marker 228.1 in the County of James City, near Old Stage Road, motorists can expect delays due to a vehicle crash. The east right shoulder is closed.","Minor Incident - Traffic - Vehicle Crash"
"10/26/2025, 04:13 AM ET","Newport News (City)","I-64W",256.8,"On I-64 at mile marker 256.8 in the City of Newport News, near Victory Boulevard, motorists can expect delays due to a disabled vehicle. The west right shoulder is closed.","Minor Incident - Traffic - Disabled Vehicle"
