Update Time,Jurisdiction,Route,MRM,Description,Label
"04/15/2025 02:00 PM ET","Albemarle (County)","Rt. 731E (Albemarle County)","","On Rt. 731 in the County of Albemarle, in the vicinity of Club Dr; Hunt Club Rd; Rt. 744N/S (Albemarle County), motorists can expect potential delays due to high wind. All east lanes are closed. All west lanes are closed.","Major Incident - High Wind - Closed"
"04/15/2025 02:12 PM ET","Augusta (County)","Rt. 611E (Augusta County)",2,"On Rt. 611 in the County of Augusta, in the vicinity of E Side Hwy; US-340N/S, motorists can expect delays due to a disabled tractor trailer. All east lanes are closed. All west lanes are closed.","Major Incident - Traffic - Disabled Tractor Trailer"
"04/15/2025 02:07 PM ET","Fairfax (County)","On I-495N Express Lanes at mile marker 44.8","","On I-495N Express Lanes at mile marker 44.8 in the County of Fairfax, motorists can expect major delays due to congestion. Traffic backups are approximately 1.0 mile.","Minor Incident - Traffic - Congestion/Delay"
"04/15/2025 12:55 PM ET","Albemarle (County)","Rt. 601N (Albemarle County)",0,"On Rt. 601 in the County of Albemarle, in the vicinity of Bypass On Ramp; Colonnade Dr; Crestwood Dr; Faulkner Way; Harvest Dr; Ivy Dr; Ivy Rd; Old Ivy Way; St Annes Dr; BUS US-250E/W, motorists can expect delays due to a tractor trailer crash. All north lanes are closed. All south lanes are closed.","Major Incident - Traffic - Tractor Trailer Crash"
"04/15/2025 02:17 PM ET","Fairfax (County)","I-495N",46.3,"On I-495 North at mile marker 46.3 in the County of Fairfax, motorists can expect delays due to a disabled tractor trailer.","Minor Incident - Traffic - Disabled Tractor Trailer"
"04/15/2025 01:22 PM ET","Amelia (County)","Rt. 640S (Amelia County)",5.3,"On Rt. 640 South in the County of Amelia, in the vicinity of Old Court House Rd; Rt. 649E/W (Amelia County), near 19000 block of Perkinson Road, motorists can expect delays due to a disabled vehicle. Lane closures exist.","Minor Incident - Traffic - Disabled Vehicle"
"04/15/2025 02:18 PM ET","Stafford (County)","Rt. 612N (Stafford County)",3.8,"On Rt. 612 in the County of Stafford, in the vicinity of Spotted Tavern Rd; Rt. 614N/S (Stafford County), motorists can expect delays due to a vehicle crash. All north lanes are closed. All south lanes are closed.","Major Incident - Traffic - Vehicle Crash"
"04/15/2025 02:03 PM ET","Fairfax (County)","I-495S",43.8,"On I-495 at mile marker 43.8 in the County of Fairfax, motorists can expect delays due to a disabled vehicle. The south right shoulder is closed.","Minor Incident - Traffic - Disabled Vehicle"
"04/15/2025 02:19 PM ET","Norfolk (City)","I-64W",272.4,"On I-64 in the City of Norfolk, at Hampton Roads Bridge Tunnel West, motorists can expect potential delays due to a bridge/tunnel stoppage. All west lanes are closed.","Major Incident - Traffic - Bridge/Tunnel Stoppage"
"04/15/2025 02:09 PM ET","Richmond (City)","I-95N",75.7,"On I-95 at mile marker 75.7 in the City of Richmond, motorists can expect delays due to a vehicle crash. The north right shoulder is closed.","Minor Incident - Traffic - Vehicle Crash"
"04/15/2025 02:01 PM ET","Fairfax (County)","I-495S",47.4,"On I-495 at mile marker 47.4 in the County of Fairfax, motorists can expect delays due to a disabled tractor trailer. The south right shoulder is closed.","Minor Incident - Traffic - Disabled Tractor Trailer"
"04/15/2025 01:39 PM ET","Bedford (County)","Rt. 680N (Bedford County)",15.6,"On Rt. 680 in the County of Bedford, in the vicinity of Goose Creek Valley Rd; Rt. 695N/S (Bedford County), motorists can expect delays due to a disabled tractor trailer. All north lanes are closed. All south lanes are closed.","Major Incident - Traffic - Disabled Tractor Trailer"
"04/15/2025 01:02 PM ET","Carroll (County)","I-77N",0,"On I-77 North at mile marker 0 in the County of Carroll, motorists can expect delays due to high wind.","Minor Incident - High Wind - Advisory"
"04/15/2025 01:03 PM ET","Carroll (County)","I-77S",24.1,"On I-77 South at mile marker 24.1 in the County of Carroll, motorists can expect delays due to high wind.","Minor Incident - High Wind - Advisory"
"04/15/2025 02:14 PM ET","Hampton (City)","I-64E",270,"On I-64 in the City of Hampton, at Hampton Roads Bridge Tunnel East, motorists can expect potential delays due to a bridge/tunnel stoppage. All east lanes are closed.","Major Incident - Traffic - Bridge/Tunnel Stoppage"
"04/15/2025 02:17 PM ET","Chesterfield (County)","I-95N",68.2,"On I-95 at mile marker 68.2 in the County of Chesterfield, motorists can expect delays due to a disabled vehicle. The north right shoulder is closed.","Minor Incident - Traffic - Disabled Vehicle"
"04/15/2025 11:50 AM ET","Essex (County)","US-360W",183.5,"On US-360 in the County of Essex, in the vicinity of Hospital Rd; Turnout; Rt. 708N/S (Essex County), motorists can expect delays due to a vehicle crash. The west right shoulder is closed.","Minor Incident - Traffic - Vehicle Crash"
"04/15/2025 02:16 PM ET","Albemarle (County)","Rt. 618E (Albemarle County)",2.7,"On Rt. 618 in the County of Albemarle, in the vicinity of Albevanna Spring Rd; Rt. 622N/S (Albemarle County), motorists can expect delays due to a vehicle crash. All east lanes are closed. All west lanes are closed.","Major Incident - Traffic - Vehicle Crash"
"04/15/2025 02:00 PM ET","Norfolk (City)","I-64W",272.4,"On I-64 in the City of Norfolk, at Hampton Roads Bridge Tunnel West, motorists can expect potential delays due to a bridge/tunnel stoppage. All west lanes are closed.","Major Incident - Traffic - Bridge/Tunnel Stoppage"
"04/15/2025 02:12 PM ET","Fairfax (County)","VA-193E",1.7,"On VA-193 in the County of Fairfax, in the vicinity of Springvale Rd; Rt. 674N/S (Fairfax County), motorists can expect delays due to an incident. All east lanes are closed. All west lanes are closed.","Major Incident - Traffic - Other Traffic"
"04/15/2025 02:08 PM ET","Newport News (City)","I-664S",7.8,"On I-664 in the City of Newport News, at Monitor Merrimac Memorial Bridge Tunnel South, motorists can expect potential delays due to a bridge/tunnel stoppage. All south lanes are closed.","Major Incident - Traffic - Bridge/Tunnel Stoppage"
"04/15/2025 02:18 PM ET","Louisa (County)","I-64W",139.4,"On I-64 West at mile marker 139.4 in the County of Louisa, motorists can expect delays due to an incident.","Minor Incident - Traffic - Other Traffic"
"04/15/2025 02:15 PM ET","Portsmouth (City)","I-264W",4.4,"On I-264 West at mile marker 4.3 in the City of Portsmouth, near Frederick Boulevard, motorists can expect delays due to a disabled vehicle.","Minor Incident - Traffic - Disabled Vehicle"
"04/15/2025 02:08 PM ET","Virginia Beach (City)","I-264E",18.7,"On I-264 East at mile marker 18.7 in the City of Virginia Beach, near Rosemont Road, motorists can expect delays due to a disabled vehicle.","Minor Incident - Traffic - Disabled Vehicle"
"04/15/2025 02:19 PM ET","Caroline (County)","I-95S",110.4,"On I-95 South at mile marker 110.4 in the County of Caroline, motorists can expect delays due to a disabled vehicle.","Minor Incident - Traffic - Disabled Vehicle"
"04/15/2025 01:59 PM ET","Norfolk (City)","I-64E",280.2,"On I-64 at mile marker 280.2 in the City of Norfolk, near Norview Avenue, motorists can expect delays due to a disabled vehicle. The east right shoulder is closed.","Minor Incident - Traffic - Disabled Vehicle"
"04/15/2025 01:56 PM ET","Stafford (County)","I-95S",133.8,"On I-95 at mile marker 133.8 in the County of Stafford, motorists can expect delays due to a disabled tractor trailer. The south right shoulder is closed.","Minor Incident - Traffic - Disabled Tractor Trailer"
"04/15/2025 02:12 PM ET","Hampton (City)","I-64E",270,"On I-64 East in the City of Hampton, at Hampton Roads Bridge Tunnel East, motorists can expect delays due to congestion. Traffic backups are approximately 1.0 mile.","Minor Incident - Traffic - Congestion/Delay"
"04/15/2025 02:16 PM ET","Henrico (County)","I-64E",195.3,"On I-64 East at mile marker 195.3 in the County of Henrico, motorists can expect delays due to a disabled vehicle.","Minor Incident - Traffic - Disabled Vehicle"
"04/15/2025 02:20 PM ET","Campbell (County)","US-460E",206.9,"On US-460 in the County of Campbell, in the vicinity of US-501N Ramp 68A; Ramp Intersection:FROM RTE 501 NORTH, motorists can expect delays due to a tractor trailer crash. The east right lane and right shoulder are closed. Traffic backups are approximately 0.5 mile.","Major Incident - Traffic - Tractor Trailer Crash"
