Update Time,Jurisdiction,Route,MRM,Description,Label
"01/19/2025 01:43 PM","Hampton (City)","I-64E",270,"On I-64 East in the City of Hampton, at Hampton Roads Bridge Tunnel East, motorists can expect potential delays due to fog.","Minor Incident - Fog - Advisory"
"01/19/2025 11:18 AM","Augusta (County)","I-64E",99.9,"On I-64 East at mile marker 99.9 in the County of Augusta, motorists can expect delays due to fog.","Minor Incident - Fog - Advisory"
"01/19/2025 02:08 PM","Rockingham (County)","I-81N",259.1,"On I-81 at mile marker 259.1 in the County of Rockingham, motorists can expect delays due to a vehicle crash. The north left shoulder and left lane are closed.","Major Incident - Traffic - Vehicle Crash"
"01/19/2025 02:09 PM","Portsmouth (City)","VA-164W",5.6,"On VA-164 in the City of Portsmouth, in the vicinity of the ramp at Western Freeway, near West Norfolk Bridge, motorists can expect delays due to a disabled vehicle. The west right shoulder is closed.","Major Incident - Traffic - Disabled Vehicle"
"01/19/2025 01:45 PM","Norfolk (City)","I-64W",272.4,"On I-64 West in the City of Norfolk, at Hampton Roads Bridge Tunnel West, motorists can expect potential delays due to fog.","Minor Incident - Fog - Advisory"
"01/19/2025 02:09 PM","Spotsylvania (County)","I-95S",123.6,"On I-95 at mile marker 123.6 in the County of Spotsylvania, motorists can expect delays due to a disabled vehicle. The south right shoulder is closed.","Major Incident - Traffic - Disabled Vehicle"
"01/19/2025 01:40 PM","Loudoun (County)","VA-9E",7.77,"On VA-9 in the County of Loudoun, in the vicinity of Berlin Tpke; VA-287N/S, motorists can expect delays due to a vehicle crash. The east left lane and right lane are closed. The west through lanes are closed.","Major Incident - Traffic - Vehicle Crash"
"01/19/2025 02:08 PM","Henry (County)","BUS US-220N (4 Martinsville/Henry)",7.25,"On BUS US-220 North in the County of Henry, in the vicinity of English Rd; Rt. 1134N/S (Henry County), motorists can expect delays due to a vehicle crash.","Minor Incident - Traffic - Vehicle Crash"
"01/19/2025 02:07 PM","Henrico (County)","I-64E",181,"On I-64 at mile marker 181 in the County of Henrico, motorists can expect delays due to a vehicle fire. The east right shoulder is closed.","Major Incident - Traffic - Vehicle Fire"
"01/19/2025 02:09 PM","Henry (County)","BUS US-220S (4 Martinsville/Henry)",7.26,"On BUS US-220 South in the County of Henry, in the vicinity of Koehler Rd; Rt. 1133N/S (Henry County); Rt. 667E/W (Henry County), motorists can expect delays due to a vehicle crash. Lane closures exist.","Minor Incident - Traffic - Vehicle Crash"
"01/19/2025 02:05 PM","Loudoun (County)","Rt. 704N (Loudoun County)",9.7,"On Rt. 704 in the County of Loudoun, in the vicinity of Clarkes Gap Rd; Rt. 662E/W (Loudoun County), motorists can expect delays due to a vehicle crash. All north lanes are closed. All south lanes are closed.","Major Incident - Traffic - Vehicle Crash"
"01/19/2025 11:10 AM","Augusta (County)","I-64W",99.9,"On I-64 West at mile marker 99.9 in the County of Augusta, motorists can expect delays due to fog.","Minor Incident - Fog - Advisory"
"01/19/2025 02:06 PM","Virginia Beach (City)","I-264W",21.62,"On I-264 at mile marker 21.6 in the City of Virginia Beach, near London Bridge Road, motorists can expect delays due to a disabled vehicle. The west right shoulder is closed.","Major Incident - Traffic - Disabled Vehicle"
"01/19/2025 01:50 PM","Augusta (County)","VA-254E",5.97,"On VA-254 in the County of Augusta, in the vicinity of William Cousins Rd; Rt. 704N/S (Augusta County), motorists can expect delays due to a vehicle crash. All east lanes are closed. All west lanes are closed.","Major Incident - Traffic - Vehicle Crash"
"01/19/2025 01:21 PM","Smyth (County)","I-81S",49,"On I-81 at mile marker 49 in the County of Smyth, motorists can expect delays due to a disabled tractor trailer. The south left shoulder and left lane are closed.","Major Incident - Traffic - Disabled Tractor Trailer"
