Update Time,Jurisdiction,Route,MRM,Description,Label
"04/15/2025 02:02 AM ET","Richmond (City)","I-95S",76.2,"On I-95 at mile marker 76.2 in the City of Richmond, motorists can expect delays due to a disabled vehicle. The south right shoulder is closed.","Minor Incident - Traffic - Disabled Vehicle"
"04/15/2025 01:48 AM ET","Goochland (County)","I-64E",165,"On I-64 at mile marker 165 in the County of Goochland, motorists can expect delays due to a vehicle crash. The east left shoulder is closed.","Minor Incident - Traffic - Vehicle Crash"
"04/15/2025 01:56 AM ET","Campbell (County)","Rt. 648N (Campbell County)",6.4,"On Rt. 648 North in the County of Campbell, in the vicinity of Glade Meadow Ln; Red House Rd; Rt. 648N (Campbell County); Rt. 615E/W (Campbell County), motorists can expect delays due to a vehicle crash. Lane closures exist.","Minor Incident - Traffic - Vehicle Crash"
"04/15/2025 01:56 AM ET","Norfolk (City)","I-64W",272.4,"On I-64 in the City of Norfolk, at Hampton Roads Bridge Tunnel West, motorists can expect potential delays due to a bridge/tunnel stoppage. All west lanes are closed.","Major Incident - Traffic - Bridge/Tunnel Stoppage"
"04/15/2025 02:15 AM ET","Richmond (City)","I-95S",76.9,"On I-95 at mile marker 76.9 in the City of Richmond, motorists can expect delays due to a multi-vehicle crash. The south right lane and right shoulder are closed.","Major Incident - Traffic - Multi-Vehicle Crash"
"04/15/2025 01:59 AM ET","Alleghany (County)","US-220S",136.5,"On US-220 in the County of Alleghany, in the vicinity of County/City/Town Line: BATH CL/ALLEGHANY CL, motorists can expect delays due to a vehicle crash. All north lanes are closed. All south lanes are closed.","Major Incident - Traffic - Vehicle Crash"
