Update Time,Jurisdiction,Route,MRM,Description,Label
"07/05/2025, 09:41 PM ET","Prince William (County)","I-95N",157.2,"On I-95 at mile marker 157.2 in the County of Prince William, motorists can expect delays due to a vehicle crash. The north exit ramp narrows.","Minor Incident - Traffic - Vehicle Crash"
"07/05/2025, 09:45 PM ET","Prince Edward (County)","US-460E",256.6,"On US-460 in the County of Prince Edward, in the vicinity of Old Ridge Rd; Rt. 630N/S (Prince Edward County), motorists can expect delays due to a multi-vehicle crash. All east lanes are closed.","Major Incident - Traffic - Multi-Vehicle Crash"
"07/05/2025, 09:04 PM ET","Prince William (County)","I-66W",39.9,"On I-66 at mile marker 39.9 in the County of Prince William, motorists can expect delays due to a disabled vehicle. The west right shoulder is closed.","Minor Incident - Traffic - Disabled Vehicle"
"07/05/2025, 09:33 PM ET","Spotsylvania (County)","I-95S",122.8,"On I-95 at mile marker 122.8 in the County of Spotsylvania, motorists can expect delays due to a disabled vehicle. The south right shoulder is closed.","Minor Incident - Traffic - Disabled Vehicle"
"07/05/2025, 09:17 PM ET","Fairfax (County)","On I-95N Express Lanes at Mile Marker 166.8","","On I-95N Express Lanes at Mile Marker 166.8 in the County of Fairfax, motorists can expect potential delays due to a disabled vehicle. The north right shoulder is closed.","Minor Incident - Traffic - Disabled Vehicle"
"07/05/2025, 09:26 PM ET","Bland (County)","I-77N",51.8,"On I-77 at mile marker 51.8 in the County of Bland, motorists can expect delays due to a vehicle crash. The north exit ramp narrows.","Minor Incident - Traffic - Vehicle Crash"
"07/05/2025, 09:36 PM ET","Spotsylvania (County)","I-95N",129.3,"On I-95 at mile marker 129.3 in the County of Spotsylvania, motorists can expect delays due to a disabled vehicle. The north right shoulder is closed.","Minor Incident - Traffic - Disabled Vehicle"
"07/05/2025, 09:39 PM ET","Newport News (City)","I-64W",248.8,"On I-64 at mile marker 248.8 in the City of Newport News, near Lee Hall, motorists can expect delays due to a disabled vehicle. The west right shoulder is closed.","Minor Incident - Traffic - Disabled Vehicle"
"07/05/2025, 09:41 PM ET","Newport News (City)","I-64E",251.1,"On I-64 at mile marker 251.1 in the City of Newport News, near Fort Eustis Boulevard, motorists can expect delays due to a vehicle crash. The east left shoulder and left lane are closed.","Major Incident - Traffic - Vehicle Crash"
