Update Time,Jurisdiction,Route,MRM,Description,Label
"06/04/2025 01:28 AM ET","Norfolk (City)","I-64W",272.4,"On I-64 in the City of Norfolk, at Hampton Roads Bridge Tunnel West, motorists can expect potential delays due to a bridge/tunnel stoppage. All west lanes are closed.","Major Incident - Traffic - Bridge/Tunnel Stoppage"
"06/04/2025 02:28 AM ET","Chesterfield (County)","VA-10E",7,"On VA-10 in the County of Chesterfield, in the vicinity of Tucker Rd; Rt. 774E/W (Chesterfield County), motorists can expect delays due to a vehicle crash. All east lanes are closed. All west lanes are closed.","Major Incident - Traffic - Vehicle Crash"
"06/04/2025 02:53 AM ET","Caroline (County)","VA-207N",9.9,"On VA-207 North in the County of Caroline, in the vicinity of Colonial Rd; Rt. 722N/S (Caroline County), motorists can expect delays due to a vehicle crash. Lane closures exist.","Minor Incident - Traffic - Vehicle Crash"
"06/04/2025 03:07 AM ET","Prince William (County)","I-95N",148,"On I-95 at mile marker 148 in the County of Prince William, motorists can expect delays due to a disabled tractor trailer. The north entrance ramp narrows.","Minor Incident - Traffic - Disabled Tractor Trailer"
"06/04/2025 02:58 AM ET","Accomack (County)","US-13S",138.1,"On US-13 in the County of Accomack, in the vicinity of Withams Rd; Rt. 703E/W (Accomack County), near 7410 Lankford highway, motorists can expect delays due to a vehicle crash. The north left shoulder and left lane are closed. The south left shoulder and left lane are closed.","Major Incident - Traffic - Vehicle Crash"
