Update Time,Jurisdiction,Route,MRM,Description,Label
"08/11/2025, 12:15 AM ET","Fairfax (County)","Rt. 690E (Fairfax County)",0.4,"On Rt. 690 East in the County of Fairfax, in the vicinity of Wrightson Dr; Rt. 1943E/W (Fairfax County), near Aerie Ln, motorists can expect delays due to weather. Lane closures exist.","Weather Incident - Other Weather - Advisory"
"08/10/2025, 10:49 PM ET","Goochland (County)","Rt. 609E (Goochland County)",3.4,"On Rt. 609 in the County of Goochland, in the vicinity of Forest Grove Rd; Rt. 615N/S (Goochland County), motorists can expect delays due to weather. All east lanes are closed. All west lanes are closed.","Weather Incident - Other Weather - Closed"
"08/11/2025, 01:17 AM ET","Fauquier (County)","VA-215E",1.5,"On VA-215 in the County of Fauquier, in the vicinity of Acorn Farm Ln; Bludau Dr; Finch Ln; Kennedy Rd; Sigler Rd; Vint Hill Pkwy; Rt. 652E/W (Fauquier County), motorists can expect delays due to a vehicle crash. All east lanes are closed. All west lanes are closed.","Major Incident - Traffic - Vehicle Crash"
"08/10/2025, 11:56 PM ET","Arlington (County)","I-66E",71.1,"On I-66 at mile marker 71.1 in the County of Arlington, motorists can expect delays due to a disabled vehicle. The east right shoulder is closed.","Minor Incident - Traffic - Disabled Vehicle"
"08/11/2025, 12:58 AM ET","Prince William (County)","I-95N",160,"On I-95 at mile marker 160 in the County of Prince William, motorists can expect delays due to a disabled vehicle. The north exit ramp narrows.","Minor Incident - Traffic - Disabled Vehicle"
"08/11/2025, 12:53 AM ET","Amelia (County)","VA-153N",14.1,"On VA-153 North in the County of Amelia, in the vicinity of Bevils Bridge Rd; Five Forks Rd; VA-38E/W; Rt. 602E/W (Amelia County), motorists can expect delays due to a vehicle crash. Lane closures exist.","Minor Incident - Traffic - Vehicle Crash"
"08/11/2025, 01:12 AM ET","Fairfax (County)","I-95S",164.6,"On I-95 at mile marker 164.6 in the County of Fairfax, motorists can expect delays due to a disabled vehicle. The south right shoulder is closed.","Minor Incident - Traffic - Disabled Vehicle"
"08/11/2025, 12:22 AM ET","Fairfax (County)","I-495S",44.5,"On I-495 at mile marker 44.5 in the County of Fairfax, motorists can expect delays due to a disabled vehicle. The south right shoulder is closed.","Minor Incident - Traffic - Disabled Vehicle"
