Update Time,Jurisdiction,Route,MRM,Description,Label
"01/26/2025 07:54 PM","Fredericksburg (City)","I-95N",131,"On I-95 at mile marker 131 in the City of Fredericksburg, motorists can expect delays due to a disabled tractor trailer. The north right shoulder is closed.","Major Incident - Traffic - Disabled Tractor Trailer"
"01/26/2025 08:02 PM","Rockingham (County)","I-81N",237,"On I-81 at mile marker 237 in the County of Rockingham, motorists can expect delays due to a disabled vehicle. The north right shoulder is closed.","Major Incident - Traffic - Disabled Vehicle"
"01/26/2025 08:13 PM","Prince William (County)","I-95N",151.6,"On I-95 at mile marker 151.6 in the County of Prince William, motorists can expect delays due to a disabled vehicle. The north right shoulder is closed.","Major Incident - Traffic - Disabled Vehicle"
"01/26/2025 08:07 PM","Gloucester (County)","US-17N",79.91,"On US-17 North in the County of Gloucester, in the vicinity of George Washington Memorial Hwy, motorists can expect delays due to a vehicle crash.","Minor Incident - Traffic - Vehicle Crash"
"01/26/2025 08:14 PM","Henrico (County)","I-64W",199,"On I-64 at mile marker 199 in the County of Henrico, motorists can expect delays due to a vehicle crash. The east left shoulder and left lane are closed. The west left shoulder and left lane are closed.","Major Incident - Traffic - Vehicle Crash"
"01/26/2025 08:09 PM","Prince William (County)","I-95N",152,"On I-95 at mile marker 152 in the County of Prince William, motorists can expect delays due to a disabled vehicle. The north right shoulder is closed.","Major Incident - Traffic - Disabled Vehicle"
"01/26/2025 07:49 PM","Washington (County)","US-19N",17,"On US-19 North in the County of Washington, in the vicinity of Everett Hagy Rd; Porterfield Hwy; Rt. 633E/W (Washington County), motorists can expect delays due to a vehicle crash. Lane closures exist.","Minor Incident - Traffic - Vehicle Crash"
"01/26/2025 05:59 PM","Washington (County)","I-81N",9.1,"On I-81 at mile marker 9.1 in the County of Washington, motorists can expect delays due to a vehicle crash. The north left shoulder and left lane are closed. Traffic backups are approximately 1.0 mile.","Major Incident - Traffic - Vehicle Crash"
