Update Time,Jurisdiction,Route,MRM,Description,Label
"10/26/2025, 07:12 AM ET","Hampton (City)","I-64W",263.5,"On I-64 at mile marker 263.5 in the City of Hampton, near Mercury Boulevard, motorists can expect delays due to a disabled vehicle. The west right shoulder is closed.","Minor Incident - Traffic - Disabled Vehicle"
"10/26/2025, 06:22 AM ET","Greensville (County)","I-95N",14,"On I-95 at mile marker 14 in the County of Greensville, motorists can expect delays due to a vehicle crash. The north right shoulder is closed.","Minor Incident - Traffic - Vehicle Crash"
"10/26/2025, 07:12 AM ET","Albemarle (County)","I-64W",109,"On I-64 at mile marker 109 in the County of Albemarle, motorists can expect delays due to a vehicle crash. The west right shoulder is closed.","Minor Incident - Traffic - Vehicle Crash"
"10/26/2025, 07:04 AM ET","Fairfax (County)","I-495S",53.4,"On I-495 at mile marker 53.4 in the County of Fairfax, motorists can expect delays due to a disabled vehicle. The south right shoulder is closed.","Minor Incident - Traffic - Disabled Vehicle"
"10/26/2025, 07:05 AM ET","Brunswick (County)","US-58E",403.9,"On US-58 in the County of Brunswick, in the vicinity of County/City/Town Line: GREENSVILLE CL/BRUNSWICK CL, motorists can expect delays due to a vehicle crash. The east right shoulder is closed.","Minor Incident - Traffic - Vehicle Crash"
"10/26/2025, 07:08 AM ET","Chesterfield (County)","I-95N",72.4,"On I-95 at mile marker 72.4 in the County of Chesterfield, motorists can expect delays due to a tractor trailer crash. The north center lane, right lane, and right shoulder are closed.","Major Incident - Traffic - Tractor Trailer Crash"
"10/26/2025, 07:09 AM ET","Dinwiddie (County)","I-85S",60,"On I-85 at mile marker 60 in the County of Dinwiddie, motorists can expect delays due to a vehicle crash. The south right shoulder is closed.","Minor Incident - Traffic - Vehicle Crash"
