Update Time,Jurisdiction,Route,MRM,Description,Label
"03/24/2025 03:09 AM ET","Fairfax (County)","I-66W",61.7,"On I-66 at mile marker 61.7 in the County of Fairfax, motorists can expect delays due to a vehicle crash. The west right shoulder is closed.","Minor Incident - Traffic - Vehicle Crash"
"03/24/2025 02:57 AM ET","Prince William (County)","I-95S",161.1,"On I-95 at mile marker 161.1 in the County of Prince William, motorists can expect delays due to a vehicle crash. The south right shoulder is closed.","Minor Incident - Traffic - Vehicle Crash"
"03/24/2025 03:07 AM ET","Henrico (County)","I-95S",86.3,"On I-95 at mile marker 86.3 in the County of Henrico, motorists can expect delays due to a disabled vehicle. The south right shoulder is closed.","Minor Incident - Traffic - Disabled Vehicle"
"03/24/2025 02:56 AM ET","Fairfax (County)","I-495S",49.8,"On I-495 at mile marker 49.8 in the County of Fairfax, motorists can expect delays due to a disabled vehicle. The south exit ramp narrows.","Minor Incident - Traffic - Disabled Vehicle"
"03/24/2025 03:00 AM ET","Fairfax (County)","I-66W",49.9,"On I-66 at mile marker 49.9 in the County of Fairfax, motorists can expect delays due to a disabled vehicle. The west right shoulder is closed.","Minor Incident - Traffic - Disabled Vehicle"
"03/24/2025 03:03 AM ET","Prince William (County)","I-95S",155.4,"On I-95 South at mile marker 155.4 in the County of Prince William, motorists can expect delays due to a vehicle crash.","Minor Incident - Traffic - Vehicle Crash"
"03/24/2025 03:13 AM ET","Bedford (County)","Rt. 655E (Bedford County)",4.8,"On Rt. 655 in the County of Bedford, in the vicinity of Rt. 1650N (Bedford County), motorists can expect delays due to a vehicle crash. All east lanes are closed. All west lanes are closed.","Major Incident - Traffic - Vehicle Crash"
"03/24/2025 02:19 AM ET","King George (County)","US-301N",142.7,"On US-301 North in the County of King George, at Harry Nice Bridge, motorists can expect delays due to high wind.","Minor Incident - High Wind - Advisory"
