Update Time,Jurisdiction,Route,MRM,Description,Label
"04/07/2025 01:24 AM ET","Carroll (County)","I-77S",24,"On I-77 South at mile marker 24 in the County of Carroll, motorists can expect delays due to high wind.","Minor Incident - High Wind - Advisory"
"04/06/2025 07:21 PM ET","Newport News (City)","I-64W",258.1,"On I-64 at mile marker 258.1 in the City of Newport News, near Oyster Point Road, motorists can expect potential delays due to an incident. The west left shoulder and left lane are closed.","Major Incident - Traffic - Other Traffic"
"04/07/2025 02:16 AM ET","Arlington (County)","I-66E",70.3,"On I-66 at mile marker 70.3 in the County of Arlington, motorists can expect delays due to a disabled vehicle. The east right shoulder is closed.","Minor Incident - Traffic - Disabled Vehicle"
"04/07/2025 02:03 AM ET","Stafford (County)","I-95N",144.5,"On I-95 at mile marker 144.5 in the County of Stafford, motorists can expect delays due to a disabled vehicle. The north right shoulder is closed.","Minor Incident - Traffic - Disabled Vehicle"
"04/07/2025 02:20 AM ET","Stafford (County)","I-95S",133.8,"On I-95 at mile marker 133.8 in the County of Stafford, motorists can expect delays due to a disabled vehicle. The south right shoulder is closed.","Minor Incident - Traffic - Disabled Vehicle"
"04/07/2025 01:24 AM ET","Carroll (County)","I-77N",0,"On I-77 North at mile marker 0 in the County of Carroll, motorists can expect delays due to high wind.","Minor Incident - High Wind - Advisory"
"04/07/2025 02:20 AM ET","Arlington (County)","I-66E",72,"On I-66 at mile marker 72 in the County of Arlington, motorists can expect delays due to a disabled vehicle. The east right shoulder is closed.","Minor Incident - Traffic - Disabled Vehicle"
"04/07/2025 02:18 AM ET","Newport News (City)","I-64E",257.2,"On I-64 at mile marker 257.2 in the City of Newport News, near Oyster Point Road, motorists can expect delays due to a vehicle crash. The east right shoulder is closed.","Minor Incident - Traffic - Vehicle Crash"
