Update Time,Jurisdiction,Route,MRM,Description,Label
"02/21/2025 12:39 PM ET","Henrico (County)","US-33W",131.3,"On US-33 West in the County of Henrico, in the vicinity of Interstate 64 Ex E; US-33W Ramp 131B; Ramp Intersection:TO RT 64 EAST, motorists can expect delays due to icy conditions.","Minor Incident - Icy Conditions - Advisory"
"02/22/2025 06:07 AM ET","Spotsylvania (County)","I-95S",130,"On I-95 at mile marker 130 in the County of Spotsylvania, motorists can expect delays due to a disabled vehicle. The south exit 130b narrows.","Minor Incident - Traffic - Disabled Vehicle"
"02/22/2025 05:40 AM ET","Fairfax (County)","Rt. 857E (Fairfax County)",0,"On Rt. 857 East in the County of Fairfax, in the vicinity of Auburn St; Beverly St; Rt. 855E/W (Fairfax County); Rt. 856E/W (Fairfax County), motorists can expect delays due to icy conditions. Lane closures exist.","Minor Incident - Icy Conditions - Advisory"
"02/22/2025 05:26 AM ET","Stafford (County)","I-95S",143.4,"On I-95 at mile marker 143.4 in the County of Stafford, motorists can expect delays due to a disabled vehicle. The south right shoulder is closed.","Minor Incident - Traffic - Disabled Vehicle"
"02/22/2025 06:09 AM ET","Colonial Heights (City)","I-95S",53.6,"On I-95 at mile marker 53.6 in the City of Colonial Heights, motorists can expect delays due to a disabled vehicle. The south left shoulder is closed.","Minor Incident - Traffic - Disabled Vehicle"
"02/22/2025 06:10 AM ET","Fauquier (County)","US-15S",188.4,"On US-15 South in the County of Fauquier, in the vicinity of Old Alexandria Tpke; Rt. 693N/S (Fauquier County), motorists can expect delays due to a vehicle crash.","Minor Incident - Traffic - Vehicle Crash"
"02/22/2025 06:11 AM ET","Norfolk (City)","I-264W",9.7,"On I-264 at mile marker 9.7 in the City of Norfolk, near Ballentine Boulevard, motorists can expect delays due to a disabled vehicle. The west right shoulder is closed.","Minor Incident - Traffic - Disabled Vehicle"
"02/22/2025 05:47 AM ET","Loudoun (County)","VA-28N",43.5,"On VA-28 in the County of Loudoun, in the vicinity of E Severn Wy; Rt. 847E/W (Loudoun County); Rt. 1748E/W (Loudoun County), motorists can expect delays due to a multi-vehicle crash. The north left shoulder, left lane, center lane, and right shoulder are closed.","Major Incident - Traffic - Multi-Vehicle Crash"
"02/22/2025 05:38 AM ET","Hampton (City)","I-64E",266.7,"On I-64 at mile marker 266.7 in the City of Hampton, near Hampton River Bridge, motorists can expect delays due to a vehicle crash. All east lanes are closed.","Major Incident - Traffic - Vehicle Crash"
