Update Time,Jurisdiction,Route,MRM,Description,Label
"12/26/2025, 12:17 AM ET","Portsmouth (City)","VA-164E",4.8,"On VA-164 in the City of Portsmouth, in the vicinity of the ramp, near National Gateway Boulevard, motorists can expect delays due to a disabled vehicle. The east left shoulder and left lane are closed.","Major Incident - Traffic - Disabled Vehicle"
"12/25/2025, 11:57 PM ET","Fairfax (County)","I-495S",47.6,"On I-495 at mile marker 47.6 in the County of Fairfax, motorists can expect delays due to a vehicle crash. The south right shoulder is closed.","Minor Incident - Traffic - Vehicle Crash"
"12/25/2025, 11:20 PM ET","Arlington (County)","I-395S",7,"On I-395 at mile marker 7 in the County of Arlington, motorists can expect delays due to a disabled vehicle. The south exit 7B narrows.","Minor Incident - Traffic - Disabled Vehicle"
"12/25/2025, 10:45 PM ET","Fairfax (County)","On I-495S Express Lanes at mile marker 47.4","","On I-495S Express Lanes at mile marker 47.4 in the County of Fairfax, motorists can expect potential delays due to a vehicle crash. All south lanes are closed.","Major Incident - Traffic - Vehicle Crash"
"12/26/2025, 12:09 AM ET","Fairfax (County)","Rt. 2796N (Fairfax County)",0.2,"On Rt. 2796 North in the County of Fairfax, in the vicinity of Southwick St; Rt. 978N/S (Fairfax County), motorists can expect delays due to an incident.","Minor Incident - Traffic - Other Traffic"
"12/26/2025, 12:20 AM ET","Fairfax (County)","I-495S",47.4,"On I-495 at mile marker 47.4 in the County of Fairfax, motorists can expect delays due to a vehicle crash. The south left lane and left center lane are closed.","Major Incident - Traffic - Vehicle Crash"
"12/26/2025, 12:17 AM ET","Fairfax (County)","I-495S",42.8,"On I-495 at mile marker 42.8 in the County of Fairfax, motorists can expect delays due to a disabled vehicle. The south right shoulder is closed.","Minor Incident - Traffic - Disabled Vehicle"
