Update Time,Jurisdiction,Route,MRM,Description,Label
"02/28/2025 03:20 AM ET","Portsmouth (City)","I-264W",3,"On I-264 West at mile marker 3 in the City of Portsmouth, near Victory Boulevard, motorists can expect delays due to a vehicle crash.","Minor Incident - Traffic - Vehicle Crash"
"02/28/2025 03:16 AM ET","Norfolk (City)","I-64W",285.5,"On I-64 at mile marker 285.5 in the City of Norfolk, near Twin Bridges, motorists can expect delays due to a vehicle crash. The west left shoulder and left lane are closed.","Major Incident - Traffic - Vehicle Crash"
"02/28/2025 03:08 AM ET","Chesterfield (County)","I-95N",60,"On I-95 at mile marker 60 in the County of Chesterfield, motorists can expect delays due to a vehicle crash. The north right shoulder is closed.","Minor Incident - Traffic - Vehicle Crash"
"02/28/2025 03:06 AM ET","Fairfax (County)","I-66E",64.6,"On I-66 at mile marker 64.6 in the County of Fairfax, motorists can expect delays due to a disabled vehicle. The east right shoulder is closed.","Minor Incident - Traffic - Disabled Vehicle"
"02/28/2025 03:10 AM ET","Mecklenburg (County)","I-85S",2.2,"On I-85 South at mile marker 2.2 in the County of Mecklenburg, motorists can expect delays due to an incident. Lane closures exist.","Minor Incident - Traffic - Other Traffic"
