Update Time,Jurisdiction,Route,MRM,Description,Label
"06/18/2025, 08:15 PM ET","Prince William (County)","VA-234N",28.5,"On VA-234 North in the County of Prince William, in the vicinity of Featherbed Ln; Rt. 622N/S (Prince William County), motorists can expect delays due to an incident. Lane closures exist.","Minor Incident - Traffic - Other Traffic"
"06/19/2025, 02:20 AM ET","Fairfax (County)","I-495S",53.8,"On I-495 at mile marker 53.8 in the County of Fairfax, motorists can expect delays due to a disabled vehicle. The south right shoulder is closed.","Minor Incident - Traffic - Disabled Vehicle"
"06/19/2025, 02:12 AM ET","Loudoun (County)","VA-28S",40.4,"On VA-28 in the County of Loudoun, in the vicinity of En Ramp Fwy, motorists can expect delays due to a disabled vehicle. The south right shoulder is closed.","Minor Incident - Traffic - Disabled Vehicle"
"06/19/2025, 02:15 AM ET","Goochland (County)","I-64W",172.6,"On I-64 at mile marker 172.6 in the County of Goochland, motorists can expect delays due to a vehicle fire. The west right lane and right shoulder are closed.","Major Incident - Traffic - Vehicle Fire"
"06/19/2025, 02:00 AM ET","Fairfax (County)","VA-235N",4.6,"On VA-235 North in the County of Fairfax, in the vicinity of Stephies Ct; Rt. 10077E/W (Fairfax County), motorists can expect delays due to an incident. Lane closures exist.","Minor Incident - Traffic - Other Traffic"
"06/19/2025, 01:32 AM ET","Campbell (County)","Rt. 622E (Campbell County)",7,"On Rt. 622 in the County of Campbell, in the vicinity of Greendale Dr; Rt. 1601N/S (Campbell County), motorists can expect delays due to a vehicle crash. All east lanes are closed. All west lanes are closed.","Major Incident - Traffic - Vehicle Crash"
