Update Time,Jurisdiction,Route,MRM,Description,Label
"02/05/2025 09:19 PM ET","Prince William (County)","On I-66W Express Lanes at mile marker 44.8","","On I-66W Express Lanes at mile marker 44.8 in the County of Prince William, motorists can expect potential delays due to a disabled vehicle. The west left shoulder is closed.","Minor Incident - Traffic - Disabled Vehicle"
"02/05/2025 09:39 PM ET","Henrico (County)","I-295N",43,"On I-295 at mile marker 43 in the County of Henrico, motorists can expect delays due to a disabled vehicle. The north right lane and right shoulder are closed.","Major Incident - Traffic - Disabled Vehicle"
"02/05/2025 09:29 PM ET","Carroll (County)","I-77N",9.6,"On I-77 at mile marker 9.6 in the County of Carroll, motorists can expect delays due to a vehicle crash. The north left shoulder and left lane are closed.","Major Incident - Traffic - Vehicle Crash"
"02/05/2025 05:26 PM ET","Campbell (County)","US-501N",52.79,"On US-501 in the County of Campbell, in the vicinity of Marshall Mill Rd; Rt. 654E/W (Campbell County), motorists can expect delays due to a multi-vehicle crash. All north lanes are closed. All south lanes are closed.","Major Incident - Traffic - Multi-Vehicle Crash"
"02/05/2025 09:39 PM ET","Stafford (County)","On I-95R Express Lanes at mile marker 138.6","","On I-95R Express Lanes at mile marker 138.6 in the County of Stafford, motorists can expect potential delays due to a disabled vehicle. The south right shoulder is closed.","Minor Incident - Traffic - Disabled Vehicle"
"02/05/2025 09:27 PM ET","Fairfax (County)","I-66W",50.8,"On I-66 at mile marker 50.8 in the County of Fairfax, motorists can expect delays due to a multi-vehicle crash. The west left shoulder, left lane, and right shoulder are closed.","Major Incident - Traffic - Multi-Vehicle Crash"
"02/05/2025 09:37 PM ET","Prince William (County)","I-95S",158.1,"On I-95 at mile marker 158.1 in the County of Prince William, motorists can expect delays due to a disabled vehicle. The south right shoulder is closed.","Minor Incident - Traffic - Disabled Vehicle"
