Update Time,Jurisdiction,Route,MRM,Description,Label
"06/23/2025, 04:14 PM ET","Chesterfield (County)","Rt. 631N (Chesterfield County)",3.4,"On Rt. 631 in the County of Chesterfield, in the vicinity of Molena Dr; Rt. 3948N/S (Chesterfield County), motorists can expect delays due to a tractor trailer crash. All north lanes are closed. All south lanes are closed.","Major Incident - Traffic - Tractor Trailer Crash"
"06/23/2025, 04:09 PM ET","Prince William (County)","I-95S",160.2,"On I-95 at mile marker 160.2 in the County of Prince William, motorists can expect delays due to a disabled vehicle. The south left lane and left center lane are closed.","Major Incident - Traffic - Disabled Vehicle"
"06/23/2025, 02:18 PM ET","Hampton (City)","I-64E",270,"On I-64 in the City of Hampton, at Hampton Roads Bridge Tunnel East, motorists can expect potential delays due to a bridge/tunnel stoppage. All east lanes are closed.","Major Incident - Traffic - Bridge/Tunnel Stoppage"
"06/23/2025, 04:18 PM ET","Botetourt (County)","Rt. 601N (Roanoke County)",2.9,"On Rt. 601 North in the County of Botetourt, in the vicinity of Lee Hwy; US-11N/S, motorists can expect delays due to a multi-vehicle crash. Lane closures exist.","Minor Incident - Traffic - Multi-Vehicle Crash"
"06/23/2025, 02:57 PM ET","Fairfax (County)","On I-66E Express Lanes at mile marker 51.7","","On I-66E Express Lanes at mile marker 51.7 in the County of Fairfax, motorists can expect potential delays due to a disabled vehicle. The east left shoulder is closed.","Minor Incident - Traffic - Disabled Vehicle"
"06/23/2025, 04:12 PM ET","York (County)","I-64E",235.3,"On I-64 at mile marker 235.3 in the County of York, near Barlow Road, motorists can expect delays due to a disabled vehicle. The east right shoulder is closed.","Minor Incident - Traffic - Disabled Vehicle"
"06/23/2025, 04:02 PM ET","Hampton (City)","I-64E",270,"On I-64 East in the City of Hampton, at Hampton Roads Bridge Tunnel East, motorists can expect delays due to congestion. Traffic backups are approximately 5.25 miles.","Major Incident - Traffic - Congestion/Delay"
"06/23/2025, 04:00 PM ET","Newport News (City)","I-664S",7.8,"On I-664 South in the City of Newport News, at Monitor Merrimac Memorial Bridge Tunnel South, motorists can expect delays due to congestion. Traffic backups are approximately 2.0 miles.","Major Incident - Traffic - Congestion/Delay"
"06/23/2025, 04:13 PM ET","Hampton (City)","I-664N",1.1,"On I-664 at mile marker 1.1 in the City of Hampton, near Power Plant Parkway, motorists can expect delays due to a disabled vehicle. The north left shoulder is closed.","Minor Incident - Traffic - Disabled Vehicle"
"06/23/2025, 04:16 PM ET","Virginia Beach (City)","I-264E",15.2,"On I-264 at mile marker 15.2 in the City of Virginia Beach, near Witchduck Road, motorists can expect delays due to a vehicle crash. The east right shoulder is closed.","Minor Incident - Traffic - Vehicle Crash"
"06/23/2025, 04:12 PM ET","Newport News (City)","I-664S",5.4,"On I-664 South at mile marker 5.4 in the City of Newport News, near Newport News Inspection Station, motorists can expect delays due to a disabled vehicle.","Minor Incident - Traffic - Disabled Vehicle"
"06/23/2025, 04:00 PM ET","Norfolk (City)","I-264W",7,"On I-264 West in the City of Norfolk, at Downtown Tunnel West, motorists can expect major delays due to congestion. Traffic backups are approximately 1.0 mile.","Minor Incident - Traffic - Congestion/Delay"
"06/23/2025, 04:02 PM ET","Fredericksburg (City)","I-95S",130,"On I-95 at mile marker 130 in the City of Fredericksburg, motorists can expect delays due to a disabled vehicle. The south left shoulder is closed.","Minor Incident - Traffic - Disabled Vehicle"
"06/23/2025, 03:42 PM ET","Norfolk (City)","I-64W",272.4,"On I-64 West in the City of Norfolk, at Hampton Roads Bridge Tunnel West, motorists can expect delays due to congestion. Traffic backups are approximately 6.5 miles.","Major Incident - Traffic - Congestion/Delay"
"06/23/2025, 04:18 PM ET","Chesapeake (City)","I-64E",291.6,"On I-64 at mile marker 291.6 in the City of Chesapeake, near 464 Interchange, motorists can expect delays due to a multi-vehicle crash. The east left lane, right center lane, and right lane are closed.","Major Incident - Traffic - Multi-Vehicle Crash"
"06/23/2025, 04:16 PM ET","Fairfax (County)","I-95N",171.7,"On I-95 at mile marker 171.7 in the County of Fairfax, motorists can expect delays due to a disabled vehicle. The north right shoulder is closed.","Minor Incident - Traffic - Disabled Vehicle"
"06/23/2025, 04:00 PM ET","Richmond (City)","I-95N",74,"On I-95 at mile marker 74 in the City of Richmond, motorists can expect delays due to a vehicle crash. The north left shoulder and left lane are closed.","Major Incident - Traffic - Vehicle Crash"
"06/23/2025, 04:13 PM ET","Fairfax (County)","I-495S",53.1,"On I-495 at mile marker 53.1 in the County of Fairfax, motorists can expect delays due to a disabled vehicle. The south right shoulder is closed.","Minor Incident - Traffic - Disabled Vehicle"
"06/23/2025, 03:56 PM ET","Loudoun (County)","Rt. 625W (Loudoun County)",7.7,"On Rt. 625 in the County of Loudoun, in the vicinity of N Aspen Av; Rt. 1408N/S (Loudoun County), motorists can expect delays due to a vehicle crash. All east lanes are closed. All west lanes are closed.","Major Incident - Traffic - Vehicle Crash"
"06/23/2025, 04:17 PM ET","Fredericksburg (City)","I-95S",130.4,"On I-95 at mile marker 130.4 in the City of Fredericksburg, motorists can expect delays due to a disabled vehicle. The south right shoulder is closed.","Minor Incident - Traffic - Disabled Vehicle"
"06/23/2025, 04:17 PM ET","Richmond (City)","I-95N",69.3,"On I-95 at mile marker 69.3 in the City of Richmond, motorists can expect delays due to a disabled vehicle. The north right shoulder is closed.","Minor Incident - Traffic - Disabled Vehicle"
"06/23/2025, 02:45 PM ET","Suffolk (City)","I-664N",8.9,"On I-664 North in the City of Suffolk, at Monitor Merrimac Memorial Bridge Tunnel North, motorists can expect delays due to congestion. Traffic backups are approximately 1.25 miles.","Major Incident - Traffic - Congestion/Delay"
"06/23/2025, 03:47 PM ET","Carroll (County)","I-77N",3.7,"On I-77 at mile marker 3.7 in the County of Carroll, motorists can expect delays due to a disabled vehicle. The north left shoulder is closed.","Minor Incident - Traffic - Disabled Vehicle"
"06/23/2025, 04:17 PM ET","Virginia Beach (City)","I-64E",286.2,"On I-64 at mile marker 286.2 in the City of Virginia Beach, near Providence Road, motorists can expect delays due to a vehicle crash. The east right shoulder is closed.","Minor Incident - Traffic - Vehicle Crash"
"06/23/2025, 03:55 PM ET","Loudoun (County)","VA-7E",44.5,"On VA-7 in the County of Loudoun, in the vicinity of Harry Byrd Hwy; Loudoun County Pkwy; Rt. 607N (Loudoun County), motorists can expect delays due to a multi-vehicle crash. The east right lane and right shoulder are closed.","Major Incident - Traffic - Multi-Vehicle Crash"
"06/23/2025, 04:14 PM ET","Chesterfield (County)","VA-288S",12.9,"On VA-288 in the County of Chesterfield, in the vicinity of the ramp to Hull Street Road, motorists can expect delays due to an incident. The south exit ramp is closed.","Minor Incident - Traffic - Other Traffic"
"06/23/2025, 03:38 PM ET","Portsmouth (City)","I-264W",5,"On I-264 at mile marker 5 in the City of Portsmouth, near Martin Luther King Freeway, motorists can expect delays due to a disabled vehicle. The west right shoulder is closed.","Minor Incident - Traffic - Disabled Vehicle"
"06/23/2025, 03:38 PM ET","Patrick (County)","VA-103E",0.9,"On VA-103 East in the County of Patrick, in the vicinity of Archies Creek Rd; Hatchers Chapel Rd; Rt. 645N/S (Patrick County), motorists can expect delays due to a vehicle crash. Lane closures exist.","Minor Incident - Traffic - Vehicle Crash"
