Update Time,Jurisdiction,Route,MRM,Description,Label
"04/21/2025 02:17 AM ET","Wythe (County)","I-77S",30.9,"On I-77 at mile marker 30.9 in the County of Wythe, motorists can expect delays due to a vehicle fire. The south left shoulder, left lane, and right shoulder are closed.","Major Incident - Traffic - Vehicle Fire"
"04/21/2025 01:43 AM ET","Fairfax (County)","I-66W",65.4,"On I-66 at mile marker 65.4 in the County of Fairfax, motorists can expect delays due to a disabled vehicle. The west right shoulder is closed.","Minor Incident - Traffic - Disabled Vehicle"
"04/21/2025 02:16 AM ET","Prince William (County)","I-95S",149.1,"On I-95 at mile marker 149.1 in the County of Prince William, motorists can expect delays due to a disabled tractor trailer. The south right lane and right shoulder are closed.","Major Incident - Traffic - Disabled Tractor Trailer"
"04/21/2025 02:23 AM ET","Hampton (City)","I-64W",265.3,"On I-64 West at mile marker 265.3 in the City of Hampton, near 664 Interchange, motorists can expect delays due to a vehicle crash.","Minor Incident - Traffic - Vehicle Crash"
"04/21/2025 02:08 AM ET","Chesterfield (County)","Rt. 654N (Chesterfield County)",10.4,"On Rt. 654 in the County of Chesterfield, in the vicinity of Battlecreek Dr; Rt. 5013N/S (Chesterfield County), motorists can expect delays due to a vehicle crash. All north lanes are closed. All south lanes are closed.","Major Incident - Traffic - Vehicle Crash"
"04/21/2025 02:24 AM ET","Virginia Beach (City)","I-264E",16.7,"On I-264 East at mile marker 16.7 in the City of Virginia Beach, near Independence Boulevard, motorists can expect delays due to a disabled vehicle.","Minor Incident - Traffic - Disabled Vehicle"
