Update Time,Jurisdiction,Route,MRM,Description,Label
"10/08/2025, 10:48 PM ET","Fairfax (County)","I-395S",1.8,"On I-395 at mile marker 1.8 in the County of Fairfax, motorists can expect delays due to a disabled tractor trailer. The south right shoulder is closed.","Minor Incident - Traffic - Disabled Tractor Trailer"
"10/08/2025, 11:25 PM ET","Fairfax (County)","I-395N",4.6,"On I-395 at mile marker 4.6 in the County of Fairfax, motorists can expect delays due to a disabled vehicle. The north right shoulder is closed.","Minor Incident - Traffic - Disabled Vehicle"
"10/08/2025, 11:10 PM ET","Henry (County)","US-220N",4.3,"On US-220 in the County of Henry, in the vicinity of Morehead Ave; County/City/Town Line: RIDGEWAY, motorists can expect delays due to a vehicle crash. The north right lane and right shoulder are closed.","Major Incident - Traffic - Vehicle Crash"
"10/08/2025, 10:42 PM ET","Amelia (County)","US-360E",110.9,"On US-360 East in the County of Amelia, in the vicinity of Military Rd; VA-153N/S, motorists can expect delays due to a vehicle crash.","Minor Incident - Traffic - Vehicle Crash"
"10/08/2025, 10:58 PM ET","Mecklenburg (County)","VA-47N",10.3,"On VA-47 North in the County of Mecklenburg, in the vicinity of Northside Rd; Rt. 658N/S (Mecklenburg County), motorists can expect delays due to a vehicle crash.","Minor Incident - Traffic - Vehicle Crash"
"10/08/2025, 11:20 PM ET","Norfolk (City)","I-264W",13.2,"On I-264 at mile marker 13.2 in the City of Norfolk, near 64 Interchange, motorists can expect delays due to a disabled vehicle. The west exit 14B narrows.","Minor Incident - Traffic - Disabled Vehicle"
"10/08/2025, 11:32 PM ET","Arlington (County)","I-66W",71.4,"On I-66 at mile marker 71.4 in the County of Arlington, motorists can expect delays due to a disabled vehicle. The west right shoulder is closed.","Minor Incident - Traffic - Disabled Vehicle"
