Update Time,Jurisdiction,Route,MRM,Description,Label
"08/10/2025, 09:42 AM ET","Rockbridge (County)","I-81S",194.4,"On I-81 at mile marker 194.4 in the County of Rockbridge, motorists can expect delays due to a disabled vehicle. The south right shoulder is closed.","Minor Incident - Traffic - Disabled Vehicle"
"08/10/2025, 10:16 AM ET","Norfolk (City)","I-64W",272.8,"On I-64 at mile marker 272.8 in the City of Norfolk, motorists can expect delays due to a multi-vehicle crash. The west left shoulder and left lane are closed. Traffic backups are approximately 2.5 miles.","Major Incident - Traffic - Multi-Vehicle Crash"
"08/10/2025, 10:16 AM ET","New Kent (County)","I-64E",219,"On I-64 at mile marker 219 in the County of New Kent, motorists can expect delays due to a vehicle crash. The east left shoulder is closed. Traffic backups are approximately 1.5 miles.","Major Incident - Traffic - Vehicle Crash"
"08/10/2025, 09:48 AM ET","Amherst (County)","Rt. 663E (Amherst County)",5.4,"On Rt. 663 in the County of Amherst, in the vicinity of Mount Airy Rd; Rt. 770E/W (Amherst County), motorists can expect delays due to a vehicle crash. All east lanes are closed. All west lanes are closed.","Major Incident - Traffic - Vehicle Crash"
"08/10/2025, 09:58 AM ET","Newport News (City)","I-64E",258.7,"On I-64 at mile marker 258.7 in the City of Newport News, near J Clyde Morris Boulevard, motorists can expect delays due to a vehicle crash. The east right shoulder is closed.","Minor Incident - Traffic - Vehicle Crash"
"08/10/2025, 10:02 AM ET","Hampton (City)","I-64E",265.3,"On I-64 at mile marker 265.3 in the City of Hampton, near La Salle avenue, motorists can expect delays due to a tractor trailer crash. All east lanes are closed.","Major Incident - Traffic - Tractor Trailer Crash"
"08/10/2025, 09:36 AM ET","Spotsylvania (County)","I-95S",127,"On I-95 at mile marker 127 in the County of Spotsylvania, motorists can expect delays due to a disabled vehicle. The south right shoulder is closed.","Minor Incident - Traffic - Disabled Vehicle"
"08/10/2025, 10:16 AM ET","Chesapeake (City)","I-664S",20,"On I-664 at mile marker 20 in the City of Chesapeake, near Bowers Hill Interchange, motorists can expect delays due to a disabled vehicle. The south exit 15B narrows.","Minor Incident - Traffic - Disabled Vehicle"
